{
    "0shot": [
        {
            "final_program_time": {
                "itinerary": []
            },
            "expected_time": {
                "itinerary": [
                    {
                        "action": "meet",
                        "location": "Russian Hill",
                        "person": "Margaret",
                        "start_time": "9:24",
                        "end_time": "9:54"
                    },
                    {
                        "action": "meet",
                        "location": "Golden Gate Park",
                        "person": "Daniel",
                        "start_time": "10:15",
                        "end_time": "10:30"
                    },
                    {
                        "action": "meet",
                        "location": "Alamo Square",
                        "person": "Charles",
                        "start_time": "18:00",
                        "end_time": "19:30"
                    },
                    {
                        "action": "meet",
                        "location": "Mission District",
                        "person": "Stephanie",
                        "start_time": "20:30",
                        "end_time": "22:00"
                    }
                ]
            },
            "has_error": true,
            "raw_model_response": "Alright, let's tackle this problem step by step. The goal is to find the optimal meeting schedule for a day in San Francisco, considering travel times and the availability of friends. The user wants to maximize the number of meetings while respecting each person's constraints.\n\nFirst, I'll start by understanding the input parameters. The travel distances between various locations are provided, which will be essential for calculating the time it takes to travel between these places. The constraints specify the arrival time at a location and the duration each person is available for a meeting.\n\nTo solve this, I'll use a greedy algorithm with a priority queue (min-heap). This approach allows me to always consider the earliest possible meetings first, which helps in maximizing the number of meetings scheduled.\n\nHere's the step-by-step plan:\n\n1. **Convert Time Strings to Minutes**: To make time calculations easier, I'll convert all time strings to minutes since midnight.\n\n2. **Read Travel Times**: The travel times between locations are stored in a nested dictionary for easy access.\n\n3. **Initialize Priority Queue**: For each person, calculate the earliest possible start time for a meeting and add it to the priority queue if it fits within their availability window.\n\n4. **Scheduling Meetings**: Extract meetings from the priority queue, checking if they can be scheduled given the current time. If a meeting is scheduled, update the current end time and check for more feasible meetings that can be added to the queue.\n\n5. **Construct Itinerary**: After scheduling all possible meetings, construct the final itinerary in the required JSON format.\n\nI'll use Python's `heapq` module for the priority queue operations. The `format_time` function will convert minutes back to the \"H:MM\" format for the final output.\n\nNow, let's outline the code structure:\n\n- **format_time**: Converts minutes to a formatted time string.\n- **to_minutes**: Converts a time string to minutes.\n- **travel_times**: Dictionary containing travel times between locations.\n- **people**: List of dictionaries, each representing a person's availability and required meeting time.\n- **Priority Queue Initialization**: For each person, calculate the earliest possible meeting time and add it to the queue.\n- **Scheduling Loop**: Process each meeting from the queue, checking if it can be scheduled based on the current time and the person's availability.\n- **Itinerary Construction**: Collect all scheduled meetings and convert them into the required JSON format.\n\nBy following this structured approach, I can ensure that the optimal meeting schedule is computed efficiently, considering all constraints and maximizing the number of meetings. The code should run independently and output valid JSON when executed.\n</think>\n\nSOLUTION:\n\n```python\nimport heapq\n\ndef format_time(minutes):\n    hours = minutes // 60\n    minutes = minutes % 60\n    return f\"{hours:02d}:{minutes:02d}\"\n\ndef to_minutes(time_str):\n    hours, mins = map(int, time_str.split(':'))\n    return hours * 60 + mins\n\n# Read travel times\ntravel_times = {\n    'Sunset District': {\n        'Alamo Square': 17,\n        'Russian Hill': 24,\n        'Golden Gate Park': 11,\n        'Mission District': 24,\n    },\n    'Alamo Square': {\n        'Sunset District': 16,\n        'Russian Hill': 13,\n        'Golden Gate Park': 9,\n        'Mission District': 10,\n    },\n    'Russian Hill': {\n        'Sunset District': 23,\n        'Alamo Square': 15,\n        'Golden Gate Park': 21,\n        'Mission District': 16,\n    },\n    'Golden Gate Park': {\n        'Sunset District': 10,\n        'Alamo Square': 10,\n        'Russian Hill': 19,\n        'Mission District': 17,\n    },\n    'Mission District': {\n        'Sunset District': 24,\n        'Alamo Square': 11,\n        'Russian Hill': 15,\n        'Golden Gate Park': 17,\n    }\n}\n\n# Read people data and convert times to minutes\npeople = [\n    {\n        'name': 'Charles',\n        'location': 'Alamo Square',\n        'availability_start': '18:00',\n        'availability_end': '20:45',\n        'required_time': 90\n    },\n    {\n        'name': 'Margaret',\n        'location': 'Russian Hill',\n        'availability_start': '9:00',\n        'availability_end': '16:00',\n        'required_time': 30\n    },\n    {\n        'name': 'Daniel',\n        'location': 'Golden Gate Park',\n        'availability_start': '8:00',\n        'availability_end': '13:30',\n        'required_time': 15\n    },\n    {\n        'name': 'Stephanie',\n        'location': 'Mission District',\n        'availability_start': '20:30',\n        'availability_end': '22:00',\n        'required_time': 90\n    }\n]\n\nfor person in people:\n    person['availability_start'] = to_minutes(person['availability_start'])\n    person['availability_end'] = to_minutes(person['availability_end'])\n\n# Initialize priority queue\npriority_queue = []\n\nfor person in people:\n    from_loc = 'Sunset District'\n    to_loc = person['location']\n    arrival_time = 540 + travel_times[from_loc][to_loc]\n    avail_start = person['availability_start']\n    avail_end = person['availability_end']\n    required = person['required_time']\n    \n    earliest_start = max(arrival_time, avail_start)\n    latest_start = avail_end - required\n    \n    if earliest_start <= latest_start:\n        heapq.heappush(priority_queue, (earliest_start, earliest_start + required, person))\n\nschedule = []\ncurrent_end = 540  # 9:00 AM in minutes\n\nwhile priority_queue:\n    start_min, end_min, person = heapq.heappop(priority_queue)\n    \n    # Check if this meeting can be scheduled\n    if start_min >= current_end:\n        # Check if the meeting ends before the person's availability end\n        if end_min <= person['availability_end']:\n            # Add to schedule\n            schedule.append({\n                'action': 'meet',\n                'location': person['location'],\n                'person': person['name'],\n                'start_time': format_time(start_min),\n                'end_time': format_time(end_min)\n            })\n            current_end = end_min\n            \n            # Check for more possible meetings\n            for p in people:\n                from_loc = 'Sunset District'\n                to_loc = p['location']\n                arrival_time = 540 + travel_times[from_loc][to_loc]\n                avail_start = p['availability_start']\n                avail_end = p['availability_end']\n                required = p['required_time']\n                \n                earliest_start = max(arrival_time, avail_start)\n                latest_start = avail_end - required\n                \n                if earliest_start <= latest_start:\n                    if earliest_start >= current_end:\n                        heapq.heappush(priority_queue, (earliest_start, earliest_start + required, p))\n    else:\n        # This meeting can't be scheduled now, put it back into the queue\n        heapq.heappush(priority_queue, (start_min, end_min, person))\n\n# Convert the schedule to the required format\nitinerary = []\nfor meeting in schedule:\n    location = meeting['location']\n    person = meeting['person']\n    start = meeting['start_time']\n    end = meeting['end_time']\n    itinerary.append({\n        'action': 'meet',\n        'location': location,\n        'person': person,\n        'start_time': start,\n        'end_time': end\n    })\n\n# Convert itinerary to JSON\nimport json\nprint(json.dumps({\n    \"itinerary\": itinerary\n}))\n```",
            "count": "meeting_planning_example_372"
        }
    ]
}