{
    "0shot": [
        {
            "final_program_time": {
                "itinerary": [
                    {
                        "action": "meet",
                        "location": "Union Square",
                        "person": "Sarah",
                        "start_time": "1154:0",
                        "end_time": "1431:30"
                    }
                ]
            },
            "expected_time": {
                "itinerary": [
                    {
                        "action": "meet",
                        "location": "The Castro",
                        "person": "Kenneth",
                        "start_time": "11:15",
                        "end_time": "11:45"
                    },
                    {
                        "action": "meet",
                        "location": "Union Square",
                        "person": "Sarah",
                        "start_time": "12:04",
                        "end_time": "13:34"
                    },
                    {
                        "action": "meet",
                        "location": "Pacific Heights",
                        "person": "Daniel",
                        "start_time": "13:49",
                        "end_time": "14:04"
                    },
                    {
                        "action": "meet",
                        "location": "Chinatown",
                        "person": "Richard",
                        "start_time": "14:15",
                        "end_time": "14:45"
                    },
                    {
                        "action": "meet",
                        "location": "Russian Hill",
                        "person": "Karen",
                        "start_time": "14:52",
                        "end_time": "16:52"
                    },
                    {
                        "action": "meet",
                        "location": "North Beach",
                        "person": "Thomas",
                        "start_time": "19:15",
                        "end_time": "19:30"
                    },
                    {
                        "action": "meet",
                        "location": "Embarcadero",
                        "person": "Mary",
                        "start_time": "20:00",
                        "end_time": "21:15"
                    }
                ]
            },
            "has_error": false,
            "raw_model_response": "Alright, I need to help this person write a Python program to schedule meetings in San Francisco. The goal is to meet as many friends as possible, considering travel times and each person's availability.\n\nFirst, I'll look at the travel distances provided. The distances are between various San Francisco neighborhoods, and I need to calculate the time it takes to travel between them. The person starts at Nob Hill at 9:00 AM, so I'll need to consider travel times from there.\n\nNext, I'll examine the constraints. There are several friends in different locations with specific time slots. For example, Mary is at Embarcadero from 8:00 PM to 9:15 PM, Kenneth at The Castro from 11:15 AM to 7:15 PM, Joseph at Haight-Ashbury from 8:00 PM to 10:00 PM, Sarah at Union Square from 11:45 AM to 2:30 PM, Thomas at North Beach from 7:15 PM to 7:45 PM, Daniel at Pacific Heights from 1:45 PM to 8:30 PM, Richard at Chinatown from 8:00 AM to 6:45 PM, Mark at Golden Gate Park from 5:30 PM to 9:30 PM, David at Marina District from 8:00 PM to 9:00 PM, and Karen at Russian Hill from 1:15 PM to 6:30 PM. Each person has a preferred location and a duration they're willing to meet.\n\nI need to determine the best times and locations to meet each person without overlapping schedules and considering travel times. The goal is to maximize the number of meetings.\n\nI'll start by calculating the travel times from Nob Hill to each location. From the given data, it takes 9 minutes to Embarcadero, 17 minutes to The Castro, 13 minutes to Haight-Ashbury, 7 minutes to Union Square, 8 minutes to North Beach, 8 minutes to Pacific Heights, 6 minutes to Chinatown, 17 minutes to Golden Gate Park, 11 minutes to Marina District, 5 minutes to Russian Hill.\n\nFor each friend, I'll calculate the earliest and latest possible start times based on their availability and the travel time from Nob Hill. For example, Mary can be met as early as 8:09 PM (8:00 + 9 minutes) and as late as 9:15 PM (9:15 - 75 minutes).\n\nI'll repeat this process for each friend, calculating their feasible meeting windows. After that, I'll sort these meetings by their end times to pick the earliest ending ones first, which helps in maximizing the number of meetings.\n\nOnce I have all the feasible meetings, I'll select non-overlapping ones, starting with the earliest and moving to the next compatible one. This greedy algorithm approach should give me the optimal schedule.\n\nFinally, I'll convert the meeting times into the required 24-hour format and structure the output as a JSON-formatted dictionary. This way, the program can run independently and provide a valid schedule based on the given constraints.\n```python\nimport json\n\n# Define travel times from Nob Hill to each location\ntravel_times = {\n    'Nob Hill': {\n        'Embarcadero': 9,\n        'The Castro': 17,\n        'Haight-Ashbury': 13,\n        'Union Square': 7,\n        'North Beach': 8,\n        'Pacific Heights': 8,\n        'Chinatown': 6,\n        'Golden Gate Park': 17,\n        'Marina District': 11,\n        'Russian Hill': 5\n    },\n    'Embarcadero': {\n        'Nob Hill': 10,\n        'The Castro': 25,\n        'Haight-Ashbury': 21,\n        'Union Square': 10,\n        'North Beach': 5,\n        'Pacific Heights': 11,\n        'Chinatown': 7,\n        'Golden Gate Park': 25,\n        'Marina District': 12,\n        'Russian Hill': 8\n    },\n    'The Castro': {\n        'Nob Hill': 16,\n        'Embarcadero': 22,\n        'Haight-Ashbury': 6,\n        'Union Square': 19,\n        'North Beach': 20,\n        'Pacific Heights': 16,\n        'Chinatown': 22,\n        'Golden Gate Park': 11,\n        'Marina District': 21,\n        'Russian Hill': 18\n    },\n    'Haight-Ashbury': {\n        'Nob Hill': 15,\n        'Embarcadero': 20,\n        'The Castro': 6,\n        'Union Square': 19,\n        'North Beach': 19,\n        'Pacific Heights': 12,\n        'Chinatown': 19,\n        'Golden Gate Park': 7,\n        'Marina District': 17,\n        'Russian Hill': 17\n    },\n    'Union Square': {\n        'Nob Hill': 9,\n        'Embarcadero': 11,\n        'The Castro': 17,\n        'Haight-Ashbury': 18,\n        'North Beach': 10,\n        'Pacific Heights': 15,\n        'Chinatown': 7,\n        'Golden Gate Park': 22,\n        'Marina District': 18,\n        'Russian Hill': 13\n    },\n    'North Beach': {\n        'Nob Hill': 7,\n        'Embarcadero': 6,\n        'The Castro': 23,\n        'Haight-Ashbury': 18,\n        'Union Square': 7,\n        'Pacific Heights': 8,\n        'Chinatown': 6,\n        'Golden Gate Park': 22,\n        'Marina District': 9,\n        'Russian Hill': 4\n    },\n    'Pacific Heights': {\n        'Nob Hill': 8,\n        'Embarcadero': 10,\n        'The Castro': 16,\n        'Haight-Ashbury': 11,\n        'Union Square': 12,\n        'North Beach': 9,\n        'Chinatown': 11,\n        'Golden Gate Park': 15,\n        'Marina District': 6,\n        'Russian Hill': 7\n    },\n    'Chinatown': {\n        'Nob Hill': 9,\n        'Embarcadero': 5,\n        'The Castro': 22,\n        'Haight-Ashbury': 19,\n        'Union Square': 7,\n        'North Beach': 3,\n        'Pacific Heights': 10,\n        'Golden Gate Park': 23,\n        'Marina District': 12,\n        'Russian Hill': 7\n    },\n    'Golden Gate Park': {\n        'Nob Hill': 20,\n        'Embarcadero': 25,\n        'The Castro': 13,\n        'Haight-Ashbury': 7,\n        'Union Square': 22,\n        'North Beach': 23,\n        'Pacific Heights': 16,\n        'Chinatown': 23,\n        'Marina District': 16,\n        'Russian Hill': 19\n    },\n    'Marina District': {\n        'Nob Hill': 12,\n        'Embarcadero': 14,\n        'The Castro': 22,\n        'Haight-Ashbury': 16,\n        'Union Square': 16,\n        'North Beach': 11,\n        'Pacific Heights': 7,\n        'Chinatown': 15,\n        'Golden Gate Park': 18,\n        'Russian Hill': 8\n    },\n    'Russian Hill': {\n        'Nob Hill': 5,\n        'Embarcadero': 8,\n        'The Castro': 21,\n        'Haight-Ashbury': 17,\n        'Union Square': 10,\n        'North Beach': 5,\n        'Pacific Heights': 7,\n        'Chinatown': 9,\n        'Golden Gate Park': 21,\n        'Marina District': 7\n    }\n}\n\n# List of people with their details\npeople = [\n    {\n        'name': 'Mary',\n        'location': 'Embarcadero',\n        'start_time': '20:00',\n        'end_time': '21:15',\n        'duration': 75,\n        'travel_time': 9\n    },\n    {\n        'name': 'Kenneth',\n        'location': 'The Castro',\n        'start_time': '11:15',\n        'end_time': '19:15',\n        'duration': 30,\n        'travel_time': 17\n    },\n    {\n        'name': 'Joseph',\n        'location': 'Haight-Ashbury',\n        'start_time': '20:00',\n        'end_time': '22:00',\n        'duration': 120,\n        'travel_time': 13\n    },\n    {\n        'name': 'Sarah',\n        'location': 'Union Square',\n        'start_time': '11:45',\n        'end_time': '14:30',\n        'duration': 90,\n        'travel_time': 10\n    },\n    {\n        'name': 'Thomas',\n        'location': 'North Beach',\n        'start_time': '19:15',\n        'end_time': '19:45',\n        'duration': 15,\n        'travel_time': 6\n    },\n    {\n        'name': 'Daniel',\n        'location': 'Pacific Heights',\n        'start_time': '13:45',\n        'end_time': '20:30',\n        'duration': 15,\n        'travel_time': 11\n    },\n    {\n        'name': 'Richard',\n        'location': 'Chinatown',\n        'start_time': '8:00',\n        'end_time': '18:45',\n        'duration': 30,\n        'travel_time': 5\n    },\n    {\n        'name': 'Mark',\n        'location': 'Golden Gate Park',\n        'start_time': '17:30',\n        'end_time': '21:30',\n        'duration': 120,\n        'travel_time': 17\n    },\n    {\n        'name': 'David',\n        'location': 'Marina District',\n        'start_time': '20:00',\n        'end_time': '21:00',\n        'duration': 60,\n        'travel_time': 12\n    },\n    {\n        'name': 'Karen',\n        'location': 'Russian Hill',\n        'start_time': '13:15',\n        'end_time': '19:30',\n        'duration': 120,\n        'travel_time': 8\n    }\n]\n\n# Function to calculate feasible meeting times\ndef calculate_feasible_meetings(people, travel_times):\n    meetings = []\n    for person in people:\n        location = person['location']\n        start_time = person['start_time']\n        end_time = person['end_time']\n        duration = person['duration']\n        travel_time = travel_times['Nob Hill'][location]\n        \n        # Convert times to minutes since 9:00 AM\n        earliest_start_min = (int(start_time.replace(':', '')) * 60) + 540  # 9:00 AM in minutes\n        latest_start_min = (int(end_time.replace(':', '')) * 60) - duration\n        \n        # Ensure earliest start is at least 9:00 AM\n        if earliest_start_min < 540:\n            earliest_start_min = 540\n        \n        if latest_start_min < earliest_start_min:\n            continue  # No possible meeting time\n        \n        meetings.append({\n            'name': person['name'],\n            'location': location,\n            'start_time': earliest_start_min,\n            'end_time': latest_start_min\n        })\n    \n    return meetings\n\n# Calculate feasible meeting times\nfeasible_meetings = calculate_feasible_meetings(people, travel_times)\n\n# Sort meetings by end time\nfeasible_meetings.sort(key=lambda x: x['end_time'])\n\n# Select non-overlapping meetings\nitinerary = []\nfor meeting in feasible_meetings:\n    start = meeting['start_time']\n    end = meeting['end_time']\n    if not itinerary or end <= itinerary[-1]['end_time']:\n        itinerary.append(meeting)\n\n# Convert time to 24-hour format strings\nitinerary = [\n    {\n        'action': 'meet',\n        'location': meeting['location'],\n        'person': meeting['name'],\n        'start_time': f\"{meeting['start_time'] // 60 + (meeting['start_time'] % 60 // 10)}:{meeting['start_time'] % 60 // 10 * 10}\",\n        'end_time': f\"{meeting['end_time'] // 60 + (meeting['end_time'] % 60 // 10)}:{meeting['end_time'] % 60 // 10 * 10}\"\n    }\n    for meeting in itinerary\n]\n\n# Generate JSON output\noutput = {\n    \"itinerary\": itinerary\n}\n\nprint(json.dumps(output))\n```",
            "count": "meeting_planning_example_934"
        }
    ]
}