{
    "0shot": [
        {
            "final_program_time": {
                "itinerary": []
            },
            "expected_time": {
                "itinerary": [
                    {
                        "action": "meet",
                        "location": "Chinatown",
                        "person": "Deborah",
                        "start_time": "9:16",
                        "end_time": "10:01"
                    },
                    {
                        "action": "meet",
                        "location": "The Castro",
                        "person": "George",
                        "start_time": "10:23",
                        "end_time": "11:23"
                    },
                    {
                        "action": "meet",
                        "location": "Russian Hill",
                        "person": "Emily",
                        "start_time": "12:15",
                        "end_time": "14:00"
                    },
                    {
                        "action": "meet",
                        "location": "Presidio",
                        "person": "Mark",
                        "start_time": "14:45",
                        "end_time": "15:45"
                    },
                    {
                        "action": "meet",
                        "location": "Golden Gate Park",
                        "person": "Steven",
                        "start_time": "15:57",
                        "end_time": "17:42"
                    },
                    {
                        "action": "meet",
                        "location": "Sunset District",
                        "person": "Margaret",
                        "start_time": "21:30",
                        "end_time": "22:30"
                    }
                ]
            },
            "has_error": false,
            "raw_model_response": "Alright, I need to write a Python program that calculates the optimal meeting schedule for someone visiting San Francisco. The goal is to meet as many friends as possible, considering their availability and the travel times between locations.\n\nFirst, I'll start by understanding the problem. The user arrives at Alamo Square at 9:00 AM and wants to meet friends in different districts. Each friend has a specific time window and a minimum meeting duration. The challenge is to find the best schedule that allows meeting the maximum number of friends without violating any constraints.\n\nI'll need to process the travel times between locations. There are several districts: Russian Hill, Presidio, Chinatown, Sunset District, The Castro, Embarcadero, and Golden Gate Park. Each location has travel times to every other location, which I'll store in a dictionary for easy access.\n\nNext, I'll list out all the friends with their respective details. Each friend has a name, location, start time, end time, and the minimum duration required for the meeting. I'll convert these times into minutes to make calculations easier.\n\nThe core of the problem is to generate all possible permutations of the friends and check each permutation to see if it's feasible. For each permutation, I'll calculate the arrival time at each location, ensuring that the meeting can start within the friend's available time window and last for the required duration. I'll also account for travel times between consecutive meetings.\n\nI'll use itertools.permutations to generate all possible orders of meeting the friends. For each order, I'll simulate the day, starting from Alamo Square at 9:00 AM. I'll track the current location and time, adding each meeting to the itinerary if it fits within the constraints.\n\nIf a permutation allows meeting more friends than the previous best, I'll update the best itinerary. After evaluating all permutations, I'll output the best schedule in the required JSON format.\n\nI'll also need to handle time conversions between minutes and hours:minutes format for the output. Ensuring that the times are correctly calculated and formatted is crucial for the solution to be valid.\n\nFinally, I'll test the program to make sure it runs independently and produces valid JSON output without any additional text or explanations.\n</think>\n\n```python\nimport itertools\n\ndef time_to_minutes(t):\n    h, m = map(int, t.split(':'))\n    return h * 60 + m\n\ndef minutes_to_time(m):\n    h = m // 60\n    m = m % 60\n    return f\"{h}:{m:02d}\"\n\ntravel_times = {\n    'Alamo Square': {\n        'Russian Hill': 13,\n        'Presidio': 18,\n        'Chinatown': 16,\n        'Sunset District': 16,\n        'The Castro': 8,\n        'Embarcadero': 17,\n        'Golden Gate Park': 9,\n    },\n    'Russian Hill': {\n        'Alamo Square': 15,\n        'Presidio': 14,\n        'Chinatown': 9,\n        'Sunset District': 23,\n        'The Castro': 21,\n        'Embarcadero': 8,\n        'Golden Gate Park': 21,\n    },\n    'Presidio': {\n        'Alamo Square': 18,\n        'Russian Hill': 14,\n        'Chinatown': 21,\n        'Sunset District': 15,\n        'The Castro': 21,\n        'Embarcadero': 20,\n        'Golden Gate Park': 12,\n    },\n    'Chinatown': {\n        'Alamo Square': 17,\n        'Russian Hill': 7,\n        'Presidio': 19,\n        'Sunset District': 29,\n        'The Castro': 22,\n        'Embarcadero': 5,\n        'Golden Gate Park': 23,\n    },\n    'Sunset District': {\n        'Alamo Square': 17,\n        'Russian Hill': 24,\n        'Presidio': 16,\n        'Chinatown': 30,\n        'The Castro': 17,\n        'Embarcadero': 31,\n        'Golden Gate Park': 11,\n    },\n    'The Castro': {\n        'Alamo Square': 8,\n        'Russian Hill': 18,\n        'Presidio': 20,\n        'Chinatown': 20,\n        'Sunset District': 17,\n        'Embarcadero': 22,\n        'Golden Gate Park': 11,\n    },\n    'Embarcadero': {\n        'Alamo Square': 19,\n        'Russian Hill': 8,\n        'Presidio': 20,\n        'Chinatown': 7,\n        'Sunset District': 30,\n        'The Castro': 25,\n        'Golden Gate Park': 25,\n    },\n    'Golden Gate Park': {\n        'Alamo Square': 10,\n        'Russian Hill': 19,\n        'Presidio': 11,\n        'Chinatown': 23,\n        'Sunset District': 10,\n        'The Castro': 13,\n        'Embarcadero': 25,\n    },\n}\n\nfriends = [\n    {'name': 'Emily', 'location': 'Russian Hill', 'start': '12:15', 'end': '14:15', 'duration': 105},\n    {'name': 'Mark', 'location': 'Presidio', 'start': '14:45', 'end': '19:30', 'duration': 60},\n    {'name': 'Deborah', 'location': 'Chinatown', 'start': '7:30', 'end': '15:30', 'duration': 45},\n    {'name': 'Margaret', 'location': 'Sunset District', 'start': '21:30', 'end': '22:30', 'duration': 60},\n    {'name': 'George', 'location': 'The Castro', 'start': '7:30', 'end': '14:15', 'duration': 60},\n    {'name': 'Andrew', 'location': 'Embarcadero', 'start': '20:15', 'end': '22:00', 'duration': 75},\n    {'name': 'Steven', 'location': 'Golden Gate Park', 'start': '11:15', 'end': '21:15', 'duration': 105},\n]\n\nbest_itinerary = []\n\nfor perm in itertools.permutations(friends):\n    current_location = 'Alamo Square'\n    current_time = 540  # 9:00 AM\n    itinerary = []\n    valid = True\n    for friend in perm:\n        travel = travel_times[current_location][friend['location']]\n        arrival = current_time + travel\n        start = time_to_minutes(friend['start'])\n        end = time_to_minutes(friend['end'])\n        meet_start = max(arrival, start)\n        meet_end = meet_start + friend['duration']\n        if meet_end > end:\n            valid = False\n            break\n        itinerary.append({\n            'action': 'meet',\n            'location': friend['location'],\n            'person': friend['name'],\n            'start_time': minutes_to_time(meet_start),\n            'end_time': minutes_to_time(meet_end)\n        })\n        current_location = friend['location']\n        current_time = meet_end\n    if valid:\n        if len(itinerary) > len(best_itinerary):\n            best_itinerary = itinerary.copy()\n\nprint('SOLUTION:')\nprint('{ \"itinerary\": [')\nfor i, meeting in enumerate(best_itinerary):\n    print(f'    {{\"action\": \"meet\", \"location\": \"{meeting[\"location\"]}\", \"person\": \"{meeting[\"person\"]}\", \"start_time\": \"{meeting[\"start_time\"]}\", \"end_time\": \"{meeting[\"end_time\"]}\"}}' + ('' if i == len(best_itinerary)-1 else ','))\nprint(']}')\n```",
            "count": "meeting_planning_example_612"
        }
    ]
}