{
    "0shot": [
        {
            "final_program_time": {
                "itinerary": [
                    {
                        "action": "meet",
                        "location": "Sunset District",
                        "person": "Sarah",
                        "start_time": "10:45",
                        "end_time": "11:15"
                    },
                    {
                        "action": "meet",
                        "location": "Haight-Ashbury",
                        "person": "Richard",
                        "start_time": "11:45",
                        "end_time": "13:15"
                    },
                    {
                        "action": "meet",
                        "location": "Mission District",
                        "person": "Elizabeth",
                        "start_time": "13:26",
                        "end_time": "15:26"
                    },
                    {
                        "action": "meet",
                        "location": "Golden Gate Park",
                        "person": "Michelle",
                        "start_time": "18:15",
                        "end_time": "19:45"
                    }
                ]
            },
            "expected_time": {
                "itinerary": [
                    {
                        "action": "meet",
                        "location": "Sunset District",
                        "person": "Sarah",
                        "start_time": "10:45",
                        "end_time": "11:15"
                    },
                    {
                        "action": "meet",
                        "location": "Haight-Ashbury",
                        "person": "Richard",
                        "start_time": "11:45",
                        "end_time": "13:15"
                    },
                    {
                        "action": "meet",
                        "location": "Mission District",
                        "person": "Elizabeth",
                        "start_time": "13:26",
                        "end_time": "15:26"
                    },
                    {
                        "action": "meet",
                        "location": "Golden Gate Park",
                        "person": "Michelle",
                        "start_time": "18:15",
                        "end_time": "19:45"
                    }
                ]
            },
            "has_error": false,
            "raw_model_response": "Okay, so I need to write a Python program that calculates the optimal meeting schedule based on the given constraints. Let's break down the problem step by step.\n\nFirst, I'll start by understanding the input parameters and constraints. The user arrives at Richmond District at 9:00 AM. There are four friends to meet, each in different districts with specific time windows and meeting durations. The goal is to meet as many friends as possible, considering travel times between districts.\n\nI'll list out the friends and their details:\n\n- Sarah is at Sunset District from 10:45 AM to 7:00 PM. Need to meet for at least 30 minutes.\n- Richard is at Haight-Ashbury from 11:45 AM to 3:45 PM. Need 90 minutes.\n- Elizabeth is at Mission District from 11:00 AM to 5:15 PM. Need 120 minutes.\n- Michelle is at Golden Gate Park from 6:15 PM to 8:45 PM. Need 90 minutes.\n\nThe travel times between districts are provided. I'll need to represent these in a data structure, maybe a dictionary where the key is a tuple of (from, to) and the value is the time in minutes.\n\nNext, I need to model the problem. The approach should consider all possible orders of visiting friends, calculate the schedule for each, and choose the one that meets the maximum number of friends.\n\nBut considering all permutations might be computationally intensive, but since there are only four friends, it's manageable.\n\nEach possible permutation of friends will be a potential schedule. For each permutation, I'll check if it's possible to meet each friend within their available time, considering travel times and meeting durations.\n\nLet me outline the steps:\n\n1. Generate all possible permutations of the four friends.\n2. For each permutation, calculate the schedule starting from Richmond District at 9:00 AM.\n3. For each friend in the permutation, calculate the earliest arrival time, considering travel from the previous location.\n4. Check if the arrival time allows enough time to meet the friend for the required duration within their available window.\n5. If all friends in the permutation can be met, record the schedule.\n6. Among all valid schedules, choose the one that meets the most friends. If multiple have the same count, perhaps choose the one with the earliest end time or the first one found.\n\nBut wait, since the goal is to meet as many as possible, we should prioritize permutations that include more friends. So, I should check permutations in order of decreasing length, starting with all four, then three, etc.\n\nAlternatively, for each possible subset of friends, check if they can be scheduled in some order. Start with subsets of size 4, then 3, etc., until a valid schedule is found.\n\nHowever, this might be more complex. Maybe it's simpler to generate all possible orders of all four friends and see which permutation allows meeting the most friends without violating constraints.\n\nBut even with four friends, there are 4! = 24 permutations. For each, I need to check if the schedule is feasible.\n\nLet me think about how to model the schedule for a given permutation.\n\nFor example, take the permutation [Sarah, Richard, Elizabeth, Michelle].\n\nStart at Richmond at 9:00 AM.\n\n1. Go from Richmond to Sunset (Sarah's location). Travel time is 11 minutes. So arrival at 9:11 AM.\n   - Check if 9:11 AM is within Sarah's available time (10:45 AM to 7:00 PM). Since 9:11 is before 10:45, we can't meet her now. So maybe we need to wait until 10:45. But the meeting needs to be at least 30 minutes. So the earliest we can start is 10:45, end at 11:15.\n\n   So after meeting Sarah, the next location is Richard's in Haight-Ashbury. Travel time from Sunset to Haight-Ashbury is 15 minutes. So arrival at 11:15 + 15 = 11:30 AM.\n\n   Richard is available from 11:45 AM. So we arrive at 11:30, which is before his start time. We can start meeting him at 11:45. The meeting needs 90 minutes, so ends at 1:15 PM.\n\n   Next, go to Elizabeth in Mission District. Travel time from Haight-Ashbury to Mission is 11 minutes. Arrival at 1:15 + 11 = 1:26 PM.\n\n   Elizabeth is available until 5:15 PM. We need 120 minutes, so meeting from 1:26 PM to 3:26 PM.\n\n   Then, go to Michelle in Golden Gate Park. Travel time from Mission to Golden Gate Park is 17 minutes. Arrival at 3:26 +17 = 3:43 PM.\n\n   Michelle is available from 6:15 PM. So we arrive at 3:43 PM, which is way before. So we have to wait until 6:15 PM. The meeting needs 90 minutes, so ends at 7:45 PM.\n\n   So this permutation seems feasible, meeting all four friends.\n\nWait, but let me double-check each step.\n\nWait, after meeting Sarah, we have to leave Sunset at 11:15 AM. Then travel to Haight-Ashbury takes 15 minutes, arriving at 11:30 AM. Richard is available from 11:45, so we can start at 11:45. Meeting for 90 minutes ends at 1:15 PM.\n\nThen, travel to Mission District: Haight-Ashbury to Mission is 11 minutes. So arrival at 1:15 + 11 = 1:26 PM. Elizabeth is available from 11 AM to 5:15 PM. So we can start meeting her at 1:26 PM. 120 minutes takes us to 3:26 PM.\n\nThen, travel to Golden Gate Park: Mission to Golden Gate Park is 17 minutes. So arrival at 3:26 +17 = 3:43 PM. Michelle is available from 6:15 PM. So we have to wait until 6:15 PM. Meeting her for 90 minutes ends at 7:45 PM.\n\nSo yes, this permutation works. So the itinerary would include all four friends.\n\nBut wait, are there any other permutations that might also include all four? Or is this the only one? I'm not sure, but at least one permutation works.\n\nSo the program needs to find such a permutation and output the schedule.\n\nNow, how to model this in code.\n\nFirst, I'll represent the travel times as a dictionary. Each key is a tuple (from_location, to_location), value is the time in minutes.\n\nThen, represent each friend as a dictionary with their location, name, start time, end time, and required duration.\n\nI'll create a list of friends, each with their details.\n\nThen, generate all possible permutations of these friends. For each permutation, simulate the schedule.\n\nFor each permutation:\n\n- Start at Richmond at 9:00 AM.\n- For each friend in the permutation order:\n   - Calculate the travel time from the current location to the friend's location.\n   - Add this to the current time to get the arrival time.\n   - Determine the earliest possible start time for the meeting, which is the maximum between the arrival time and the friend's start time.\n   - Check if there's enough time to meet for the required duration before the friend's end time.\n   - If yes, update the current time to the end of the meeting, and the current location to the friend's location.\n   - If no, this permutation is invalid, break and try the next permutation.\n\nIf all friends in the permutation can be met, record the schedule.\n\nOnce all permutations are checked, select the permutation that meets the most friends. If multiple permutations meet the same number, choose the one that finishes earliest or the first one found.\n\nWait, but in the example above, the permutation [Sarah, Richard, Elizabeth, Michelle] works. Are there other permutations that might also include all four? Maybe, but the program should find at least one.\n\nSo in code, I can generate all permutations of the four friends, and for each, check if the schedule is possible. Once a valid permutation is found that includes all four, that's the optimal solution.\n\nNow, how to represent time. I'll need to convert times to minutes since midnight for easier calculations.\n\nFor example, 9:00 AM is 9*60 = 540 minutes.\n\nEach friend's start and end times will be converted similarly.\n\nSo, for Sarah:\n\nstart_time = 10:45 AM \u2192 10*60 +45 = 645 minutes.\n\nend_time = 19:00 \u2192 19*60=1140.\n\nSimilarly for others.\n\nWhen calculating arrival times, I'll add the travel time to the current time, then compare with the friend's available window.\n\nNow, implementing this in Python:\n\nFirst, read the travel times into a dictionary.\n\nThen, define the friends with their details.\n\nThen, generate all possible permutations of the friends.\n\nFor each permutation, simulate the schedule:\n\nInitialize current_time = 540 (9:00 AM), current_location = 'Richmond District'.\n\nFor each friend in permutation:\n\n   travel_time = travel_times[(current_location, friend.location)]\n\n   arrival_time = current_time + travel_time\n\n   meeting_start = max(arrival_time, friend.start_time)\n\n   meeting_end = meeting_start + friend.duration\n\n   if meeting_end > friend.end_time:\n\n       permutation is invalid, break.\n\n   else:\n\n       add to itinerary: meet at friend.location from meeting_start to meeting_end.\n\n       current_time = meeting_end\n\n       current_location = friend.location\n\nIf all friends in permutation are processed without breaking, then this is a valid schedule.\n\nOnce a valid permutation is found that includes all four friends, we can output it.\n\nBut wait, the code needs to find the optimal schedule, which may not always be possible to meet all four. So the code should check all possible permutations, starting from the longest possible, and return the one with the most friends.\n\nAlternatively, the code can check all possible permutations and track the best one.\n\nBut for the sake of time, perhaps the code can generate all permutations, check each, and keep track of the best schedule (the one with the most friends met). If multiple schedules have the same number, the first one found can be chosen.\n\nBut in the given example, it's possible to meet all four, so the code should find that.\n\nNow, let's think about the code structure.\n\nImport necessary modules: itertools for permutations.\n\nDefine the travel times as a dictionary.\n\nDefine the friends as a list of dictionaries, each with location, name, start, end, duration.\n\nThen, for each permutation in itertools.permutations(friends):\n\n   simulate the schedule.\n\n   if all friends can be met, record the itinerary.\n\n   since we're looking for the maximum, once a permutation with all four is found, it's the best possible, so we can return it.\n\nBut wait, what if a permutation with all four is found, but another permutation also includes all four but ends earlier? The problem statement says to optimize the goals, which is to meet as many as possible. So if all four can be met, that's the best, regardless of the order.\n\nSo the code can stop once a permutation that includes all four is found, as it's the optimal solution.\n\nBut to be thorough, perhaps the code should check all permutations and select the one that allows meeting the most friends, and in case of a tie, the one that ends earliest.\n\nBut for the sake of efficiency, once a permutation with all four is found, it can be returned immediately.\n\nNow, coding this:\n\nFirst, represent the friends:\n\nfriends = [\n    {\n        'location': 'Sunset District',\n        'name': 'Sarah',\n        'start': 645,  # 10:45 AM\n        'end': 1140,   # 7:00 PM\n        'duration': 30\n    },\n    {\n        'location': 'Haight-Ashbury',\n        'name': 'Richard',\n        'start': 705,  # 11:45 AM\n        'end': 885,    # 3:45 PM\n        'duration': 90\n    },\n    {\n        'location': 'Mission District',\n        'name': 'Elizabeth',\n        'start': 660,  # 11:00 AM\n        'end': 1020 + 75,  # Wait, 5:15 PM is 17:15 \u2192 17*60 +15= 1035?\n        Wait, 5:15 PM is 17*60 +15 = 1035 minutes.\n\n        So 'end': 1035,\n        'duration': 120\n    },\n    {\n        'location': 'Golden Gate Park',\n        'name': 'Michelle',\n        'start': 1115 + 45 = 6:15 PM is 18*60 +15= 1115? Wait 6:15 PM is 18:15 \u2192 18*60 +15= 1095 minutes.\n\n        So 'start': 1095,\n        'end': 8:45 PM is 20*60 +45= 1245,\n        'duration': 90\n    }\n]\n\nWait, double-checking:\n\n- Sarah: 10:45 AM = 10*60 +45 = 645\n- Richard: 11:45 AM = 11*60+45=705\n- Elizabeth: 11:00 AM=660, ends at 5:15 PM=17*60+15=1035\n- Michelle: 6:15 PM=18*60+15=1095, ends at 8:45 PM=20*60+45=1245.\n\nYes.\n\nNow, the travel_times dictionary:\n\ntravel_times = {\n    ('Richmond District', 'Sunset District'): 11,\n    ('Richmond District', 'Haight-Ashbury'): 10,\n    ('Richmond District', 'Mission District'): 20,\n    ('Richmond District', 'Golden Gate Park'): 9,\n    ('Sunset District', 'Richmond District'): 12,\n    ('Sunset District', 'Haight-Ashbury'): 15,\n    ('Sunset District', 'Mission District'): 24,\n    ('Sunset District', 'Golden Gate Park'): 11,\n    ('Haight-Ashbury', 'Richmond District'): 10,\n    ('Haight-Ashbury', 'Sunset District'): 15,\n    ('Haight-Ashbury', 'Mission District'): 11,\n    ('Haight-Ashbury', 'Golden Gate Park'): 7,\n    ('Mission District', 'Richmond District'): 20,\n    ('Mission District', 'Sunset District'): 24,\n    ('Mission District', 'Haight-Ashbury'): 12,\n    ('Mission District', 'Golden Gate Park'): 17,\n    ('Golden Gate Park', 'Richmond District'): 7,\n    ('Golden Gate Park', 'Sunset District'): 10,\n    ('Golden Gate Park', 'Haight-Ashbury'): 7,\n    ('Golden Gate Park', 'Mission District'): 17,\n}\n\nWait, I think I might have missed some entries, but according to the problem statement, all possible pairs are given. So I need to make sure all are included.\n\nNow, the code:\n\nImport itertools.\n\nThen, for each permutation in itertools.permutations(friends):\n\n   current_time = 540 (9:00 AM)\n   current_location = 'Richmond District'\n   itinerary = []\n   valid = True\n\n   for friend in permutation:\n       # Get travel time\n       travel = travel_times.get((current_location, friend['location']), None)\n       if travel is None:\n           valid = False\n           break\n       arrival = current_time + travel\n       meeting_start = max(arrival, friend['start'])\n       meeting_end = meeting_start + friend['duration']\n       if meeting_end > friend['end']:\n           valid = False\n           break\n       # Add to itinerary\n       itinerary.append({\n           'action': 'meet',\n           'location': friend['location'],\n           'person': friend['name'],\n           'start_time': format_time(meeting_start),\n           'end_time': format_time(meeting_end)\n       })\n       current_time = meeting_end\n       current_location = friend['location']\n\n   if valid:\n       # Check if this permutation meets all four\n       if len(itinerary) == 4:\n           # Found optimal solution\n           print(json.dumps({'itinerary': itinerary}))\n           exit()\n       else:\n           # Keep track if it's the best so far\n           # But since we're looking for maximum, once a 4 is found, we can return\n           pass\n\nBut wait, the code above will loop through all permutations, and for each, if it's valid, check if it's length 4. Once found, print and exit.\n\nBut in the example permutation [Sarah, Richard, Elizabeth, Michelle], the code would generate the itinerary and print it.\n\nBut I also need a function to convert minutes to time string in 'H:MM' format without leading zero.\n\nSo, a helper function:\n\ndef format_time(minutes):\n    hours = minutes // 60\n    mins = minutes % 60\n    return f\"{hours}:{mins:02d}\"\n\nWait, but the problem says times should be in 24-hour format like '9:00' or '13:30' (no leading zero). So for 9:05 AM, it's '9:05', not '09:05'.\n\nSo the function should return hours as an integer without leading zero, and minutes with two digits.\n\nSo the function can be:\n\ndef format_time(minutes):\n    hours = minutes // 60\n    mins = minutes % 60\n    return f\"{hours}:{mins:02d}\"\n\nTesting:\n\nminutes = 645 \u2192 10*60 +45 \u2192 10:45 \u2192 '10:45'\nminutes = 705 \u2192 11:45 \u2192 '11:45'\nminutes = 1115 \u2192 18*60 +35= 18:35? Wait 18*60=1080, 1115-1080=35 \u2192 18:35.\n\nYes.\n\nNow, putting it all together.\n\nThe code will generate all permutations, simulate each, and return the first one that meets all four friends.\n\nBut what if no permutation meets all four? Then the code should find the best possible with three, etc.\n\nBut in this case, the example shows that it's possible to meet all four, so the code should find it.\n\nWait, but in the permutation [Sarah, Richard, Elizabeth, Michelle], after meeting Elizabeth, we have to go to Michelle's location. Let's recheck the times.\n\nAfter Elizabeth:\n\ncurrent_time is 3:26 PM (3*60 +26= 206 minutes? Wait no, 3:26 PM is 15:26 \u2192 15*60 +26= 926 minutes.\n\nWait, wait, no. Let me recalculate.\n\nWait, initial current_time is 540 (9:00 AM).\n\nFirst, meeting Sarah:\n\narrival_time = 540 + 11 (Richmond to Sunset) = 551 minutes \u2192 9:11 AM.\n\nBut Sarah is available from 10:45 (645). So meeting starts at 645.\n\nMeeting ends at 645 +30= 675 (11:15 AM).\n\nThen, travel to Haight-Ashbury: Sunset to Haight is 15 minutes. Arrival at 675 +15= 690 (11:30 AM).\n\nRichard is available from 705 (11:45 AM). So meeting starts at 705.\n\nMeeting ends at 705 +90= 795 (13:15 or 1:15 PM).\n\nTravel to Mission District: Haight to Mission is 11 minutes. Arrival at 795 +11= 806 (13:26 or 1:26 PM).\n\nElizabeth is available from 660 (11:00 AM) to 1035 (5:15 PM). So meeting starts at 806.\n\nMeeting ends at 806 +120= 926 (15:26 or 3:26 PM).\n\nTravel to Golden Gate Park: Mission to Golden Gate is 17 minutes. Arrival at 926 +17= 943 (15:43 or 3:43 PM).\n\nMichelle is available from 1095 (18:15 or 6:15 PM). So arrival is 943, which is earlier than 1095.\n\nSo meeting starts at 1095.\n\nMeeting ends at 1095 +90= 1185 (19:45 or 7:45 PM).\n\nSo the itinerary would be:\n\n[\n    {'action': 'meet', 'location': 'Sunset District', 'person': 'Sarah', 'start_time': '10:45', 'end_time': '11:15'},\n    {'action': 'meet', 'location': 'Haight-Ashbury', 'person': 'Richard', 'start_time': '11:45', 'end_time': '13:15'},\n    {'action': 'meet', 'location': 'Mission District', 'person': 'Elizabeth', 'start_time': '13:26', 'end_time': '15:26'},\n    {'action': 'meet', 'location': 'Golden Gate Park', 'person': 'Michelle', 'start_time': '18:15', 'end_time': '19:45'}\n]\n\nWhich is valid.\n\nSo the code should generate this.\n\nNow, the code:\n\nI'll need to import itertools and json.\n\nThen, define the travel_times and friends.\n\nThen, for each permutation, simulate.\n\nOnce a valid permutation with all four is found, output the JSON.\n\nSo the code would look like this.\n</think>\n\n```python\nimport itertools\nimport json\n\ndef format_time(minutes):\n    hours = minutes // 60\n    mins = minutes % 60\n    return f\"{hours}:{mins:02d}\"\n\ntravel_times = {\n    ('Richmond District', 'Sunset District'): 11,\n    ('Richmond District', 'Haight-Ashbury'): 10,\n    ('Richmond District', 'Mission District'): 20,\n    ('Richmond District', 'Golden Gate Park'): 9,\n    ('Sunset District', 'Richmond District'): 12,\n    ('Sunset District', 'Haight-Ashbury'): 15,\n    ('Sunset District', 'Mission District'): 24,\n    ('Sunset District', 'Golden Gate Park'): 11,\n    ('Haight-Ashbury', 'Richmond District'): 10,\n    ('Haight-Ashbury', 'Sunset District'): 15,\n    ('Haight-Ashbury', 'Mission District'): 11,\n    ('Haight-Ashbury', 'Golden Gate Park'): 7,\n    ('Mission District', 'Richmond District'): 20,\n    ('Mission District', 'Sunset District'): 24,\n    ('Mission District', 'Haight-Ashbury'): 12,\n    ('Mission District', 'Golden Gate Park'): 17,\n    ('Golden Gate Park', 'Richmond District'): 7,\n    ('Golden Gate Park', 'Sunset District'): 10,\n    ('Golden Gate Park', 'Haight-Ashbury'): 7,\n    ('Golden Gate Park', 'Mission District'): 17,\n}\n\nfriends = [\n    {\n        'location': 'Sunset District',\n        'name': 'Sarah',\n        'start': 645,\n        'end': 1140,\n        'duration': 30\n    },\n    {\n        'location': 'Haight-Ashbury',\n        'name': 'Richard',\n        'start': 705,\n        'end': 885,\n        'duration': 90\n    },\n    {\n        'location': 'Mission District',\n        'name': 'Elizabeth',\n        'start': 660,\n        'end': 1035,\n        'duration': 120\n    },\n    {\n        'location': 'Golden Gate Park',\n        'name': 'Michelle',\n        'start': 1095,\n        'end': 1245,\n        'duration': 90\n    }\n]\n\nfor perm in itertools.permutations(friends):\n    current_time = 540  # 9:00 AM\n    current_location = 'Richmond District'\n    itinerary = []\n    valid = True\n    \n    for friend in perm:\n        travel = travel_times.get((current_location, friend['location']), None)\n        if travel is None:\n            valid = False\n            break\n        arrival = current_time + travel\n        meeting_start = max(arrival, friend['start'])\n        meeting_end = meeting_start + friend['duration']\n        if meeting_end > friend['end']:\n            valid = False\n            break\n        itinerary.append({\n            'action': 'meet',\n            'location': friend['location'],\n            'person': friend['name'],\n            'start_time': format_time(meeting_start),\n            'end_time': format_time(meeting_end)\n        })\n        current_time = meeting_end\n        current_location = friend['location']\n    \n    if valid and len(itinerary) == 4:\n        print(json.dumps({'itinerary': itinerary}))\n        exit()\n\n# If no permutation meets all four, check for permutations with fewer friends\nmax_meetings = 0\nbest_itinerary = []\nfor r in range(3, 0, -1):\n    for perm in itertools.permutations(friends, r):\n        current_time = 540\n        current_location = 'Richmond District'\n        itinerary = []\n        valid = True\n        \n        for friend in perm:\n            travel = travel_times.get((current_location, friend['location']), None)\n            if travel is None:\n                valid = False\n                break\n            arrival = current_time + travel\n            meeting_start = max(arrival, friend['start'])\n            meeting_end = meeting_start + friend['duration']\n            if meeting_end > friend['end']:\n                valid = False\n                break\n            itinerary.append({\n                'action': 'meet',\n                'location': friend['location'],\n                'person': friend['name'],\n                'start_time': format_time(meeting_start),\n                'end_time': format_time(meeting_end)\n            })\n            current_time = meeting_end\n            current_location = friend['location']\n        \n        if valid and len(itinerary) > max_meetings:\n            max_meetings = len(itinerary)\n            best_itinerary = itinerary\n            if max_meetings == 3:\n                print(json.dumps({'itinerary': best_itinerary}))\n                exit()\n\nprint(json.dumps({'itinerary': best_itinerary}))\n```",
            "count": "meeting_planning_example_312"
        }
    ]
}