{
    "0shot": [
        {
            "final_program_time": {
                "itinerary": [
                    {
                        "action": "meet",
                        "location": "Pacific Heights",
                        "person": "Emily",
                        "start_time": "11:15",
                        "end_time": "11:45"
                    },
                    {
                        "action": "meet",
                        "location": "Nob Hill",
                        "person": "Rebecca",
                        "start_time": "12:00",
                        "end_time": "13:45"
                    },
                    {
                        "action": "meet",
                        "location": "Marina District",
                        "person": "Brian",
                        "start_time": "13:45",
                        "end_time": "14:15"
                    },
                    {
                        "action": "meet",
                        "location": "Mission District",
                        "person": "Stephanie",
                        "start_time": "14:30",
                        "end_time": "15:15"
                    },
                    {
                        "action": "meet",
                        "location": "Chinatown",
                        "person": "James",
                        "start_time": "15:45",
                        "end_time": "16:45"
                    },
                    {
                        "action": "meet",
                        "location": "Russian Hill",
                        "person": "Steven",
                        "start_time": "17:00",
                        "end_time": "17:30"
                    },
                    {
                        "action": "meet",
                        "location": "Alamo Square",
                        "person": "Elizabeth",
                        "start_time": "17:30",
                        "end_time": "18:45"
                    },
                    {
                        "action": "meet",
                        "location": "Bayview",
                        "person": "William",
                        "start_time": "19:15",
                        "end_time": "20:15"
                    },
                    {
                        "action": "meet",
                        "location": "Richmond District",
                        "person": "Matthew",
                        "start_time": "20:45",
                        "end_time": "21:30"
                    }
                ]
            },
            "expected_time": {
                "itinerary": [
                    {
                        "action": "meet",
                        "location": "Pacific Heights",
                        "person": "Emily",
                        "start_time": "11:15",
                        "end_time": "11:30"
                    },
                    {
                        "action": "meet",
                        "location": "Haight-Ashbury",
                        "person": "Karen",
                        "start_time": "11:45",
                        "end_time": "12:15"
                    },
                    {
                        "action": "meet",
                        "location": "Mission District",
                        "person": "Stephanie",
                        "start_time": "13:00",
                        "end_time": "14:15"
                    },
                    {
                        "action": "meet",
                        "location": "Chinatown",
                        "person": "James",
                        "start_time": "14:31",
                        "end_time": "16:31"
                    },
                    {
                        "action": "meet",
                        "location": "Russian Hill",
                        "person": "Steven",
                        "start_time": "16:38",
                        "end_time": "17:08"
                    },
                    {
                        "action": "meet",
                        "location": "The Castro",
                        "person": "Matthew",
                        "start_time": "17:29",
                        "end_time": "18:14"
                    },
                    {
                        "action": "meet",
                        "location": "Bayview",
                        "person": "William",
                        "start_time": "18:33",
                        "end_time": "20:03"
                    },
                    {
                        "action": "meet",
                        "location": "Marina District",
                        "person": "Brian",
                        "start_time": "20:30",
                        "end_time": "21:00"
                    }
                ]
            },
            "count": "meeting_planning_example_900",
            "is_correct": false,
            "reasoning_token_count": 673,
            "raw_model_response": "Alright, I need to help this user schedule their meetings in San Francisco. They've provided a lot of travel distances and constraints, so I need to make sure I consider all the possible meeting times while respecting everyone's availability.\n\nFirst, the user is starting at the Richmond District at 9:00 AM. They need to meet as many friends as possible, so I should aim for a schedule that maximizes the number of meetings without overlapping conflicts.\n\nLooking at the constraints, there are several friends with specific time slots. I'll need to map out each person's availability and see how they can fit into the day without causing too much back-and-forth travel.\n\nStarting with the earliest possible meeting, I see that Matthew is at The Castro from 4:30 PM to 8:00 PM. That gives me a window in the afternoon. I can plan to meet him somewhere in the late afternoon or early evening.\n\nNext, Rebecca is at Nob Hill from 3:15 PM to 7:15 PM. That's a longer window, so I can potentially meet her later in the afternoon or early evening as well.\n\nBrian is at Marina District from 2:15 PM to 10:00 PM. That's a good chunk of time, so I can fit him in after meeting Matthew or Rebecca.\n\nEmily is at Pacific Heights from 11:15 AM to 7:45 PM. That's a bit earlier, so I might want to meet her in the late morning or early afternoon.\n\nKaren is at Haight-Ashbury from 11:45 AM to 5:30 PM. This gives me a window to meet her in the late morning or early afternoon.\n\nStephanie is at Mission District from 1:00 PM to 3:45 PM. That's a shorter window, so I'll need to schedule that carefully.\n\nJames is at Chinatown from 2:30 PM to 7:00 PM. That's a good time slot, but I need to make sure I don't book anything too late that conflicts with others.\n\nSteven is at Russian Hill from 2:00 PM to 8:00 PM. Another good window, but I need to balance it with other meetings.\n\nElizabeth is at Alamo Square from 1:00 PM to 5:15 PM. That's a solid window, so I can plan a meeting around that time.\n\nWilliam is at Bayview from 6:15 PM to 8:15 PM. That's towards the end of the day, so I can save that slot for last.\n\nI'll start by listing all the possible meeting times and see how they can fit together without overlapping. Starting with the earliest possible meeting, I'll choose Emily at Pacific Heights at 11:15 AM. Then, moving forward, I'll slot in the other meetings, making sure each person has enough time and the travel distances are manageable.\n\nI need to make sure that each meeting doesn't require too much travel time, as that could make the day too packed. So, I'll consider the locations and ensure that moving from one place to another isn't too time-consuming.\n\nAfter planning, I'll check the itinerary to make sure all the constraints are met and that the user can meet as many friends as possible within the day.\n</think>\n\n```json\n{\n  \"itinerary\": [\n    {\n      \"action\": \"meet\",\n      \"location\": \"Pacific Heights\",\n      \"person\": \"Emily\",\n      \"start_time\": \"11:15\",\n      \"end_time\": \"11:45\"\n    },\n    {\n      \"action\": \"meet\",\n      \"location\": \"Nob Hill\",\n      \"person\": \"Rebecca\",\n      \"start_time\": \"12:00\",\n      \"end_time\": \"13:45\"\n    },\n    {\n      \"action\": \"meet\",\n      \"location\": \"Marina District\",\n      \"person\": \"Brian\",\n      \"start_time\": \"13:45\",\n      \"end_time\": \"14:15\"\n    },\n    {\n      \"action\": \"meet\",\n      \"location\": \"Mission District\",\n      \"person\": \"Stephanie\",\n      \"start_time\": \"14:30\",\n      \"end_time\": \"15:15\"\n    },\n    {\n      \"action\": \"meet\",\n      \"location\": \"Chinatown\",\n      \"person\": \"James\",\n      \"start_time\": \"15:45\",\n      \"end_time\": \"16:45\"\n    },\n    {\n      \"action\": \"meet\",\n      \"location\": \"Russian Hill\",\n      \"person\": \"Steven\",\n      \"start_time\": \"17:00\",\n      \"end_time\": \"17:30\"\n    },\n    {\n      \"action\": \"meet\",\n      \"location\": \"Alamo Square\",\n      \"person\": \"Elizabeth\",\n      \"start_time\": \"17:30\",\n      \"end_time\": \"18:45\"\n    },\n    {\n      \"action\": \"meet\",\n      \"location\": \"Bayview\",\n      \"person\": \"William\",\n      \"start_time\": \"19:15\",\n      \"end_time\": \"20:15\"\n    },\n    {\n      \"action\": \"meet\",\n      \"location\": \"Richmond District\",\n      \"person\": \"Matthew\",\n      \"start_time\": \"20:45\",\n      \"end_time\": \"21:30\"\n    }\n  ]\n}\n```",
            "raw_model_reasoning": "Alright, I need to help this user schedule their meetings in San Francisco. They've provided a lot of travel distances and constraints, so I need to make sure I consider all the possible meeting times while respecting everyone's availability.\n\nFirst, the user is starting at the Richmond District at 9:00 AM. They need to meet as many friends as possible, so I should aim for a schedule that maximizes the number of meetings without overlapping conflicts.\n\nLooking at the constraints, there are several friends with specific time slots. I'll need to map out each person's availability and see how they can fit into the day without causing too much back-and-forth travel.\n\nStarting with the earliest possible meeting, I see that Matthew is at The Castro from 4:30 PM to 8:00 PM. That gives me a window in the afternoon. I can plan to meet him somewhere in the late afternoon or early evening.\n\nNext, Rebecca is at Nob Hill from 3:15 PM to 7:15 PM. That's a longer window, so I can potentially meet her later in the afternoon or early evening as well.\n\nBrian is at Marina District from 2:15 PM to 10:00 PM. That's a good chunk of time, so I can fit him in after meeting Matthew or Rebecca.\n\nEmily is at Pacific Heights from 11:15 AM to 7:45 PM. That's a bit earlier, so I might want to meet her in the late morning or early afternoon.\n\nKaren is at Haight-Ashbury from 11:45 AM to 5:30 PM. This gives me a window to meet her in the late morning or early afternoon.\n\nStephanie is at Mission District from 1:00 PM to 3:45 PM. That's a shorter window, so I'll need to schedule that carefully.\n\nJames is at Chinatown from 2:30 PM to 7:00 PM. That's a good time slot, but I need to make sure I don't book anything too late that conflicts with others.\n\nSteven is at Russian Hill from 2:00 PM to 8:00 PM. Another good window, but I need to balance it with other meetings.\n\nElizabeth is at Alamo Square from 1:00 PM to 5:15 PM. That's a solid window, so I can plan a meeting around that time.\n\nWilliam is at Bayview from 6:15 PM to 8:15 PM. That's towards the end of the day, so I can save that slot for last.\n\nI'll start by listing all the possible meeting times and see how they can fit together without overlapping. Starting with the earliest possible meeting, I'll choose Emily at Pacific Heights at 11:15 AM. Then, moving forward, I'll slot in the other meetings, making sure each person has enough time and the travel distances are manageable.\n\nI need to make sure that each meeting doesn't require too much travel time, as that could make the day too packed. So, I'll consider the locations and ensure that moving from one place to another isn't too time-consuming.\n\nAfter planning, I'll check the itinerary to make sure all the constraints are met and that the user can meet as many friends as possible within the day.\n</think>\n\n```json"
        }
    ]
}