{
    "0shot": [
        {
            "final_program_time": {
                "itinerary": [
                    {
                        "action": "meet",
                        "location": "Sunset District",
                        "person": "Carol",
                        "start_time": "10:15",
                        "end_time": "10:45"
                    },
                    {
                        "action": "meet",
                        "location": "Mission District",
                        "person": "Rebecca",
                        "start_time": "11:30",
                        "end_time": "12:50"
                    },
                    {
                        "action": "meet",
                        "location": "Bayview",
                        "person": "Karen",
                        "start_time": "13:00",
                        "end_time": "14:20"
                    }
                ]
            },
            "expected_time": {
                "itinerary": [
                    {
                        "action": "meet",
                        "location": "Sunset District",
                        "person": "Carol",
                        "start_time": "10:15",
                        "end_time": "10:45"
                    },
                    {
                        "action": "meet",
                        "location": "Bayview",
                        "person": "Karen",
                        "start_time": "12:45",
                        "end_time": "14:45"
                    },
                    {
                        "action": "meet",
                        "location": "Mission District",
                        "person": "Rebecca",
                        "start_time": "14:58",
                        "end_time": "16:58"
                    }
                ]
            },
            "count": "meeting_planning_example_286",
            "is_correct": false,
            "reasoning_token_count": 971,
            "raw_model_response": "Alright, let's tackle this problem step by step. I'm an AI meeting planner, and my goal is to help you schedule your day efficiently, considering all the constraints and maximizing the number of friends you meet. First, I'll review the travel distances provided to understand the layout of San Francisco and the possible locations you can visit.\n\nStarting with the constraints, you arrive at Union Square at 9:00 AM. You need to meet several friends located in different districts. Let's list out the people you need to meet and their availability:\n\n1. **Rebecca** - Mission District from 11:30 AM to 8:15 PM. Minimum meeting time: 120 minutes.\n2. **Karen** - Bayview from 12:45 PM to 3:00 PM. Minimum meeting time: 120 minutes.\n3. **Carol** - Sunset District from 10:15 AM to 11:45 AM. Minimum meeting time: 30 minutes.\n\nGiven your arrival at 9:00 AM, the first thing to consider is the timing of your meetings. You need to meet Carol first because her availability is the earliest, from 10:15 AM. Since her meeting only requires 30 minutes, this seems manageable.\n\nAfter meeting Carol, the next earliest time is 11:15 AM, which aligns well with Rebecca's availability starting at 11:30 AM. Since Rebecca needs a 120-minute meeting, this is a significant chunk of your day but doable if planned correctly.\n\nFollowing that, Karen is available from 12:45 PM to 3:00 PM, which is later in the day. However, considering the travel times between locations, it's important to check if there's enough time to move from one place to another without rushing.\n\nNow, let's map out the possible locations and travel times:\n\n- **Union Square** is your starting point.\n- **Mission District** is 14 minutes away from Union Square.\n- **Bayview** is 15 minutes away from Union Square.\n- **Sunset District** is 26 minutes away from Union Square.\n\nGiven that, here's a potential schedule:\n\n1. **10:15 AM - 10:45 AM**: Meet Carol at Sunset District.\n   - Travel time from Union Square to Sunset District: 26 minutes.\n   - Meeting time: 30 minutes.\n   - Next available time: 11:15 AM.\n\n2. **11:15 AM - 12:35 PM**: Meet Rebecca at Mission District.\n   - Travel time from Sunset District to Mission District: 24 minutes.\n   - Meeting time: 120 minutes.\n   - Next available time: 12:35 PM.\n\n3. **12:45 PM - 1:15 PM**: Travel from Mission District to Bayview.\n   - Travel time: 15 minutes.\n   - Next available time: 1:15 PM.\n\n4. **1:15 PM - 2:15 PM**: Meet Karen at Bayview.\n   - Meeting time: 120 minutes.\n   - Next available time: 2:15 PM.\n\nHowever, this schedule leaves a lot of downtime between meetings, especially after meeting Karen. Perhaps there's a better way to optimize the schedule by adjusting the order of meetings or considering overlapping times.\n\nAnother approach could be:\n\n1. **10:15 AM - 10:45 AM**: Meet Carol at Sunset District.\n   - As before.\n\n2. **11:00 AM - 11:30 AM**: Travel from Sunset District to Mission District (24 minutes).\n   - Arrive by 11:30 AM, just in time to meet Rebecca starting at 11:30 AM.\n\n3. **11:30 AM - 12:50 PM**: Meet Rebecca at Mission District (120 minutes).\n   - Next available time: 12:50 PM.\n\n4. **12:50 PM - 1:20 PM**: Travel from Mission District to Bayview (15 minutes).\n   - Arrive by 1:20 PM, meet Karen from 12:45 PM. Adjust meeting time to fit.\n\n5. **1:20 PM - 2:20 PM**: Meet Karen at Bayview (120 minutes).\n   - Next available time: 2:20 PM.\n\nThis seems a bit more efficient, but the main issue is ensuring that the travel times don't overlap with meeting times. It's crucial to factor in the travel time before each meeting to avoid being late or rushed.\n\nConsidering all this, the optimal schedule would be to meet Carol first, then Rebecca, and finally Karen, ensuring that each meeting is timed with enough buffer for travel. This way, you can maximize the number of friends met within your visit to San Francisco.\n</think>\n\n```json\n{\n  \"itinerary\": [\n    {\n      \"action\": \"meet\",\n      \"location\": \"Sunset District\",\n      \"person\": \"Carol\",\n      \"start_time\": \"10:15\",\n      \"end_time\": \"10:45\"\n    },\n    {\n      \"action\": \"meet\",\n      \"location\": \"Mission District\",\n      \"person\": \"Rebecca\",\n      \"start_time\": \"11:30\",\n      \"end_time\": \"12:50\"\n    },\n    {\n      \"action\": \"meet\",\n      \"location\": \"Bayview\",\n      \"person\": \"Karen\",\n      \"start_time\": \"13:00\",\n      \"end_time\": \"14:20\"\n    }\n  ]\n}\n```",
            "raw_model_reasoning": "Alright, let's tackle this problem step by step. I'm an AI meeting planner, and my goal is to help you schedule your day efficiently, considering all the constraints and maximizing the number of friends you meet. First, I'll review the travel distances provided to understand the layout of San Francisco and the possible locations you can visit.\n\nStarting with the constraints, you arrive at Union Square at 9:00 AM. You need to meet several friends located in different districts. Let's list out the people you need to meet and their availability:\n\n1. **Rebecca** - Mission District from 11:30 AM to 8:15 PM. Minimum meeting time: 120 minutes.\n2. **Karen** - Bayview from 12:45 PM to 3:00 PM. Minimum meeting time: 120 minutes.\n3. **Carol** - Sunset District from 10:15 AM to 11:45 AM. Minimum meeting time: 30 minutes.\n\nGiven your arrival at 9:00 AM, the first thing to consider is the timing of your meetings. You need to meet Carol first because her availability is the earliest, from 10:15 AM. Since her meeting only requires 30 minutes, this seems manageable.\n\nAfter meeting Carol, the next earliest time is 11:15 AM, which aligns well with Rebecca's availability starting at 11:30 AM. Since Rebecca needs a 120-minute meeting, this is a significant chunk of your day but doable if planned correctly.\n\nFollowing that, Karen is available from 12:45 PM to 3:00 PM, which is later in the day. However, considering the travel times between locations, it's important to check if there's enough time to move from one place to another without rushing.\n\nNow, let's map out the possible locations and travel times:\n\n- **Union Square** is your starting point.\n- **Mission District** is 14 minutes away from Union Square.\n- **Bayview** is 15 minutes away from Union Square.\n- **Sunset District** is 26 minutes away from Union Square.\n\nGiven that, here's a potential schedule:\n\n1. **10:15 AM - 10:45 AM**: Meet Carol at Sunset District.\n   - Travel time from Union Square to Sunset District: 26 minutes.\n   - Meeting time: 30 minutes.\n   - Next available time: 11:15 AM.\n\n2. **11:15 AM - 12:35 PM**: Meet Rebecca at Mission District.\n   - Travel time from Sunset District to Mission District: 24 minutes.\n   - Meeting time: 120 minutes.\n   - Next available time: 12:35 PM.\n\n3. **12:45 PM - 1:15 PM**: Travel from Mission District to Bayview.\n   - Travel time: 15 minutes.\n   - Next available time: 1:15 PM.\n\n4. **1:15 PM - 2:15 PM**: Meet Karen at Bayview.\n   - Meeting time: 120 minutes.\n   - Next available time: 2:15 PM.\n\nHowever, this schedule leaves a lot of downtime between meetings, especially after meeting Karen. Perhaps there's a better way to optimize the schedule by adjusting the order of meetings or considering overlapping times.\n\nAnother approach could be:\n\n1. **10:15 AM - 10:45 AM**: Meet Carol at Sunset District.\n   - As before.\n\n2. **11:00 AM - 11:30 AM**: Travel from Sunset District to Mission District (24 minutes).\n   - Arrive by 11:30 AM, just in time to meet Rebecca starting at 11:30 AM.\n\n3. **11:30 AM - 12:50 PM**: Meet Rebecca at Mission District (120 minutes).\n   - Next available time: 12:50 PM.\n\n4. **12:50 PM - 1:20 PM**: Travel from Mission District to Bayview (15 minutes).\n   - Arrive by 1:20 PM, meet Karen from 12:45 PM. Adjust meeting time to fit.\n\n5. **1:20 PM - 2:20 PM**: Meet Karen at Bayview (120 minutes).\n   - Next available time: 2:20 PM.\n\nThis seems a bit more efficient, but the main issue is ensuring that the travel times don't overlap with meeting times. It's crucial to factor in the travel time before each meeting to avoid being late or rushed.\n\nConsidering all this, the optimal schedule would be to meet Carol first, then Rebecca, and finally Karen, ensuring that each meeting is timed with enough buffer for travel. This way, you can maximize the number of friends met within your visit to San Francisco.\n</think>\n\n```json"
        }
    ]
}