{
    "0shot": [
        {
            "final_program_time": {
                "itinerary": [
                    {
                        "action": "meet",
                        "location": "Presidio",
                        "person": "Matthew",
                        "start_time": "10:00",
                        "end_time": "11:00"
                    },
                    {
                        "action": "meet",
                        "location": "Chinatown",
                        "person": "Margaret",
                        "start_time": "11:15",
                        "end_time": "12:00"
                    },
                    {
                        "action": "meet",
                        "location": "Pacific Heights",
                        "person": "Nancy",
                        "start_time": "12:15",
                        "end_time": "12:30"
                    },
                    {
                        "action": "meet",
                        "location": "Richmond District",
                        "person": "Helen",
                        "start_time": "12:45",
                        "end_time": "13:45"
                    },
                    {
                        "action": "meet",
                        "location": "Fisherman's Wharf",
                        "person": "Rebecca",
                        "start_time": "14:15",
                        "end_time": "14:45"
                    },
                    {
                        "action": "meet",
                        "location": "Golden Gate Park",
                        "person": "Kimberly",
                        "start_time": "15:30",
                        "end_time": "16:30"
                    },
                    {
                        "action": "meet",
                        "location": "Bayview",
                        "person": "Kenneth",
                        "start_time": "17:00",
                        "end_time": "17:30"
                    }
                ]
            },
            "expected_time": {
                "itinerary": [
                    {
                        "action": "meet",
                        "location": "Presidio",
                        "person": "Matthew",
                        "start_time": "11:00",
                        "end_time": "12:30"
                    },
                    {
                        "action": "meet",
                        "location": "Golden Gate Park",
                        "person": "Kimberly",
                        "start_time": "13:00",
                        "end_time": "15:00"
                    },
                    {
                        "action": "meet",
                        "location": "Pacific Heights",
                        "person": "Nancy",
                        "start_time": "15:16",
                        "end_time": "15:31"
                    },
                    {
                        "action": "meet",
                        "location": "Bayview",
                        "person": "Kenneth",
                        "start_time": "15:53",
                        "end_time": "16:53"
                    },
                    {
                        "action": "meet",
                        "location": "Chinatown",
                        "person": "Margaret",
                        "start_time": "17:11",
                        "end_time": "18:41"
                    },
                    {
                        "action": "meet",
                        "location": "Richmond District",
                        "person": "Helen",
                        "start_time": "19:45",
                        "end_time": "20:45"
                    },
                    {
                        "action": "meet",
                        "location": "Fisherman's Wharf",
                        "person": "Rebecca",
                        "start_time": "21:15",
                        "end_time": "22:15"
                    }
                ]
            },
            "count": "meeting_planning_example_629",
            "is_correct": false,
            "reasoning_token_count": 847,
            "raw_model_response": "Alright, let's tackle this problem. I need to schedule a day of meetings in San Francisco, starting at Russian Hill at 9:00 AM. My goal is to meet as many friends as possible, so I need to plan the meetings efficiently, considering travel times and constraints.\n\nFirst, I'll list out the travel distances provided. Russian Hill is connected to several locations, so I need to figure out the best order to visit these places to minimize travel time and maximize the time spent with each friend.\n\nLooking at the constraints, I see that:\n\n1. **Matthew** will be at Presidio from 11:00 AM to 9:00 PM. I need at least 90 minutes with him.\n2. **Margaret** will be at Chinatown from 9:15 AM to 6:45 PM. I need 90 minutes with her.\n3. **Nancy** will be at Pacific Heights from 2:15 PM to 5:00 PM. I need 15 minutes with her.\n4. **Helen** will be at Richmond District from 7:45 PM to 10:00 PM. I need 60 minutes with her.\n5. **Rebecca** will be at Fisherman's Wharf from 9:15 PM to 10:15 PM. I need 60 minutes with her.\n6. **Kimberly** will be at Golden Gate Park from 1:00 PM to 4:30 PM. I need 120 minutes with her.\n7. **Kenneth** will be at Bayview from 2:30 PM to 6:00 PM. I need 60 minutes with him.\n\nConsidering these constraints, I need to ensure that I have enough time to meet each person without rushing or cutting short any meeting.\n\nStarting at Russian Hill at 9:00 AM, my first move should be to Presidio to meet Matthew. Presidio is 14 minutes away. From Presidio, I can then head to Chinatown to meet Margaret, which is 21 minutes away.\n\nAfter meeting Margaret, I can go to Pacific Heights to meet Nancy, just 11 minutes from Chinatown. From Pacific Heights, I'll travel to Richmond District to meet Helen, which is 12 minutes away.\n\nFrom Richmond District, I'll head to Fisherman's Wharf to meet Rebecca, a 18-minute trip. Then, I'll go to Golden Gate Park to meet Kimberly, 24 minutes from Fisherman's Wharf.\n\nFinally, I'll travel to Bayview to meet Kenneth, 21 minutes from Golden Gate Park.\n\nI need to ensure that each meeting starts and ends within the required times. For example, meeting Matthew at Presidio from 10:00 AM to 11:00 AM gives me enough time to proceed to Chinatown for Margaret.\n\nI also need to check if any adjustments are needed if a meeting is running too long, but given the travel distances, this seems feasible.\n\nSo, the planned itinerary is:\n\n1. **Presidio** to meet Matthew from 10:00 AM to 11:00 AM.\n2. **Chinatown** to meet Margaret from 11:15 AM to 12:00 PM.\n3. **Pacific Heights** to meet Nancy from 12:15 PM to 12:30 PM.\n4. **Richmond District** to meet Helen from 12:45 PM to 13:45 PM.\n5. **Fisherman's Wharf** to meet Rebecca from 14:15 PM to 14:45 PM.\n6. **Golden Gate Park** to meet Kimberly from 15:30 PM to 16:30 PM.\n7. **Bayview** to meet Kenneth from 17:00 PM to 17:30 PM.\n\nThis schedule allows me to meet each friend within the required time frames, considering travel distances and the constraints provided. I should double-check each travel time to ensure I have enough time between meetings and that I don't exceed any meeting durations.\n\nOverall, this plan seems efficient and allows me to meet all the friends I want to see within the day.\n```json\n{\n  \"itinerary\": [\n    {\n      \"action\": \"meet\",\n      \"location\": \"Presidio\",\n      \"person\": \"Matthew\",\n      \"start_time\": \"10:00\",\n      \"end_time\": \"11:00\"\n    },\n    {\n      \"action\": \"meet\",\n      \"location\": \"Chinatown\",\n      \"person\": \"Margaret\",\n      \"start_time\": \"11:15\",\n      \"end_time\": \"12:00\"\n    },\n    {\n      \"action\": \"meet\",\n      \"location\": \"Pacific Heights\",\n      \"person\": \"Nancy\",\n      \"start_time\": \"12:15\",\n      \"end_time\": \"12:30\"\n    },\n    {\n      \"action\": \"meet\",\n      \"location\": \"Richmond District\",\n      \"person\": \"Helen\",\n      \"start_time\": \"12:45\",\n      \"end_time\": \"13:45\"\n    },\n    {\n      \"action\": \"meet\",\n      \"location\": \"Fisherman's Wharf\",\n      \"person\": \"Rebecca\",\n      \"start_time\": \"14:15\",\n      \"end_time\": \"14:45\"\n    },\n    {\n      \"action\": \"meet\",\n      \"location\": \"Golden Gate Park\",\n      \"person\": \"Kimberly\",\n      \"start_time\": \"15:30\",\n      \"end_time\": \"16:30\"\n    },\n    {\n      \"action\": \"meet\",\n      \"location\": \"Bayview\",\n      \"person\": \"Kenneth\",\n      \"start_time\": \"17:00\",\n      \"end_time\": \"17:30\"\n    }\n  ]\n}\n```",
            "raw_model_reasoning": "Alright, let's tackle this problem. I need to schedule a day of meetings in San Francisco, starting at Russian Hill at 9:00 AM. My goal is to meet as many friends as possible, so I need to plan the meetings efficiently, considering travel times and constraints.\n\nFirst, I'll list out the travel distances provided. Russian Hill is connected to several locations, so I need to figure out the best order to visit these places to minimize travel time and maximize the time spent with each friend.\n\nLooking at the constraints, I see that:\n\n1. **Matthew** will be at Presidio from 11:00 AM to 9:00 PM. I need at least 90 minutes with him.\n2. **Margaret** will be at Chinatown from 9:15 AM to 6:45 PM. I need 90 minutes with her.\n3. **Nancy** will be at Pacific Heights from 2:15 PM to 5:00 PM. I need 15 minutes with her.\n4. **Helen** will be at Richmond District from 7:45 PM to 10:00 PM. I need 60 minutes with her.\n5. **Rebecca** will be at Fisherman's Wharf from 9:15 PM to 10:15 PM. I need 60 minutes with her.\n6. **Kimberly** will be at Golden Gate Park from 1:00 PM to 4:30 PM. I need 120 minutes with her.\n7. **Kenneth** will be at Bayview from 2:30 PM to 6:00 PM. I need 60 minutes with him.\n\nConsidering these constraints, I need to ensure that I have enough time to meet each person without rushing or cutting short any meeting.\n\nStarting at Russian Hill at 9:00 AM, my first move should be to Presidio to meet Matthew. Presidio is 14 minutes away. From Presidio, I can then head to Chinatown to meet Margaret, which is 21 minutes away.\n\nAfter meeting Margaret, I can go to Pacific Heights to meet Nancy, just 11 minutes from Chinatown. From Pacific Heights, I'll travel to Richmond District to meet Helen, which is 12 minutes away.\n\nFrom Richmond District, I'll head to Fisherman's Wharf to meet Rebecca, a 18-minute trip. Then, I'll go to Golden Gate Park to meet Kimberly, 24 minutes from Fisherman's Wharf.\n\nFinally, I'll travel to Bayview to meet Kenneth, 21 minutes from Golden Gate Park.\n\nI need to ensure that each meeting starts and ends within the required times. For example, meeting Matthew at Presidio from 10:00 AM to 11:00 AM gives me enough time to proceed to Chinatown for Margaret.\n\nI also need to check if any adjustments are needed if a meeting is running too long, but given the travel distances, this seems feasible.\n\nSo, the planned itinerary is:\n\n1. **Presidio** to meet Matthew from 10:00 AM to 11:00 AM.\n2. **Chinatown** to meet Margaret from 11:15 AM to 12:00 PM.\n3. **Pacific Heights** to meet Nancy from 12:15 PM to 12:30 PM.\n4. **Richmond District** to meet Helen from 12:45 PM to 13:45 PM.\n5. **Fisherman's Wharf** to meet Rebecca from 14:15 PM to 14:45 PM.\n6. **Golden Gate Park** to meet Kimberly from 15:30 PM to 16:30 PM.\n7. **Bayview** to meet Kenneth from 17:00 PM to 17:30 PM.\n\nThis schedule allows me to meet each friend within the required time frames, considering travel distances and the constraints provided. I should double-check each travel time to ensure I have enough time between meetings and that I don't exceed any meeting durations.\n\nOverall, this plan seems efficient and allows me to meet all the friends I want to see within the day.\n```json"
        }
    ]
}