{
    "0shot": [
        {
            "final_program_time": {
                "itinerary": [
                    {
                        "action": "meet",
                        "location": "Embarcadero",
                        "person": "Timothy",
                        "start_time": "9:45",
                        "end_time": "12:05"
                    },
                    {
                        "action": "meet",
                        "location": "Nob Hill",
                        "person": "Patricia",
                        "start_time": "12:05",
                        "end_time": "14:55"
                    },
                    {
                        "action": "meet",
                        "location": "Mission District",
                        "person": "Ashley",
                        "start_time": "14:55",
                        "end_time": "15:40"
                    }
                ]
            },
            "expected_time": {
                "itinerary": [
                    {
                        "action": "meet",
                        "location": "Embarcadero",
                        "person": "Timothy",
                        "start_time": "9:45",
                        "end_time": "11:45"
                    },
                    {
                        "action": "meet",
                        "location": "Nob Hill",
                        "person": "Patricia",
                        "start_time": "18:30",
                        "end_time": "20:00"
                    },
                    {
                        "action": "meet",
                        "location": "Mission District",
                        "person": "Ashley",
                        "start_time": "20:30",
                        "end_time": "21:15"
                    }
                ]
            },
            "count": "meeting_planning_example_272",
            "is_correct": false,
            "reasoning_token_count": 652,
            "raw_model_response": "Okay, so I'm trying to help this person who's an AI meeting planner. They need to schedule a day of meetings in San Francisco, considering travel times and constraints. The goal is to meet as many friends as possible, so they want an efficient schedule that allows them to see as many people as they can within the day.\n\nFirst, I need to look at the travel distances provided. It seems like the locations are all around the city, so I need to make sure that the person isn't spending too much time traveling between meetings, but still gets to meet everyone they want.\n\nThe constraints say they arrive at Russian Hill at 9:00 AM. So their day starts there. The first thing I should do is check who is available when and where, and see how to fit everyone in without too much back-and-forth travel.\n\nLooking at the people they need to meet:\n\n- Patricia is at Nob Hill from 6:30 PM to 9:45 PM. They need at least 90 minutes with her.\n- Ashley is at Mission District from 8:30 PM to 9:15 PM. 45 minutes needed.\n- Timothy is at Embarcadero from 9:45 AM to 5:45 PM. 120 minutes needed.\n\nSo, Timothy is available from 9:45 AM, which is after they arrive. But they need 120 minutes with him, which is a long time. That might be a good starting point since he's available early in the day.\n\nNext, they need to meet Patricia, who is at Nob Hill in the evening. Since they start at Russian Hill, they can go to Nob Hill after their meeting with Timothy. But Nob Hill is close to Russian Hill, so the travel time is minimal.\n\nAshley is at Mission District in the evening, so they can go there after Nob Hill. Mission District is a bit farther, but it's manageable.\n\nSo, the plan might be:\n\n1. Start at Russian Hill, go to Embarcadero to meet Timothy for 120 minutes.\n2. After that, go to Nob Hill to meet Patricia for 90 minutes.\n3. Then, head to Mission District to meet Ashley for 45 minutes.\n\nThis way, they maximize the time with each person without too much travel.\n\nBut I also need to make sure the travel times between these locations don't add up too much. From Russian Hill to Embarcadero is 8 minutes, which is quick. From Embarcadero to Nob Hill is 10 minutes. From Nob Hill to Mission District is 13 minutes. That seems doable.\n\nI should also check the times to ensure they don't have to wait too long between meetings. For example, if they finish with Timothy at 5:45 PM, they can immediately go to Nob Hill, which is only 10 minutes away. Then from Nob Hill to Mission District is another 13 minutes, arriving just in time for Ashley.\n\nThis seems efficient and allows them to meet all three people without too much stress. I think this is a good plan, but I should double-check the travel times and the meeting durations to make sure everything fits within the day.\n</think>\n\n```json\n{\n  \"itinerary\": [\n    {\n      \"action\": \"meet\",\n      \"location\": \"Embarcadero\",\n      \"person\": \"Timothy\",\n      \"start_time\": \"09:45\",\n      \"end_time\": \"12:05\"\n    },\n    {\n      \"action\": \"meet\",\n      \"location\": \"Nob Hill\",\n      \"person\": \"Patricia\",\n      \"start_time\": \"12:05\",\n      \"end_time\": \"14:55\"\n    },\n    {\n      \"action\": \"meet\",\n      \"location\": \"Mission District\",\n      \"person\": \"Ashley\",\n      \"start_time\": \"14:55\",\n      \"end_time\": \"15:40\"\n    }\n  ]\n}\n```",
            "raw_model_reasoning": "Okay, so I'm trying to help this person who's an AI meeting planner. They need to schedule a day of meetings in San Francisco, considering travel times and constraints. The goal is to meet as many friends as possible, so they want an efficient schedule that allows them to see as many people as they can within the day.\n\nFirst, I need to look at the travel distances provided. It seems like the locations are all around the city, so I need to make sure that the person isn't spending too much time traveling between meetings, but still gets to meet everyone they want.\n\nThe constraints say they arrive at Russian Hill at 9:00 AM. So their day starts there. The first thing I should do is check who is available when and where, and see how to fit everyone in without too much back-and-forth travel.\n\nLooking at the people they need to meet:\n\n- Patricia is at Nob Hill from 6:30 PM to 9:45 PM. They need at least 90 minutes with her.\n- Ashley is at Mission District from 8:30 PM to 9:15 PM. 45 minutes needed.\n- Timothy is at Embarcadero from 9:45 AM to 5:45 PM. 120 minutes needed.\n\nSo, Timothy is available from 9:45 AM, which is after they arrive. But they need 120 minutes with him, which is a long time. That might be a good starting point since he's available early in the day.\n\nNext, they need to meet Patricia, who is at Nob Hill in the evening. Since they start at Russian Hill, they can go to Nob Hill after their meeting with Timothy. But Nob Hill is close to Russian Hill, so the travel time is minimal.\n\nAshley is at Mission District in the evening, so they can go there after Nob Hill. Mission District is a bit farther, but it's manageable.\n\nSo, the plan might be:\n\n1. Start at Russian Hill, go to Embarcadero to meet Timothy for 120 minutes.\n2. After that, go to Nob Hill to meet Patricia for 90 minutes.\n3. Then, head to Mission District to meet Ashley for 45 minutes.\n\nThis way, they maximize the time with each person without too much travel.\n\nBut I also need to make sure the travel times between these locations don't add up too much. From Russian Hill to Embarcadero is 8 minutes, which is quick. From Embarcadero to Nob Hill is 10 minutes. From Nob Hill to Mission District is 13 minutes. That seems doable.\n\nI should also check the times to ensure they don't have to wait too long between meetings. For example, if they finish with Timothy at 5:45 PM, they can immediately go to Nob Hill, which is only 10 minutes away. Then from Nob Hill to Mission District is another 13 minutes, arriving just in time for Ashley.\n\nThis seems efficient and allows them to meet all three people without too much stress. I think this is a good plan, but I should double-check the travel times and the meeting durations to make sure everything fits within the day.\n</think>\n\n```json"
        }
    ]
}