{
    "0shot": [
        {
            "final_program_time": {
                "itinerary": [
                    {
                        "action": "meet",
                        "location": "Fisherman's Wharf",
                        "person": "Mark",
                        "start_time": "9:00",
                        "end_time": "9:30"
                    },
                    {
                        "action": "meet",
                        "location": "The Castro",
                        "person": "Brian",
                        "start_time": "9:45",
                        "end_time": "10:15"
                    },
                    {
                        "action": "meet",
                        "location": "Marina District",
                        "person": "Joseph",
                        "start_time": "10:45",
                        "end_time": "12:15"
                    },
                    {
                        "action": "meet",
                        "location": "Richmond District",
                        "person": "Ashley",
                        "start_time": "9:45",
                        "end_time": "10:30"
                    },
                    {
                        "action": "meet",
                        "location": "Union Square",
                        "person": "Patricia",
                        "start_time": "16:30",
                        "end_time": "18:00"
                    },
                    {
                        "action": "meet",
                        "location": "Sunset District",
                        "person": "Karen",
                        "start_time": "16:30",
                        "end_time": "17:45"
                    },
                    {
                        "action": "meet",
                        "location": "Golden Gate Park",
                        "person": "Deborah",
                        "start_time": "7:00",
                        "end_time": "7:30"
                    }
                ]
            },
            "expected_time": {
                "itinerary": [
                    {
                        "action": "meet",
                        "location": "Fisherman's Wharf",
                        "person": "Mark",
                        "start_time": "9:10",
                        "end_time": "9:40"
                    },
                    {
                        "action": "meet",
                        "location": "Bayview",
                        "person": "Betty",
                        "start_time": "10:06",
                        "end_time": "10:21"
                    },
                    {
                        "action": "meet",
                        "location": "The Castro",
                        "person": "Brian",
                        "start_time": "10:40",
                        "end_time": "11:10"
                    },
                    {
                        "action": "meet",
                        "location": "Marina District",
                        "person": "Joseph",
                        "start_time": "11:31",
                        "end_time": "13:01"
                    },
                    {
                        "action": "meet",
                        "location": "Presidio",
                        "person": "Stephanie",
                        "start_time": "13:11",
                        "end_time": "14:26"
                    },
                    {
                        "action": "meet",
                        "location": "Haight-Ashbury",
                        "person": "Lisa",
                        "start_time": "15:30",
                        "end_time": "16:15"
                    },
                    {
                        "action": "meet",
                        "location": "Union Square",
                        "person": "Patricia",
                        "start_time": "16:34",
                        "end_time": "18:34"
                    },
                    {
                        "action": "meet",
                        "location": "Russian Hill",
                        "person": "William",
                        "start_time": "18:47",
                        "end_time": "19:47"
                    },
                    {
                        "action": "meet",
                        "location": "Sunset District",
                        "person": "Karen",
                        "start_time": "20:10",
                        "end_time": "21:55"
                    }
                ]
            },
            "count": "meeting_planning_example_908",
            "is_correct": false,
            "reasoning_token_count": 1123,
            "raw_model_response": "Okay, so I need to help this AI planning tool create a meeting schedule for the day. The user has provided a lot of travel distances and constraints, so I need to carefully consider all of that to optimize the schedule.\n\nFirst, I'll look at the constraints. The user arrives at Financial District at 9:00 AM. There are several people to meet, each with their own locations and time constraints. I need to make sure that each meeting fits within the person's availability and the travel times.\n\nLooking at the first constraint, Mark is at Fisherman's Wharf from 8:15 AM to 10:00 AM. The user wants to meet Mark for at least 30 minutes. Since the user arrives at Financial District at 9:00 AM, they can travel to Fisherman's Wharf, which is a 10-minute walk. The earliest they can meet Mark is at 9:00 AM, but Mark is available until 10:00 AM. So, the meeting should be scheduled for 9:00 AM to 9:30 AM.\n\nNext, Stephanie is at Presidio from 12:15 PM to 3:00 PM. The user needs to meet her for 75 minutes. Presidio is a 22-minute walk from Financial District. The user should leave enough time to travel there and have the meeting. The latest they can arrive is 12:15 PM to have the meeting by 3:00 PM. So, the meeting should be at 12:15 PM to 3:15 PM.\n\nBetty is at Bayview from 7:15 AM to 8:30 PM. The user wants to meet her for 15 minutes. Bayview is a 19-minute walk from Financial District. To meet her early, the user could go at 7:15 AM, but that's quite early. Alternatively, the user could meet her later, say at 8:15 AM to 8:30 AM, which fits within Betty's availability. This seems reasonable.\n\nLisa is at Haight-Ashbury from 3:30 PM to 6:30 PM. The user needs to meet her for 45 minutes. Haight-Ashbury is a 19-minute walk from Financial District. The user should plan to go after meeting Stephanie. The latest they can meet Lisa is at 3:30 PM to 6:30 PM. So, the meeting should be scheduled for 3:30 PM to 4:15 PM.\n\nWilliam is at Russian Hill from 6:45 PM to 8:00 PM. The user wants to meet him for 60 minutes. Russian Hill is an 11-minute walk from Financial District. The user should go after all other meetings. The latest they can meet William is at 6:45 PM to 8:00 PM. So, the meeting should be at 6:45 PM to 7:45 PM.\n\nBrian is at The Castro from 9:15 AM to 1:15 PM. The user needs to meet him for 30 minutes. The Castro is a 20-minute walk from Financial District. The user can meet him at 9:15 AM to 9:45 AM.\n\nJoseph is at Marina District from 10:45 AM to 3:00 PM. The user needs to meet him for 90 minutes. Marina District is a 15-minute walk from Financial District. The user should go after meeting Brian. The latest they can meet Joseph is at 10:45 AM to 3:00 PM. So, the meeting should be at 10:45 AM to 3:45 PM.\n\nAshley is at Richmond District from 9:45 AM to 11:15 AM. The user needs to meet her for 45 minutes. Richmond District is a 21-minute walk from Financial District. The user can meet her at 9:45 AM to 10:30 AM.\n\nPatricia is at Union Square from 4:30 PM to 8:00 PM. The user needs to meet her for 120 minutes. Union Square is a 9-minute walk from Financial District. The user should go after all other meetings. The latest they can meet Patricia is at 4:30 PM to 8:00 PM. So, the meeting should be at 4:30 PM to 8:30 PM.\n\nKaren is at Sunset District from 4:30 PM to 10:00 PM. The user needs to meet her for 105 minutes. Sunset District is a 30-minute walk from Financial District. The user should plan to go after meeting Patricia. The latest they can meet Karen is at 4:30 PM to 10:00 PM. So, the meeting should be at 4:30 PM to 10:45 PM.\n\nFinally, Deborah is at Golden Gate Park from 7:00 AM to 6:15 PM. The user needs to meet her for 90 minutes. Golden Gate Park is a 23-minute walk from Financial District. The user can meet her at 7:00 AM to 7:30 AM.\n\nNow, putting all this together, I need to make sure the meetings are scheduled in a logical order, considering travel times and constraints. The user should start with the earliest meetings and move to the ones that are later in the day, ensuring they have enough time to travel between locations and meet each person for the required duration.\n</think>\n\n```json\n{\n  \"itinerary\": [\n    {\n      \"action\": \"meet\",\n      \"location\": \"Fisherman's Wharf\",\n      \"person\": \"Mark\",\n      \"start_time\": \"09:00\",\n      \"end_time\": \"09:30\"\n    },\n    {\n      \"action\": \"meet\",\n      \"location\": \"The Castro\",\n      \"person\": \"Brian\",\n      \"start_time\": \"09:45\",\n      \"end_time\": \"10:15\"\n    },\n    {\n      \"action\": \"meet\",\n      \"location\": \"Marina District\",\n      \"person\": \"Joseph\",\n      \"start_time\": \"10:45\",\n      \"end_time\": \"12:15\"\n    },\n    {\n      \"action\": \"meet\",\n      \"location\": \"Richmond District\",\n      \"person\": \"Ashley\",\n      \"start_time\": \"09:45\",\n      \"end_time\": \"10:30\"\n    },\n    {\n      \"action\": \"meet\",\n      \"location\": \"Union Square\",\n      \"person\": \"Patricia\",\n      \"start_time\": \"16:30\",\n      \"end_time\": \"18:00\"\n    },\n    {\n      \"action\": \"meet\",\n      \"location\": \"Sunset District\",\n      \"person\": \"Karen\",\n      \"start_time\": \"16:30\",\n      \"end_time\": \"17:45\"\n    },\n    {\n      \"action\": \"meet\",\n      \"location\": \"Golden Gate Park\",\n      \"person\": \"Deborah\",\n      \"start_time\": \"07:00\",\n      \"end_time\": \"07:30\"\n    }\n  ]\n}\n```",
            "raw_model_reasoning": "Okay, so I need to help this AI planning tool create a meeting schedule for the day. The user has provided a lot of travel distances and constraints, so I need to carefully consider all of that to optimize the schedule.\n\nFirst, I'll look at the constraints. The user arrives at Financial District at 9:00 AM. There are several people to meet, each with their own locations and time constraints. I need to make sure that each meeting fits within the person's availability and the travel times.\n\nLooking at the first constraint, Mark is at Fisherman's Wharf from 8:15 AM to 10:00 AM. The user wants to meet Mark for at least 30 minutes. Since the user arrives at Financial District at 9:00 AM, they can travel to Fisherman's Wharf, which is a 10-minute walk. The earliest they can meet Mark is at 9:00 AM, but Mark is available until 10:00 AM. So, the meeting should be scheduled for 9:00 AM to 9:30 AM.\n\nNext, Stephanie is at Presidio from 12:15 PM to 3:00 PM. The user needs to meet her for 75 minutes. Presidio is a 22-minute walk from Financial District. The user should leave enough time to travel there and have the meeting. The latest they can arrive is 12:15 PM to have the meeting by 3:00 PM. So, the meeting should be at 12:15 PM to 3:15 PM.\n\nBetty is at Bayview from 7:15 AM to 8:30 PM. The user wants to meet her for 15 minutes. Bayview is a 19-minute walk from Financial District. To meet her early, the user could go at 7:15 AM, but that's quite early. Alternatively, the user could meet her later, say at 8:15 AM to 8:30 AM, which fits within Betty's availability. This seems reasonable.\n\nLisa is at Haight-Ashbury from 3:30 PM to 6:30 PM. The user needs to meet her for 45 minutes. Haight-Ashbury is a 19-minute walk from Financial District. The user should plan to go after meeting Stephanie. The latest they can meet Lisa is at 3:30 PM to 6:30 PM. So, the meeting should be scheduled for 3:30 PM to 4:15 PM.\n\nWilliam is at Russian Hill from 6:45 PM to 8:00 PM. The user wants to meet him for 60 minutes. Russian Hill is an 11-minute walk from Financial District. The user should go after all other meetings. The latest they can meet William is at 6:45 PM to 8:00 PM. So, the meeting should be at 6:45 PM to 7:45 PM.\n\nBrian is at The Castro from 9:15 AM to 1:15 PM. The user needs to meet him for 30 minutes. The Castro is a 20-minute walk from Financial District. The user can meet him at 9:15 AM to 9:45 AM.\n\nJoseph is at Marina District from 10:45 AM to 3:00 PM. The user needs to meet him for 90 minutes. Marina District is a 15-minute walk from Financial District. The user should go after meeting Brian. The latest they can meet Joseph is at 10:45 AM to 3:00 PM. So, the meeting should be at 10:45 AM to 3:45 PM.\n\nAshley is at Richmond District from 9:45 AM to 11:15 AM. The user needs to meet her for 45 minutes. Richmond District is a 21-minute walk from Financial District. The user can meet her at 9:45 AM to 10:30 AM.\n\nPatricia is at Union Square from 4:30 PM to 8:00 PM. The user needs to meet her for 120 minutes. Union Square is a 9-minute walk from Financial District. The user should go after all other meetings. The latest they can meet Patricia is at 4:30 PM to 8:00 PM. So, the meeting should be at 4:30 PM to 8:30 PM.\n\nKaren is at Sunset District from 4:30 PM to 10:00 PM. The user needs to meet her for 105 minutes. Sunset District is a 30-minute walk from Financial District. The user should plan to go after meeting Patricia. The latest they can meet Karen is at 4:30 PM to 10:00 PM. So, the meeting should be at 4:30 PM to 10:45 PM.\n\nFinally, Deborah is at Golden Gate Park from 7:00 AM to 6:15 PM. The user needs to meet her for 90 minutes. Golden Gate Park is a 23-minute walk from Financial District. The user can meet her at 7:00 AM to 7:30 AM.\n\nNow, putting all this together, I need to make sure the meetings are scheduled in a logical order, considering travel times and constraints. The user should start with the earliest meetings and move to the ones that are later in the day, ensuring they have enough time to travel between locations and meet each person for the required duration.\n</think>\n\n```json"
        }
    ]
}