{
    "0shot": [
        {
            "final_program_time": {
                "itinerary": [
                    {
                        "action": "meet",
                        "location": "Financial District",
                        "person": "Lisa",
                        "start_time": "10:45",
                        "end_time": "11:00"
                    },
                    {
                        "action": "meet",
                        "location": "Marina District",
                        "person": "Betty",
                        "start_time": "10:45",
                        "end_time": "11:00"
                    },
                    {
                        "action": "meet",
                        "location": "Haight-Ashbury",
                        "person": "Joshua",
                        "start_time": "9:00",
                        "end_time": "9:30"
                    },
                    {
                        "action": "meet",
                        "location": "Presidio",
                        "person": "Joseph",
                        "start_time": "7:00",
                        "end_time": "8:00"
                    },
                    {
                        "action": "meet",
                        "location": "Fisherman's Wharf",
                        "person": "Stephanie",
                        "start_time": "15:30",
                        "end_time": "16:00"
                    },
                    {
                        "action": "meet",
                        "location": "Richmond District",
                        "person": "Sarah",
                        "start_time": "16:15",
                        "end_time": "16:45"
                    },
                    {
                        "action": "meet",
                        "location": "Marina District",
                        "person": "Betty",
                        "start_time": "10:45",
                        "end_time": "11:00"
                    },
                    {
                        "action": "meet",
                        "location": "The Castro",
                        "person": "John",
                        "start_time": "13:30",
                        "end_time": "14:00"
                    },
                    {
                        "action": "meet",
                        "location": "Nob Hill",
                        "person": "Andrew",
                        "start_time": "19:45",
                        "end_time": "20:00"
                    },
                    {
                        "action": "meet",
                        "location": "Russian Hill",
                        "person": "Melissa",
                        "start_time": "20:00",
                        "end_time": "20:45"
                    }
                ]
            },
            "expected_time": {
                "itinerary": [
                    {
                        "action": "meet",
                        "location": "Financial District",
                        "person": "Lisa",
                        "start_time": "10:45",
                        "end_time": "11:00"
                    },
                    {
                        "action": "meet",
                        "location": "Haight-Ashbury",
                        "person": "Joshua",
                        "start_time": "11:19",
                        "end_time": "11:34"
                    },
                    {
                        "action": "meet",
                        "location": "Presidio",
                        "person": "Joseph",
                        "start_time": "11:49",
                        "end_time": "12:34"
                    },
                    {
                        "action": "meet",
                        "location": "Marina District",
                        "person": "Betty",
                        "start_time": "12:45",
                        "end_time": "13:45"
                    },
                    {
                        "action": "meet",
                        "location": "The Castro",
                        "person": "John",
                        "start_time": "14:07",
                        "end_time": "14:52"
                    },
                    {
                        "action": "meet",
                        "location": "Fisherman's Wharf",
                        "person": "Stephanie",
                        "start_time": "15:30",
                        "end_time": "16:00"
                    },
                    {
                        "action": "meet",
                        "location": "Russian Hill",
                        "person": "Melissa",
                        "start_time": "17:00",
                        "end_time": "19:00"
                    },
                    {
                        "action": "meet",
                        "location": "Pacific Heights",
                        "person": "Daniel",
                        "start_time": "19:07",
                        "end_time": "20:07"
                    },
                    {
                        "action": "meet",
                        "location": "Nob Hill",
                        "person": "Andrew",
                        "start_time": "20:15",
                        "end_time": "22:00"
                    }
                ]
            },
            "count": "meeting_planning_example_978",
            "is_correct": false,
            "reasoning_token_count": 1124,
            "raw_model_response": "Alright, let's tackle this problem step by step. The user has provided a series of constraints and travel distances, and they want an optimal meeting schedule that maximizes the number of friends met while considering travel times and constraints.\n\nFirst, I'll start by understanding the constraints. The user arrives at Embarcadero at 9:00 AM. They need to meet several people, each with specific location preferences and time windows. The goal is to schedule these meetings in a way that minimizes travel time and maximizes the number of people met.\n\nLooking at the constraints, the first meeting is with Stephanie at Fisherman's Wharf from 3:30 PM to 10:00 PM. Since the user arrives at Embarcadero at 9:00 AM, they have a significant amount of time before Stephanie's availability. I should consider if there are any early afternoon meetings that can be scheduled without conflicting with Stephanie's time.\n\nNext, Lisa is at Financial District from 10:45 AM to 5:15 PM. This is a shorter window, so the meeting with Lisa needs to be scheduled within this time frame. The user will need to travel from Embarcadero to Financial District, which is a short distance of 5 minutes.\n\nMelissa is at Russian Hill from 5:00 PM to 9:45 PM. This is a longer window, but the user will need to travel from Financial District to Russian Hill, which is 11 minutes. It might be more efficient to schedule this later in the day after other meetings.\n\nBetty is at Marina District from 10:45 AM to 2:15 PM. The user can meet Betty shortly after arriving, as they're both available around 10:45 AM. The travel time from Embarcadero to Marina District is 14 minutes, which is reasonable.\n\nSarah is at Richmond District from 4:15 PM to 7:30 PM. The user will need to travel from Marina District to Richmond District, which is 11 minutes. This meeting can be scheduled in the late afternoon.\n\nDaniel is at Pacific Heights from 6:30 PM to 9:45 PM. The travel time from Richmond District to Pacific Heights is 10 minutes, so this can be scheduled towards the end of the day.\n\nJoshua is at Haight-Ashbury from 9:00 AM to 3:30 PM. The user can meet Joshua early in the day, as they're both available until 3:30 PM. The travel time from Embarcadero to Haight-Ashbury is 21 minutes.\n\nJoseph is at Presidio from 7:00 AM to 1:00 PM. The user can meet Joseph in the morning, as both are available until 1:00 PM. The travel time from Haight-Ashbury to Presidio is 15 minutes.\n\nAndrew is at Nob Hill from 7:45 PM to 10:00 PM. The user can meet Andrew in the evening, after other meetings. The travel time from Presidio to Nob Hill is 18 minutes.\n\nJohn is at The Castro from 1:15 PM to 7:45 PM. The user can meet John in the afternoon, as they're both available until 7:45 PM. The travel time from Haight-Ashbury to The Castro is 6 minutes.\n\nNow, I need to sequence these meetings in a logical order, considering travel times and the availability windows. Starting with the earliest possible meetings makes sense to maximize the day's efficiency.\n\n1. **Fisherman's Wharf (Stephanie)**: Can be scheduled from 3:30 PM to 4:00 PM. The user will need to travel from Embarcadero to Fisherman's Wharf, which is 8 minutes.\n\n2. **Financial District (Lisa)**: Available from 10:45 AM to 11:00 AM. The user can meet Lisa right after arriving, as the travel time is only 5 minutes.\n\n3. **Marina District (Betty)**: Available from 10:45 AM to 11:00 AM. The user can meet Betty shortly after arriving, with a travel time of 14 minutes.\n\n4. **Richmond District (Sarah)**: Available from 4:15 PM to 4:45 PM. The user can travel from Marina District to Richmond District, taking 11 minutes.\n\n5. **Haight-Ashbury (Joshua)**: Available from 9:00 AM to 10:00 AM. The user can meet Joshua early, with a travel time of 21 minutes.\n\n6. **Presidio (Joseph)**: Available from 7:00 AM to 8:00 AM. The user can meet Joseph in the morning, with a travel time of 15 minutes.\n\n7. **Nob Hill (Andrew)**: Available from 7:45 PM to 8:00 PM. The user can meet Andrew in the evening, with a travel time of 18 minutes.\n\n8. **The Castro (John)**: Available from 1:15 PM to 2:00 PM. The user can meet John in the afternoon, with a travel time of 6 minutes.\n\nBy scheduling the meetings in this order, the user can efficiently move between locations, minimizing travel time and ensuring that all meetings are within the required time windows. This plan maximizes the number of friends met while considering the constraints and travel distances.\n</think>\n\n```json\n{\n  \"itinerary\": [\n    {\n      \"action\": \"meet\",\n      \"location\": \"Financial District\",\n      \"person\": \"Lisa\",\n      \"start_time\": \"10:45\",\n      \"end_time\": \"11:00\"\n    },\n    {\n      \"action\": \"meet\",\n      \"location\": \"Marina District\",\n      \"person\": \"Betty\",\n      \"start_time\": \"10:45\",\n      \"end_time\": \"11:00\"\n    },\n    {\n      \"action\": \"meet\",\n      \"location\": \"Haight-Ashbury\",\n      \"person\": \"Joshua\",\n      \"start_time\": \"09:00\",\n      \"end_time\": \"09:30\"\n    },\n    {\n      \"action\": \"meet\",\n      \"location\": \"Presidio\",\n      \"person\": \"Joseph\",\n      \"start_time\": \"07:00\",\n      \"end_time\": \"08:00\"\n    },\n    {\n      \"action\": \"meet\",\n      \"location\": \"Fisherman's Wharf\",\n      \"person\": \"Stephanie\",\n      \"start_time\": \"15:30\",\n      \"end_time\": \"16:00\"\n    },\n    {\n      \"action\": \"meet\",\n      \"location\": \"Richmond District\",\n      \"person\": \"Sarah\",\n      \"start_time\": \"16:15\",\n      \"end_time\": \"16:45\"\n    },\n    {\n      \"action\": \"meet\",\n      \"location\": \"Marina District\",\n      \"person\": \"Betty\",\n      \"start_time\": \"10:45\",\n      \"end_time\": \"11:00\"\n    },\n    {\n      \"action\": \"meet\",\n      \"location\": \"The Castro\",\n      \"person\": \"John\",\n      \"start_time\": \"13:30\",\n      \"end_time\": \"14:00\"\n    },\n    {\n      \"action\": \"meet\",\n      \"location\": \"Nob Hill\",\n      \"person\": \"Andrew\",\n      \"start_time\": \"19:45\",\n      \"end_time\": \"20:00\"\n    },\n    {\n      \"action\": \"meet\",\n      \"location\": \"Russian Hill\",\n      \"person\": \"Melissa\",\n      \"start_time\": \"20:00\",\n      \"end_time\": \"20:45\"\n    }\n  ]\n}\n```",
            "raw_model_reasoning": "Alright, let's tackle this problem step by step. The user has provided a series of constraints and travel distances, and they want an optimal meeting schedule that maximizes the number of friends met while considering travel times and constraints.\n\nFirst, I'll start by understanding the constraints. The user arrives at Embarcadero at 9:00 AM. They need to meet several people, each with specific location preferences and time windows. The goal is to schedule these meetings in a way that minimizes travel time and maximizes the number of people met.\n\nLooking at the constraints, the first meeting is with Stephanie at Fisherman's Wharf from 3:30 PM to 10:00 PM. Since the user arrives at Embarcadero at 9:00 AM, they have a significant amount of time before Stephanie's availability. I should consider if there are any early afternoon meetings that can be scheduled without conflicting with Stephanie's time.\n\nNext, Lisa is at Financial District from 10:45 AM to 5:15 PM. This is a shorter window, so the meeting with Lisa needs to be scheduled within this time frame. The user will need to travel from Embarcadero to Financial District, which is a short distance of 5 minutes.\n\nMelissa is at Russian Hill from 5:00 PM to 9:45 PM. This is a longer window, but the user will need to travel from Financial District to Russian Hill, which is 11 minutes. It might be more efficient to schedule this later in the day after other meetings.\n\nBetty is at Marina District from 10:45 AM to 2:15 PM. The user can meet Betty shortly after arriving, as they're both available around 10:45 AM. The travel time from Embarcadero to Marina District is 14 minutes, which is reasonable.\n\nSarah is at Richmond District from 4:15 PM to 7:30 PM. The user will need to travel from Marina District to Richmond District, which is 11 minutes. This meeting can be scheduled in the late afternoon.\n\nDaniel is at Pacific Heights from 6:30 PM to 9:45 PM. The travel time from Richmond District to Pacific Heights is 10 minutes, so this can be scheduled towards the end of the day.\n\nJoshua is at Haight-Ashbury from 9:00 AM to 3:30 PM. The user can meet Joshua early in the day, as they're both available until 3:30 PM. The travel time from Embarcadero to Haight-Ashbury is 21 minutes.\n\nJoseph is at Presidio from 7:00 AM to 1:00 PM. The user can meet Joseph in the morning, as both are available until 1:00 PM. The travel time from Haight-Ashbury to Presidio is 15 minutes.\n\nAndrew is at Nob Hill from 7:45 PM to 10:00 PM. The user can meet Andrew in the evening, after other meetings. The travel time from Presidio to Nob Hill is 18 minutes.\n\nJohn is at The Castro from 1:15 PM to 7:45 PM. The user can meet John in the afternoon, as they're both available until 7:45 PM. The travel time from Haight-Ashbury to The Castro is 6 minutes.\n\nNow, I need to sequence these meetings in a logical order, considering travel times and the availability windows. Starting with the earliest possible meetings makes sense to maximize the day's efficiency.\n\n1. **Fisherman's Wharf (Stephanie)**: Can be scheduled from 3:30 PM to 4:00 PM. The user will need to travel from Embarcadero to Fisherman's Wharf, which is 8 minutes.\n\n2. **Financial District (Lisa)**: Available from 10:45 AM to 11:00 AM. The user can meet Lisa right after arriving, as the travel time is only 5 minutes.\n\n3. **Marina District (Betty)**: Available from 10:45 AM to 11:00 AM. The user can meet Betty shortly after arriving, with a travel time of 14 minutes.\n\n4. **Richmond District (Sarah)**: Available from 4:15 PM to 4:45 PM. The user can travel from Marina District to Richmond District, taking 11 minutes.\n\n5. **Haight-Ashbury (Joshua)**: Available from 9:00 AM to 10:00 AM. The user can meet Joshua early, with a travel time of 21 minutes.\n\n6. **Presidio (Joseph)**: Available from 7:00 AM to 8:00 AM. The user can meet Joseph in the morning, with a travel time of 15 minutes.\n\n7. **Nob Hill (Andrew)**: Available from 7:45 PM to 8:00 PM. The user can meet Andrew in the evening, with a travel time of 18 minutes.\n\n8. **The Castro (John)**: Available from 1:15 PM to 2:00 PM. The user can meet John in the afternoon, with a travel time of 6 minutes.\n\nBy scheduling the meetings in this order, the user can efficiently move between locations, minimizing travel time and ensuring that all meetings are within the required time windows. This plan maximizes the number of friends met while considering the constraints and travel distances.\n</think>\n\n```json"
        }
    ]
}