{
    "0shot": [
        {
            "final_program_time": {
                "itinerary": [
                    {
                        "action": "meet",
                        "location": "Union Square",
                        "person": "Emily",
                        "start_time": "16:00",
                        "end_time": "16:45"
                    },
                    {
                        "action": "meet",
                        "location": "Russian Hill",
                        "person": "Margaret",
                        "start_time": "18:00",
                        "end_time": "19:00"
                    }
                ]
            },
            "expected_time": {
                "itinerary": [
                    {
                        "action": "meet",
                        "location": "Union Square",
                        "person": "Emily",
                        "start_time": "16:00",
                        "end_time": "16:45"
                    },
                    {
                        "action": "meet",
                        "location": "Russian Hill",
                        "person": "Margaret",
                        "start_time": "19:00",
                        "end_time": "21:00"
                    }
                ]
            },
            "count": "meeting_planning_example_170",
            "is_correct": false,
            "reasoning_token_count": 1385,
            "raw_model_response": "Alright, let's tackle this problem step by step. I'm trying to schedule a day of meetings in San Francisco, starting from North Beach at 9:00 AM. I need to meet Emily at Union Square between 4:00 PM and 5:15 PM for at least 45 minutes and Margaret at Russian Hill from 7:00 PM to 9:00 PM for at least 120 minutes. My goal is to meet as many friends as possible while considering travel times and constraints.\n\nFirst, I'll outline the locations involved: North Beach, Union Square, and Russian Hill. I need to figure out the optimal times to meet Emily and Margaret without overlapping too much, considering the travel distances between these areas.\n\nStarting at North Beach at 9:00 AM, I can either stay there or move to another location. Since Emily is available in the late afternoon and Margaret in the evening, I can plan my day around these times.\n\nIf I stay in North Beach, I can explore other nearby areas. For example, North Beach is close to Russian Hill, which is only 4 minutes away. Maybe I can head there in the morning to start my day. From Russian Hill, I can easily reach Union Square, which is 11 minutes away.\n\nSo, here's a possible itinerary:\n\n1. **Morning: North Beach to Russian Hill** - Start at North Beach at 9:00 AM. It takes 4 minutes to get to Russian Hill. I can spend some time there, maybe visit a nearby attraction or just relax.\n\n2. **Mid-Morning: Meet Margaret at Russian Hill** - Margaret is available from 7:00 PM to 9:00 PM. But wait, that's in the evening. Maybe I should plan to meet her in the evening after other meetings.\n\n3. **Afternoon: From Russian Hill to Union Square** - After spending time in Russian Hill, I can head to Union Square, which is 11 minutes away. I need to meet Emily there between 4:00 PM and 5:15 PM.\n\n4. **Evening: Meet Margaret at Russian Hill** - Since Margaret is available in the evening, I can go back to Russian Hill after meeting Emily.\n\nBut I need to ensure that my travel times are accounted for and that I don't have back-to-back meetings that are too close.\n\nLet me adjust the timings:\n\n- **Morning: 9:00 AM - 9:04 AM**: Travel from North Beach to Russian Hill (4 minutes).\n- **9:04 AM - 10:04 AM**: Explore Russian Hill.\n- **10:04 AM**: Travel back to North Beach (4 minutes).\n- **10:04 AM - 10:44 AM**: Explore North Beach.\n- **10:44 AM**: Travel to Union Square (10 minutes).\n- **10:44 AM - 4:00 PM**: Free time before meeting Emily.\n- **4:00 PM - 5:15 PM**: Meet Emily at Union Square.\n- **5:15 PM - 5:15 PM**: Travel back to North Beach (10 minutes).\n- **5:15 PM - 6:15 PM**: Free time.\n- **6:15 PM**: Travel to Russian Hill (4 minutes).\n- **6:15 PM - 9:00 PM**: Prepare for meeting Margaret.\n\nWait, this seems too rushed. Maybe I should consider the travel times more carefully to ensure I have enough time between meetings.\n\nAlternatively, what if I move from North Beach to Union Square directly in the morning? It takes 10 minutes. Then, I can spend time there before meeting Emily in the afternoon.\n\nBut then, I'd have to travel back to Russian Hill in the evening for Margaret. Let's see:\n\n- **9:00 AM - 9:10 AM**: Travel from North Beach to Union Square (10 minutes).\n- **9:10 AM - 12:10 PM**: Explore Union Square.\n- **12:10 PM - 12:20 PM**: Travel back to North Beach (10 minutes).\n- **12:20 PM - 12:20 PM**: Explore North Beach.\n- **12:20 PM - 1:20 PM**: Free time.\n- **1:20 PM - 4:00 PM**: Free time before meeting Emily.\n- **4:00 PM - 5:15 PM**: Meet Emily at Union Square.\n- **5:15 PM - 5:15 PM**: Travel back to North Beach (10 minutes).\n- **5:15 PM - 6:15 PM**: Free time.\n- **6:15 PM**: Travel to Russian Hill (4 minutes).\n- **6:15 PM - 9:00 PM**: Prepare for meeting Margaret.\n\nThis seems a bit better, but I still need to ensure I have enough time to get to Russian Hill for Margaret without overlapping with Emily's meeting.\n\nPerhaps I can have a buffer between meetings. For example, after meeting Emily, I can travel back to North Beach, have a quick meal, and then go to Russian Hill for Margaret.\n\nLet me outline this:\n\n1. **Morning: North Beach to Union Square** - 9:00 AM - 9:10 AM travel, explore until 12:10 PM.\n2. **Afternoon: Union Square to North Beach** - 12:10 PM - 12:20 PM travel, explore until 1:20 PM.\n3. **1:20 PM - 4:00 PM**: Free time.\n4. **4:00 PM - 5:15 PM**: Meet Emily at Union Square.\n5. **5:15 PM - 5:15 PM**: Travel back to North Beach (10 minutes).\n6. **5:15 PM - 5:45 PM**: Light meal or relax.\n7. **5:45 PM**: Travel to Russian Hill (4 minutes).\n8. **6:45 PM - 9:00 PM**: Prepare for meeting Margaret.\n\nThis way, I have a short buffer between meetings, which should be enough for travel and preparation.\n\nBut I need to make sure that the meeting with Margaret starts at 7:00 PM, not 6:45 PM. Maybe I can adjust the timing slightly.\n\nAlternatively, I could meet Margaret earlier if her availability allows, but according to the constraints, she's available from 7:00 PM to 9:00 PM.\n\nTherefore, my final itinerary would be:\n\n- **Morning: Explore North Beach and Union Square**.\n- **Afternoon: Meet Emily at Union Square**.\n- **Evening: Travel to Russian Hill and meet Margaret**.\n\nThis way, I maximize the time I can spend with each friend without rushing.\n</think>\n\n```json\n{\n  \"itinerary\": [\n    {\n      \"action\": \"meet\",\n      \"location\": \"Union Square\",\n      \"person\": \"Emily\",\n      \"start_time\": \"16:00\",\n      \"end_time\": \"16:45\"\n    },\n    {\n      \"action\": \"meet\",\n      \"location\": \"Russian Hill\",\n      \"person\": \"Margaret\",\n      \"start_time\": \"18:00\",\n      \"end_time\": \"19:00\"\n    }\n  ]\n}\n```",
            "raw_model_reasoning": "Alright, let's tackle this problem step by step. I'm trying to schedule a day of meetings in San Francisco, starting from North Beach at 9:00 AM. I need to meet Emily at Union Square between 4:00 PM and 5:15 PM for at least 45 minutes and Margaret at Russian Hill from 7:00 PM to 9:00 PM for at least 120 minutes. My goal is to meet as many friends as possible while considering travel times and constraints.\n\nFirst, I'll outline the locations involved: North Beach, Union Square, and Russian Hill. I need to figure out the optimal times to meet Emily and Margaret without overlapping too much, considering the travel distances between these areas.\n\nStarting at North Beach at 9:00 AM, I can either stay there or move to another location. Since Emily is available in the late afternoon and Margaret in the evening, I can plan my day around these times.\n\nIf I stay in North Beach, I can explore other nearby areas. For example, North Beach is close to Russian Hill, which is only 4 minutes away. Maybe I can head there in the morning to start my day. From Russian Hill, I can easily reach Union Square, which is 11 minutes away.\n\nSo, here's a possible itinerary:\n\n1. **Morning: North Beach to Russian Hill** - Start at North Beach at 9:00 AM. It takes 4 minutes to get to Russian Hill. I can spend some time there, maybe visit a nearby attraction or just relax.\n\n2. **Mid-Morning: Meet Margaret at Russian Hill** - Margaret is available from 7:00 PM to 9:00 PM. But wait, that's in the evening. Maybe I should plan to meet her in the evening after other meetings.\n\n3. **Afternoon: From Russian Hill to Union Square** - After spending time in Russian Hill, I can head to Union Square, which is 11 minutes away. I need to meet Emily there between 4:00 PM and 5:15 PM.\n\n4. **Evening: Meet Margaret at Russian Hill** - Since Margaret is available in the evening, I can go back to Russian Hill after meeting Emily.\n\nBut I need to ensure that my travel times are accounted for and that I don't have back-to-back meetings that are too close.\n\nLet me adjust the timings:\n\n- **Morning: 9:00 AM - 9:04 AM**: Travel from North Beach to Russian Hill (4 minutes).\n- **9:04 AM - 10:04 AM**: Explore Russian Hill.\n- **10:04 AM**: Travel back to North Beach (4 minutes).\n- **10:04 AM - 10:44 AM**: Explore North Beach.\n- **10:44 AM**: Travel to Union Square (10 minutes).\n- **10:44 AM - 4:00 PM**: Free time before meeting Emily.\n- **4:00 PM - 5:15 PM**: Meet Emily at Union Square.\n- **5:15 PM - 5:15 PM**: Travel back to North Beach (10 minutes).\n- **5:15 PM - 6:15 PM**: Free time.\n- **6:15 PM**: Travel to Russian Hill (4 minutes).\n- **6:15 PM - 9:00 PM**: Prepare for meeting Margaret.\n\nWait, this seems too rushed. Maybe I should consider the travel times more carefully to ensure I have enough time between meetings.\n\nAlternatively, what if I move from North Beach to Union Square directly in the morning? It takes 10 minutes. Then, I can spend time there before meeting Emily in the afternoon.\n\nBut then, I'd have to travel back to Russian Hill in the evening for Margaret. Let's see:\n\n- **9:00 AM - 9:10 AM**: Travel from North Beach to Union Square (10 minutes).\n- **9:10 AM - 12:10 PM**: Explore Union Square.\n- **12:10 PM - 12:20 PM**: Travel back to North Beach (10 minutes).\n- **12:20 PM - 12:20 PM**: Explore North Beach.\n- **12:20 PM - 1:20 PM**: Free time.\n- **1:20 PM - 4:00 PM**: Free time before meeting Emily.\n- **4:00 PM - 5:15 PM**: Meet Emily at Union Square.\n- **5:15 PM - 5:15 PM**: Travel back to North Beach (10 minutes).\n- **5:15 PM - 6:15 PM**: Free time.\n- **6:15 PM**: Travel to Russian Hill (4 minutes).\n- **6:15 PM - 9:00 PM**: Prepare for meeting Margaret.\n\nThis seems a bit better, but I still need to ensure I have enough time to get to Russian Hill for Margaret without overlapping with Emily's meeting.\n\nPerhaps I can have a buffer between meetings. For example, after meeting Emily, I can travel back to North Beach, have a quick meal, and then go to Russian Hill for Margaret.\n\nLet me outline this:\n\n1. **Morning: North Beach to Union Square** - 9:00 AM - 9:10 AM travel, explore until 12:10 PM.\n2. **Afternoon: Union Square to North Beach** - 12:10 PM - 12:20 PM travel, explore until 1:20 PM.\n3. **1:20 PM - 4:00 PM**: Free time.\n4. **4:00 PM - 5:15 PM**: Meet Emily at Union Square.\n5. **5:15 PM - 5:15 PM**: Travel back to North Beach (10 minutes).\n6. **5:15 PM - 5:45 PM**: Light meal or relax.\n7. **5:45 PM**: Travel to Russian Hill (4 minutes).\n8. **6:45 PM - 9:00 PM**: Prepare for meeting Margaret.\n\nThis way, I have a short buffer between meetings, which should be enough for travel and preparation.\n\nBut I need to make sure that the meeting with Margaret starts at 7:00 PM, not 6:45 PM. Maybe I can adjust the timing slightly.\n\nAlternatively, I could meet Margaret earlier if her availability allows, but according to the constraints, she's available from 7:00 PM to 9:00 PM.\n\nTherefore, my final itinerary would be:\n\n- **Morning: Explore North Beach and Union Square**.\n- **Afternoon: Meet Emily at Union Square**.\n- **Evening: Travel to Russian Hill and meet Margaret**.\n\nThis way, I maximize the time I can spend with each friend without rushing.\n</think>\n\n```json"
        }
    ]
}