{
    "0shot": [
        {
            "final_program_time": {
                "itinerary": [
                    {
                        "action": "meet",
                        "location": "North Beach",
                        "person": "Helen",
                        "start_time": "11:30",
                        "end_time": "12:15"
                    },
                    {
                        "action": "meet",
                        "location": "Presidio",
                        "person": "Kevin",
                        "start_time": "8:45",
                        "end_time": "9:00"
                    },
                    {
                        "action": "meet",
                        "location": "Golden Gate Park",
                        "person": "Michelle",
                        "start_time": "20:00",
                        "end_time": "20:45"
                    },
                    {
                        "action": "meet",
                        "location": "Fisherman's Wharf",
                        "person": "Emily",
                        "start_time": "16:30",
                        "end_time": "17:00"
                    },
                    {
                        "action": "meet",
                        "location": "Marina District",
                        "person": "Mark",
                        "start_time": "17:45",
                        "end_time": "18:30"
                    },
                    {
                        "action": "meet",
                        "location": "Alamo Square",
                        "person": "Barbara",
                        "start_time": "18:45",
                        "end_time": "19:45"
                    },
                    {
                        "action": "meet",
                        "location": "Sunset District",
                        "person": "Laura",
                        "start_time": "19:45",
                        "end_time": "20:45"
                    },
                    {
                        "action": "meet",
                        "location": "Nob Hill",
                        "person": "Mary",
                        "start_time": "20:45",
                        "end_time": "21:15"
                    }
                ]
            },
            "expected_time": {
                "itinerary": [
                    {
                        "action": "meet",
                        "location": "North Beach",
                        "person": "Helen",
                        "start_time": "11:00",
                        "end_time": "11:45"
                    },
                    {
                        "action": "meet",
                        "location": "Fisherman's Wharf",
                        "person": "Emily",
                        "start_time": "16:15",
                        "end_time": "16:45"
                    },
                    {
                        "action": "meet",
                        "location": "Nob Hill",
                        "person": "Mary",
                        "start_time": "17:30",
                        "end_time": "18:15"
                    },
                    {
                        "action": "meet",
                        "location": "Marina District",
                        "person": "Mark",
                        "start_time": "18:26",
                        "end_time": "19:41"
                    },
                    {
                        "action": "meet",
                        "location": "Golden Gate Park",
                        "person": "Michelle",
                        "start_time": "20:00",
                        "end_time": "20:15"
                    }
                ]
            },
            "count": "meeting_planning_example_700",
            "is_correct": false,
            "reasoning_token_count": 1181,
            "raw_model_response": "Okay, so I'm trying to figure out how to help this person schedule their meetings in San Francisco. They want to meet as many friends as possible, so efficiency is key. They've provided a bunch of travel distances between different areas, which is helpful, but also some constraints about when each person is available.\n\nFirst, I need to understand the constraints. The user arrives at Presidio at 9:00 AM. Then, there are several friends available at different times and locations. For example, Kevin is at Pacific Heights from 7:15 AM to 8:45 AM. That's a short window, so I need to make sure the meeting can happen within that time frame.\n\nMichelle is at Golden Gate Park from 8:00 PM to 9:00 PM. That's a two-hour window in the evening. Emily is at Fisherman's Wharf from 4:15 PM to 7:00 PM, which is a bit longer. Mark is at Marina District from 6:15 PM to 7:45 PM. Barbara is at Alamo Square from 5:00 PM to 7:00 PM. Laura is at Sunset District from 7:00 PM to 9:15 PM. Mary is at Nob Hill from 5:30 PM to 7:00 PM. Helen is at North Beach from 11:00 AM to 12:15 PM.\n\nI need to figure out a way to meet all these people without backtracking too much, considering the travel times. Presidio is where I start, so I should plan meetings in areas close to Presidio first to save time.\n\nLooking at the travel distances, Presidio is connected to Pacific Heights, Golden Gate Park, Fisherman's Wharf, Marina District, and Alamo Square, among others. So, I can plan the first meeting with Kevin at Pacific Heights, but he's only available until 8:45 AM. Since I arrive at Presidio at 9:00 AM, I can leave Presidio, go to Pacific Heights, meet Kevin, and then head back to Presidio.\n\nAfter that, the next earliest slot is Michelle at Golden Gate Park from 8:00 PM. But wait, that's in the evening. I need to see if I can fit that in after some other meetings.\n\nEmily is at Fisherman's Wharf from 4:15 PM to 7:00 PM. That's a good window. Mark is at Marina District until 7:45 PM, which is a bit later. Barbara is at Alamo Square until 7:00 PM. Laura is at Sunset District until 9:15 PM. Mary is at Nob Hill until 7:00 PM. Helen is at North Beach from 11:00 AM to 12:15 PM.\n\nI think I should start with Kevin in the morning, then move to Golden Gate Park to meet Michelle in the evening. Then, maybe go to Fisherman's Wharf to meet Emily. After that, head to Marina District to meet Mark, then to Alamo Square for Barbara, Sunset District for Laura, and finally Nob Hill for Mary.\n\nWait, but I have to consider the travel times between these places. For example, after meeting Kevin, I need to get back to Presidio, then go to Golden Gate Park. That might take some time. I should make sure the travel time isn't too long, or else I might be late for the next meeting.\n\nAlso, Helen is available early in the day at North Beach from 11:00 AM to 12:15 PM. Maybe I can meet her first thing after arriving at Presidio. That way, I don't have to travel far early in the day.\n\nLet me outline a possible itinerary:\n\n1. Arrive at Presidio at 9:00 AM.\n2. Meet Helen at North Beach from 11:00 AM to 12:15 PM. But wait, I can't reach North Beach by 11:00 AM if I just arrived at Presidio at 9:00 AM. The travel time from Presidio to North Beach is 18 minutes. So, I can leave Presidio at 10:45 AM, arrive at North Beach by 11:30 AM, but Helen is available until 12:15 PM. That works.\n\n3. After meeting Helen, head back to Presidio, then go to Pacific Heights to meet Kevin by 8:45 AM. But wait, I can't meet Kevin at 8:45 AM if I'm meeting Helen at 11:30 AM. So, maybe I need to prioritize who to meet in the morning.\n\nAlternatively, maybe meet Kevin first, then go to North Beach for Helen.\n\nBut Kevin is only available until 8:45 AM, so I need to make that meeting quickly.\n\nAfter that, I can go to Golden Gate Park to meet Michelle in the evening.\n\nThen, Fisherman's Wharf for Emily, Marina District for Mark, Alamo Square for Barbara, Sunset District for Laura, and finally Nob Hill for Mary.\n\nI need to make sure the travel times between these locations are manageable. For example, from Presidio to Fisherman's Wharf is 19 minutes, which is feasible.\n\nI think the key is to plan the meetings in a logical order, starting with the ones that are closer or have earlier availability, then moving to those that are farther or have later availability.\n\nI also need to ensure that each meeting has the required minimum time, and that the travel time doesn't exceed the available time windows.\n\nIt's a bit complex, but I think with careful planning, I can fit all the meetings in without missing any.\n</think>\n\n```json\n{\n  \"itinerary\": [\n    {\n      \"action\": \"meet\",\n      \"location\": \"North Beach\",\n      \"person\": \"Helen\",\n      \"start_time\": \"11:30\",\n      \"end_time\": \"12:15\"\n    },\n    {\n      \"action\": \"meet\",\n      \"location\": \"Presidio\",\n      \"person\": \"Kevin\",\n      \"start_time\": \"08:45\",\n      \"end_time\": \"09:00\"\n    },\n    {\n      \"action\": \"meet\",\n      \"location\": \"Golden Gate Park\",\n      \"person\": \"Michelle\",\n      \"start_time\": \"20:00\",\n      \"end_time\": \"20:45\"\n    },\n    {\n      \"action\": \"meet\",\n      \"location\": \"Fisherman's Wharf\",\n      \"person\": \"Emily\",\n      \"start_time\": \"16:30\",\n      \"end_time\": \"17:00\"\n    },\n    {\n      \"action\": \"meet\",\n      \"location\": \"Marina District\",\n      \"person\": \"Mark\",\n      \"start_time\": \"17:45\",\n      \"end_time\": \"18:30\"\n    },\n    {\n      \"action\": \"meet\",\n      \"location\": \"Alamo Square\",\n      \"person\": \"Barbara\",\n      \"start_time\": \"18:45\",\n      \"end_time\": \"19:45\"\n    },\n    {\n      \"action\": \"meet\",\n      \"location\": \"Sunset District\",\n      \"person\": \"Laura\",\n      \"start_time\": \"19:45\",\n      \"end_time\": \"20:45\"\n    },\n    {\n      \"action\": \"meet\",\n      \"location\": \"Nob Hill\",\n      \"person\": \"Mary\",\n      \"start_time\": \"20:45\",\n      \"end_time\": \"21:15\"\n    }\n  ]\n}\n```",
            "raw_model_reasoning": "Okay, so I'm trying to figure out how to help this person schedule their meetings in San Francisco. They want to meet as many friends as possible, so efficiency is key. They've provided a bunch of travel distances between different areas, which is helpful, but also some constraints about when each person is available.\n\nFirst, I need to understand the constraints. The user arrives at Presidio at 9:00 AM. Then, there are several friends available at different times and locations. For example, Kevin is at Pacific Heights from 7:15 AM to 8:45 AM. That's a short window, so I need to make sure the meeting can happen within that time frame.\n\nMichelle is at Golden Gate Park from 8:00 PM to 9:00 PM. That's a two-hour window in the evening. Emily is at Fisherman's Wharf from 4:15 PM to 7:00 PM, which is a bit longer. Mark is at Marina District from 6:15 PM to 7:45 PM. Barbara is at Alamo Square from 5:00 PM to 7:00 PM. Laura is at Sunset District from 7:00 PM to 9:15 PM. Mary is at Nob Hill from 5:30 PM to 7:00 PM. Helen is at North Beach from 11:00 AM to 12:15 PM.\n\nI need to figure out a way to meet all these people without backtracking too much, considering the travel times. Presidio is where I start, so I should plan meetings in areas close to Presidio first to save time.\n\nLooking at the travel distances, Presidio is connected to Pacific Heights, Golden Gate Park, Fisherman's Wharf, Marina District, and Alamo Square, among others. So, I can plan the first meeting with Kevin at Pacific Heights, but he's only available until 8:45 AM. Since I arrive at Presidio at 9:00 AM, I can leave Presidio, go to Pacific Heights, meet Kevin, and then head back to Presidio.\n\nAfter that, the next earliest slot is Michelle at Golden Gate Park from 8:00 PM. But wait, that's in the evening. I need to see if I can fit that in after some other meetings.\n\nEmily is at Fisherman's Wharf from 4:15 PM to 7:00 PM. That's a good window. Mark is at Marina District until 7:45 PM, which is a bit later. Barbara is at Alamo Square until 7:00 PM. Laura is at Sunset District until 9:15 PM. Mary is at Nob Hill until 7:00 PM. Helen is at North Beach from 11:00 AM to 12:15 PM.\n\nI think I should start with Kevin in the morning, then move to Golden Gate Park to meet Michelle in the evening. Then, maybe go to Fisherman's Wharf to meet Emily. After that, head to Marina District to meet Mark, then to Alamo Square for Barbara, Sunset District for Laura, and finally Nob Hill for Mary.\n\nWait, but I have to consider the travel times between these places. For example, after meeting Kevin, I need to get back to Presidio, then go to Golden Gate Park. That might take some time. I should make sure the travel time isn't too long, or else I might be late for the next meeting.\n\nAlso, Helen is available early in the day at North Beach from 11:00 AM to 12:15 PM. Maybe I can meet her first thing after arriving at Presidio. That way, I don't have to travel far early in the day.\n\nLet me outline a possible itinerary:\n\n1. Arrive at Presidio at 9:00 AM.\n2. Meet Helen at North Beach from 11:00 AM to 12:15 PM. But wait, I can't reach North Beach by 11:00 AM if I just arrived at Presidio at 9:00 AM. The travel time from Presidio to North Beach is 18 minutes. So, I can leave Presidio at 10:45 AM, arrive at North Beach by 11:30 AM, but Helen is available until 12:15 PM. That works.\n\n3. After meeting Helen, head back to Presidio, then go to Pacific Heights to meet Kevin by 8:45 AM. But wait, I can't meet Kevin at 8:45 AM if I'm meeting Helen at 11:30 AM. So, maybe I need to prioritize who to meet in the morning.\n\nAlternatively, maybe meet Kevin first, then go to North Beach for Helen.\n\nBut Kevin is only available until 8:45 AM, so I need to make that meeting quickly.\n\nAfter that, I can go to Golden Gate Park to meet Michelle in the evening.\n\nThen, Fisherman's Wharf for Emily, Marina District for Mark, Alamo Square for Barbara, Sunset District for Laura, and finally Nob Hill for Mary.\n\nI need to make sure the travel times between these locations are manageable. For example, from Presidio to Fisherman's Wharf is 19 minutes, which is feasible.\n\nI think the key is to plan the meetings in a logical order, starting with the ones that are closer or have earlier availability, then moving to those that are farther or have later availability.\n\nI also need to ensure that each meeting has the required minimum time, and that the travel time doesn't exceed the available time windows.\n\nIt's a bit complex, but I think with careful planning, I can fit all the meetings in without missing any.\n</think>\n\n```json"
        }
    ]
}