{
    "0shot": [
        {
            "final_program_time": {
                "itinerary": [
                    {
                        "action": "meet",
                        "location": "Chinatown",
                        "person": "Robert",
                        "start_time": "9:30",
                        "end_time": "11:30"
                    },
                    {
                        "action": "meet",
                        "location": "Sunset District",
                        "person": "David",
                        "start_time": "12:45",
                        "end_time": "13:30"
                    },
                    {
                        "action": "meet",
                        "location": "Alamo Square",
                        "person": "Matthew",
                        "start_time": "14:00",
                        "end_time": "15:00"
                    },
                    {
                        "action": "meet",
                        "location": "Financial District",
                        "person": "Jessica",
                        "start_time": "15:30",
                        "end_time": "16:15"
                    },
                    {
                        "action": "meet",
                        "location": "North Beach",
                        "person": "Melissa",
                        "start_time": "16:45",
                        "end_time": "17:15"
                    },
                    {
                        "action": "meet",
                        "location": "Embarcadero",
                        "person": "Mark",
                        "start_time": "17:30",
                        "end_time": "18:00"
                    },
                    {
                        "action": "meet",
                        "location": "Presidio",
                        "person": "Deborah",
                        "start_time": "18:30",
                        "end_time": "19:15"
                    },
                    {
                        "action": "meet",
                        "location": "Golden Gate Park",
                        "person": "Karen",
                        "start_time": "19:45",
                        "end_time": "20:45"
                    },
                    {
                        "action": "meet",
                        "location": "Bayview",
                        "person": "Laura",
                        "start_time": "21:15",
                        "end_time": "21:30"
                    }
                ]
            },
            "expected_time": {
                "itinerary": [
                    {
                        "action": "meet",
                        "location": "Chinatown",
                        "person": "Robert",
                        "start_time": "9:20",
                        "end_time": "11:20"
                    },
                    {
                        "action": "meet",
                        "location": "Alamo Square",
                        "person": "Matthew",
                        "start_time": "11:37",
                        "end_time": "13:07"
                    },
                    {
                        "action": "meet",
                        "location": "Sunset District",
                        "person": "David",
                        "start_time": "13:23",
                        "end_time": "14:08"
                    },
                    {
                        "action": "meet",
                        "location": "North Beach",
                        "person": "Melissa",
                        "start_time": "14:36",
                        "end_time": "15:21"
                    },
                    {
                        "action": "meet",
                        "location": "Embarcadero",
                        "person": "Mark",
                        "start_time": "15:27",
                        "end_time": "16:12"
                    },
                    {
                        "action": "meet",
                        "location": "Financial District",
                        "person": "Jessica",
                        "start_time": "16:17",
                        "end_time": "17:02"
                    },
                    {
                        "action": "meet",
                        "location": "Presidio",
                        "person": "Deborah",
                        "start_time": "19:00",
                        "end_time": "19:45"
                    },
                    {
                        "action": "meet",
                        "location": "Golden Gate Park",
                        "person": "Karen",
                        "start_time": "19:57",
                        "end_time": "21:57"
                    }
                ]
            },
            "count": "meeting_planning_example_884",
            "is_correct": false,
            "reasoning_token_count": 558,
            "raw_model_response": "Alright, I'm trying to figure out how to help this user by scheduling their meetings in San Francisco. They've provided a lot of travel distances and constraints, so I need to carefully consider each one.\n\nFirst, the user arrives at Richmond District at 9:00 AM. Their goal is to meet as many friends as possible, so I need to maximize the number of meetings without overlapping in a way that makes travel too time-consuming.\n\nLooking at the constraints, Robert is in Chinatown until 5:30 PM, so that's a long window. David is in Sunset District from 12:30 PM to 7:45 PM, which is also a good chunk of time. Matthew is at Alamo Square until 1:45 PM, so I can meet him early. Jessica is in Financial District until 6:45 PM, which gives me some flexibility. Melissa is at North Beach until 4:45 PM, Mark at Embarcadero from 3:15 PM to 5:00 PM, Deborah at Presidio from 7:00 PM to 7:45 PM, Karen at Golden Gate Park until 10:00 PM, and Laura at Bayview from 9:15 PM to 10:15 PM.\n\nI need to ensure that each meeting starts after the previous one ends, considering travel times. Starting with Robert in Chinatown makes sense because it's nearby. Then moving to Sunset District for David. After that, maybe Alamo Square for Matthew. Then head to Financial District for Jessica. Next, North Beach for Melissa, then Embarcadero for Mark. After that, Presidio for Deborah, Golden Gate Park for Karen, and finally Bayview for Laura.\n\nI should calculate the travel times to make sure each move is feasible. For example, from Chinatown to Sunset District is 29 minutes, which is manageable. From Sunset District to Alamo Square is 17 minutes. From Alamo Square to Financial District is 17 minutes as well. I need to make sure each meeting starts and ends within the person's available time and that the user has enough time to travel to the next location.\n\nI also need to check if the last meeting with Laura at Bayview at 9:15 PM is feasible after Deborah's meeting at Presidio. The travel time from Presidio to Bayview is 31 minutes, which would get there just in time. Laura's meeting is only 15 minutes, so that should work.\n\nI think this schedule maximizes the number of meetings without too much backtracking, considering the travel times provided. Each meeting is spaced out enough to allow for travel without being too rushed. Hopefully, this plan works for the user.\n</think>\n\nSOLUTION:\n{\n  \"itinerary\": [\n    {\"action\": \"meet\", \"location\": \"Chinatown\", \"person\": \"Robert\", \"start_time\": \"9:30\", \"end_time\": \"11:30\"},\n    {\"action\": \"meet\", \"location\": \"Sunset District\", \"person\": \"David\", \"start_time\": \"12:45\", \"end_time\": \"13:30\"},\n    {\"action\": \"meet\", \"location\": \"Alamo Square\", \"person\": \"Matthew\", \"start_time\": \"14:00\", \"end_time\": \"15:00\"},\n    {\"action\": \"meet\", \"location\": \"Financial District\", \"person\": \"Jessica\", \"start_time\": \"15:30\", \"end_time\": \"16:15\"},\n    {\"action\": \"meet\", \"location\": \"North Beach\", \"person\": \"Melissa\", \"start_time\": \"16:45\", \"end_time\": \"17:15\"},\n    {\"action\": \"meet\", \"location\": \"Embarcadero\", \"person\": \"Mark\", \"start_time\": \"17:30\", \"end_time\": \"18:00\"},\n    {\"action\": \"meet\", \"location\": \"Presidio\", \"person\": \"Deborah\", \"start_time\": \"18:30\", \"end_time\": \"19:15\"},\n    {\"action\": \"meet\", \"location\": \"Golden Gate Park\", \"person\": \"Karen\", \"start_time\": \"19:45\", \"end_time\": \"20:45\"},\n    {\"action\": \"meet\", \"location\": \"Bayview\", \"person\": \"Laura\", \"start_time\": \"21:15\", \"end_time\": \"21:30\"}\n  ]\n}",
            "raw_model_reasoning": "Alright, I'm trying to figure out how to help this user by scheduling their meetings in San Francisco. They've provided a lot of travel distances and constraints, so I need to carefully consider each one.\n\nFirst, the user arrives at Richmond District at 9:00 AM. Their goal is to meet as many friends as possible, so I need to maximize the number of meetings without overlapping in a way that makes travel too time-consuming.\n\nLooking at the constraints, Robert is in Chinatown until 5:30 PM, so that's a long window. David is in Sunset District from 12:30 PM to 7:45 PM, which is also a good chunk of time. Matthew is at Alamo Square until 1:45 PM, so I can meet him early. Jessica is in Financial District until 6:45 PM, which gives me some flexibility. Melissa is at North Beach until 4:45 PM, Mark at Embarcadero from 3:15 PM to 5:00 PM, Deborah at Presidio from 7:00 PM to 7:45 PM, Karen at Golden Gate Park until 10:00 PM, and Laura at Bayview from 9:15 PM to 10:15 PM.\n\nI need to ensure that each meeting starts after the previous one ends, considering travel times. Starting with Robert in Chinatown makes sense because it's nearby. Then moving to Sunset District for David. After that, maybe Alamo Square for Matthew. Then head to Financial District for Jessica. Next, North Beach for Melissa, then Embarcadero for Mark. After that, Presidio for Deborah, Golden Gate Park for Karen, and finally Bayview for Laura.\n\nI should calculate the travel times to make sure each move is feasible. For example, from Chinatown to Sunset District is 29 minutes, which is manageable. From Sunset District to Alamo Square is 17 minutes. From Alamo Square to Financial District is 17 minutes as well. I need to make sure each meeting starts and ends within the person's available time and that the user has enough time to travel to the next location.\n\nI also need to check if the last meeting with Laura at Bayview at 9:15 PM is feasible after Deborah's meeting at Presidio. The travel time from Presidio to Bayview is 31 minutes, which would get there just in time. Laura's meeting is only 15 minutes, so that should work.\n\nI think this schedule maximizes the number of meetings without too much backtracking, considering the travel times provided. Each meeting is spaced out enough to allow for travel without being too rushed. Hopefully, this plan works for the user.\n</think>\n\nSOLUTION:"
        }
    ]
}