{
    "0shot": [
        {
            "final_program_time": {
                "itinerary": [
                    {
                        "action": "meet",
                        "location": "Richmond District",
                        "person": "Laura",
                        "start_time": "9:15",
                        "end_time": "10:15"
                    },
                    {
                        "action": "meet",
                        "location": "Chinatown",
                        "person": "Richard",
                        "start_time": "9:30",
                        "end_time": "9:45"
                    },
                    {
                        "action": "meet",
                        "location": "Fisherman's Wharf",
                        "person": "Jeffrey",
                        "start_time": "10:15",
                        "end_time": "11:45"
                    },
                    {
                        "action": "meet",
                        "location": "Alamo Square",
                        "person": "Ronald",
                        "start_time": "11:30",
                        "end_time": "14:30"
                    },
                    {
                        "action": "meet",
                        "location": "Financial District",
                        "person": "Jason",
                        "start_time": "14:30",
                        "end_time": "16:30"
                    },
                    {
                        "action": "meet",
                        "location": "Sunset District",
                        "person": "Elizabeth",
                        "start_time": "16:30",
                        "end_time": "17:30"
                    },
                    {
                        "action": "meet",
                        "location": "Embarcadero",
                        "person": "Margaret",
                        "start_time": "17:30",
                        "end_time": "18:30"
                    },
                    {
                        "action": "meet",
                        "location": "Golden Gate Park",
                        "person": "George",
                        "start_time": "18:30",
                        "end_time": "19:30"
                    }
                ]
            },
            "expected_time": {
                "itinerary": [
                    {
                        "action": "meet",
                        "location": "Fisherman's Wharf",
                        "person": "Jeffrey",
                        "start_time": "10:15",
                        "end_time": "11:45"
                    },
                    {
                        "action": "meet",
                        "location": "Alamo Square",
                        "person": "Ronald",
                        "start_time": "12:06",
                        "end_time": "14:06"
                    },
                    {
                        "action": "meet",
                        "location": "Embarcadero",
                        "person": "Margaret",
                        "start_time": "14:22",
                        "end_time": "15:52"
                    },
                    {
                        "action": "meet",
                        "location": "Chinatown",
                        "person": "Richard",
                        "start_time": "15:59",
                        "end_time": "16:14"
                    },
                    {
                        "action": "meet",
                        "location": "Richmond District",
                        "person": "Laura",
                        "start_time": "16:34",
                        "end_time": "17:34"
                    },
                    {
                        "action": "meet",
                        "location": "Union Square",
                        "person": "Melissa",
                        "start_time": "17:55",
                        "end_time": "18:10"
                    },
                    {
                        "action": "meet",
                        "location": "Golden Gate Park",
                        "person": "George",
                        "start_time": "19:00",
                        "end_time": "20:15"
                    }
                ]
            },
            "count": "meeting_planning_example_831",
            "is_correct": false,
            "reasoning_token_count": 790,
            "raw_model_response": "Alright, I need to help this user by scheduling their meetings in San Francisco. They want to meet as many friends as possible, so I should aim for a packed itinerary. They arrive at Presidio at 9:00 AM, so that's my starting point.\n\nFirst, I'll look at the constraints. Jeffrey is at Fisherman's Wharf from 10:15 AM to 1:00 PM. He needs at least 90 minutes, so I should meet him somewhere nearby. Presidio to Fisherman's Wharf is 19 minutes, which is manageable.\n\nNext, Ronald is at Alamo Square from 7:45 AM to 2:45 PM. He needs 120 minutes. Since he's at Alamo Square, I should plan to go there after Jeffrey's meeting. The travel time from Fisherman's Wharf to Alamo Square is 21 minutes, which fits well.\n\nThen, Jason is at Financial District from 10:45 AM to 4:00 PM. He needs 105 minutes. From Alamo Square to Financial District is 17 minutes, so after meeting Ronald, I can head there. But I have to make sure the meeting ends before 4:00 PM.\n\nMelissa is at Union Square from 5:45 PM to 6:15 PM. She needs 15 minutes. I'll have to travel from Financial District to Union Square, which is 9 minutes. But I need to check if the time works after Jason's meeting.\n\nElizabeth is at Sunset District from 2:45 PM to 5:30 PM. She needs 105 minutes. From Financial District to Sunset District is 30 minutes, so I can meet her after Jason, but I need to ensure I have enough time before her meeting ends.\n\nMargaret is at Embarcadero from 1:15 PM to 7:00 PM. She needs 90 minutes. From Sunset District to Embarcadero is 30 minutes, so I can meet her after Elizabeth. I should make sure the timing works.\n\nGeorge is at Golden Gate Park from 7:00 PM to 10:00 PM. He needs 75 minutes. After Margaret's meeting, I can go to Golden Gate Park. The travel time from Embarcadero is 25 minutes, which is doable.\n\nRichard is at Chinatown from 9:30 AM to 9:00 PM. He needs 15 minutes. I can meet him early at Chinatown, which is 21 minutes from Presidio. That's feasible.\n\nLaura is at Richmond District from 9:45 AM to 6:00 PM. She needs 60 minutes. From Presidio to Richmond District is 7 minutes, so I can meet her first thing in the morning. \n\nNow, I need to piece this together without overlapping meetings and ensuring travel times are accounted for. Starting with Laura at Richmond District at 9:15 AM, then Richard at Chinatown at 9:30 AM, then Jeffrey at Fisherman's Wharf at 10:15 AM, Ronald at Alamo Square at 11:30 AM, Jason at Financial District at 12:45 PM, Elizabeth at Sunset District at 2:45 PM, Margaret at Embarcadero at 3:45 PM, and George at Golden Gate Park at 4:45 PM.\n\nI need to check each meeting's duration and ensure I have enough time to travel to the next location. For example, after meeting Laura, I travel to Chinatown, then to Fisherman's Wharf, etc. Each meeting ends just in time to catch the next one without too much waiting.\n\nI think this schedule works. It meets all the friends with the required durations and travel times. I should present this in JSON format as per the user's request.\n</think>\n\nSOLUTION:\n{\n  \"itinerary\": [\n    {\"action\": \"meet\", \"location\": \"Richmond District\", \"person\": \"Laura\", \"start_time\": \"09:15\", \"end_time\": \"10:15\"},\n    {\"action\": \"meet\", \"location\": \"Chinatown\", \"person\": \"Richard\", \"start_time\": \"09:30\", \"end_time\": \"09:45\"},\n    {\"action\": \"meet\", \"location\": \"Fisherman's Wharf\", \"person\": \"Jeffrey\", \"start_time\": \"10:15\", \"end_time\": \"11:45\"},\n    {\"action\": \"meet\", \"location\": \"Alamo Square\", \"person\": \"Ronald\", \"start_time\": \"11:30\", \"end_time\": \"14:30\"},\n    {\"action\": \"meet\", \"location\": \"Financial District\", \"person\": \"Jason\", \"start_time\": \"14:30\", \"end_time\": \"16:30\"},\n    {\"action\": \"meet\", \"location\": \"Sunset District\", \"person\": \"Elizabeth\", \"start_time\": \"16:30\", \"end_time\": \"17:30\"},\n    {\"action\": \"meet\", \"location\": \"Embarcadero\", \"person\": \"Margaret\", \"start_time\": \"17:30\", \"end_time\": \"18:30\"},\n    {\"action\": \"meet\", \"location\": \"Golden Gate Park\", \"person\": \"George\", \"start_time\": \"18:30\", \"end_time\": \"19:30\"}\n  ]\n}",
            "raw_model_reasoning": "Alright, I need to help this user by scheduling their meetings in San Francisco. They want to meet as many friends as possible, so I should aim for a packed itinerary. They arrive at Presidio at 9:00 AM, so that's my starting point.\n\nFirst, I'll look at the constraints. Jeffrey is at Fisherman's Wharf from 10:15 AM to 1:00 PM. He needs at least 90 minutes, so I should meet him somewhere nearby. Presidio to Fisherman's Wharf is 19 minutes, which is manageable.\n\nNext, Ronald is at Alamo Square from 7:45 AM to 2:45 PM. He needs 120 minutes. Since he's at Alamo Square, I should plan to go there after Jeffrey's meeting. The travel time from Fisherman's Wharf to Alamo Square is 21 minutes, which fits well.\n\nThen, Jason is at Financial District from 10:45 AM to 4:00 PM. He needs 105 minutes. From Alamo Square to Financial District is 17 minutes, so after meeting Ronald, I can head there. But I have to make sure the meeting ends before 4:00 PM.\n\nMelissa is at Union Square from 5:45 PM to 6:15 PM. She needs 15 minutes. I'll have to travel from Financial District to Union Square, which is 9 minutes. But I need to check if the time works after Jason's meeting.\n\nElizabeth is at Sunset District from 2:45 PM to 5:30 PM. She needs 105 minutes. From Financial District to Sunset District is 30 minutes, so I can meet her after Jason, but I need to ensure I have enough time before her meeting ends.\n\nMargaret is at Embarcadero from 1:15 PM to 7:00 PM. She needs 90 minutes. From Sunset District to Embarcadero is 30 minutes, so I can meet her after Elizabeth. I should make sure the timing works.\n\nGeorge is at Golden Gate Park from 7:00 PM to 10:00 PM. He needs 75 minutes. After Margaret's meeting, I can go to Golden Gate Park. The travel time from Embarcadero is 25 minutes, which is doable.\n\nRichard is at Chinatown from 9:30 AM to 9:00 PM. He needs 15 minutes. I can meet him early at Chinatown, which is 21 minutes from Presidio. That's feasible.\n\nLaura is at Richmond District from 9:45 AM to 6:00 PM. She needs 60 minutes. From Presidio to Richmond District is 7 minutes, so I can meet her first thing in the morning. \n\nNow, I need to piece this together without overlapping meetings and ensuring travel times are accounted for. Starting with Laura at Richmond District at 9:15 AM, then Richard at Chinatown at 9:30 AM, then Jeffrey at Fisherman's Wharf at 10:15 AM, Ronald at Alamo Square at 11:30 AM, Jason at Financial District at 12:45 PM, Elizabeth at Sunset District at 2:45 PM, Margaret at Embarcadero at 3:45 PM, and George at Golden Gate Park at 4:45 PM.\n\nI need to check each meeting's duration and ensure I have enough time to travel to the next location. For example, after meeting Laura, I travel to Chinatown, then to Fisherman's Wharf, etc. Each meeting ends just in time to catch the next one without too much waiting.\n\nI think this schedule works. It meets all the friends with the required durations and travel times. I should present this in JSON format as per the user's request.\n</think>\n\nSOLUTION:"
        }
    ]
}