{
    "0shot": [
        {
            "final_program_time": {
                "itinerary": [
                    {
                        "action": "meet",
                        "location": "Mission District",
                        "person": "Kenneth",
                        "start_time": "12:45",
                        "end_time": "1:30"
                    },
                    {
                        "action": "meet",
                        "location": "Pacific Heights",
                        "person": "Thomas",
                        "start_time": "3:00",
                        "end_time": "4:00"
                    }
                ]
            },
            "expected_time": {
                "itinerary": [
                    {
                        "action": "meet",
                        "location": "Mission District",
                        "person": "Kenneth",
                        "start_time": "12:00",
                        "end_time": "12:45"
                    },
                    {
                        "action": "meet",
                        "location": "Pacific Heights",
                        "person": "Thomas",
                        "start_time": "15:30",
                        "end_time": "16:45"
                    }
                ]
            },
            "count": "meeting_planning_example_174",
            "is_correct": false,
            "reasoning_token_count": 521,
            "raw_model_response": "Okay, so I'm trying to help this user who's an AI meeting planner. They need to schedule a day of meetings in San Francisco, starting from Nob Hill at 9 AM. The goal is to meet as many friends as possible, considering travel times and constraints.\n\nFirst, I'll look at the constraints. The user arrives at Nob Hill at 9:00 AM. There are two main friends they want to meet: Thomas, who's at Pacific Heights from 3:30 PM to 7:15 PM, and Kenneth, who's at the Mission District from 12:00 PM to 3:45 PM. They need to meet each for a minimum of 75 and 45 minutes, respectively.\n\nI need to figure out the best times and locations to meet them without overlapping too much and considering the travel distances between areas.\n\nStarting with Thomas, who's in Pacific Heights from 3:30 PM to 7:15 PM. Since the user is at Nob Hill at 9 AM, I should calculate the travel time from Nob Hill to Pacific Heights. The distance is 8 minutes, so it's quick. If the user leaves Nob Hill around 3:00 PM, they can arrive at Pacific Heights by 3:08 PM, which is within Thomas's availability. They need at least 75 minutes together, so the meeting should end by 4:08 PM to give enough time.\n\nNext, Kenneth is at the Mission District from 12:00 PM to 3:45 PM. The user needs to meet him for 45 minutes. The travel time from Nob Hill to Mission District is 13 minutes. If the user leaves Nob Hill around 12:45 PM, they can arrive at Mission District by 12:58 PM. Meeting Kenneth until 1:43 PM would give the required 45 minutes, leaving time to travel to Pacific Heights by 2:10 PM, arriving at 2:18 PM, which is before Thomas's 3:30 PM start time.\n\nSo the plan is to meet Kenneth first in the Mission District at 12:45 PM, then travel to Pacific Heights to meet Thomas starting at 3:00 PM. This way, the user maximizes the number of meetings while respecting the travel times and constraints.\n\nI should make sure the meeting times are within each person's availability and that the user has enough time to travel between locations without being too rushed. This seems to work, so the itinerary would include both meetings with the necessary start and end times.\n</think>\n\nSOLUTION:\n{\n  \"itinerary\": [\n    {\"action\": \"meet\", \"location\": \"Mission District\", \"person\": \"Kenneth\", \"start_time\": \"12:45\", \"end_time\": \"1:30\"},\n    {\"action\": \"meet\", \"location\": \"Pacific Heights\", \"person\": \"Thomas\", \"start_time\": \"3:00\", \"end_time\": \"4:00\"}\n  ]\n}",
            "raw_model_reasoning": "Okay, so I'm trying to help this user who's an AI meeting planner. They need to schedule a day of meetings in San Francisco, starting from Nob Hill at 9 AM. The goal is to meet as many friends as possible, considering travel times and constraints.\n\nFirst, I'll look at the constraints. The user arrives at Nob Hill at 9:00 AM. There are two main friends they want to meet: Thomas, who's at Pacific Heights from 3:30 PM to 7:15 PM, and Kenneth, who's at the Mission District from 12:00 PM to 3:45 PM. They need to meet each for a minimum of 75 and 45 minutes, respectively.\n\nI need to figure out the best times and locations to meet them without overlapping too much and considering the travel distances between areas.\n\nStarting with Thomas, who's in Pacific Heights from 3:30 PM to 7:15 PM. Since the user is at Nob Hill at 9 AM, I should calculate the travel time from Nob Hill to Pacific Heights. The distance is 8 minutes, so it's quick. If the user leaves Nob Hill around 3:00 PM, they can arrive at Pacific Heights by 3:08 PM, which is within Thomas's availability. They need at least 75 minutes together, so the meeting should end by 4:08 PM to give enough time.\n\nNext, Kenneth is at the Mission District from 12:00 PM to 3:45 PM. The user needs to meet him for 45 minutes. The travel time from Nob Hill to Mission District is 13 minutes. If the user leaves Nob Hill around 12:45 PM, they can arrive at Mission District by 12:58 PM. Meeting Kenneth until 1:43 PM would give the required 45 minutes, leaving time to travel to Pacific Heights by 2:10 PM, arriving at 2:18 PM, which is before Thomas's 3:30 PM start time.\n\nSo the plan is to meet Kenneth first in the Mission District at 12:45 PM, then travel to Pacific Heights to meet Thomas starting at 3:00 PM. This way, the user maximizes the number of meetings while respecting the travel times and constraints.\n\nI should make sure the meeting times are within each person's availability and that the user has enough time to travel between locations without being too rushed. This seems to work, so the itinerary would include both meetings with the necessary start and end times.\n</think>\n\nSOLUTION:"
        }
    ]
}