{
    "0shot": [
        {
            "final_program_time": {
                "itinerary": [
                    {
                        "action": "meet",
                        "location": "Haight-Ashbury",
                        "person": "Linda",
                        "start_time": "9:17",
                        "end_time": "9:17"
                    },
                    {
                        "action": "meet",
                        "location": "Pacific Heights",
                        "person": "Emily",
                        "start_time": "9:17",
                        "end_time": "9:17"
                    },
                    {
                        "action": "meet",
                        "location": "Alamo Square",
                        "person": "Nancy",
                        "start_time": "9:32",
                        "end_time": "9:32"
                    },
                    {
                        "action": "meet",
                        "location": "Embarcadero",
                        "person": "James",
                        "start_time": "10:37",
                        "end_time": "10:37"
                    },
                    {
                        "action": "meet",
                        "location": "Golden Gate Park",
                        "person": "Steven",
                        "start_time": "11:36",
                        "end_time": "11:36"
                    },
                    {
                        "action": "meet",
                        "location": "North Beach",
                        "person": "Helen",
                        "start_time": "14:54",
                        "end_time": "14:54"
                    },
                    {
                        "action": "meet",
                        "location": "Fisherman's Wharf",
                        "person": "Paul",
                        "start_time": "14:49",
                        "end_time": "14:49"
                    },
                    {
                        "action": "meet",
                        "location": "Richmond District",
                        "person": "Margaret",
                        "start_time": "15:29",
                        "end_time": "15:29"
                    },
                    {
                        "action": "meet",
                        "location": "Bayview",
                        "person": "William",
                        "start_time": "17:43",
                        "end_time": "17:43"
                    }
                ]
            },
            "expected_time": {
                "itinerary": [
                    {
                        "action": "meet",
                        "location": "Pacific Heights",
                        "person": "Emily",
                        "start_time": "9:15",
                        "end_time": "11:15"
                    },
                    {
                        "action": "meet",
                        "location": "Haight-Ashbury",
                        "person": "Linda",
                        "start_time": "11:26",
                        "end_time": "11:41"
                    },
                    {
                        "action": "meet",
                        "location": "Mission District",
                        "person": "Anthony",
                        "start_time": "11:52",
                        "end_time": "13:37"
                    },
                    {
                        "action": "meet",
                        "location": "North Beach",
                        "person": "Helen",
                        "start_time": "13:54",
                        "end_time": "14:24"
                    },
                    {
                        "action": "meet",
                        "location": "Fisherman's Wharf",
                        "person": "Paul",
                        "start_time": "14:45",
                        "end_time": "16:15"
                    },
                    {
                        "action": "meet",
                        "location": "Bayview",
                        "person": "William",
                        "start_time": "17:30",
                        "end_time": "19:30"
                    },
                    {
                        "action": "meet",
                        "location": "Golden Gate Park",
                        "person": "Kimberly",
                        "start_time": "19:52",
                        "end_time": "21:07"
                    }
                ]
            },
            "count": "meeting_planning_example_901",
            "is_correct": false,
            "reasoning_token_count": 1048,
            "raw_model_response": "Alright, let's tackle this scheduling problem. The user wants to meet as many friends as possible in San Francisco, starting from Russian Hill at 9:00 AM. They've provided a list of travel distances between various locations, so I need to consider those to plan the optimal itinerary.\n\nFirst, I should look at the constraints. The user has to meet several people, each with specific time windows. For example, Emily is at Pacific Heights from 9:15 AM to 1:45 PM, which is a long window. Helen is at North Beach from 1:45 PM to 6:45 PM. Kimberly is at Golden Gate Park from 6:45 PM to 9:15 PM. James is at Embarcadero for a short time, so I need to catch him early. Linda is at Haight-Ashbury from early morning to evening, so I can meet her early. Paul is at Fisherman's Wharf from 2:45 PM to 6:45 PM. Anthony is at the Mission District until 2:45 PM. Nancy is at Alamo Square until 1:45 PM. William is at Bayview from 5:30 PM to 8:30 PM. Margaret is at Richmond District from 3:15 PM to 6:15 PM.\n\nI need to ensure that each meeting doesn't overlap and that travel times between locations are considered. Starting with the earliest possible meetings seems logical. Let's see:\n\n1. **Linda** is at Haight-Ashbury from 7:30 AM to 7:15 PM. Since I'm at Russian Hill at 9:00 AM, I can meet her at Haight-Ashbury after traveling. The travel time from Russian Hill to Haight-Ashbury is 17 minutes. If I meet her at 9:17 AM, that's efficient.\n\n2. **James** is at Embarcadero from 10:30 AM to 11:30 AM. I need to travel from Haight-Ashbury to Embarcadero, which takes 20 minutes. So, I can meet him at 10:37 AM.\n\n3. **Linda** is already met, so next is **Emily** at Pacific Heights from 9:15 AM to 1:45 PM. The travel time from Russian Hill to Pacific Heights is 7 minutes. I can meet her at 9:17 AM as well.\n\n4. **Helen** is at North Beach from 1:45 PM to 6:45 PM. I'll need to travel from Pacific Heights to North Beach, which is 9 minutes. So, I can meet her at 2:54 PM.\n\n5. **Paul** is at Fisherman's Wharf from 2:45 PM to 6:45 PM. Traveling from North Beach to Fisherman's Wharf takes 5 minutes. I can meet him at 2:49 PM.\n\n6. **Nancy** is at Alamo Square from 8:30 AM to 1:45 PM. Traveling from Russian Hill to Alamo Square is 15 minutes. If I go there after meeting Linda, maybe at 9:32 AM.\n\n7. **Anthony** is at Mission District from 8:00 AM to 2:45 PM. Traveling from Russian Hill to Mission District is 16 minutes. I can meet him at 9:16 AM.\n\n8. **William** is at Bayview from 5:30 PM to 8:30 PM. Traveling from Russian Hill to Bayview is 23 minutes. I can meet him at 5:43 PM.\n\n9. **Margaret** is at Richmond District from 3:15 PM to 6:15 PM. Traveling from Russian Hill to Richmond District is 14 minutes. I can meet her at 3:29 PM.\n\n10. **Steven** is at Golden Gate Park from 11:15 AM to 9:15 PM. Traveling from Russian Hill to Golden Gate Park is 21 minutes. I can meet him at 11:36 AM.\n\nWait, but I need to make sure the meetings don't overlap. Let me check:\n\n- 9:00 AM: Arrive at Russian Hill.\n- 9:17 AM: Meet Linda at Haight-Ashbury.\n- 9:17 AM: Meet Emily at Pacific Heights.\n- 9:32 AM: Meet Nancy at Alamo Square.\n- 10:37 AM: Meet James at Embarcadero.\n- 11:36 AM: Meet Steven at Golden Gate Park.\n- 2:54 PM: Meet Helen at North Beach.\n- 2:49 PM: Meet Paul at Fisherman's Wharf.\n- 3:29 PM: Meet Margaret at Richmond District.\n- 5:43 PM: Meet William at Bayview.\n\nThis seems feasible. Each meeting is scheduled without overlapping times, considering the travel distances. I think this is a good plan to meet as many friends as possible within the day.\n</think>\n\n```json\n{\n  \"itinerary\": [\n    {\n      \"action\": \"meet\",\n      \"location\": \"Haight-Ashbury\",\n      \"person\": \"Linda\",\n      \"start_time\": \"09:17\",\n      \"end_time\": \"09:17\"\n    },\n    {\n      \"action\": \"meet\",\n      \"location\": \"Pacific Heights\",\n      \"person\": \"Emily\",\n      \"start_time\": \"09:17\",\n      \"end_time\": \"09:17\"\n    },\n    {\n      \"action\": \"meet\",\n      \"location\": \"Alamo Square\",\n      \"person\": \"Nancy\",\n      \"start_time\": \"09:32\",\n      \"end_time\": \"09:32\"\n    },\n    {\n      \"action\": \"meet\",\n      \"location\": \"Embarcadero\",\n      \"person\": \"James\",\n      \"start_time\": \"10:37\",\n      \"end_time\": \"10:37\"\n    },\n    {\n      \"action\": \"meet\",\n      \"location\": \"Golden Gate Park\",\n      \"person\": \"Steven\",\n      \"start_time\": \"11:36\",\n      \"end_time\": \"11:36\"\n    },\n    {\n      \"action\": \"meet\",\n      \"location\": \"North Beach\",\n      \"person\": \"Helen\",\n      \"start_time\": \"14:54\",\n      \"end_time\": \"14:54\"\n    },\n    {\n      \"action\": \"meet\",\n      \"location\": \"Fisherman's Wharf\",\n      \"person\": \"Paul\",\n      \"start_time\": \"14:49\",\n      \"end_time\": \"14:49\"\n    },\n    {\n      \"action\": \"meet\",\n      \"location\": \"Richmond District\",\n      \"person\": \"Margaret\",\n      \"start_time\": \"15:29\",\n      \"end_time\": \"15:29\"\n    },\n    {\n      \"action\": \"meet\",\n      \"location\": \"Bayview\",\n      \"person\": \"William\",\n      \"start_time\": \"17:43\",\n      \"end_time\": \"17:43\"\n    }\n  ]\n}\n```",
            "raw_model_reasoning": "Alright, let's tackle this scheduling problem. The user wants to meet as many friends as possible in San Francisco, starting from Russian Hill at 9:00 AM. They've provided a list of travel distances between various locations, so I need to consider those to plan the optimal itinerary.\n\nFirst, I should look at the constraints. The user has to meet several people, each with specific time windows. For example, Emily is at Pacific Heights from 9:15 AM to 1:45 PM, which is a long window. Helen is at North Beach from 1:45 PM to 6:45 PM. Kimberly is at Golden Gate Park from 6:45 PM to 9:15 PM. James is at Embarcadero for a short time, so I need to catch him early. Linda is at Haight-Ashbury from early morning to evening, so I can meet her early. Paul is at Fisherman's Wharf from 2:45 PM to 6:45 PM. Anthony is at the Mission District until 2:45 PM. Nancy is at Alamo Square until 1:45 PM. William is at Bayview from 5:30 PM to 8:30 PM. Margaret is at Richmond District from 3:15 PM to 6:15 PM.\n\nI need to ensure that each meeting doesn't overlap and that travel times between locations are considered. Starting with the earliest possible meetings seems logical. Let's see:\n\n1. **Linda** is at Haight-Ashbury from 7:30 AM to 7:15 PM. Since I'm at Russian Hill at 9:00 AM, I can meet her at Haight-Ashbury after traveling. The travel time from Russian Hill to Haight-Ashbury is 17 minutes. If I meet her at 9:17 AM, that's efficient.\n\n2. **James** is at Embarcadero from 10:30 AM to 11:30 AM. I need to travel from Haight-Ashbury to Embarcadero, which takes 20 minutes. So, I can meet him at 10:37 AM.\n\n3. **Linda** is already met, so next is **Emily** at Pacific Heights from 9:15 AM to 1:45 PM. The travel time from Russian Hill to Pacific Heights is 7 minutes. I can meet her at 9:17 AM as well.\n\n4. **Helen** is at North Beach from 1:45 PM to 6:45 PM. I'll need to travel from Pacific Heights to North Beach, which is 9 minutes. So, I can meet her at 2:54 PM.\n\n5. **Paul** is at Fisherman's Wharf from 2:45 PM to 6:45 PM. Traveling from North Beach to Fisherman's Wharf takes 5 minutes. I can meet him at 2:49 PM.\n\n6. **Nancy** is at Alamo Square from 8:30 AM to 1:45 PM. Traveling from Russian Hill to Alamo Square is 15 minutes. If I go there after meeting Linda, maybe at 9:32 AM.\n\n7. **Anthony** is at Mission District from 8:00 AM to 2:45 PM. Traveling from Russian Hill to Mission District is 16 minutes. I can meet him at 9:16 AM.\n\n8. **William** is at Bayview from 5:30 PM to 8:30 PM. Traveling from Russian Hill to Bayview is 23 minutes. I can meet him at 5:43 PM.\n\n9. **Margaret** is at Richmond District from 3:15 PM to 6:15 PM. Traveling from Russian Hill to Richmond District is 14 minutes. I can meet her at 3:29 PM.\n\n10. **Steven** is at Golden Gate Park from 11:15 AM to 9:15 PM. Traveling from Russian Hill to Golden Gate Park is 21 minutes. I can meet him at 11:36 AM.\n\nWait, but I need to make sure the meetings don't overlap. Let me check:\n\n- 9:00 AM: Arrive at Russian Hill.\n- 9:17 AM: Meet Linda at Haight-Ashbury.\n- 9:17 AM: Meet Emily at Pacific Heights.\n- 9:32 AM: Meet Nancy at Alamo Square.\n- 10:37 AM: Meet James at Embarcadero.\n- 11:36 AM: Meet Steven at Golden Gate Park.\n- 2:54 PM: Meet Helen at North Beach.\n- 2:49 PM: Meet Paul at Fisherman's Wharf.\n- 3:29 PM: Meet Margaret at Richmond District.\n- 5:43 PM: Meet William at Bayview.\n\nThis seems feasible. Each meeting is scheduled without overlapping times, considering the travel distances. I think this is a good plan to meet as many friends as possible within the day.\n</think>\n\n```json"
        }
    ]
}