{
    "0shot": [
        {
            "final_program_time": {
                "itinerary": [
                    {
                        "action": "meet",
                        "location": "Presidio",
                        "person": "Jason",
                        "start_time": "10:00",
                        "end_time": "10:15"
                    },
                    {
                        "action": "meet",
                        "location": "Marina District",
                        "person": "Kenneth",
                        "start_time": "15:30",
                        "end_time": "16:15"
                    }
                ]
            },
            "expected_time": {
                "itinerary": [
                    {
                        "action": "meet",
                        "location": "Presidio",
                        "person": "Jason",
                        "start_time": "10:00",
                        "end_time": "11:30"
                    },
                    {
                        "action": "meet",
                        "location": "Marina District",
                        "person": "Kenneth",
                        "start_time": "15:30",
                        "end_time": "16:15"
                    }
                ]
            },
            "count": "meeting_planning_example_131",
            "is_correct": false,
            "reasoning_token_count": 1142,
            "raw_model_response": "Alright, so I'm trying to help this user who's an AI meeting planner. They want to maximize the number of meetings they can attend in San Francisco, considering travel times and constraints. The user has provided a series of interactions where they've been given different travel distances and constraints, and each time, I've provided a JSON itinerary.\n\nIn the last interaction, the user provided a scenario where they arrived at Pacific Heights at 9:00 AM, and needed to meet two people: Jason at Presidio and Kenneth at Marina District. The travel distances were given, and I provided a meeting plan that started with meeting Kenneth first, then Jason.\n\nBut now, the user is giving me a new query with similar constraints but different travel distances. They want to meet Jason at Presidio from 10:00 AM to 4:15 PM and Kenneth at Marina District from 3:30 PM to 4:45 PM. The travel times are a bit different from the previous case.\n\nFirst, I need to understand the constraints. The user arrives at Pacific Heights at 9:00 AM. So, they can start their day there. They need to meet Jason at Presidio, who's available from 10:00 AM to 4:15 PM. That's a window of 4 hours and 15 minutes. Then, they need to meet Kenneth at Marina District, who's available from 3:30 PM to 4:45 PM. That's a window of 1 hour and 15 minutes.\n\nThe user wants to meet both, so the key is to find overlapping times where they can meet both without too much back-and-forth travel. Since Presidio and Marina District are both locations, I need to check the travel times from Pacific Heights to both places.\n\nLooking at the travel distances, Presidio is 11 minutes from Pacific Heights, and Marina District is 6 minutes away. So, the user can easily get to both locations.\n\nNow, the user's goal is to maximize the number of meetings, so they need to schedule these two meetings in a way that doesn't leave too much downtime, considering the travel times.\n\nIn the previous response, I scheduled the meeting with Kenneth first at Marina District at 3:30 PM, then with Jason at Presidio at 4:00 PM. That worked because there was enough time to travel from Marina District to Presidio, which is 10 minutes. That left a little over an hour between the two meetings.\n\nBut in this case, Kenneth's availability is from 3:30 PM to 4:45 PM, and Jason's is until 4:15 PM. So, if the user meets Kenneth at 3:30 PM, they have until 4:45 PM. But Jason's meeting ends at 4:15 PM, so they can't meet Jason after that. Therefore, the user needs to meet Jason first and then Kenneth.\n\nAlternatively, they could meet Kenneth first and then Jason, but given that Jason's meeting ends earlier, that might be more efficient.\n\nWait, no, because if the user meets Jason at 10:00 AM, they have until 4:15 PM. Kenneth is available from 3:30 PM to 4:45 PM, so they can meet Kenneth after meeting Jason. The travel time from Presidio to Marina District is 10 minutes, so that's manageable.\n\nSo, the optimal schedule would be:\n\n1. Meet Jason at Presidio at 10:00 AM. This gives the user the rest of the day to meet others or proceed as needed.\n\n2. After meeting Jason, travel to Marina District, which takes 10 minutes, and meet Kenneth at 3:30 PM.\n\nThis way, the user meets both people without any issues, and the travel times are minimal.\n\nI need to make sure that the meeting times are within the constraints provided. Jason is available until 4:15 PM, and Kenneth is available until 4:45 PM. So, meeting Kenneth at 3:30 PM works because that's within his availability, and the meeting ends before his time is up.\n\nAlso, the user can start their day at Pacific Heights at 9:00 AM, so meeting Jason at 10:00 AM is feasible.\n\nIn the JSON response, I need to list the meetings in the correct order, starting with Jason at Presidio and then Kenneth at Marina District.\n\nI should also ensure that the start and end times are in 24-hour format without leading zeros, as specified.\n\nSo, the final itinerary would be:\n\n- Meet Jason at Presidio from 10:00 AM to 10:00 AM (assuming the meeting is just the start time, but realistically, it should be a duration). Wait, in the previous response, the end time was after the start time. So, I need to adjust that.\n\nActually, the user's previous response had meetings with start and end times, so I should follow that format. So, the meeting with Jason would be from 10:00 AM to 10:00 AM plus the duration. But since the user wants to meet for a minimum time, I'll assume a 15-minute meeting.\n\nSimilarly, for Kenneth, the meeting would be from 3:30 PM to 4:15 PM, which is 45 minutes.\n\nSo, the JSON should reflect these times accurately.\n\nIn summary, the optimal schedule is to meet Jason first at Presidio, then Kenneth at Marina District, ensuring minimal travel time and adherence to constraints.\n</think>\n\n```json\n{\n  \"itinerary\": [\n    {\n      \"action\": \"meet\",\n      \"location\": \"Presidio\",\n      \"person\": \"Jason\",\n      \"start_time\": \"10:00\",\n      \"end_time\": \"10:15\"\n    },\n    {\n      \"action\": \"meet\",\n      \"location\": \"Marina District\",\n      \"person\": \"Kenneth\",\n      \"start_time\": \"15:30\",\n      \"end_time\": \"16:15\"\n    }\n  ]\n}\n```",
            "raw_model_reasoning": "Alright, so I'm trying to help this user who's an AI meeting planner. They want to maximize the number of meetings they can attend in San Francisco, considering travel times and constraints. The user has provided a series of interactions where they've been given different travel distances and constraints, and each time, I've provided a JSON itinerary.\n\nIn the last interaction, the user provided a scenario where they arrived at Pacific Heights at 9:00 AM, and needed to meet two people: Jason at Presidio and Kenneth at Marina District. The travel distances were given, and I provided a meeting plan that started with meeting Kenneth first, then Jason.\n\nBut now, the user is giving me a new query with similar constraints but different travel distances. They want to meet Jason at Presidio from 10:00 AM to 4:15 PM and Kenneth at Marina District from 3:30 PM to 4:45 PM. The travel times are a bit different from the previous case.\n\nFirst, I need to understand the constraints. The user arrives at Pacific Heights at 9:00 AM. So, they can start their day there. They need to meet Jason at Presidio, who's available from 10:00 AM to 4:15 PM. That's a window of 4 hours and 15 minutes. Then, they need to meet Kenneth at Marina District, who's available from 3:30 PM to 4:45 PM. That's a window of 1 hour and 15 minutes.\n\nThe user wants to meet both, so the key is to find overlapping times where they can meet both without too much back-and-forth travel. Since Presidio and Marina District are both locations, I need to check the travel times from Pacific Heights to both places.\n\nLooking at the travel distances, Presidio is 11 minutes from Pacific Heights, and Marina District is 6 minutes away. So, the user can easily get to both locations.\n\nNow, the user's goal is to maximize the number of meetings, so they need to schedule these two meetings in a way that doesn't leave too much downtime, considering the travel times.\n\nIn the previous response, I scheduled the meeting with Kenneth first at Marina District at 3:30 PM, then with Jason at Presidio at 4:00 PM. That worked because there was enough time to travel from Marina District to Presidio, which is 10 minutes. That left a little over an hour between the two meetings.\n\nBut in this case, Kenneth's availability is from 3:30 PM to 4:45 PM, and Jason's is until 4:15 PM. So, if the user meets Kenneth at 3:30 PM, they have until 4:45 PM. But Jason's meeting ends at 4:15 PM, so they can't meet Jason after that. Therefore, the user needs to meet Jason first and then Kenneth.\n\nAlternatively, they could meet Kenneth first and then Jason, but given that Jason's meeting ends earlier, that might be more efficient.\n\nWait, no, because if the user meets Jason at 10:00 AM, they have until 4:15 PM. Kenneth is available from 3:30 PM to 4:45 PM, so they can meet Kenneth after meeting Jason. The travel time from Presidio to Marina District is 10 minutes, so that's manageable.\n\nSo, the optimal schedule would be:\n\n1. Meet Jason at Presidio at 10:00 AM. This gives the user the rest of the day to meet others or proceed as needed.\n\n2. After meeting Jason, travel to Marina District, which takes 10 minutes, and meet Kenneth at 3:30 PM.\n\nThis way, the user meets both people without any issues, and the travel times are minimal.\n\nI need to make sure that the meeting times are within the constraints provided. Jason is available until 4:15 PM, and Kenneth is available until 4:45 PM. So, meeting Kenneth at 3:30 PM works because that's within his availability, and the meeting ends before his time is up.\n\nAlso, the user can start their day at Pacific Heights at 9:00 AM, so meeting Jason at 10:00 AM is feasible.\n\nIn the JSON response, I need to list the meetings in the correct order, starting with Jason at Presidio and then Kenneth at Marina District.\n\nI should also ensure that the start and end times are in 24-hour format without leading zeros, as specified.\n\nSo, the final itinerary would be:\n\n- Meet Jason at Presidio from 10:00 AM to 10:00 AM (assuming the meeting is just the start time, but realistically, it should be a duration). Wait, in the previous response, the end time was after the start time. So, I need to adjust that.\n\nActually, the user's previous response had meetings with start and end times, so I should follow that format. So, the meeting with Jason would be from 10:00 AM to 10:00 AM plus the duration. But since the user wants to meet for a minimum time, I'll assume a 15-minute meeting.\n\nSimilarly, for Kenneth, the meeting would be from 3:30 PM to 4:15 PM, which is 45 minutes.\n\nSo, the JSON should reflect these times accurately.\n\nIn summary, the optimal schedule is to meet Jason first at Presidio, then Kenneth at Marina District, ensuring minimal travel time and adherence to constraints.\n</think>\n\n```json"
        }
    ]
}