{
    "0shot": [
        {
            "final_program_time": {
                "itinerary": [
                    {
                        "action": "meet",
                        "location": "Marina District",
                        "person": "Carol",
                        "start_time": "11:30",
                        "end_time": "12:30"
                    },
                    {
                        "action": "meet",
                        "location": "Pacific Heights",
                        "person": "Jessica",
                        "start_time": "15:30",
                        "end_time": "16:15"
                    }
                ]
            },
            "expected_time": {
                "itinerary": [
                    {
                        "action": "meet",
                        "location": "Marina District",
                        "person": "Carol",
                        "start_time": "11:30",
                        "end_time": "12:30"
                    },
                    {
                        "action": "meet",
                        "location": "Pacific Heights",
                        "person": "Jessica",
                        "start_time": "15:30",
                        "end_time": "16:15"
                    }
                ]
            },
            "count": "meeting_planning_example_115",
            "is_correct": true,
            "reasoning_token_count": 1188,
            "raw_model_response": "Okay, so I'm trying to help this user who's an AI meeting planner. They want to schedule meetings in San Francisco to meet as many friends as possible. The user has provided travel distances between various locations and constraints for each meeting. The goal is to create an optimal itinerary considering travel times and meeting durations.\n\nFirst, I need to understand the constraints. The user arrives at a specific location, like Richmond District at 9:00 AM, and each friend has a specific time window they're available. The meetings need to be scheduled in a way that the user can travel between locations efficiently without overlapping or conflicting with their availability.\n\nLooking at the last example, the user had to meet four people in different locations with specific time windows. They managed to fit all the meetings by coordinating the travel times and ensuring each meeting didn't exceed the minimum required duration.\n\nIn this current problem, the user is at Richmond District at 9:00 AM. They need to meet Jessica at Pacific Heights from 3:30 PM to 4:45 PM, and Carol at Marina District from 11:30 AM to 3:00 PM. The user wants to meet Jessica for 45 minutes and Carol for 60 minutes.\n\nI need to figure out the best times to meet these two without making the user travel too much. Since the user is at Richmond District, I should calculate the travel times to each location.\n\nFrom Richmond District to Pacific Heights, it's 10 minutes. To Marina District, it's 9 minutes. From there, the user can go to Pacific Heights, which is 6 minutes from Marina District.\n\nI should consider the user's arrival time and see when they can reach each location within their friend's available time windows.\n\nFor Carol, available from 11:30 AM to 3:00 PM, the user can meet her at Marina District at 11:30 AM after a short 9-minute trip. Then, they can go to Pacific Heights, which takes 6 minutes, arriving by 12:00 PM. But Jessica is only available from 3:30 PM to 4:45 PM. So, the user needs to travel from Pacific Heights back to Marina District, which is 6 minutes, and then to Pacific Heights again, which is 6 minutes, but that might be too much. Alternatively, the user could stay at Marina District after meeting Carol and then go to Pacific Heights later.\n\nWait, maybe it's better to meet Carol first at Marina District at 11:30 AM. Then, the user can go to Pacific Heights at 12:00 PM, which is within Jessica's availability from 3:30 PM. But that would leave a long gap. Alternatively, the user could meet Jessica first at Pacific Heights at 3:30 PM, then go to Marina District to meet Carol at 3:00 PM, but that would mean the user has to be in two places at once, which isn't possible.\n\nHmm, perhaps the user should meet Carol first at Marina District at 11:30 AM, then travel to Pacific Heights at 12:00 PM, and wait there until 3:30 PM to meet Jessica. But that would mean waiting for 3.5 hours, which is not ideal but doable. Alternatively, the user could meet Jessica at 3:30 PM and then go back to Marina District to meet Carol at 3:00 PM, but again, that's conflicting.\n\nWait, maybe there's a better way. If the user meets Carol at Marina District at 11:30 AM, then travels to Pacific Heights at 12:00 PM, and then stays there until 3:30 PM to meet Jessica. That would work, but the user would be waiting from 12:00 PM to 3:30 PM at Pacific Heights. Alternatively, the user could meet Jessica at 3:30 PM and then go back to Marina District to meet Carol at 3:00 PM, but that would require the user to be in two places at once, which isn't possible.\n\nSo, the best option seems to be meeting Carol first at Marina District at 11:30 AM, then traveling to Pacific Heights at 12:00 PM, and waiting there until 3:30 PM to meet Jessica. The travel time from Marina District to Pacific Heights is 6 minutes, and the waiting time is 3.5 hours. Alternatively, the user could meet Jessica at 3:30 PM and then go back to Marina District to meet Carol at 3:00 PM, but that would mean the user has to be in two places at once, which isn't feasible.\n\nTherefore, the optimal schedule would be:\n\n1. Meet Carol at Marina District at 11:30 AM.\n2. Travel to Pacific Heights at 12:00 PM.\n3. Wait at Pacific Heights until 3:30 PM to meet Jessica.\n4. Then, if possible, travel back to Marina District to meet Carol again, but that might be too much.\n\nAlternatively, the user could meet Jessica at 3:30 PM and then go back to Marina District to meet Carol at 3:00 PM, but that's not possible as the user can't be in two places at once.\n\nSo, the best plan is to meet Carol first at Marina District at 11:30 AM, then travel to Pacific Heights at 12:00 PM, and wait there until 3:30 PM to meet Jessica. The user would have to wait for 3.5 hours at Pacific Heights, which isn't ideal but is necessary to meet Jessica within her available time window.\n\nAlternatively, if the user can rearrange their schedule to meet Jessica earlier, but based on the constraints, that's not possible. Therefore, this seems like the best option.\n</think>\n\n```json\n{\n  \"itinerary\": [\n    {\n      \"action\": \"meet\",\n      \"location\": \"Marina District\",\n      \"person\": \"Carol\",\n      \"start_time\": \"11:30\",\n      \"end_time\": \"12:30\"\n    },\n    {\n      \"action\": \"meet\",\n      \"location\": \"Pacific Heights\",\n      \"person\": \"Jessica\",\n      \"start_time\": \"15:30\",\n      \"end_time\": \"16:15\"\n    }\n  ]\n}\n```",
            "raw_model_reasoning": "Okay, so I'm trying to help this user who's an AI meeting planner. They want to schedule meetings in San Francisco to meet as many friends as possible. The user has provided travel distances between various locations and constraints for each meeting. The goal is to create an optimal itinerary considering travel times and meeting durations.\n\nFirst, I need to understand the constraints. The user arrives at a specific location, like Richmond District at 9:00 AM, and each friend has a specific time window they're available. The meetings need to be scheduled in a way that the user can travel between locations efficiently without overlapping or conflicting with their availability.\n\nLooking at the last example, the user had to meet four people in different locations with specific time windows. They managed to fit all the meetings by coordinating the travel times and ensuring each meeting didn't exceed the minimum required duration.\n\nIn this current problem, the user is at Richmond District at 9:00 AM. They need to meet Jessica at Pacific Heights from 3:30 PM to 4:45 PM, and Carol at Marina District from 11:30 AM to 3:00 PM. The user wants to meet Jessica for 45 minutes and Carol for 60 minutes.\n\nI need to figure out the best times to meet these two without making the user travel too much. Since the user is at Richmond District, I should calculate the travel times to each location.\n\nFrom Richmond District to Pacific Heights, it's 10 minutes. To Marina District, it's 9 minutes. From there, the user can go to Pacific Heights, which is 6 minutes from Marina District.\n\nI should consider the user's arrival time and see when they can reach each location within their friend's available time windows.\n\nFor Carol, available from 11:30 AM to 3:00 PM, the user can meet her at Marina District at 11:30 AM after a short 9-minute trip. Then, they can go to Pacific Heights, which takes 6 minutes, arriving by 12:00 PM. But Jessica is only available from 3:30 PM to 4:45 PM. So, the user needs to travel from Pacific Heights back to Marina District, which is 6 minutes, and then to Pacific Heights again, which is 6 minutes, but that might be too much. Alternatively, the user could stay at Marina District after meeting Carol and then go to Pacific Heights later.\n\nWait, maybe it's better to meet Carol first at Marina District at 11:30 AM. Then, the user can go to Pacific Heights at 12:00 PM, which is within Jessica's availability from 3:30 PM. But that would leave a long gap. Alternatively, the user could meet Jessica first at Pacific Heights at 3:30 PM, then go to Marina District to meet Carol at 3:00 PM, but that would mean the user has to be in two places at once, which isn't possible.\n\nHmm, perhaps the user should meet Carol first at Marina District at 11:30 AM, then travel to Pacific Heights at 12:00 PM, and wait there until 3:30 PM to meet Jessica. But that would mean waiting for 3.5 hours, which is not ideal but doable. Alternatively, the user could meet Jessica at 3:30 PM and then go back to Marina District to meet Carol at 3:00 PM, but again, that's conflicting.\n\nWait, maybe there's a better way. If the user meets Carol at Marina District at 11:30 AM, then travels to Pacific Heights at 12:00 PM, and then stays there until 3:30 PM to meet Jessica. That would work, but the user would be waiting from 12:00 PM to 3:30 PM at Pacific Heights. Alternatively, the user could meet Jessica at 3:30 PM and then go back to Marina District to meet Carol at 3:00 PM, but that would require the user to be in two places at once, which isn't possible.\n\nSo, the best option seems to be meeting Carol first at Marina District at 11:30 AM, then traveling to Pacific Heights at 12:00 PM, and waiting there until 3:30 PM to meet Jessica. The travel time from Marina District to Pacific Heights is 6 minutes, and the waiting time is 3.5 hours. Alternatively, the user could meet Jessica at 3:30 PM and then go back to Marina District to meet Carol at 3:00 PM, but that would mean the user has to be in two places at once, which isn't feasible.\n\nTherefore, the optimal schedule would be:\n\n1. Meet Carol at Marina District at 11:30 AM.\n2. Travel to Pacific Heights at 12:00 PM.\n3. Wait at Pacific Heights until 3:30 PM to meet Jessica.\n4. Then, if possible, travel back to Marina District to meet Carol again, but that might be too much.\n\nAlternatively, the user could meet Jessica at 3:30 PM and then go back to Marina District to meet Carol at 3:00 PM, but that's not possible as the user can't be in two places at once.\n\nSo, the best plan is to meet Carol first at Marina District at 11:30 AM, then travel to Pacific Heights at 12:00 PM, and wait there until 3:30 PM to meet Jessica. The user would have to wait for 3.5 hours at Pacific Heights, which isn't ideal but is necessary to meet Jessica within her available time window.\n\nAlternatively, if the user can rearrange their schedule to meet Jessica earlier, but based on the constraints, that's not possible. Therefore, this seems like the best option.\n</think>\n\n```json"
        }
    ]
}