{
    "0shot": [
        {
            "final_program_time": {
                "itinerary": [
                    {
                        "action": "meet",
                        "location": "Alamo Square",
                        "person": "Timothy",
                        "start_time": "12:00",
                        "end_time": "14:45"
                    },
                    {
                        "action": "meet",
                        "location": "Presidio",
                        "person": "Mark",
                        "start_time": "16:45",
                        "end_time": "17:45"
                    },
                    {
                        "action": "meet",
                        "location": "Russian Hill",
                        "person": "Joseph",
                        "start_time": "18:45",
                        "end_time": "19:45"
                    }
                ]
            },
            "expected_time": {
                "itinerary": [
                    {
                        "action": "meet",
                        "location": "Alamo Square",
                        "person": "Timothy",
                        "start_time": "12:00",
                        "end_time": "13:45"
                    },
                    {
                        "action": "meet",
                        "location": "Presidio",
                        "person": "Mark",
                        "start_time": "18:45",
                        "end_time": "19:45"
                    },
                    {
                        "action": "meet",
                        "location": "Russian Hill",
                        "person": "Joseph",
                        "start_time": "19:59",
                        "end_time": "20:59"
                    }
                ]
            },
            "count": "meeting_planning_example_268",
            "is_correct": false,
            "reasoning_token_count": 646,
            "raw_model_response": "Alright, let's tackle this problem step by step. First, I need to understand the constraints and the travel distances provided. The goal is to schedule meetings efficiently, considering the travel times and the availability of each person.\n\nI start by noting that I arrive at Golden Gate Park at 9:00AM. The first thing I need to do is figure out where to meet first based on the constraints. From the constraints, I see that Timothy will be at Alamo Square from 12:00PM to 4:15PM, which is a block of time that's a few hours long. Since I need to meet Timothy for at least 105 minutes, I should aim to meet him somewhere that fits within his schedule.\n\nNext, Mark will be at Presidio from 6:45PM to 9:00PM. That's a later time in the day, so I'll need to plan the second meeting accordingly. Finally, Joseph will be at Russian Hill from 4:45PM to 9:30PM, which gives me a window to meet him either in the late afternoon or early evening.\n\nConsidering the travel distances, I need to ensure that the locations I choose for each meeting are reachable within a reasonable time frame, especially given my starting point at Golden Gate Park. I should also consider the travel times to ensure that I can move from one meeting to another without excessive delays.\n\nStarting with Timothy at Alamo Square, I can plan to meet him there since it's a central location and he's available from 12:00PM onwards. Alamo Square is a convenient spot as it's within a short travel distance from Golden Gate Park.\n\nAfter meeting Timothy, I need to head to Presidio to meet Mark. Presidio is a bit further away, so I should factor in the travel time to ensure I arrive on time. Mark is available from 6:45PM to 9:00PM, which gives me a bit of flexibility, but I need to make sure I leave Alamo Square sufficiently early to reach Presidio by 6:45PM.\n\nFor the third meeting with Joseph at Russian Hill, I need to check if I have enough time to travel from Presidio to Russian Hill after meeting Mark. Joseph is available until 9:30PM, so if I meet Mark earlier, I can manage the travel time to Russian Hill.\n\nI also need to consider the travel distances between these locations to optimize the schedule. For example, traveling from Golden Gate Park to Alamo Square is 10 minutes, which is very convenient. From Alamo Square to Presidio is 18 minutes, which is manageable. From Presidio to Russian Hill is 14 minutes, which is also feasible.\n\nBy planning the meetings in this order, I can minimize the travel time and ensure that I meet each person within their available time slots without any conflicts or delays.\n\nFinally, I'll structure the itinerary based on these considerations, ensuring that each meeting is timed appropriately and that the travel times between locations are accounted for. This way, I can meet as many friends as possible while adhering to the constraints and optimizing the schedule.\n</think>\n\n```json\n{\n  \"itinerary\": [\n    {\n      \"action\": \"meet\",\n      \"location\": \"Alamo Square\",\n      \"person\": \"Timothy\",\n      \"start_time\": \"12:00\",\n      \"end_time\": \"14:45\"\n    },\n    {\n      \"action\": \"meet\",\n      \"location\": \"Presidio\",\n      \"person\": \"Mark\",\n      \"start_time\": \"16:45\",\n      \"end_time\": \"17:45\"\n    },\n    {\n      \"action\": \"meet\",\n      \"location\": \"Russian Hill\",\n      \"person\": \"Joseph\",\n      \"start_time\": \"18:45\",\n      \"end_time\": \"19:45\"\n    }\n  ]\n}\n```",
            "raw_model_reasoning": "Alright, let's tackle this problem step by step. First, I need to understand the constraints and the travel distances provided. The goal is to schedule meetings efficiently, considering the travel times and the availability of each person.\n\nI start by noting that I arrive at Golden Gate Park at 9:00AM. The first thing I need to do is figure out where to meet first based on the constraints. From the constraints, I see that Timothy will be at Alamo Square from 12:00PM to 4:15PM, which is a block of time that's a few hours long. Since I need to meet Timothy for at least 105 minutes, I should aim to meet him somewhere that fits within his schedule.\n\nNext, Mark will be at Presidio from 6:45PM to 9:00PM. That's a later time in the day, so I'll need to plan the second meeting accordingly. Finally, Joseph will be at Russian Hill from 4:45PM to 9:30PM, which gives me a window to meet him either in the late afternoon or early evening.\n\nConsidering the travel distances, I need to ensure that the locations I choose for each meeting are reachable within a reasonable time frame, especially given my starting point at Golden Gate Park. I should also consider the travel times to ensure that I can move from one meeting to another without excessive delays.\n\nStarting with Timothy at Alamo Square, I can plan to meet him there since it's a central location and he's available from 12:00PM onwards. Alamo Square is a convenient spot as it's within a short travel distance from Golden Gate Park.\n\nAfter meeting Timothy, I need to head to Presidio to meet Mark. Presidio is a bit further away, so I should factor in the travel time to ensure I arrive on time. Mark is available from 6:45PM to 9:00PM, which gives me a bit of flexibility, but I need to make sure I leave Alamo Square sufficiently early to reach Presidio by 6:45PM.\n\nFor the third meeting with Joseph at Russian Hill, I need to check if I have enough time to travel from Presidio to Russian Hill after meeting Mark. Joseph is available until 9:30PM, so if I meet Mark earlier, I can manage the travel time to Russian Hill.\n\nI also need to consider the travel distances between these locations to optimize the schedule. For example, traveling from Golden Gate Park to Alamo Square is 10 minutes, which is very convenient. From Alamo Square to Presidio is 18 minutes, which is manageable. From Presidio to Russian Hill is 14 minutes, which is also feasible.\n\nBy planning the meetings in this order, I can minimize the travel time and ensure that I meet each person within their available time slots without any conflicts or delays.\n\nFinally, I'll structure the itinerary based on these considerations, ensuring that each meeting is timed appropriately and that the travel times between locations are accounted for. This way, I can meet as many friends as possible while adhering to the constraints and optimizing the schedule.\n</think>\n\n```json"
        }
    ]
}