{
    "0shot": [
        {
            "final_program_time": {
                "itinerary": [
                    {
                        "action": "meet",
                        "location": "Richmond District",
                        "person": "Barbara",
                        "start_time": "13:15",
                        "end_time": "14:00"
                    }
                ]
            },
            "expected_time": {
                "itinerary": [
                    {
                        "action": "meet",
                        "location": "Richmond District",
                        "person": "Barbara",
                        "start_time": "13:15",
                        "end_time": "14:00"
                    }
                ]
            },
            "count": "meeting_planning_example_52",
            "is_correct": true,
            "reasoning_token_count": 604,
            "raw_model_response": "Okay, so I'm trying to help this user schedule meetings in San Francisco. They've given me a series of travel distances between different locations and a set of constraints. The user wants to meet as many friends as possible, so I need to optimize the schedule to maximize the number of meetings while considering the travel times and the friends' availability.\n\nFirst, I look at the constraints. The user arrives at Russian Hill at 9:00 AM. Barbara will be at the Richmond District from 1:15 PM to 6:15 PM, and they need at least 45 minutes to meet her. That's the only constraint given, so my main focus is on meeting Barbara without conflicting with other potential meetings.\n\nNext, I check the travel distances. There are only two relevant distances provided: from Russian Hill to Richmond District (14 minutes) and from Richmond District to Russian Hill (13 minutes). This means the travel time between these two locations is very short, just about 10-15 minutes each way.\n\nNow, I need to figure out the best time to meet Barbara. Since she's available from 1:15 PM to 6:15 PM, and the user arrives at 9:00 AM, there's a significant window before her availability. However, the user can't just sit around waiting; they need to be productive.\n\nI consider the possibility of the user moving around to meet others before meeting Barbara. But since the only constraint is meeting Barbara for at least 45 minutes, I need to ensure that the meeting with Barbara doesn't interfere with any other meetings the user might have.\n\nLooking at the travel times, if the user leaves Russian Hill at, say, 1:00 PM, they can reach Richmond District in 14 minutes. They could potentially meet Barbara at 1:15 PM, which fits within her availability and the required 45 minutes. However, if the user wants to meet others before Barbara, they might need to leave earlier, but given the travel time, it's manageable.\n\nAlternatively, the user could meet Barbara later in her availability, but that might not be optimal if they want to meet others. However, since the only constraint is Barbara, the user might prefer to meet her as early as possible to have the rest of the day free.\n\nI also think about whether the user can do other meetings after meeting Barbara. Since Barbara's availability ends at 6:15 PM, and the travel time back is quick, the user could potentially have another meeting after that. But since the user's main goal is to meet as many friends as possible, meeting Barbara as early as possible might allow the user to maximize the number of meetings throughout the day.\n\nIn conclusion, the optimal meeting plan is to meet Barbara at 1:15 PM in the Richmond District. This allows the user to meet her within her availability and the required time, while also being able to travel back to Russian Hill quickly if needed for other meetings.\n</think>\n\nSOLUTION:\n{\n  \"itinerary\": [\n    {\"action\": \"meet\", \"location\": \"Richmond District\", \"person\": \"Barbara\", \"start_time\": \"13:15\", \"end_time\": \"14:00\"}\n  ]\n}",
            "raw_model_reasoning": "Okay, so I'm trying to help this user schedule meetings in San Francisco. They've given me a series of travel distances between different locations and a set of constraints. The user wants to meet as many friends as possible, so I need to optimize the schedule to maximize the number of meetings while considering the travel times and the friends' availability.\n\nFirst, I look at the constraints. The user arrives at Russian Hill at 9:00 AM. Barbara will be at the Richmond District from 1:15 PM to 6:15 PM, and they need at least 45 minutes to meet her. That's the only constraint given, so my main focus is on meeting Barbara without conflicting with other potential meetings.\n\nNext, I check the travel distances. There are only two relevant distances provided: from Russian Hill to Richmond District (14 minutes) and from Richmond District to Russian Hill (13 minutes). This means the travel time between these two locations is very short, just about 10-15 minutes each way.\n\nNow, I need to figure out the best time to meet Barbara. Since she's available from 1:15 PM to 6:15 PM, and the user arrives at 9:00 AM, there's a significant window before her availability. However, the user can't just sit around waiting; they need to be productive.\n\nI consider the possibility of the user moving around to meet others before meeting Barbara. But since the only constraint is meeting Barbara for at least 45 minutes, I need to ensure that the meeting with Barbara doesn't interfere with any other meetings the user might have.\n\nLooking at the travel times, if the user leaves Russian Hill at, say, 1:00 PM, they can reach Richmond District in 14 minutes. They could potentially meet Barbara at 1:15 PM, which fits within her availability and the required 45 minutes. However, if the user wants to meet others before Barbara, they might need to leave earlier, but given the travel time, it's manageable.\n\nAlternatively, the user could meet Barbara later in her availability, but that might not be optimal if they want to meet others. However, since the only constraint is Barbara, the user might prefer to meet her as early as possible to have the rest of the day free.\n\nI also think about whether the user can do other meetings after meeting Barbara. Since Barbara's availability ends at 6:15 PM, and the travel time back is quick, the user could potentially have another meeting after that. But since the user's main goal is to meet as many friends as possible, meeting Barbara as early as possible might allow the user to maximize the number of meetings throughout the day.\n\nIn conclusion, the optimal meeting plan is to meet Barbara at 1:15 PM in the Richmond District. This allows the user to meet her within her availability and the required time, while also being able to travel back to Russian Hill quickly if needed for other meetings.\n</think>\n\nSOLUTION:"
        }
    ]
}