{
    "0shot": [
        {
            "final_program_time": {
                "itinerary": [
                    {
                        "action": "meet",
                        "location": "Richmond District",
                        "person": "Ronald",
                        "start_time": "9:00",
                        "end_time": "9:30"
                    },
                    {
                        "action": "meet",
                        "location": "Presidio",
                        "person": "Joshua",
                        "start_time": "10:00",
                        "end_time": "10:45"
                    },
                    {
                        "action": "meet",
                        "location": "Golden Gate Park",
                        "person": "Lisa",
                        "start_time": "11:15",
                        "end_time": "12:00"
                    },
                    {
                        "action": "meet",
                        "location": "Haight-Ashbury",
                        "person": "Kimberly",
                        "start_time": "12:45",
                        "end_time": "13:30"
                    },
                    {
                        "action": "meet",
                        "location": "North Beach",
                        "person": "Timothy",
                        "start_time": "14:15",
                        "end_time": "14:45"
                    },
                    {
                        "action": "meet",
                        "location": "Marina District",
                        "person": "Steven",
                        "start_time": "15:15",
                        "end_time": "16:00"
                    },
                    {
                        "action": "meet",
                        "location": "Alamo Square",
                        "person": "Stephanie",
                        "start_time": "16:45",
                        "end_time": "17:15"
                    },
                    {
                        "action": "meet",
                        "location": "Financial District",
                        "person": "Helen",
                        "start_time": "17:45",
                        "end_time": "18:15"
                    },
                    {
                        "action": "meet",
                        "location": "Sunset District",
                        "person": "Laura",
                        "start_time": "18:45",
                        "end_time": "19:30"
                    },
                    {
                        "action": "meet",
                        "location": "The Castro",
                        "person": "Elizabeth",
                        "start_time": "20:15",
                        "end_time": "20:45"
                    }
                ]
            },
            "expected_time": {
                "itinerary": [
                    {
                        "action": "meet",
                        "location": "Presidio",
                        "person": "Joshua",
                        "start_time": "9:20",
                        "end_time": "11:05"
                    },
                    {
                        "action": "meet",
                        "location": "Embarcadero",
                        "person": "David",
                        "start_time": "11:25",
                        "end_time": "11:55"
                    },
                    {
                        "action": "meet",
                        "location": "Alamo Square",
                        "person": "Stephanie",
                        "start_time": "15:30",
                        "end_time": "16:00"
                    },
                    {
                        "action": "meet",
                        "location": "Haight-Ashbury",
                        "person": "Kimberly",
                        "start_time": "16:45",
                        "end_time": "18:00"
                    },
                    {
                        "action": "meet",
                        "location": "Golden Gate Park",
                        "person": "Lisa",
                        "start_time": "18:07",
                        "end_time": "18:52"
                    },
                    {
                        "action": "meet",
                        "location": "North Beach",
                        "person": "Timothy",
                        "start_time": "19:45",
                        "end_time": "21:15"
                    }
                ]
            },
            "count": "meeting_planning_example_962",
            "is_correct": false,
            "reasoning_token_count": 719,
            "raw_model_response": "Alright, let's tackle this problem. I need to help the user schedule their meetings in San Francisco efficiently. They've provided a lot of travel distances and specific constraints, so I'll need to consider both to optimize their schedule.\n\nFirst, I'll look at the constraints. The user arrives at The Castro at 9:00AM. They have several friends spread out across different locations with specific time slots. My goal is to meet as many friends as possible without exceeding the travel time and meeting duration constraints.\n\nI'll start by identifying the earliest possible meetings. The Castro is the starting point, so I'll check who can meet near that location first. Elizabeth is at Marina District from 7:00PM to 8:45PM. Since she's far away, maybe I can schedule that later.\n\nNext, Joshua is at Presidio from 8:30AM to 1:15PM. That's a long block, so it's doable if I can make it in the morning. I'll tentatively schedule that for 10:00AM.\n\nTimothy is at North Beach from 7:45PM to 10:00PM. That's late in the day, but possible. I'll note that for the evening.\n\nDavid is at Embarcadero from 10:45AM to 12:30PM. That's a short window, but I can fit that in after Joshua.\n\nKimberly is at Haight-Ashbury from 4:45PM to 9:30PM. That's a longer window, so I'll schedule that later in the afternoon.\n\nLisa is at Golden Gate Park from 5:30PM to 9:45PM. Another long window, so I'll plan for the evening.\n\nRonald is at Richmond District from 8:00AM to 9:30AM. That's early, so I'll schedule that right after arriving.\n\nStephanie is at Alamo Square from 3:30PM to 4:30PM. That's a short window, so I'll need to be precise with timing.\n\nHelen is at Financial District from 5:30PM to 6:30PM. That's a bit later in the day, so I'll schedule that after other meetings.\n\nLaura is at Sunset District from 5:45PM to 9:15PM. That's a good window, so I'll plan that for the late afternoon.\n\nNow, considering travel times, I need to make sure that moving from one location to another doesn't take too much time, and that the meetings don't overlap. I'll map out the possible routes and see the most efficient way to move between these places.\n\nStarting at The Castro, I can go to Presidio, then to Golden Gate Park, then to Haight-Ashbury, then to North Beach, and finally to Sunset District. This seems to cover most of the required locations without too much backtracking.\n\nI'll also check if any meetings can be combined or adjusted to fit within the time constraints. For example, if I can meet someone en route to another location, that would save time.\n\nAfter considering all possibilities, I'll draft a schedule that maximizes the number of meetings while respecting the travel and time constraints. I'll make sure each meeting is scheduled at the earliest possible time to leave room for other meetings.\n\nFinally, I'll present the itinerary in the required JSON format, ensuring all times are in 24-hour format and locations are correctly named.\n</think>\n\n```json\n{\n  \"itinerary\": [\n    {\n      \"action\": \"meet\",\n      \"location\": \"Richmond District\",\n      \"person\": \"Ronald\",\n      \"start_time\": \"09:00\",\n      \"end_time\": \"09:30\"\n    },\n    {\n      \"action\": \"meet\",\n      \"location\": \"Presidio\",\n      \"person\": \"Joshua\",\n      \"start_time\": \"10:00\",\n      \"end_time\": \"10:45\"\n    },\n    {\n      \"action\": \"meet\",\n      \"location\": \"Golden Gate Park\",\n      \"person\": \"Lisa\",\n      \"start_time\": \"11:15\",\n      \"end_time\": \"12:00\"\n    },\n    {\n      \"action\": \"meet\",\n      \"location\": \"Haight-Ashbury\",\n      \"person\": \"Kimberly\",\n      \"start_time\": \"12:45\",\n      \"end_time\": \"13:30\"\n    },\n    {\n      \"action\": \"meet\",\n      \"location\": \"North Beach\",\n      \"person\": \"Timothy\",\n      \"start_time\": \"14:15\",\n      \"end_time\": \"14:45\"\n    },\n    {\n      \"action\": \"meet\",\n      \"location\": \"Marina District\",\n      \"person\": \"Steven\",\n      \"start_time\": \"15:15\",\n      \"end_time\": \"16:00\"\n    },\n    {\n      \"action\": \"meet\",\n      \"location\": \"Alamo Square\",\n      \"person\": \"Stephanie\",\n      \"start_time\": \"16:45\",\n      \"end_time\": \"17:15\"\n    },\n    {\n      \"action\": \"meet\",\n      \"location\": \"Financial District\",\n      \"person\": \"Helen\",\n      \"start_time\": \"17:45\",\n      \"end_time\": \"18:15\"\n    },\n    {\n      \"action\": \"meet\",\n      \"location\": \"Sunset District\",\n      \"person\": \"Laura\",\n      \"start_time\": \"18:45\",\n      \"end_time\": \"19:30\"\n    },\n    {\n      \"action\": \"meet\",\n      \"location\": \"The Castro\",\n      \"person\": \"Elizabeth\",\n      \"start_time\": \"20:15\",\n      \"end_time\": \"20:45\"\n    }\n  ]\n}\n```",
            "raw_model_reasoning": "Alright, let's tackle this problem. I need to help the user schedule their meetings in San Francisco efficiently. They've provided a lot of travel distances and specific constraints, so I'll need to consider both to optimize their schedule.\n\nFirst, I'll look at the constraints. The user arrives at The Castro at 9:00AM. They have several friends spread out across different locations with specific time slots. My goal is to meet as many friends as possible without exceeding the travel time and meeting duration constraints.\n\nI'll start by identifying the earliest possible meetings. The Castro is the starting point, so I'll check who can meet near that location first. Elizabeth is at Marina District from 7:00PM to 8:45PM. Since she's far away, maybe I can schedule that later.\n\nNext, Joshua is at Presidio from 8:30AM to 1:15PM. That's a long block, so it's doable if I can make it in the morning. I'll tentatively schedule that for 10:00AM.\n\nTimothy is at North Beach from 7:45PM to 10:00PM. That's late in the day, but possible. I'll note that for the evening.\n\nDavid is at Embarcadero from 10:45AM to 12:30PM. That's a short window, but I can fit that in after Joshua.\n\nKimberly is at Haight-Ashbury from 4:45PM to 9:30PM. That's a longer window, so I'll schedule that later in the afternoon.\n\nLisa is at Golden Gate Park from 5:30PM to 9:45PM. Another long window, so I'll plan for the evening.\n\nRonald is at Richmond District from 8:00AM to 9:30AM. That's early, so I'll schedule that right after arriving.\n\nStephanie is at Alamo Square from 3:30PM to 4:30PM. That's a short window, so I'll need to be precise with timing.\n\nHelen is at Financial District from 5:30PM to 6:30PM. That's a bit later in the day, so I'll schedule that after other meetings.\n\nLaura is at Sunset District from 5:45PM to 9:15PM. That's a good window, so I'll plan that for the late afternoon.\n\nNow, considering travel times, I need to make sure that moving from one location to another doesn't take too much time, and that the meetings don't overlap. I'll map out the possible routes and see the most efficient way to move between these places.\n\nStarting at The Castro, I can go to Presidio, then to Golden Gate Park, then to Haight-Ashbury, then to North Beach, and finally to Sunset District. This seems to cover most of the required locations without too much backtracking.\n\nI'll also check if any meetings can be combined or adjusted to fit within the time constraints. For example, if I can meet someone en route to another location, that would save time.\n\nAfter considering all possibilities, I'll draft a schedule that maximizes the number of meetings while respecting the travel and time constraints. I'll make sure each meeting is scheduled at the earliest possible time to leave room for other meetings.\n\nFinally, I'll present the itinerary in the required JSON format, ensuring all times are in 24-hour format and locations are correctly named.\n</think>\n\n```json"
        }
    ]
}