{
    "0shot": [
        {
            "final_program_time": {
                "itinerary": [
                    {
                        "action": "meet",
                        "location": "Union Square",
                        "person": "Kimberly",
                        "start_time": "9:15",
                        "end_time": "9:45"
                    },
                    {
                        "action": "meet",
                        "location": "Presidio",
                        "person": "Margaret",
                        "start_time": "10:15",
                        "end_time": "10:45"
                    },
                    {
                        "action": "meet",
                        "location": "Golden Gate Park",
                        "person": "Robert",
                        "start_time": "14:15",
                        "end_time": "14:45"
                    },
                    {
                        "action": "meet",
                        "location": "North Beach",
                        "person": "Barbara",
                        "start_time": "15:45",
                        "end_time": "16:15"
                    },
                    {
                        "action": "meet",
                        "location": "Haight-Ashbury",
                        "person": "Kevin",
                        "start_time": "20:00",
                        "end_time": "20:30"
                    }
                ]
            },
            "expected_time": {
                "itinerary": [
                    {
                        "action": "meet",
                        "location": "Presidio",
                        "person": "Margaret",
                        "start_time": "10:15",
                        "end_time": "10:45"
                    },
                    {
                        "action": "meet",
                        "location": "North Beach",
                        "person": "Barbara",
                        "start_time": "13:45",
                        "end_time": "14:45"
                    },
                    {
                        "action": "meet",
                        "location": "Union Square",
                        "person": "Kimberly",
                        "start_time": "14:52",
                        "end_time": "15:22"
                    },
                    {
                        "action": "meet",
                        "location": "Haight-Ashbury",
                        "person": "Kevin",
                        "start_time": "20:00",
                        "end_time": "20:30"
                    }
                ]
            },
            "count": "meeting_planning_example_356",
            "is_correct": false,
            "reasoning_token_count": 1548,
            "raw_model_response": "Okay, I'm trying to help this user who is an AI meeting planner. They've been given a series of constraints and travel distances for various locations in San Francisco. The goal is to schedule meetings efficiently, maximizing the number of friends met while considering travel times and constraints.\n\nFirst, I need to understand the problem. The user has provided a list of travel distances between different areas like Bayview, North Beach, Presidio, Haight-Ashbury, Union Square, etc. Then, there are specific constraints with arrival times and meeting durations for each person.\n\nThe user wants a meeting plan that starts at Bayview at 9:00 AM. They need to meet several people, each with their own location, time constraints, and meeting durations.\n\nLooking at the constraints, the first thing I notice is that each person has a specific time window during which they are available. For example, Barbara is available from 1:45 PM to 8:15 PM, Margaret from 10:15 AM to 3:15 PM, and so on.\n\nI need to figure out the optimal order to meet these people, considering the travel times between locations. The goal is to maximize the number of meetings while ensuring that each meeting fits within the person's available time and that the travel time between meetings is manageable.\n\nStarting at Bayview at 9:00 AM, the first step is to identify who can be met earliest. Looking at the constraints, Kimberly is at Union Square from 7:45 AM to 4:45 PM. Since I'm starting at Bayview, I need to calculate the travel time from Bayview to Union Square, which is 15 minutes. That seems feasible. So, meeting Kimberly first at Union Square at 9:15 AM makes sense.\n\nNext, after meeting Kimberly, I need to decide whom to meet next. Margaret is at Presidio from 10:15 AM to 3:15 PM. The travel time from Union Square to Presidio is 24 minutes. If I leave Union Square at 9:30 AM, I can arrive at Presidio by 9:54 AM, but Margaret isn't available until 10:15 AM. So, maybe I can wait at Presidio until 10:15 AM and then meet her.\n\nBut wait, Margaret only needs a 30-minute meeting, and her availability starts at 10:15 AM. So, if I arrive a bit early, I can just wait for the meeting to start. That seems efficient.\n\nAfter meeting Margaret, the next person is Kevin, who is at Haight-Ashbury from 8:00 PM to 8:45 PM. That's in the evening, so I have the rest of the day to travel around. But I should consider who else I can meet before Kevin.\n\nLooking at the constraints, Barbara is at North Beach from 1:45 PM to 8:15 PM. The travel time from Presidio to North Beach is 18 minutes. If I leave Presidio after meeting Margaret, I can go to North Beach and meet Barbara.\n\nBarbara's availability is from 1:45 PM onwards, so I should plan the travel time accordingly. If I leave Presidio at 10:45 AM, I can arrive at North Beach by 11:03 AM, but Barbara isn't available until 1:45 PM. So, I need to wait until her availability starts.\n\nThat might be too long a wait, so maybe it's better to meet Barbara later in the day after other meetings. Alternatively, perhaps I can meet someone else who has an earlier availability.\n\nLooking at the remaining people, Kevin is at Haight-Ashbury in the evening, which might be a good time to meet after other meetings. So, perhaps I can meet Barbara after meeting Margaret and then proceed to Haight-Ashbury later in the day.\n\nWait, but Barbara is available from 1:45 PM, which is earlier than Kevin's 8:00 PM. So, maybe meeting Barbara first makes sense, then moving on to other meetings.\n\nAfter meeting Barbara, I can then move on to Presidio, but Margaret has already been met. Alternatively, perhaps I can meet someone else who has a more flexible schedule.\n\nWait, let me re-examine the constraints. Kimberly is at Union Square until 4:45 PM, so after meeting her, I can proceed to Presidio to meet Margaret, then to North Beach to meet Barbara, and then to Haight-Ashbury to meet Kevin.\n\nBut I need to make sure that the travel times between these meetings are reasonable and that I don't miss any time windows.\n\nAlternatively, perhaps I can meet Kevin earlier. But his availability is from 8:00 PM to 8:45 PM, which is in the evening, so maybe it's better to save Kevin for last.\n\nSo, the plan would be:\n\n1. Start at Bayview at 9:00 AM.\n2. Travel to Union Square (15 mins) to meet Kimberly from 9:15 AM to 9:45 AM.\n3. Travel to Presidio (24 mins) to meet Margaret from 10:15 AM to 10:45 AM.\n4. Travel to North Beach (18 mins) to meet Barbara from 1:45 PM to 2:15 PM.\n5. Travel to Haight-Ashbury (19 mins) to meet Kevin from 8:00 PM to 8:30 PM.\n\nWait, but there's a gap between 10:45 AM and 1:45 PM. I need to consider what to do during that time. Maybe I can meet someone else during that window.\n\nLooking back at the constraints, the only other person is Robert, who is at Golden Gate Park from 2:15 PM to 9:30 PM. The travel time from North Beach to Golden Gate Park is 23 minutes. If I leave North Beach at 1:45 PM, I can arrive at Golden Gate Park by 2:08 PM, just in time to meet Robert from 2:15 PM to 2:45 PM.\n\nThat seems feasible. So, adjusting the plan:\n\n1. Start at Bayview at 9:00 AM.\n2. Travel to Union Square (15 mins) to meet Kimberly from 9:15 AM to 9:45 AM.\n3. Travel to Presidio (24 mins) to meet Margaret from 10:15 AM to 10:45 AM.\n4. Travel to Golden Gate Park (23 mins) to meet Robert from 2:15 PM to 2:45 PM.\n5. Travel to North Beach (18 mins) to meet Barbara from 3:45 PM to 4:15 PM.\n6. Travel to Haight-Ashbury (19 mins) to meet Kevin from 8:00 PM to 8:30 PM.\n\nThis way, I'm utilizing the time more efficiently by fitting in Robert's meeting in the afternoon before meeting Barbara.\n\nI also need to ensure that the travel times between meetings are accounted for. For example, after meeting Robert at 2:45 PM, I can travel to North Beach and meet Barbara at 3:45 PM, which gives a reasonable buffer time.\n\nFinally, ending with Kevin in the evening seems appropriate, as his availability is late in the day.\n\nSo, the final itinerary would include these meetings in this order, ensuring that each meeting is within the person's availability and that the travel times are manageable.\n</think>\n\n```json\n{\n  \"itinerary\": [\n    {\n      \"action\": \"meet\",\n      \"location\": \"Union Square\",\n      \"person\": \"Kimberly\",\n      \"start_time\": \"09:15\",\n      \"end_time\": \"09:45\"\n    },\n    {\n      \"action\": \"meet\",\n      \"location\": \"Presidio\",\n      \"person\": \"Margaret\",\n      \"start_time\": \"10:15\",\n      \"end_time\": \"10:45\"\n    },\n    {\n      \"action\": \"meet\",\n      \"location\": \"Golden Gate Park\",\n      \"person\": \"Robert\",\n      \"start_time\": \"14:15\",\n      \"end_time\": \"14:45\"\n    },\n    {\n      \"action\": \"meet\",\n      \"location\": \"North Beach\",\n      \"person\": \"Barbara\",\n      \"start_time\": \"15:45\",\n      \"end_time\": \"16:15\"\n    },\n    {\n      \"action\": \"meet\",\n      \"location\": \"Haight-Ashbury\",\n      \"person\": \"Kevin\",\n      \"start_time\": \"20:00\",\n      \"end_time\": \"20:30\"\n    }\n  ]\n}\n```",
            "raw_model_reasoning": "Okay, I'm trying to help this user who is an AI meeting planner. They've been given a series of constraints and travel distances for various locations in San Francisco. The goal is to schedule meetings efficiently, maximizing the number of friends met while considering travel times and constraints.\n\nFirst, I need to understand the problem. The user has provided a list of travel distances between different areas like Bayview, North Beach, Presidio, Haight-Ashbury, Union Square, etc. Then, there are specific constraints with arrival times and meeting durations for each person.\n\nThe user wants a meeting plan that starts at Bayview at 9:00 AM. They need to meet several people, each with their own location, time constraints, and meeting durations.\n\nLooking at the constraints, the first thing I notice is that each person has a specific time window during which they are available. For example, Barbara is available from 1:45 PM to 8:15 PM, Margaret from 10:15 AM to 3:15 PM, and so on.\n\nI need to figure out the optimal order to meet these people, considering the travel times between locations. The goal is to maximize the number of meetings while ensuring that each meeting fits within the person's available time and that the travel time between meetings is manageable.\n\nStarting at Bayview at 9:00 AM, the first step is to identify who can be met earliest. Looking at the constraints, Kimberly is at Union Square from 7:45 AM to 4:45 PM. Since I'm starting at Bayview, I need to calculate the travel time from Bayview to Union Square, which is 15 minutes. That seems feasible. So, meeting Kimberly first at Union Square at 9:15 AM makes sense.\n\nNext, after meeting Kimberly, I need to decide whom to meet next. Margaret is at Presidio from 10:15 AM to 3:15 PM. The travel time from Union Square to Presidio is 24 minutes. If I leave Union Square at 9:30 AM, I can arrive at Presidio by 9:54 AM, but Margaret isn't available until 10:15 AM. So, maybe I can wait at Presidio until 10:15 AM and then meet her.\n\nBut wait, Margaret only needs a 30-minute meeting, and her availability starts at 10:15 AM. So, if I arrive a bit early, I can just wait for the meeting to start. That seems efficient.\n\nAfter meeting Margaret, the next person is Kevin, who is at Haight-Ashbury from 8:00 PM to 8:45 PM. That's in the evening, so I have the rest of the day to travel around. But I should consider who else I can meet before Kevin.\n\nLooking at the constraints, Barbara is at North Beach from 1:45 PM to 8:15 PM. The travel time from Presidio to North Beach is 18 minutes. If I leave Presidio after meeting Margaret, I can go to North Beach and meet Barbara.\n\nBarbara's availability is from 1:45 PM onwards, so I should plan the travel time accordingly. If I leave Presidio at 10:45 AM, I can arrive at North Beach by 11:03 AM, but Barbara isn't available until 1:45 PM. So, I need to wait until her availability starts.\n\nThat might be too long a wait, so maybe it's better to meet Barbara later in the day after other meetings. Alternatively, perhaps I can meet someone else who has an earlier availability.\n\nLooking at the remaining people, Kevin is at Haight-Ashbury in the evening, which might be a good time to meet after other meetings. So, perhaps I can meet Barbara after meeting Margaret and then proceed to Haight-Ashbury later in the day.\n\nWait, but Barbara is available from 1:45 PM, which is earlier than Kevin's 8:00 PM. So, maybe meeting Barbara first makes sense, then moving on to other meetings.\n\nAfter meeting Barbara, I can then move on to Presidio, but Margaret has already been met. Alternatively, perhaps I can meet someone else who has a more flexible schedule.\n\nWait, let me re-examine the constraints. Kimberly is at Union Square until 4:45 PM, so after meeting her, I can proceed to Presidio to meet Margaret, then to North Beach to meet Barbara, and then to Haight-Ashbury to meet Kevin.\n\nBut I need to make sure that the travel times between these meetings are reasonable and that I don't miss any time windows.\n\nAlternatively, perhaps I can meet Kevin earlier. But his availability is from 8:00 PM to 8:45 PM, which is in the evening, so maybe it's better to save Kevin for last.\n\nSo, the plan would be:\n\n1. Start at Bayview at 9:00 AM.\n2. Travel to Union Square (15 mins) to meet Kimberly from 9:15 AM to 9:45 AM.\n3. Travel to Presidio (24 mins) to meet Margaret from 10:15 AM to 10:45 AM.\n4. Travel to North Beach (18 mins) to meet Barbara from 1:45 PM to 2:15 PM.\n5. Travel to Haight-Ashbury (19 mins) to meet Kevin from 8:00 PM to 8:30 PM.\n\nWait, but there's a gap between 10:45 AM and 1:45 PM. I need to consider what to do during that time. Maybe I can meet someone else during that window.\n\nLooking back at the constraints, the only other person is Robert, who is at Golden Gate Park from 2:15 PM to 9:30 PM. The travel time from North Beach to Golden Gate Park is 23 minutes. If I leave North Beach at 1:45 PM, I can arrive at Golden Gate Park by 2:08 PM, just in time to meet Robert from 2:15 PM to 2:45 PM.\n\nThat seems feasible. So, adjusting the plan:\n\n1. Start at Bayview at 9:00 AM.\n2. Travel to Union Square (15 mins) to meet Kimberly from 9:15 AM to 9:45 AM.\n3. Travel to Presidio (24 mins) to meet Margaret from 10:15 AM to 10:45 AM.\n4. Travel to Golden Gate Park (23 mins) to meet Robert from 2:15 PM to 2:45 PM.\n5. Travel to North Beach (18 mins) to meet Barbara from 3:45 PM to 4:15 PM.\n6. Travel to Haight-Ashbury (19 mins) to meet Kevin from 8:00 PM to 8:30 PM.\n\nThis way, I'm utilizing the time more efficiently by fitting in Robert's meeting in the afternoon before meeting Barbara.\n\nI also need to ensure that the travel times between meetings are accounted for. For example, after meeting Robert at 2:45 PM, I can travel to North Beach and meet Barbara at 3:45 PM, which gives a reasonable buffer time.\n\nFinally, ending with Kevin in the evening seems appropriate, as his availability is late in the day.\n\nSo, the final itinerary would include these meetings in this order, ensuring that each meeting is within the person's availability and that the travel times are manageable.\n</think>\n\n```json"
        }
    ]
}