{
    "0shot": [
        {
            "final_program_time": {
                "itinerary": [
                    {
                        "action": "meet",
                        "location": "Nob Hill",
                        "person": "Nancy",
                        "start_time": "9:30",
                        "end_time": "10:00"
                    },
                    {
                        "action": "meet",
                        "location": "Haight-Ashbury",
                        "person": "Stephanie",
                        "start_time": "10:30",
                        "end_time": "11:00"
                    },
                    {
                        "action": "meet",
                        "location": "Marina District",
                        "person": "David",
                        "start_time": "11:30",
                        "end_time": "12:00"
                    },
                    {
                        "action": "meet",
                        "location": "Union Square",
                        "person": "Elizabeth",
                        "start_time": "12:00",
                        "end_time": "13:00"
                    },
                    {
                        "action": "meet",
                        "location": "Financial District",
                        "person": "Robert",
                        "start_time": "13:30",
                        "end_time": "14:15"
                    },
                    {
                        "action": "meet",
                        "location": "Presidio",
                        "person": "James",
                        "start_time": "15:30",
                        "end_time": "16:45"
                    },
                    {
                        "action": "meet",
                        "location": "Richmond District",
                        "person": "Melissa",
                        "start_time": "16:00",
                        "end_time": "16:30"
                    },
                    {
                        "action": "meet",
                        "location": "Embarcadero",
                        "person": "Brian",
                        "start_time": "16:30",
                        "end_time": "16:45"
                    },
                    {
                        "action": "meet",
                        "location": "Golden Gate Park",
                        "person": "Sarah",
                        "start_time": "17:00",
                        "end_time": "18:15"
                    },
                    {
                        "action": "meet",
                        "location": "North Beach",
                        "person": "Steven",
                        "start_time": "18:30",
                        "end_time": "19:00"
                    }
                ]
            },
            "expected_time": {
                "itinerary": [
                    {
                        "action": "meet",
                        "location": "Nob Hill",
                        "person": "Nancy",
                        "start_time": "9:16",
                        "end_time": "10:46"
                    },
                    {
                        "action": "meet",
                        "location": "Haight-Ashbury",
                        "person": "Stephanie",
                        "start_time": "10:59",
                        "end_time": "12:14"
                    },
                    {
                        "action": "meet",
                        "location": "Union Square",
                        "person": "Elizabeth",
                        "start_time": "12:33",
                        "end_time": "13:33"
                    },
                    {
                        "action": "meet",
                        "location": "Financial District",
                        "person": "Robert",
                        "start_time": "13:42",
                        "end_time": "14:27"
                    },
                    {
                        "action": "meet",
                        "location": "Richmond District",
                        "person": "Melissa",
                        "start_time": "14:48",
                        "end_time": "15:18"
                    },
                    {
                        "action": "meet",
                        "location": "Presidio",
                        "person": "James",
                        "start_time": "15:25",
                        "end_time": "17:25"
                    },
                    {
                        "action": "meet",
                        "location": "Golden Gate Park",
                        "person": "Sarah",
                        "start_time": "17:37",
                        "end_time": "18:52"
                    },
                    {
                        "action": "meet",
                        "location": "North Beach",
                        "person": "Steven",
                        "start_time": "19:15",
                        "end_time": "19:30"
                    }
                ]
            },
            "count": "meeting_planning_example_911",
            "is_correct": false,
            "reasoning_token_count": 1293,
            "raw_model_response": "Okay, so I need to help this user schedule their meetings in San Francisco. They want to meet as many friends as possible, so I need to maximize the number of meetings while considering travel times and constraints.\n\nFirst, I'll look at the constraints. They arrive at The Castro at 9:00AM. There are several people they want to meet, each with specific time windows and locations. I need to make sure each meeting fits within the person's availability and that the travel time is manageable.\n\nLet me list out all the people and their availability:\n\n1. Steven at North Beach from 5:30PM to 8:30PM.\n2. Sarah at Golden Gate Park from 5:00PM to 7:15PM.\n3. Brian at Embarcadero from 2:15PM to 4:00PM.\n4. Stephanie at Haight-Ashbury from 10:15AM to 12:15PM.\n5. Melissa at Richmond District from 2:00PM to 7:30PM.\n6. Nancy at Nob Hill from 8:15AM to 12:45PM.\n7. David at Marina District from 11:15AM to 1:15PM.\n8. James at Presidio from 3:00PM to 6:15PM.\n9. Elizabeth at Union Square from 11:30AM to 9:00PM.\n10. Robert at Financial District from 1:15PM to 3:15PM.\n\nI need to schedule these meetings in a way that the user can attend each without backtracking too much, as SF is a big city with varying distances between locations.\n\nStarting with the earliest availability, Nancy at Nob Hill from 8:15AM to 12:45PM. Since the user arrives at 9:00AM, the latest they can meet Nancy is 12:45PM. Let's choose 9:30AM for a 30-minute meeting.\n\nNext, Nancy's meeting is done. Now, looking for the next earliest. Stephanie at Haight-Ashbury from 10:15AM to 12:15PM. The user can meet her at 10:30AM, which is a 30-minute meeting.\n\nAfter that, the next earliest is Brian at Embarcadero from 2:15PM to 4:00PM. But before that, there are other meetings possible. Let's check David at Marina District from 11:15AM to 1:15PM. The user can meet David at 11:30AM, a 30-minute meeting.\n\nThen, Elizabeth at Union Square from 11:30AM to 9:00PM. The user can meet Elizabeth at 12:00PM, which is a 60-minute meeting.\n\nNow, moving to Robert at Financial District from 1:15PM to 3:15PM. The user can meet Robert at 1:30PM, a 45-minute meeting.\n\nAfter Robert, the next available time is after 3:15PM. Let's see who else can be met. James at Presidio from 3:00PM to 6:15PM. The user can meet James at 3:30PM, a 105-minute meeting.\n\nNext, Melissa at Richmond District from 2:00PM to 7:30PM. The user can meet Melissa at 4:00PM, a 30-minute meeting.\n\nThen, Brian at Embarcadero from 2:15PM to 4:00PM. The user can meet Brian at 4:00PM, a 15-minute meeting.\n\nAfter that, the next available time is after 4:15PM. Let's check Sarah at Golden Gate Park from 5:00PM to 7:15PM. The user can meet Sarah at 5:00PM, a 75-minute meeting.\n\nFinally, Steven at North Beach from 5:30PM to 8:30PM. The user can meet Steven at 6:00PM, a 30-minute meeting.\n\nWait, but I need to ensure the travel times between these locations are considered. For example, moving from Union Square to Financial District after meeting Elizabeth, but I think the user can manage that. Also, the user needs to travel from each meeting location to the next, which should be within a reasonable time frame.\n\nLet me double-check the itinerary:\n\n1. Nob Hill (Nancy) at 9:30AM.\n2. Haight-Ashbury (Stephanie) at 10:30AM.\n3. Marina District (David) at 11:30AM.\n4. Union Square (Elizabeth) at 12:00PM.\n5. Financial District (Robert) at 1:30PM.\n6. Presidio (James) at 3:30PM.\n7. Richmond District (Melissa) at 4:00PM.\n8. Embarcadero (Brian) at 4:00PM.\n9. Golden Gate Park (Sarah) at 5:00PM.\n10. North Beach (Steven) at 6:00PM.\n\nWait, there's an overlap at 4:00PM between Melissa and Brian. The user can't be in two places at once, so I need to adjust. Let's move Brian's meeting to 4:15PM after Melissa's.\n\nSo the updated itinerary would be:\n\n1. Nob Hill (Nancy) at 9:30AM.\n2. Haight-Ashbury (Stephanie) at 10:30AM.\n3. Marina District (David) at 11:30AM.\n4. Union Square (Elizabeth) at 12:00PM.\n5. Financial District (Robert) at 1:30PM.\n6. Presidio (James) at 3:30PM.\n7. Richmond District (Melissa) at 4:00PM.\n8. Embarcadero (Brian) at 4:15PM.\n9. Golden Gate Park (Sarah) at 5:00PM.\n10. North Beach (Steven) at 6:00PM.\n\nThis way, all meetings are scheduled without overlaps, and the user can travel between locations efficiently.\n</think>\n\nSOLUTION:\n{\n  \"itinerary\": [\n    {\"action\": \"meet\", \"location\": \"Nob Hill\", \"person\": \"Nancy\", \"start_time\": \"09:30\", \"end_time\": \"10:00\"},\n    {\"action\": \"meet\", \"location\": \"Haight-Ashbury\", \"person\": \"Stephanie\", \"start_time\": \"10:30\", \"end_time\": \"11:00\"},\n    {\"action\": \"meet\", \"location\": \"Marina District\", \"person\": \"David\", \"start_time\": \"11:30\", \"end_time\": \"12:00\"},\n    {\"action\": \"meet\", \"location\": \"Union Square\", \"person\": \"Elizabeth\", \"start_time\": \"12:00\", \"end_time\": \"13:00\"},\n    {\"action\": \"meet\", \"location\": \"Financial District\", \"person\": \"Robert\", \"start_time\": \"13:30\", \"end_time\": \"14:15\"},\n    {\"action\": \"meet\", \"location\": \"Presidio\", \"person\": \"James\", \"start_time\": \"15:30\", \"end_time\": \"16:45\"},\n    {\"action\": \"meet\", \"location\": \"Richmond District\", \"person\": \"Melissa\", \"start_time\": \"16:00\", \"end_time\": \"16:30\"},\n    {\"action\": \"meet\", \"location\": \"Embarcadero\", \"person\": \"Brian\", \"start_time\": \"16:30\", \"end_time\": \"16:45\"},\n    {\"action\": \"meet\", \"location\": \"Golden Gate Park\", \"person\": \"Sarah\", \"start_time\": \"17:00\", \"end_time\": \"18:15\"},\n    {\"action\": \"meet\", \"location\": \"North Beach\", \"person\": \"Steven\", \"start_time\": \"18:30\", \"end_time\": \"19:00\"}\n  ]\n}",
            "raw_model_reasoning": "Okay, so I need to help this user schedule their meetings in San Francisco. They want to meet as many friends as possible, so I need to maximize the number of meetings while considering travel times and constraints.\n\nFirst, I'll look at the constraints. They arrive at The Castro at 9:00AM. There are several people they want to meet, each with specific time windows and locations. I need to make sure each meeting fits within the person's availability and that the travel time is manageable.\n\nLet me list out all the people and their availability:\n\n1. Steven at North Beach from 5:30PM to 8:30PM.\n2. Sarah at Golden Gate Park from 5:00PM to 7:15PM.\n3. Brian at Embarcadero from 2:15PM to 4:00PM.\n4. Stephanie at Haight-Ashbury from 10:15AM to 12:15PM.\n5. Melissa at Richmond District from 2:00PM to 7:30PM.\n6. Nancy at Nob Hill from 8:15AM to 12:45PM.\n7. David at Marina District from 11:15AM to 1:15PM.\n8. James at Presidio from 3:00PM to 6:15PM.\n9. Elizabeth at Union Square from 11:30AM to 9:00PM.\n10. Robert at Financial District from 1:15PM to 3:15PM.\n\nI need to schedule these meetings in a way that the user can attend each without backtracking too much, as SF is a big city with varying distances between locations.\n\nStarting with the earliest availability, Nancy at Nob Hill from 8:15AM to 12:45PM. Since the user arrives at 9:00AM, the latest they can meet Nancy is 12:45PM. Let's choose 9:30AM for a 30-minute meeting.\n\nNext, Nancy's meeting is done. Now, looking for the next earliest. Stephanie at Haight-Ashbury from 10:15AM to 12:15PM. The user can meet her at 10:30AM, which is a 30-minute meeting.\n\nAfter that, the next earliest is Brian at Embarcadero from 2:15PM to 4:00PM. But before that, there are other meetings possible. Let's check David at Marina District from 11:15AM to 1:15PM. The user can meet David at 11:30AM, a 30-minute meeting.\n\nThen, Elizabeth at Union Square from 11:30AM to 9:00PM. The user can meet Elizabeth at 12:00PM, which is a 60-minute meeting.\n\nNow, moving to Robert at Financial District from 1:15PM to 3:15PM. The user can meet Robert at 1:30PM, a 45-minute meeting.\n\nAfter Robert, the next available time is after 3:15PM. Let's see who else can be met. James at Presidio from 3:00PM to 6:15PM. The user can meet James at 3:30PM, a 105-minute meeting.\n\nNext, Melissa at Richmond District from 2:00PM to 7:30PM. The user can meet Melissa at 4:00PM, a 30-minute meeting.\n\nThen, Brian at Embarcadero from 2:15PM to 4:00PM. The user can meet Brian at 4:00PM, a 15-minute meeting.\n\nAfter that, the next available time is after 4:15PM. Let's check Sarah at Golden Gate Park from 5:00PM to 7:15PM. The user can meet Sarah at 5:00PM, a 75-minute meeting.\n\nFinally, Steven at North Beach from 5:30PM to 8:30PM. The user can meet Steven at 6:00PM, a 30-minute meeting.\n\nWait, but I need to ensure the travel times between these locations are considered. For example, moving from Union Square to Financial District after meeting Elizabeth, but I think the user can manage that. Also, the user needs to travel from each meeting location to the next, which should be within a reasonable time frame.\n\nLet me double-check the itinerary:\n\n1. Nob Hill (Nancy) at 9:30AM.\n2. Haight-Ashbury (Stephanie) at 10:30AM.\n3. Marina District (David) at 11:30AM.\n4. Union Square (Elizabeth) at 12:00PM.\n5. Financial District (Robert) at 1:30PM.\n6. Presidio (James) at 3:30PM.\n7. Richmond District (Melissa) at 4:00PM.\n8. Embarcadero (Brian) at 4:00PM.\n9. Golden Gate Park (Sarah) at 5:00PM.\n10. North Beach (Steven) at 6:00PM.\n\nWait, there's an overlap at 4:00PM between Melissa and Brian. The user can't be in two places at once, so I need to adjust. Let's move Brian's meeting to 4:15PM after Melissa's.\n\nSo the updated itinerary would be:\n\n1. Nob Hill (Nancy) at 9:30AM.\n2. Haight-Ashbury (Stephanie) at 10:30AM.\n3. Marina District (David) at 11:30AM.\n4. Union Square (Elizabeth) at 12:00PM.\n5. Financial District (Robert) at 1:30PM.\n6. Presidio (James) at 3:30PM.\n7. Richmond District (Melissa) at 4:00PM.\n8. Embarcadero (Brian) at 4:15PM.\n9. Golden Gate Park (Sarah) at 5:00PM.\n10. North Beach (Steven) at 6:00PM.\n\nThis way, all meetings are scheduled without overlaps, and the user can travel between locations efficiently.\n</think>\n\nSOLUTION:"
        }
    ]
}