{
    "0shot": [
        {
            "final_program_time": {
                "itinerary": [
                    {
                        "action": "meet",
                        "location": "Sunset District",
                        "person": "Sarah",
                        "start_time": "10:45",
                        "end_time": "11:15"
                    },
                    {
                        "action": "meet",
                        "location": "Haight-Ashbury",
                        "person": "Richard",
                        "start_time": "11:45",
                        "end_time": "12:45"
                    },
                    {
                        "action": "meet",
                        "location": "Mission District",
                        "person": "Elizabeth",
                        "start_time": "11:30",
                        "end_time": "12:00"
                    },
                    {
                        "action": "meet",
                        "location": "Golden Gate Park",
                        "person": "Michelle",
                        "start_time": "18:45",
                        "end_time": "19:15"
                    }
                ]
            },
            "expected_time": {
                "itinerary": [
                    {
                        "action": "meet",
                        "location": "Sunset District",
                        "person": "Sarah",
                        "start_time": "10:45",
                        "end_time": "11:15"
                    },
                    {
                        "action": "meet",
                        "location": "Haight-Ashbury",
                        "person": "Richard",
                        "start_time": "11:45",
                        "end_time": "13:15"
                    },
                    {
                        "action": "meet",
                        "location": "Mission District",
                        "person": "Elizabeth",
                        "start_time": "13:26",
                        "end_time": "15:26"
                    },
                    {
                        "action": "meet",
                        "location": "Golden Gate Park",
                        "person": "Michelle",
                        "start_time": "18:15",
                        "end_time": "19:45"
                    }
                ]
            },
            "count": "meeting_planning_example_312",
            "is_correct": false,
            "reasoning_token_count": 418,
            "raw_model_response": "Alright, I need to help this user by creating a meeting schedule for them in San Francisco. They want to meet as many friends as possible, so I need to maximize the number of meetings without overlapping times and considering travel distances.\n\nFirst, I'll look at the constraints. The user arrives at the Richmond District at 9:00 AM. They have specific friends in different locations with varying availability times and meeting durations.\n\nI should start by identifying the earliest possible meetings. The first friend, Sarah, is at the Sunset District from 10:45 AM to 7:00 PM. The travel time from Richmond District to Sunset District is 11 minutes, which is manageable. I'll schedule the meeting at 10:45 AM to ensure they have enough time to travel there.\n\nNext, Richard is at Haight-Ashbury from 11:45 AM to 3:45 PM. The travel time is 10 minutes. If I schedule the meeting at 11:45 AM, it's right when he arrives, which should work.\n\nThen, Elizabeth is at the Mission District from 11:00 AM to 5:15 PM. The travel time is 20 minutes. I'll set the meeting at 11:30 AM, giving a bit of buffer time for travel and arrival.\n\nFor Michelle, who is at Golden Gate Park from 6:15 PM to 8:45 PM, I need to plan the latest meeting. The travel time is 9 minutes. Scheduling at 6:45 PM allows enough time to travel and meet her.\n\nNow, I'll check the timeline to ensure there are no overlaps. The meetings are at 10:45 AM, 11:45 AM, 11:30 AM, and 6:45 PM, which are all feasible and within the available times.\n\nI should also consider the durations. Each meeting is at least 30 minutes, which fits within the constraints provided. This schedule allows the user to meet four friends throughout the day without excessive travel or time conflicts.\n</think>\n\n```json\n{\n  \"itinerary\": [\n    {\n      \"action\": \"meet\",\n      \"location\": \"Sunset District\",\n      \"person\": \"Sarah\",\n      \"start_time\": \"10:45\",\n      \"end_time\": \"11:15\"\n    },\n    {\n      \"action\": \"meet\",\n      \"location\": \"Haight-Ashbury\",\n      \"person\": \"Richard\",\n      \"start_time\": \"11:45\",\n      \"end_time\": \"12:45\"\n    },\n    {\n      \"action\": \"meet\",\n      \"location\": \"Mission District\",\n      \"person\": \"Elizabeth\",\n      \"start_time\": \"11:30\",\n      \"end_time\": \"12:00\"\n    },\n    {\n      \"action\": \"meet\",\n      \"location\": \"Golden Gate Park\",\n      \"person\": \"Michelle\",\n      \"start_time\": \"18:45\",\n      \"end_time\": \"19:15\"\n    }\n  ]\n}\n```",
            "raw_model_reasoning": "Alright, I need to help this user by creating a meeting schedule for them in San Francisco. They want to meet as many friends as possible, so I need to maximize the number of meetings without overlapping times and considering travel distances.\n\nFirst, I'll look at the constraints. The user arrives at the Richmond District at 9:00 AM. They have specific friends in different locations with varying availability times and meeting durations.\n\nI should start by identifying the earliest possible meetings. The first friend, Sarah, is at the Sunset District from 10:45 AM to 7:00 PM. The travel time from Richmond District to Sunset District is 11 minutes, which is manageable. I'll schedule the meeting at 10:45 AM to ensure they have enough time to travel there.\n\nNext, Richard is at Haight-Ashbury from 11:45 AM to 3:45 PM. The travel time is 10 minutes. If I schedule the meeting at 11:45 AM, it's right when he arrives, which should work.\n\nThen, Elizabeth is at the Mission District from 11:00 AM to 5:15 PM. The travel time is 20 minutes. I'll set the meeting at 11:30 AM, giving a bit of buffer time for travel and arrival.\n\nFor Michelle, who is at Golden Gate Park from 6:15 PM to 8:45 PM, I need to plan the latest meeting. The travel time is 9 minutes. Scheduling at 6:45 PM allows enough time to travel and meet her.\n\nNow, I'll check the timeline to ensure there are no overlaps. The meetings are at 10:45 AM, 11:45 AM, 11:30 AM, and 6:45 PM, which are all feasible and within the available times.\n\nI should also consider the durations. Each meeting is at least 30 minutes, which fits within the constraints provided. This schedule allows the user to meet four friends throughout the day without excessive travel or time conflicts.\n</think>\n\n```json"
        }
    ]
}