{
    "0shot": [
        {
            "final_program_time": {
                "itinerary": [
                    {
                        "action": "meet",
                        "location": "Pacific Heights",
                        "person": "John",
                        "start_time": "9:00",
                        "end_time": "9:30"
                    },
                    {
                        "action": "meet",
                        "location": "Presidio",
                        "person": "Jeffrey",
                        "start_time": "9:30",
                        "end_time": "10:30"
                    },
                    {
                        "action": "meet",
                        "location": "North Beach",
                        "person": "Steven",
                        "start_time": "11:30",
                        "end_time": "12:30"
                    },
                    {
                        "action": "meet",
                        "location": "Fisherman's Wharf",
                        "person": "Barbara",
                        "start_time": "14:00",
                        "end_time": "14:30"
                    }
                ]
            },
            "expected_time": {
                "itinerary": [
                    {
                        "action": "meet",
                        "location": "Pacific Heights",
                        "person": "John",
                        "start_time": "9:08",
                        "end_time": "9:23"
                    },
                    {
                        "action": "meet",
                        "location": "North Beach",
                        "person": "Steven",
                        "start_time": "13:30",
                        "end_time": "14:15"
                    },
                    {
                        "action": "meet",
                        "location": "Fisherman's Wharf",
                        "person": "Barbara",
                        "start_time": "18:00",
                        "end_time": "18:30"
                    }
                ]
            },
            "count": "meeting_planning_example_385",
            "is_correct": false,
            "reasoning_token_count": 908,
            "raw_model_response": "Okay, so I'm trying to help this user who's an AI meeting planner. They want to schedule meetings in San Francisco, considering various constraints and travel times to meet as many friends as possible. The user provided a lot of travel distances and specific constraints for each meeting. \n\nFirst, I need to understand the constraints properly. The user arrives at Nob Hill at 9:00 AM. There are four people they need to meet: Jeffrey at Presidio, Steven at North Beach, Barbara at Fisherman's Wharf, and John at Pacific Heights. Each has specific time windows and minimum meeting durations.\n\nStarting with Jeffrey at Presidio, who's available from 8:00 AM to 10:00 AM. Since the user arrives at Nob Hill at 9:00 AM, they need to travel to Presidio. The travel distance from Nob Hill to Presidio is 17 minutes, which is manageable. But considering the meeting duration of 105 minutes, the user needs to plan the time accordingly.\n\nNext, Steven is at North Beach from 1:30 PM to 10:00 PM. The user needs to travel from Nob Hill to North Beach, which is 8 minutes away. They should plan the meeting around Steven's availability.\n\nBarbara is at Fisherman's Wharf from 6:00 PM to 9:30 PM. The user needs to travel from Nob Hill to Fisherman's Wharf, which takes 11 minutes. They should ensure the meeting fits within Barbara's time frame.\n\nJohn is at Pacific Heights from 9:00 AM to 1:30 PM. The user is arriving at Nob Hill at 9:00 AM, so meeting John early makes sense. The travel time from Nob Hill to Pacific Heights is 8 minutes.\n\nI need to create an itinerary that allows the user to meet all four friends without overlapping travel times too much. Starting with John at Pacific Heights seems logical since he's available early. Then, Jeffrey at Presidio, which is a short trip from Nob Hill. After that, Steven at North Beach in the afternoon, and finally Barbara at Fisherman's Wharf in the evening.\n\nI should check the travel times to ensure the user has enough time to move between locations without rushing. For example, after meeting Jeffrey, the user can head to North Beach for Steven's meeting, then to Fisherman's Wharf for Barbara, and back to Nob Hill if needed.\n\nWait, the user needs to meet four people, but only three are mentioned in the constraints. Oh, no, the user mentioned four people: Jeffrey, Steven, Barbara, and John. So I need to include all four.\n\nLet me outline the possible meeting times:\n\n1. John at Pacific Heights from 9:00 AM. The user can meet him right at 9:00 AM, then travel to Presidio for Jeffrey.\n\n2. Jeffrey at Presidio from 8:00 AM to 10:00 AM. The user can meet him around 9:30 AM after leaving Pacific Heights.\n\n3. Steven at North Beach from 1:30 PM to 10:00 PM. The user can head there after Presidio, around 10:30 AM.\n\n4. Barbara at Fisherman's Wharf from 6:00 PM to 9:30 PM. The user can go there after North Beach, maybe around 3:30 PM.\n\nBut the user needs to ensure they have enough time between meetings. For example, after meeting Steven, they need to travel to Fisherman's Wharf, which is 6 minutes from North Beach.\n\nAlso, the user needs to consider the travel times and ensure they don't exceed the meeting durations. Each meeting has a minimum time, so the user should allocate enough time for each meeting.\n\nI think the optimal schedule would be:\n\n- Start at Pacific Heights with John from 9:00 AM.\n- Travel to Presidio to meet Jeffrey from 9:30 AM to 10:30 AM.\n- Then go to North Beach to meet Steven from 11:30 AM to 12:30 PM.\n- Travel to Fisherman's Wharf to meet Barbara from 2:00 PM to 3:00 PM.\n- Finally, return to Nob Hill as needed.\n\nThis way, the user meets all four friends within their available time windows and travel times, ensuring they have enough time between meetings.\n</think>\n\n```json\n{\n  \"itinerary\": [\n    {\n      \"action\": \"meet\",\n      \"location\": \"Pacific Heights\",\n      \"person\": \"John\",\n      \"start_time\": \"09:00\",\n      \"end_time\": \"09:30\"\n    },\n    {\n      \"action\": \"meet\",\n      \"location\": \"Presidio\",\n      \"person\": \"Jeffrey\",\n      \"start_time\": \"09:30\",\n      \"end_time\": \"10:30\"\n    },\n    {\n      \"action\": \"meet\",\n      \"location\": \"North Beach\",\n      \"person\": \"Steven\",\n      \"start_time\": \"11:30\",\n      \"end_time\": \"12:30\"\n    },\n    {\n      \"action\": \"meet\",\n      \"location\": \"Fisherman's Wharf\",\n      \"person\": \"Barbara\",\n      \"start_time\": \"14:00\",\n      \"end_time\": \"14:30\"\n    }\n  ]\n}\n```",
            "raw_model_reasoning": "Okay, so I'm trying to help this user who's an AI meeting planner. They want to schedule meetings in San Francisco, considering various constraints and travel times to meet as many friends as possible. The user provided a lot of travel distances and specific constraints for each meeting. \n\nFirst, I need to understand the constraints properly. The user arrives at Nob Hill at 9:00 AM. There are four people they need to meet: Jeffrey at Presidio, Steven at North Beach, Barbara at Fisherman's Wharf, and John at Pacific Heights. Each has specific time windows and minimum meeting durations.\n\nStarting with Jeffrey at Presidio, who's available from 8:00 AM to 10:00 AM. Since the user arrives at Nob Hill at 9:00 AM, they need to travel to Presidio. The travel distance from Nob Hill to Presidio is 17 minutes, which is manageable. But considering the meeting duration of 105 minutes, the user needs to plan the time accordingly.\n\nNext, Steven is at North Beach from 1:30 PM to 10:00 PM. The user needs to travel from Nob Hill to North Beach, which is 8 minutes away. They should plan the meeting around Steven's availability.\n\nBarbara is at Fisherman's Wharf from 6:00 PM to 9:30 PM. The user needs to travel from Nob Hill to Fisherman's Wharf, which takes 11 minutes. They should ensure the meeting fits within Barbara's time frame.\n\nJohn is at Pacific Heights from 9:00 AM to 1:30 PM. The user is arriving at Nob Hill at 9:00 AM, so meeting John early makes sense. The travel time from Nob Hill to Pacific Heights is 8 minutes.\n\nI need to create an itinerary that allows the user to meet all four friends without overlapping travel times too much. Starting with John at Pacific Heights seems logical since he's available early. Then, Jeffrey at Presidio, which is a short trip from Nob Hill. After that, Steven at North Beach in the afternoon, and finally Barbara at Fisherman's Wharf in the evening.\n\nI should check the travel times to ensure the user has enough time to move between locations without rushing. For example, after meeting Jeffrey, the user can head to North Beach for Steven's meeting, then to Fisherman's Wharf for Barbara, and back to Nob Hill if needed.\n\nWait, the user needs to meet four people, but only three are mentioned in the constraints. Oh, no, the user mentioned four people: Jeffrey, Steven, Barbara, and John. So I need to include all four.\n\nLet me outline the possible meeting times:\n\n1. John at Pacific Heights from 9:00 AM. The user can meet him right at 9:00 AM, then travel to Presidio for Jeffrey.\n\n2. Jeffrey at Presidio from 8:00 AM to 10:00 AM. The user can meet him around 9:30 AM after leaving Pacific Heights.\n\n3. Steven at North Beach from 1:30 PM to 10:00 PM. The user can head there after Presidio, around 10:30 AM.\n\n4. Barbara at Fisherman's Wharf from 6:00 PM to 9:30 PM. The user can go there after North Beach, maybe around 3:30 PM.\n\nBut the user needs to ensure they have enough time between meetings. For example, after meeting Steven, they need to travel to Fisherman's Wharf, which is 6 minutes from North Beach.\n\nAlso, the user needs to consider the travel times and ensure they don't exceed the meeting durations. Each meeting has a minimum time, so the user should allocate enough time for each meeting.\n\nI think the optimal schedule would be:\n\n- Start at Pacific Heights with John from 9:00 AM.\n- Travel to Presidio to meet Jeffrey from 9:30 AM to 10:30 AM.\n- Then go to North Beach to meet Steven from 11:30 AM to 12:30 PM.\n- Travel to Fisherman's Wharf to meet Barbara from 2:00 PM to 3:00 PM.\n- Finally, return to Nob Hill as needed.\n\nThis way, the user meets all four friends within their available time windows and travel times, ensuring they have enough time between meetings.\n</think>\n\n```json"
        }
    ]
}