{
    "0shot": [
        {
            "final_program_time": {
                "itinerary": [
                    {
                        "action": "meet",
                        "location": "Mission District",
                        "person": "James",
                        "start_time": "12:45",
                        "end_time": "2:00"
                    },
                    {
                        "action": "meet",
                        "location": "The Castro",
                        "person": "Robert",
                        "start_time": "2:07",
                        "end_time": "2:37"
                    }
                ]
            },
            "expected_time": {
                "itinerary": [
                    {
                        "action": "meet",
                        "location": "Mission District",
                        "person": "James",
                        "start_time": "12:45",
                        "end_time": "14:00"
                    },
                    {
                        "action": "meet",
                        "location": "The Castro",
                        "person": "Robert",
                        "start_time": "14:07",
                        "end_time": "14:37"
                    }
                ]
            },
            "count": "meeting_planning_example_180",
            "is_correct": false,
            "reasoning_token_count": 978,
            "raw_model_response": "Alright, so I'm trying to help this user schedule their meetings in San Francisco. They've given me a specific scenario where they arrive at North Beach at 9:00 AM and need to meet two people: James in the Mission District and Robert in The Castro. The goal is to meet both for the required minimum times, considering the travel distances provided.\n\nFirst, I need to understand the constraints. James is available from 12:45 PM to 2:00 PM, and he needs at least 75 minutes. Robert is available from 12:45 PM to 3:15 PM, needing only 30 minutes. The user arrives at North Beach at 9:00 AM.\n\nI should start by figuring out the best time to meet each person, ensuring that the user can travel from one location to another without backtracking too much, which would take up too much time. Also, I need to consider the travel times between these areas to make sure the user doesn't miss either meeting.\n\nLooking at the travel distances:\n\n- North Beach to Mission District: 18 minutes.\n- North Beach to The Castro: 22 minutes.\n- Mission District to The Castro: 7 minutes.\n\nSo, if the user goes from North Beach to Mission District first, it's a quick 18-minute trip. Then, from Mission District to The Castro is only 7 minutes. That seems efficient.\n\nNow, checking the availability:\n\nJames is available from 12:45 PM to 2:00 PM. If the user meets him at 12:45 PM, that leaves 75 minutes, which fits his requirement. Then, after meeting James, the user can travel to The Castro, which takes 7 minutes, arriving at 1:52 PM. Robert is available until 3:15 PM, so meeting him at 1:52 PM gives him 2 hours and 23 minutes, which is more than the 30 minutes he needs. That works.\n\nAlternatively, if the user meets Robert first, they'd have to go from North Beach to The Castro, which takes 22 minutes, arriving at 10:22 AM. But that's too early because James isn't available until 12:45 PM. So, it's better to meet James first.\n\nSo the plan is:\n\n1. Meet James at Mission District at 12:45 PM. This takes 18 minutes from North Beach, so they arrive at 12:18 PM. Wait, but James isn't available until 12:45 PM. Hmm, that's a conflict. Maybe I need to adjust the start time.\n\nWait, perhaps the user can leave North Beach a bit earlier. If they leave at 12:00 PM, they can reach Mission District by 12:18 PM, but James isn't available until 12:45 PM. So, maybe they should wait at Mission District until 12:45 PM, then meet him. But that would mean they're waiting for 45 minutes, which is acceptable as long as they can still meet Robert afterward.\n\nAfter meeting James from 12:45 PM to 2:00 PM, the user needs to go to The Castro, which takes 7 minutes, arriving at 2:07 PM. Robert is available until 3:15 PM, so they can meet him then.\n\nAlternatively, if they meet Robert first, they can go to The Castro from North Beach, arriving at 10:22 AM, but that's too early for both Robert and James. So, meeting James first seems better.\n\nWait, but the user arrives at North Beach at 9:00 AM. They can leave North Beach at 12:00 PM to reach Mission District by 12:18 PM. But James isn't available until 12:45 PM. So, the user can wait at Mission District until 12:45 PM, then meet James for 75 minutes until 2:00 PM. Then, they can go to The Castro, arriving at 2:07 PM, and meet Robert until 3:15 PM.\n\nThat seems to work. The user's schedule would be:\n\n- 12:45 PM to 2:00 PM: Meet James at Mission District.\n- 2:07 PM to 3:15 PM: Meet Robert at The Castro.\n\nThis way, the user meets both friends within their available times and the required durations.\n\nI should double-check the travel times to ensure everything adds up correctly. From North Beach to Mission District is 18 minutes, then to The Castro is 7 minutes. So, the user can make it to both meetings on time.\n\nYes, this plan should work best. It allows the user to meet both James and Robert without any scheduling conflicts and within the required time frames.\n</think>\n\nSOLUTION:\n{\n  \"itinerary\": [\n    {\"action\": \"meet\", \"location\": \"Mission District\", \"person\": \"James\", \"start_time\": \"12:45\", \"end_time\": \"2:00\"},\n    {\"action\": \"meet\", \"location\": \"The Castro\", \"person\": \"Robert\", \"start_time\": \"2:07\", \"end_time\": \"2:37\"}\n  ]\n}",
            "raw_model_reasoning": "Alright, so I'm trying to help this user schedule their meetings in San Francisco. They've given me a specific scenario where they arrive at North Beach at 9:00 AM and need to meet two people: James in the Mission District and Robert in The Castro. The goal is to meet both for the required minimum times, considering the travel distances provided.\n\nFirst, I need to understand the constraints. James is available from 12:45 PM to 2:00 PM, and he needs at least 75 minutes. Robert is available from 12:45 PM to 3:15 PM, needing only 30 minutes. The user arrives at North Beach at 9:00 AM.\n\nI should start by figuring out the best time to meet each person, ensuring that the user can travel from one location to another without backtracking too much, which would take up too much time. Also, I need to consider the travel times between these areas to make sure the user doesn't miss either meeting.\n\nLooking at the travel distances:\n\n- North Beach to Mission District: 18 minutes.\n- North Beach to The Castro: 22 minutes.\n- Mission District to The Castro: 7 minutes.\n\nSo, if the user goes from North Beach to Mission District first, it's a quick 18-minute trip. Then, from Mission District to The Castro is only 7 minutes. That seems efficient.\n\nNow, checking the availability:\n\nJames is available from 12:45 PM to 2:00 PM. If the user meets him at 12:45 PM, that leaves 75 minutes, which fits his requirement. Then, after meeting James, the user can travel to The Castro, which takes 7 minutes, arriving at 1:52 PM. Robert is available until 3:15 PM, so meeting him at 1:52 PM gives him 2 hours and 23 minutes, which is more than the 30 minutes he needs. That works.\n\nAlternatively, if the user meets Robert first, they'd have to go from North Beach to The Castro, which takes 22 minutes, arriving at 10:22 AM. But that's too early because James isn't available until 12:45 PM. So, it's better to meet James first.\n\nSo the plan is:\n\n1. Meet James at Mission District at 12:45 PM. This takes 18 minutes from North Beach, so they arrive at 12:18 PM. Wait, but James isn't available until 12:45 PM. Hmm, that's a conflict. Maybe I need to adjust the start time.\n\nWait, perhaps the user can leave North Beach a bit earlier. If they leave at 12:00 PM, they can reach Mission District by 12:18 PM, but James isn't available until 12:45 PM. So, maybe they should wait at Mission District until 12:45 PM, then meet him. But that would mean they're waiting for 45 minutes, which is acceptable as long as they can still meet Robert afterward.\n\nAfter meeting James from 12:45 PM to 2:00 PM, the user needs to go to The Castro, which takes 7 minutes, arriving at 2:07 PM. Robert is available until 3:15 PM, so they can meet him then.\n\nAlternatively, if they meet Robert first, they can go to The Castro from North Beach, arriving at 10:22 AM, but that's too early for both Robert and James. So, meeting James first seems better.\n\nWait, but the user arrives at North Beach at 9:00 AM. They can leave North Beach at 12:00 PM to reach Mission District by 12:18 PM. But James isn't available until 12:45 PM. So, the user can wait at Mission District until 12:45 PM, then meet James for 75 minutes until 2:00 PM. Then, they can go to The Castro, arriving at 2:07 PM, and meet Robert until 3:15 PM.\n\nThat seems to work. The user's schedule would be:\n\n- 12:45 PM to 2:00 PM: Meet James at Mission District.\n- 2:07 PM to 3:15 PM: Meet Robert at The Castro.\n\nThis way, the user meets both friends within their available times and the required durations.\n\nI should double-check the travel times to ensure everything adds up correctly. From North Beach to Mission District is 18 minutes, then to The Castro is 7 minutes. So, the user can make it to both meetings on time.\n\nYes, this plan should work best. It allows the user to meet both James and Robert without any scheduling conflicts and within the required time frames.\n</think>\n\nSOLUTION:"
        }
    ]
}