{
    "0shot": [
        {
            "final_program_time": {
                "itinerary": [
                    {
                        "action": "meet",
                        "location": "Nob Hill",
                        "person": "Daniel",
                        "start_time": "9:30",
                        "end_time": "10:00"
                    },
                    {
                        "action": "meet",
                        "location": "Chinatown",
                        "person": "Kevin",
                        "start_time": "12:00",
                        "end_time": "12:30"
                    },
                    {
                        "action": "meet",
                        "location": "Richmond District",
                        "person": "Betty",
                        "start_time": "13:30",
                        "end_time": "14:00"
                    },
                    {
                        "action": "meet",
                        "location": "Marina District",
                        "person": "Steven",
                        "start_time": "16:30",
                        "end_time": "17:30"
                    },
                    {
                        "action": "meet",
                        "location": "Golden Gate Park",
                        "person": "Ashley",
                        "start_time": "20:15",
                        "end_time": "20:45"
                    },
                    {
                        "action": "meet",
                        "location": "Presidio",
                        "person": "Elizabeth",
                        "start_time": "21:15",
                        "end_time": "21:45"
                    }
                ]
            },
            "expected_time": {
                "itinerary": [
                    {
                        "action": "meet",
                        "location": "Nob Hill",
                        "person": "Daniel",
                        "start_time": "9:12",
                        "end_time": "9:27"
                    },
                    {
                        "action": "meet",
                        "location": "Pacific Heights",
                        "person": "Timothy",
                        "start_time": "12:00",
                        "end_time": "13:30"
                    },
                    {
                        "action": "meet",
                        "location": "Chinatown",
                        "person": "Kevin",
                        "start_time": "13:41",
                        "end_time": "14:11"
                    },
                    {
                        "action": "meet",
                        "location": "Richmond District",
                        "person": "Betty",
                        "start_time": "14:31",
                        "end_time": "15:01"
                    },
                    {
                        "action": "meet",
                        "location": "Marina District",
                        "person": "Steven",
                        "start_time": "16:30",
                        "end_time": "18:00"
                    },
                    {
                        "action": "meet",
                        "location": "The Castro",
                        "person": "Lisa",
                        "start_time": "19:15",
                        "end_time": "21:15"
                    }
                ]
            },
            "count": "meeting_planning_example_701",
            "is_correct": false,
            "reasoning_token_count": 902,
            "raw_model_response": "Alright, let's tackle this problem. I need to schedule a day of meetings in San Francisco, starting from the Mission District at 9:00 AM. My goal is to meet as many friends as possible, so I need to maximize the number of meetings while considering travel times and the constraints provided.\n\nFirst, I'll review the travel distances and constraints. The travel distances are provided for various locations, and the constraints outline the availability of each friend during specific times. My task is to create an itinerary that allows me to meet each friend within their availability, ensuring that each meeting is at least the required duration.\n\nStarting at the Mission District at 9:00 AM, I need to plan the first meeting. The earliest availability is Daniel at Nob Hill from 8:15 AM to 11:00 AM. Since I arrive at 9:00 AM, I can meet Daniel at Nob Hill around 9:30 AM, allowing a 30-minute meeting. This seems efficient.\n\nNext, after meeting Daniel, I need to consider the next friend. The next earliest availability is Elizabeth at Presidio from 9:15 PM to 10:15 PM. However, that's later in the day, and I need to see if there's someone else available earlier. Checking the constraints, Steven is available at Marina District from 4:30 PM to 8:45 PM, which is later. Ashley is at Golden Gate Park from 8:45 PM to 9:45 PM, also later. Kevin is at Chinatown from 12:00 PM to 7:00 PM. Betty is at Richmond District from 1:15 PM to 3:45 PM. \n\nGiven the current time, meeting Kevin at Chinatown at 12:00 PM seems feasible. I'll need to travel from Nob Hill to Chinatown. The travel distance is 6 minutes, so that's manageable. I can meet Kevin for 30 minutes.\n\nAfter meeting Kevin, the next available friend is Betty at Richmond District from 1:15 PM to 3:45 PM. I can meet her at Richmond District around 1:30 PM, allowing a 30-minute meeting.\n\nNow, considering the time, I should check if I can meet another friend. Steven is available from 4:30 PM to 8:45 PM at Marina District. That's a long window, so I can plan to meet him later in the day.\n\nNext, checking the availability, Ashley is at Golden Gate Park from 8:45 PM to 9:45 PM. That's quite late, but I can schedule that meeting after Steven.\n\nFinally, Elizabeth is available at Presidio from 9:15 PM to 10:15 PM. I can meet her last.\n\nI need to ensure that each meeting doesn't overlap and that the travel times between locations are reasonable. Let's outline the itinerary:\n\n1. **Mission District (9:00 AM)**\n   - Start at Mission District.\n   - Travel to Nob Hill to meet Daniel (9:30 - 10:00 AM).\n   \n2. **Chinatown (12:00 PM)**\n   - Travel from Nob Hill to Chinatown (6 minutes).\n   - Meet Kevin for 30 minutes (12:00 - 12:30 PM).\n   \n3. **Richmond District (1:30 PM)**\n   - Travel from Chinatown to Richmond District (20 minutes).\n   - Meet Betty for 30 minutes (1:30 - 2:00 PM).\n   \n4. **Marina District (4:30 PM)**\n   - Travel from Richmond District to Marina District (11 minutes).\n   - Meet Steven for 90 minutes (4:30 - 5:30 PM).\n   \n5. **Golden Gate Park (8:45 PM)**\n   - Travel from Marina District to Golden Gate Park (16 minutes).\n   - Meet Ashley for 60 minutes (8:45 - 9:45 PM).\n   \n6. **Presidio (9:15 PM)**\n   - Travel from Golden Gate Park to Presidio (11 minutes).\n   - Meet Elizabeth for 45 minutes (9:15 - 10:00 PM).\n\nThis itinerary ensures that I meet five friends within the day, considering travel times and constraints. Each meeting is scheduled without overlapping, and the travel times between locations are accounted for.\n</think>\n\n```json\n{\n  \"itinerary\": [\n    {\n      \"action\": \"meet\",\n      \"location\": \"Nob Hill\",\n      \"person\": \"Daniel\",\n      \"start_time\": \"09:30\",\n      \"end_time\": \"10:00\"\n    },\n    {\n      \"action\": \"meet\",\n      \"location\": \"Chinatown\",\n      \"person\": \"Kevin\",\n      \"start_time\": \"12:00\",\n      \"end_time\": \"12:30\"\n    },\n    {\n      \"action\": \"meet\",\n      \"location\": \"Richmond District\",\n      \"person\": \"Betty\",\n      \"start_time\": \"13:30\",\n      \"end_time\": \"14:00\"\n    },\n    {\n      \"action\": \"meet\",\n      \"location\": \"Marina District\",\n      \"person\": \"Steven\",\n      \"start_time\": \"16:30\",\n      \"end_time\": \"17:30\"\n    },\n    {\n      \"action\": \"meet\",\n      \"location\": \"Golden Gate Park\",\n      \"person\": \"Ashley\",\n      \"start_time\": \"20:15\",\n      \"end_time\": \"20:45\"\n    },\n    {\n      \"action\": \"meet\",\n      \"location\": \"Presidio\",\n      \"person\": \"Elizabeth\",\n      \"start_time\": \"21:15\",\n      \"end_time\": \"21:45\"\n    }\n  ]\n}\n```",
            "raw_model_reasoning": "Alright, let's tackle this problem. I need to schedule a day of meetings in San Francisco, starting from the Mission District at 9:00 AM. My goal is to meet as many friends as possible, so I need to maximize the number of meetings while considering travel times and the constraints provided.\n\nFirst, I'll review the travel distances and constraints. The travel distances are provided for various locations, and the constraints outline the availability of each friend during specific times. My task is to create an itinerary that allows me to meet each friend within their availability, ensuring that each meeting is at least the required duration.\n\nStarting at the Mission District at 9:00 AM, I need to plan the first meeting. The earliest availability is Daniel at Nob Hill from 8:15 AM to 11:00 AM. Since I arrive at 9:00 AM, I can meet Daniel at Nob Hill around 9:30 AM, allowing a 30-minute meeting. This seems efficient.\n\nNext, after meeting Daniel, I need to consider the next friend. The next earliest availability is Elizabeth at Presidio from 9:15 PM to 10:15 PM. However, that's later in the day, and I need to see if there's someone else available earlier. Checking the constraints, Steven is available at Marina District from 4:30 PM to 8:45 PM, which is later. Ashley is at Golden Gate Park from 8:45 PM to 9:45 PM, also later. Kevin is at Chinatown from 12:00 PM to 7:00 PM. Betty is at Richmond District from 1:15 PM to 3:45 PM. \n\nGiven the current time, meeting Kevin at Chinatown at 12:00 PM seems feasible. I'll need to travel from Nob Hill to Chinatown. The travel distance is 6 minutes, so that's manageable. I can meet Kevin for 30 minutes.\n\nAfter meeting Kevin, the next available friend is Betty at Richmond District from 1:15 PM to 3:45 PM. I can meet her at Richmond District around 1:30 PM, allowing a 30-minute meeting.\n\nNow, considering the time, I should check if I can meet another friend. Steven is available from 4:30 PM to 8:45 PM at Marina District. That's a long window, so I can plan to meet him later in the day.\n\nNext, checking the availability, Ashley is at Golden Gate Park from 8:45 PM to 9:45 PM. That's quite late, but I can schedule that meeting after Steven.\n\nFinally, Elizabeth is available at Presidio from 9:15 PM to 10:15 PM. I can meet her last.\n\nI need to ensure that each meeting doesn't overlap and that the travel times between locations are reasonable. Let's outline the itinerary:\n\n1. **Mission District (9:00 AM)**\n   - Start at Mission District.\n   - Travel to Nob Hill to meet Daniel (9:30 - 10:00 AM).\n   \n2. **Chinatown (12:00 PM)**\n   - Travel from Nob Hill to Chinatown (6 minutes).\n   - Meet Kevin for 30 minutes (12:00 - 12:30 PM).\n   \n3. **Richmond District (1:30 PM)**\n   - Travel from Chinatown to Richmond District (20 minutes).\n   - Meet Betty for 30 minutes (1:30 - 2:00 PM).\n   \n4. **Marina District (4:30 PM)**\n   - Travel from Richmond District to Marina District (11 minutes).\n   - Meet Steven for 90 minutes (4:30 - 5:30 PM).\n   \n5. **Golden Gate Park (8:45 PM)**\n   - Travel from Marina District to Golden Gate Park (16 minutes).\n   - Meet Ashley for 60 minutes (8:45 - 9:45 PM).\n   \n6. **Presidio (9:15 PM)**\n   - Travel from Golden Gate Park to Presidio (11 minutes).\n   - Meet Elizabeth for 45 minutes (9:15 - 10:00 PM).\n\nThis itinerary ensures that I meet five friends within the day, considering travel times and constraints. Each meeting is scheduled without overlapping, and the travel times between locations are accounted for.\n</think>\n\n```json"
        }
    ]
}