{
    "0shot": [
        {
            "final_program_time": {
                "itinerary": [
                    {
                        "action": "meet",
                        "location": "Nob Hill",
                        "person": "Ronald",
                        "start_time": "10:00",
                        "end_time": "10:45"
                    },
                    {
                        "action": "meet",
                        "location": "Russian Hill",
                        "person": "Sarah",
                        "start_time": "8:30",
                        "end_time": "9:30"
                    },
                    {
                        "action": "meet",
                        "location": "Haight-Ashbury",
                        "person": "Margaret",
                        "start_time": "9:30",
                        "end_time": "10:30"
                    },
                    {
                        "action": "meet",
                        "location": "The Castro",
                        "person": "Helen",
                        "start_time": "13:30",
                        "end_time": "14:30"
                    },
                    {
                        "action": "meet",
                        "location": "Sunset District",
                        "person": "Joshua",
                        "start_time": "15:45",
                        "end_time": "16:45"
                    }
                ]
            },
            "expected_time": {
                "itinerary": [
                    {
                        "action": "meet",
                        "location": "Nob Hill",
                        "person": "Ronald",
                        "start_time": "10:00",
                        "end_time": "11:45"
                    },
                    {
                        "action": "meet",
                        "location": "The Castro",
                        "person": "Helen",
                        "start_time": "13:30",
                        "end_time": "15:30"
                    },
                    {
                        "action": "meet",
                        "location": "Sunset District",
                        "person": "Joshua",
                        "start_time": "15:47",
                        "end_time": "17:17"
                    },
                    {
                        "action": "meet",
                        "location": "Haight-Ashbury",
                        "person": "Margaret",
                        "start_time": "17:32",
                        "end_time": "18:32"
                    }
                ]
            },
            "count": "meeting_planning_example_488",
            "is_correct": false,
            "reasoning_token_count": 802,
            "raw_model_response": "Okay, so I need to help this person plan their meetings in San Francisco. They want to meet as many friends as possible, but they have some constraints. They start at Pacific Heights at 9:00 AM, and they have specific people they want to meet in different locations with certain time blocks. \n\nFirst, I should look at the travel distances provided. It's a list of distances between various locations in San Francisco, which will help me figure out how long it takes to move from one place to another. Since the person wants to maximize the number of meetings, I need to schedule their day in a way that minimizes travel time between each meeting.\n\nThe constraints mention that Ronald will be at Nob Hill from 10:00 AM to 5:00 PM. Since the person arrives at Pacific Heights at 9:00 AM, they have a little time before Ronald is available. They should probably meet Ronald early to make the most of his schedule. \n\nNext, Sarah will be at Russian Hill from 7:15 AM to 9:30 AM. The person arrives at Pacific Heights at 9:00 AM, so they have about an hour and 15 minutes before Sarah leaves. They need to make sure they can get from Pacific Heights to Russian Hill within that time.\n\nHelen will be at The Castro from 1:30 PM to 5:00 PM. The person needs to plan a meeting that fits within Helen's schedule. Since she's available from 1:30 PM to 5:00 PM, the meeting should be scheduled around that time.\n\nJoshua will be at Sunset District from 2:15 PM to 7:30 PM. This gives a longer window, so the person can plan a meeting here without too many constraints.\n\nMargaret will be at Haight-Ashbury from 10:15 AM to 10:00 PM. This is a long window, so the person can meet her either in the morning or late at night, but since they want to maximize the number of meetings, it's better to meet her earlier to have more time for other meetings.\n\nNow, I need to figure out the best order to visit these locations. Starting at Pacific Heights, the person can go to Nob Hill next since Ronald is there from 10:00 AM. Then, from Nob Hill, they can go to Russian Hill to meet Sarah before she leaves at 9:30 AM. \n\nAfter meeting Sarah, the person can head to Haight-Ashbury to meet Margaret. From there, they can go to The Castro to meet Helen. Finally, they can go to Sunset District to meet Joshua before he leaves at 7:30 PM.\n\nI need to check the travel times to make sure the person can get from one location to another without exceeding the time constraints. For example, from Pacific Heights to Nob Hill is 8 minutes, which is quick. From Nob Hill to Russian Hill is 5 minutes, so they can make it to meet Sarah. From Russian Hill to Haight-Ashbury is 17 minutes, so they can meet Margaret. From Haight-Ashbury to The Castro is 6 minutes, and then to Sunset District is 15 minutes. \n\nThis schedule allows the person to meet all four friends without backtracking too much and within the time constraints. They start at Pacific Heights, move to Nob Hill, then to Russian Hill, Haight-Ashbury, The Castro, and finally Sunset District. Each meeting is timed to fit within the available windows, and the travel times are reasonable.\n\nI think this is a good plan because it maximizes the number of meetings while respecting the time constraints and minimizing travel time. It's important to check each leg of the journey to ensure the person can move smoothly from one location to another without delays. \n\nOverall, this itinerary should work well for the person to meet as many friends as possible in a single day.\n</think>\n\n```json\n{\n  \"itinerary\": [\n    {\n      \"action\": \"meet\",\n      \"location\": \"Nob Hill\",\n      \"person\": \"Ronald\",\n      \"start_time\": \"10:00\",\n      \"end_time\": \"10:45\"\n    },\n    {\n      \"action\": \"meet\",\n      \"location\": \"Russian Hill\",\n      \"person\": \"Sarah\",\n      \"start_time\": \"08:30\",\n      \"end_time\": \"09:30\"\n    },\n    {\n      \"action\": \"meet\",\n      \"location\": \"Haight-Ashbury\",\n      \"person\": \"Margaret\",\n      \"start_time\": \"09:30\",\n      \"end_time\": \"10:30\"\n    },\n    {\n      \"action\": \"meet\",\n      \"location\": \"The Castro\",\n      \"person\": \"Helen\",\n      \"start_time\": \"13:30\",\n      \"end_time\": \"14:30\"\n    },\n    {\n      \"action\": \"meet\",\n      \"location\": \"Sunset District\",\n      \"person\": \"Joshua\",\n      \"start_time\": \"15:45\",\n      \"end_time\": \"16:45\"\n    }\n  ]\n}\n```",
            "raw_model_reasoning": "Okay, so I need to help this person plan their meetings in San Francisco. They want to meet as many friends as possible, but they have some constraints. They start at Pacific Heights at 9:00 AM, and they have specific people they want to meet in different locations with certain time blocks. \n\nFirst, I should look at the travel distances provided. It's a list of distances between various locations in San Francisco, which will help me figure out how long it takes to move from one place to another. Since the person wants to maximize the number of meetings, I need to schedule their day in a way that minimizes travel time between each meeting.\n\nThe constraints mention that Ronald will be at Nob Hill from 10:00 AM to 5:00 PM. Since the person arrives at Pacific Heights at 9:00 AM, they have a little time before Ronald is available. They should probably meet Ronald early to make the most of his schedule. \n\nNext, Sarah will be at Russian Hill from 7:15 AM to 9:30 AM. The person arrives at Pacific Heights at 9:00 AM, so they have about an hour and 15 minutes before Sarah leaves. They need to make sure they can get from Pacific Heights to Russian Hill within that time.\n\nHelen will be at The Castro from 1:30 PM to 5:00 PM. The person needs to plan a meeting that fits within Helen's schedule. Since she's available from 1:30 PM to 5:00 PM, the meeting should be scheduled around that time.\n\nJoshua will be at Sunset District from 2:15 PM to 7:30 PM. This gives a longer window, so the person can plan a meeting here without too many constraints.\n\nMargaret will be at Haight-Ashbury from 10:15 AM to 10:00 PM. This is a long window, so the person can meet her either in the morning or late at night, but since they want to maximize the number of meetings, it's better to meet her earlier to have more time for other meetings.\n\nNow, I need to figure out the best order to visit these locations. Starting at Pacific Heights, the person can go to Nob Hill next since Ronald is there from 10:00 AM. Then, from Nob Hill, they can go to Russian Hill to meet Sarah before she leaves at 9:30 AM. \n\nAfter meeting Sarah, the person can head to Haight-Ashbury to meet Margaret. From there, they can go to The Castro to meet Helen. Finally, they can go to Sunset District to meet Joshua before he leaves at 7:30 PM.\n\nI need to check the travel times to make sure the person can get from one location to another without exceeding the time constraints. For example, from Pacific Heights to Nob Hill is 8 minutes, which is quick. From Nob Hill to Russian Hill is 5 minutes, so they can make it to meet Sarah. From Russian Hill to Haight-Ashbury is 17 minutes, so they can meet Margaret. From Haight-Ashbury to The Castro is 6 minutes, and then to Sunset District is 15 minutes. \n\nThis schedule allows the person to meet all four friends without backtracking too much and within the time constraints. They start at Pacific Heights, move to Nob Hill, then to Russian Hill, Haight-Ashbury, The Castro, and finally Sunset District. Each meeting is timed to fit within the available windows, and the travel times are reasonable.\n\nI think this is a good plan because it maximizes the number of meetings while respecting the time constraints and minimizing travel time. It's important to check each leg of the journey to ensure the person can move smoothly from one location to another without delays. \n\nOverall, this itinerary should work well for the person to meet as many friends as possible in a single day.\n</think>\n\n```json"
        }
    ]
}