{
    "0shot": [
        {
            "final_program_time": {
                "itinerary": [
                    {
                        "action": "meet",
                        "location": "Russian Hill",
                        "person": "Mark",
                        "start_time": "10:00",
                        "end_time": "11:15"
                    },
                    {
                        "action": "meet",
                        "location": "Mission District",
                        "person": "William",
                        "start_time": "12:30",
                        "end_time": "12:45"
                    },
                    {
                        "action": "meet",
                        "location": "Golden Gate Park",
                        "person": "Robert",
                        "start_time": "14:00",
                        "end_time": "14:30"
                    },
                    {
                        "action": "meet",
                        "location": "Sunset District",
                        "person": "Linda",
                        "start_time": "16:15",
                        "end_time": "16:45"
                    },
                    {
                        "action": "meet",
                        "location": "Haight-Ashbury",
                        "person": "Elizabeth",
                        "start_time": "17:45",
                        "end_time": "18:30"
                    },
                    {
                        "action": "meet",
                        "location": "Presidio",
                        "person": "Rebecca",
                        "start_time": "19:15",
                        "end_time": "20:15"
                    }
                ]
            },
            "expected_time": {
                "itinerary": [
                    {
                        "action": "meet",
                        "location": "Mission District",
                        "person": "William",
                        "start_time": "13:15",
                        "end_time": "13:45"
                    },
                    {
                        "action": "meet",
                        "location": "Golden Gate Park",
                        "person": "Robert",
                        "start_time": "14:15",
                        "end_time": "15:00"
                    },
                    {
                        "action": "meet",
                        "location": "Russian Hill",
                        "person": "Mark",
                        "start_time": "15:19",
                        "end_time": "16:34"
                    },
                    {
                        "action": "meet",
                        "location": "Sunset District",
                        "person": "Linda",
                        "start_time": "16:57",
                        "end_time": "17:27"
                    },
                    {
                        "action": "meet",
                        "location": "Haight-Ashbury",
                        "person": "Elizabeth",
                        "start_time": "17:42",
                        "end_time": "19:27"
                    },
                    {
                        "action": "meet",
                        "location": "Presidio",
                        "person": "Rebecca",
                        "start_time": "19:42",
                        "end_time": "20:42"
                    }
                ]
            },
            "count": "meeting_planning_example_575",
            "is_correct": false,
            "reasoning_token_count": 966,
            "raw_model_response": "Alright, let's tackle this problem step by step. I'm an AI meeting planner trying to schedule a day's worth of meetings in San Francisco for a user who wants to meet as many friends as possible. The goal is to maximize the number of meetings while considering travel times and the constraints provided.\n\nFirst, I'll start by understanding the constraints. The user arrives at The Castro at 9:00 AM. From there, they need to meet several people spread out across different locations: Presidio, Sunset District, Haight-Ashbury, Mission District, Golden Gate Park, and Russian Hill. Each meeting has a minimum time requirement, which adds complexity to the scheduling.\n\nNext, I'll look at the travel distances provided. These distances help determine the time it takes to travel between locations, which is crucial for ensuring that the user doesn't have back-to-back meetings that are too close together, causing stress or rushed arrivals.\n\nI'll begin by identifying the earliest possible meeting time. The user arrives at The Castro at 9:00 AM. The first person they can meet is Mark at Russian Hill, who is available from 10:00 AM to 11:15 AM. The travel time from The Castro to Russian Hill is 18 minutes, so the user can make it there by 10:18 AM, which fits nicely within Mark's availability. This seems like a good starting point.\n\nAfter meeting Mark, the next logical location would be Presidio, as it's close to The Castro (21 minutes away) and Rebecca is available from 6:15 PM to 8:45 PM. The user can head there after their meeting with Mark. However, 6:15 PM is quite late in the day, and the user might want to maximize the number of meetings. Alternatively, considering the travel time, it might be better to schedule meetings closer to each other to save time.\n\nLooking at other options, the Sunset District is 17 minutes from The Castro, and Linda is available from 3:30 PM to 7:45 PM. Meeting Linda could be efficient, especially since she's available for a shorter duration. The user can go from The Castro to Sunset District, meet Linda, and then proceed to other meetings.\n\nHaight-Ashbury is another option, with Elizabeth available from 5:15 PM to 7:30 PM. The travel time is 19 minutes, making it feasible. Meeting Elizabeth could be a good midpoint in the afternoon.\n\nThe Mission District is 7 minutes away, and William is available from 1:15 PM to 7:30 PM. This seems like an ideal location for a quick meeting, especially since the user can get there quickly and has a good window of time.\n\nGolden Gate Park is 11 minutes from The Castro, and Robert is available from 2:15 PM to 9:30 PM. This is another good option for an early afternoon meeting.\n\nConsidering all these options, the user needs to balance the number of meetings against the travel time and the availability of each person. Starting with the earliest possible meeting at The Castro, then moving to nearby locations, and ensuring that each meeting fits within the available time windows is key.\n\nI'll outline a possible itinerary:\n\n1. **The Castro - Mark (Russian Hill):** Start at 10:00 AM. Travel time is 18 minutes, arriving at 10:18 AM. Meet Mark until 11:15 AM.\n2. **Presidio - Rebecca:** After Mark's meeting, head to Presidio, a 21-minute travel. Rebecca is available from 6:15 PM, which is later in the day. Maybe better to schedule another meeting closer to The Castro.\n3. **Sunset District - Linda:** Go to Sunset District, 17 minutes away. Available from 3:30 PM. This could be a good afternoon meeting.\n4. **Mission District - William:** Short 7-minute trip. Available from 1:15 PM. Perfect for a quick visit.\n5. **Golden Gate Park - Robert:** 11-minute travel. Available from 2:15 PM. Good for an early afternoon meeting.\n6. **Haight-Ashbury - Elizabeth:** 19-minute travel. Available from 5:15 PM. Good for later in the day.\n\nBy scheduling meetings in this order, the user can efficiently move between locations, respecting the travel times and the availability windows of each friend. This approach maximizes the number of meetings while minimizing travel stress.\n\nFinally, I'll ensure that the itinerary is optimized for time, with each meeting spaced out enough to allow for travel without rushing. This way, the user can enjoy a productive and stress-free day of meetings.\n</think>\n\n```json\n{\n  \"itinerary\": [\n    {\n      \"action\": \"meet\",\n      \"location\": \"Russian Hill\",\n      \"person\": \"Mark\",\n      \"start_time\": \"10:00\",\n      \"end_time\": \"11:15\"\n    },\n    {\n      \"action\": \"meet\",\n      \"location\": \"Mission District\",\n      \"person\": \"William\",\n      \"start_time\": \"12:30\",\n      \"end_time\": \"12:45\"\n    },\n    {\n      \"action\": \"meet\",\n      \"location\": \"Golden Gate Park\",\n      \"person\": \"Robert\",\n      \"start_time\": \"14:00\",\n      \"end_time\": \"14:30\"\n    },\n    {\n      \"action\": \"meet\",\n      \"location\": \"Sunset District\",\n      \"person\": \"Linda\",\n      \"start_time\": \"16:15\",\n      \"end_time\": \"16:45\"\n    },\n    {\n      \"action\": \"meet\",\n      \"location\": \"Haight-Ashbury\",\n      \"person\": \"Elizabeth\",\n      \"start_time\": \"17:45\",\n      \"end_time\": \"18:30\"\n    },\n    {\n      \"action\": \"meet\",\n      \"location\": \"Presidio\",\n      \"person\": \"Rebecca\",\n      \"start_time\": \"19:15\",\n      \"end_time\": \"20:15\"\n    }\n  ]\n}\n```",
            "raw_model_reasoning": "Alright, let's tackle this problem step by step. I'm an AI meeting planner trying to schedule a day's worth of meetings in San Francisco for a user who wants to meet as many friends as possible. The goal is to maximize the number of meetings while considering travel times and the constraints provided.\n\nFirst, I'll start by understanding the constraints. The user arrives at The Castro at 9:00 AM. From there, they need to meet several people spread out across different locations: Presidio, Sunset District, Haight-Ashbury, Mission District, Golden Gate Park, and Russian Hill. Each meeting has a minimum time requirement, which adds complexity to the scheduling.\n\nNext, I'll look at the travel distances provided. These distances help determine the time it takes to travel between locations, which is crucial for ensuring that the user doesn't have back-to-back meetings that are too close together, causing stress or rushed arrivals.\n\nI'll begin by identifying the earliest possible meeting time. The user arrives at The Castro at 9:00 AM. The first person they can meet is Mark at Russian Hill, who is available from 10:00 AM to 11:15 AM. The travel time from The Castro to Russian Hill is 18 minutes, so the user can make it there by 10:18 AM, which fits nicely within Mark's availability. This seems like a good starting point.\n\nAfter meeting Mark, the next logical location would be Presidio, as it's close to The Castro (21 minutes away) and Rebecca is available from 6:15 PM to 8:45 PM. The user can head there after their meeting with Mark. However, 6:15 PM is quite late in the day, and the user might want to maximize the number of meetings. Alternatively, considering the travel time, it might be better to schedule meetings closer to each other to save time.\n\nLooking at other options, the Sunset District is 17 minutes from The Castro, and Linda is available from 3:30 PM to 7:45 PM. Meeting Linda could be efficient, especially since she's available for a shorter duration. The user can go from The Castro to Sunset District, meet Linda, and then proceed to other meetings.\n\nHaight-Ashbury is another option, with Elizabeth available from 5:15 PM to 7:30 PM. The travel time is 19 minutes, making it feasible. Meeting Elizabeth could be a good midpoint in the afternoon.\n\nThe Mission District is 7 minutes away, and William is available from 1:15 PM to 7:30 PM. This seems like an ideal location for a quick meeting, especially since the user can get there quickly and has a good window of time.\n\nGolden Gate Park is 11 minutes from The Castro, and Robert is available from 2:15 PM to 9:30 PM. This is another good option for an early afternoon meeting.\n\nConsidering all these options, the user needs to balance the number of meetings against the travel time and the availability of each person. Starting with the earliest possible meeting at The Castro, then moving to nearby locations, and ensuring that each meeting fits within the available time windows is key.\n\nI'll outline a possible itinerary:\n\n1. **The Castro - Mark (Russian Hill):** Start at 10:00 AM. Travel time is 18 minutes, arriving at 10:18 AM. Meet Mark until 11:15 AM.\n2. **Presidio - Rebecca:** After Mark's meeting, head to Presidio, a 21-minute travel. Rebecca is available from 6:15 PM, which is later in the day. Maybe better to schedule another meeting closer to The Castro.\n3. **Sunset District - Linda:** Go to Sunset District, 17 minutes away. Available from 3:30 PM. This could be a good afternoon meeting.\n4. **Mission District - William:** Short 7-minute trip. Available from 1:15 PM. Perfect for a quick visit.\n5. **Golden Gate Park - Robert:** 11-minute travel. Available from 2:15 PM. Good for an early afternoon meeting.\n6. **Haight-Ashbury - Elizabeth:** 19-minute travel. Available from 5:15 PM. Good for later in the day.\n\nBy scheduling meetings in this order, the user can efficiently move between locations, respecting the travel times and the availability windows of each friend. This approach maximizes the number of meetings while minimizing travel stress.\n\nFinally, I'll ensure that the itinerary is optimized for time, with each meeting spaced out enough to allow for travel without rushing. This way, the user can enjoy a productive and stress-free day of meetings.\n</think>\n\n```json"
        }
    ]
}