{
    "0shot": [
        {
            "final_program_time": {
                "itinerary": [
                    {
                        "action": "meet",
                        "location": "Mission District",
                        "person": "Laura",
                        "start_time": "12:15",
                        "end_time": "12:32"
                    },
                    {
                        "action": "meet",
                        "location": "Financial District",
                        "person": "Anthony",
                        "start_time": "12:32",
                        "end_time": "14:45"
                    }
                ]
            },
            "expected_time": {
                "itinerary": [
                    {
                        "action": "meet",
                        "location": "Mission District",
                        "person": "Laura",
                        "start_time": "12:15",
                        "end_time": "13:30"
                    },
                    {
                        "action": "meet",
                        "location": "Financial District",
                        "person": "Anthony",
                        "start_time": "13:47",
                        "end_time": "14:17"
                    }
                ]
            },
            "count": "meeting_planning_example_144",
            "is_correct": false,
            "reasoning_token_count": 1044,
            "raw_model_response": "Alright, let's dive into this problem. I'm an AI meeting planner trying to help someone optimize their schedule to meet as many friends as possible in San Francisco. The user has provided a series of travel distances between various locations and specific constraints for each meeting. My goal is to create an efficient itinerary that allows the user to meet the maximum number of friends without exceeding time limits or travel distances.\n\nFirst, I'll need to understand the travel distances provided. It looks like the distances are between different neighborhoods, which helps me plan the best routes between locations. Each meeting has a start and end time, so I need to ensure that travel times between meetings are accounted for and that the user doesn't have back-to-back meetings that are too close.\n\nNext, I'll look at the constraints. The user arrives at a specific location, and each friend has their own availability window. My task is to align the user's schedule with these windows, considering the travel times between locations.\n\nFor this particular problem, the user is starting at The Castro and needs to meet Laura in the Mission District, followed by Anthony in the Financial District. I need to find the most efficient order of meetings, considering the travel times between these locations.\n\nI'll start by calculating the travel time from The Castro to the Mission District. According to the provided distances, The Castro to Mission District is 7 minutes. That's a quick trip. Laura is available from 12:15PM to 7:45PM, so the earliest the user can meet her is at 12:15PM.\n\nAfter meeting Laura, the user needs to travel to the Financial District to meet Anthony. The travel time from Mission District to Financial District is 17 minutes. Anthony is available from 12:30PM to 2:45PM. However, the user would arrive at 12:32PM, which is within Anthony's availability window. But there's a catch: the user needs to leave Laura's meeting by 12:32PM to reach Anthony on time. That leaves only about 2 minutes between meetings, which isn't enough for a comfortable transition. \n\nTo address this, I need to adjust the schedule. Maybe the user can meet Laura a bit later to allow time for travel and meeting Anthony. Alternatively, perhaps the user can prioritize one meeting over the other based on the constraints.\n\nWait, the user's goal is to meet as many friends as possible. If the user can't meet both Laura and Anthony due to tight scheduling, they might need to choose one. But the user might prefer to meet Laura first since she has a later availability window. Alternatively, maybe there's a more optimal route or a way to rearrange the meetings.\n\nLet me consider the alternative: meeting Anthony first. The user can travel from The Castro to Financial District, which is 23 minutes. If they leave The Castro at 12:00PM, they'll arrive at 12:23PM, which is within Anthony's 12:30PM start time. After meeting Anthony until 2:45PM, the user can then travel to the Mission District, which takes 17 minutes, arriving at 3:02PM. Laura is available until 7:45PM, so there's a significant gap. This allows the user to meet Laura without rushing.\n\nHowever, the user might prefer to meet Laura first due to her longer availability window. In that case, meeting Laura at 12:15PM and then trying to squeeze in Anthony's meeting might be challenging. The user would need to leave Laura's meeting at 12:15PM, travel 17 minutes to the Financial District, and arrive by 12:32PM, but Anthony's meeting starts at 12:30PM. That's doable if the user can adjust their schedule slightly, perhaps by leaving Laura's meeting a few minutes early.\n\nAlternatively, if the user can't make both meetings due to time constraints, they might need to prioritize one over the other. But the user's goal is to meet as many friends as possible, so ideally, they'd meet both.\n\nI think the optimal schedule would be:\n\n1. Meet Laura at Mission District at 12:15PM.\n2. Travel to Financial District, arriving at 12:32PM to meet Anthony until 2:45PM.\n3. After meeting Anthony, the user has the rest of the day free to meet other friends if possible.\n\nThis way, the user meets both Laura and Anthony, fitting within their availability windows and travel times.\n\nHowever, if the user prefers to meet Anthony first, the schedule would be:\n\n1. Meet Anthony at Financial District at 12:23PM.\n2. Travel to Mission District, arriving at 3:02PM to meet Laura until 7:45PM.\n\nThis also works and allows the user to meet both friends, but it changes the order based on the user's preferences.\n\nIn conclusion, the best approach is to meet Laura first, allowing for a smooth transition to Anthony's meeting, ensuring the user doesn't miss either friend. This schedule maximizes the number of friends met within the given constraints.\n</think>\n\n```json\n{\n  \"itinerary\": [\n    {\n      \"action\": \"meet\",\n      \"location\": \"Mission District\",\n      \"person\": \"Laura\",\n      \"start_time\": \"12:15\",\n      \"end_time\": \"12:32\"\n    },\n    {\n      \"action\": \"meet\",\n      \"location\": \"Financial District\",\n      \"person\": \"Anthony\",\n      \"start_time\": \"12:32\",\n      \"end_time\": \"14:45\"\n    }\n  ]\n}\n```",
            "raw_model_reasoning": "Alright, let's dive into this problem. I'm an AI meeting planner trying to help someone optimize their schedule to meet as many friends as possible in San Francisco. The user has provided a series of travel distances between various locations and specific constraints for each meeting. My goal is to create an efficient itinerary that allows the user to meet the maximum number of friends without exceeding time limits or travel distances.\n\nFirst, I'll need to understand the travel distances provided. It looks like the distances are between different neighborhoods, which helps me plan the best routes between locations. Each meeting has a start and end time, so I need to ensure that travel times between meetings are accounted for and that the user doesn't have back-to-back meetings that are too close.\n\nNext, I'll look at the constraints. The user arrives at a specific location, and each friend has their own availability window. My task is to align the user's schedule with these windows, considering the travel times between locations.\n\nFor this particular problem, the user is starting at The Castro and needs to meet Laura in the Mission District, followed by Anthony in the Financial District. I need to find the most efficient order of meetings, considering the travel times between these locations.\n\nI'll start by calculating the travel time from The Castro to the Mission District. According to the provided distances, The Castro to Mission District is 7 minutes. That's a quick trip. Laura is available from 12:15PM to 7:45PM, so the earliest the user can meet her is at 12:15PM.\n\nAfter meeting Laura, the user needs to travel to the Financial District to meet Anthony. The travel time from Mission District to Financial District is 17 minutes. Anthony is available from 12:30PM to 2:45PM. However, the user would arrive at 12:32PM, which is within Anthony's availability window. But there's a catch: the user needs to leave Laura's meeting by 12:32PM to reach Anthony on time. That leaves only about 2 minutes between meetings, which isn't enough for a comfortable transition. \n\nTo address this, I need to adjust the schedule. Maybe the user can meet Laura a bit later to allow time for travel and meeting Anthony. Alternatively, perhaps the user can prioritize one meeting over the other based on the constraints.\n\nWait, the user's goal is to meet as many friends as possible. If the user can't meet both Laura and Anthony due to tight scheduling, they might need to choose one. But the user might prefer to meet Laura first since she has a later availability window. Alternatively, maybe there's a more optimal route or a way to rearrange the meetings.\n\nLet me consider the alternative: meeting Anthony first. The user can travel from The Castro to Financial District, which is 23 minutes. If they leave The Castro at 12:00PM, they'll arrive at 12:23PM, which is within Anthony's 12:30PM start time. After meeting Anthony until 2:45PM, the user can then travel to the Mission District, which takes 17 minutes, arriving at 3:02PM. Laura is available until 7:45PM, so there's a significant gap. This allows the user to meet Laura without rushing.\n\nHowever, the user might prefer to meet Laura first due to her longer availability window. In that case, meeting Laura at 12:15PM and then trying to squeeze in Anthony's meeting might be challenging. The user would need to leave Laura's meeting at 12:15PM, travel 17 minutes to the Financial District, and arrive by 12:32PM, but Anthony's meeting starts at 12:30PM. That's doable if the user can adjust their schedule slightly, perhaps by leaving Laura's meeting a few minutes early.\n\nAlternatively, if the user can't make both meetings due to time constraints, they might need to prioritize one over the other. But the user's goal is to meet as many friends as possible, so ideally, they'd meet both.\n\nI think the optimal schedule would be:\n\n1. Meet Laura at Mission District at 12:15PM.\n2. Travel to Financial District, arriving at 12:32PM to meet Anthony until 2:45PM.\n3. After meeting Anthony, the user has the rest of the day free to meet other friends if possible.\n\nThis way, the user meets both Laura and Anthony, fitting within their availability windows and travel times.\n\nHowever, if the user prefers to meet Anthony first, the schedule would be:\n\n1. Meet Anthony at Financial District at 12:23PM.\n2. Travel to Mission District, arriving at 3:02PM to meet Laura until 7:45PM.\n\nThis also works and allows the user to meet both friends, but it changes the order based on the user's preferences.\n\nIn conclusion, the best approach is to meet Laura first, allowing for a smooth transition to Anthony's meeting, ensuring the user doesn't miss either friend. This schedule maximizes the number of friends met within the given constraints.\n</think>\n\n```json"
        }
    ]
}