{
    "0shot": [
        {
            "final_program_time": {
                "itinerary": [
                    {
                        "action": "meet",
                        "location": "Presidio",
                        "person": "Kenneth",
                        "start_time": "9:15",
                        "end_time": "9:45"
                    },
                    {
                        "action": "meet",
                        "location": "North Beach",
                        "person": "Sandra",
                        "start_time": "9:45",
                        "end_time": "10:00"
                    },
                    {
                        "action": "meet",
                        "location": "Golden Gate Park",
                        "person": "Anthony",
                        "start_time": "10:15",
                        "end_time": "10:45"
                    },
                    {
                        "action": "meet",
                        "location": "Fisherman's Wharf",
                        "person": "Joseph",
                        "start_time": "10:45",
                        "end_time": "11:15"
                    },
                    {
                        "action": "meet",
                        "location": "Embarcadero",
                        "person": "Barbara",
                        "start_time": "11:15",
                        "end_time": "11:45"
                    },
                    {
                        "action": "meet",
                        "location": "Union Square",
                        "person": "William",
                        "start_time": "11:45",
                        "end_time": "12:15"
                    },
                    {
                        "action": "meet",
                        "location": "Nob Hill",
                        "person": "Elizabeth",
                        "start_time": "12:45",
                        "end_time": "13:30"
                    },
                    {
                        "action": "meet",
                        "location": "Richmond District",
                        "person": "Stephanie",
                        "start_time": "13:30",
                        "end_time": "14:15"
                    },
                    {
                        "action": "meet",
                        "location": "Financial District",
                        "person": "Carol",
                        "start_time": "14:15",
                        "end_time": "14:45"
                    }
                ]
            },
            "expected_time": {
                "itinerary": [
                    {
                        "action": "meet",
                        "location": "Union Square",
                        "person": "William",
                        "start_time": "10:45",
                        "end_time": "11:30"
                    },
                    {
                        "action": "meet",
                        "location": "North Beach",
                        "person": "Sandra",
                        "start_time": "11:40",
                        "end_time": "11:55"
                    },
                    {
                        "action": "meet",
                        "location": "Nob Hill",
                        "person": "Elizabeth",
                        "start_time": "12:15",
                        "end_time": "14:00"
                    },
                    {
                        "action": "meet",
                        "location": "Financial District",
                        "person": "Carol",
                        "start_time": "14:09",
                        "end_time": "15:09"
                    },
                    {
                        "action": "meet",
                        "location": "Golden Gate Park",
                        "person": "Anthony",
                        "start_time": "15:32",
                        "end_time": "16:47"
                    },
                    {
                        "action": "meet",
                        "location": "Richmond District",
                        "person": "Stephanie",
                        "start_time": "16:54",
                        "end_time": "18:09"
                    },
                    {
                        "action": "meet",
                        "location": "Embarcadero",
                        "person": "Barbara",
                        "start_time": "19:15",
                        "end_time": "20:30"
                    },
                    {
                        "action": "meet",
                        "location": "Presidio",
                        "person": "Kenneth",
                        "start_time": "21:15",
                        "end_time": "22:00"
                    }
                ]
            },
            "count": "meeting_planning_example_828",
            "is_correct": false,
            "reasoning_token_count": 1044,
            "raw_model_response": "Alright, let's tackle this problem. I need to schedule a day of meetings in San Francisco, starting at Marina District at 9:00 AM. My goal is to meet as many friends as possible, so I need to plan the meetings efficiently, considering travel times and constraints.\n\nFirst, I'll list the travel distances provided:\n\n- Marina District to Richmond District: 11 minutes.\n- Marina District to Union Square: 16 minutes.\n- Marina District to Nob Hill: 12 minutes.\n- Marina District to Fisherman's Wharf: 10 minutes.\n- Marina District to Golden Gate Park: 18 minutes.\n- Marina District to Embarcadero: 14 minutes.\n- Marina District to Financial District: 17 minutes.\n- Marina District to North Beach: 11 minutes.\n- Marina District to Presidio: 10 minutes.\n\nNow, looking at the constraints:\n\n1. **Stephanie** will be at Richmond District from 4:15 PM to 9:30 PM. Need at least 75 minutes with her.\n2. **William** will be at Union Square from 10:45 AM to 5:30 PM. Need 45 minutes.\n3. **Elizabeth** will be at Nob Hill from 12:15 PM to 3:00 PM. Need 105 minutes.\n4. **Joseph** will be at Fisherman's Wharf from 12:45 PM to 2:00 PM. Need 75 minutes.\n5. **Anthony** will be at Golden Gate Park from 1:00 PM to 8:30 PM. Need 75 minutes.\n6. **Barbara** will be at Embarcadero from 7:15 PM to 8:30 PM. Need 75 minutes.\n7. **Carol** will be at Financial District from 11:45 AM to 4:15 PM. Need 60 minutes.\n8. **Sandra** will be at North Beach from 10:00 AM to 12:30 PM. Need 15 minutes.\n9. **Kenneth** will be at Presidio from 9:15 PM to 10:15 PM. Need 45 minutes.\n\nConsidering these constraints, I need to ensure that I have enough time to meet each person without rushing or cutting short any meeting.\n\nStarting at Marina District at 9:00 AM, my first move should be to Presidio to meet Kenneth. Presidio is 10 minutes away. From Presidio, I can then head to North Beach to meet Sandra, which is 17 minutes from Presidio.\n\nAfter meeting Sandra, I can go to Golden Gate Park to meet Anthony, which is 18 minutes from North Beach.\n\nFrom Golden Gate Park, I'll travel to Fisherman's Wharf to meet Joseph, a 25-minute trip.\n\nFrom Fisherman's Wharf, I'll head to Embarcadero to meet Barbara, 8 minutes away.\n\nFrom Embarcadero, I'll travel to Union Square to meet William, 10 minutes from Embarcadero.\n\nFrom Union Square, I'll go to Nob Hill to meet Elizabeth, 9 minutes from Union Square.\n\nFrom Nob Hill, I'll travel to Richmond District to meet Stephanie, 14 minutes from Nob Hill.\n\nFinally, I'll head to Financial District to meet Carol, 20 minutes from Richmond District.\n\nI need to ensure that each meeting starts and ends within the required times. For example, meeting Kenneth at Presidio from 9:15 AM to 9:45 AM gives me enough time to proceed to North Beach for Sandra.\n\nI also need to check if any adjustments are needed if a meeting is running too long, but this initial plan seems feasible.\n\nFinal itinerary:\n\n1. **Presidio** to meet Kenneth from 9:15 AM to 9:45 AM.\n2. **North Beach** to meet Sandra from 9:45 AM to 10:00 AM.\n3. **Golden Gate Park** to meet Anthony from 10:15 AM to 10:45 AM.\n4. **Fisherman's Wharf** to meet Joseph from 10:45 AM to 11:15 AM.\n5. **Embarcadero** to meet Barbara from 11:15 AM to 11:45 AM.\n6. **Union Square** to meet William from 11:45 AM to 12:15 PM.\n7. **Nob Hill** to meet Elizabeth from 12:45 PM to 1:30 PM.\n8. **Richmond District** to meet Stephanie from 1:30 PM to 2:15 PM.\n9. **Financial District** to meet Carol from 2:45 PM to 3:15 PM.\n\nThis schedule allows me to meet each friend within the required time frames, considering travel distances and the constraints provided. I should double-check each travel time to ensure I have enough time between meetings and that I don't exceed any meeting durations.\n\nOverall, this plan seems efficient and allows me to meet all the friends I want to see within the day.\n```json\n{\n  \"itinerary\": [\n    {\n      \"action\": \"meet\",\n      \"location\": \"Presidio\",\n      \"person\": \"Kenneth\",\n      \"start_time\": \"09:15\",\n      \"end_time\": \"09:45\"\n    },\n    {\n      \"action\": \"meet\",\n      \"location\": \"North Beach\",\n      \"person\": \"Sandra\",\n      \"start_time\": \"09:45\",\n      \"end_time\": \"10:00\"\n    },\n    {\n      \"action\": \"meet\",\n      \"location\": \"Golden Gate Park\",\n      \"person\": \"Anthony\",\n      \"start_time\": \"10:15\",\n      \"end_time\": \"10:45\"\n    },\n    {\n      \"action\": \"meet\",\n      \"location\": \"Fisherman's Wharf\",\n      \"person\": \"Joseph\",\n      \"start_time\": \"10:45\",\n      \"end_time\": \"11:15\"\n    },\n    {\n      \"action\": \"meet\",\n      \"location\": \"Embarcadero\",\n      \"person\": \"Barbara\",\n      \"start_time\": \"11:15\",\n      \"end_time\": \"11:45\"\n    },\n    {\n      \"action\": \"meet\",\n      \"location\": \"Union Square\",\n      \"person\": \"William\",\n      \"start_time\": \"11:45\",\n      \"end_time\": \"12:15\"\n    },\n    {\n      \"action\": \"meet\",\n      \"location\": \"Nob Hill\",\n      \"person\": \"Elizabeth\",\n      \"start_time\": \"12:45\",\n      \"end_time\": \"13:30\"\n    },\n    {\n      \"action\": \"meet\",\n      \"location\": \"Richmond District\",\n      \"person\": \"Stephanie\",\n      \"start_time\": \"13:30\",\n      \"end_time\": \"14:15\"\n    },\n    {\n      \"action\": \"meet\",\n      \"location\": \"Financial District\",\n      \"person\": \"Carol\",\n      \"start_time\": \"14:15\",\n      \"end_time\": \"14:45\"\n    }\n  ]\n}\n```",
            "raw_model_reasoning": "Alright, let's tackle this problem. I need to schedule a day of meetings in San Francisco, starting at Marina District at 9:00 AM. My goal is to meet as many friends as possible, so I need to plan the meetings efficiently, considering travel times and constraints.\n\nFirst, I'll list the travel distances provided:\n\n- Marina District to Richmond District: 11 minutes.\n- Marina District to Union Square: 16 minutes.\n- Marina District to Nob Hill: 12 minutes.\n- Marina District to Fisherman's Wharf: 10 minutes.\n- Marina District to Golden Gate Park: 18 minutes.\n- Marina District to Embarcadero: 14 minutes.\n- Marina District to Financial District: 17 minutes.\n- Marina District to North Beach: 11 minutes.\n- Marina District to Presidio: 10 minutes.\n\nNow, looking at the constraints:\n\n1. **Stephanie** will be at Richmond District from 4:15 PM to 9:30 PM. Need at least 75 minutes with her.\n2. **William** will be at Union Square from 10:45 AM to 5:30 PM. Need 45 minutes.\n3. **Elizabeth** will be at Nob Hill from 12:15 PM to 3:00 PM. Need 105 minutes.\n4. **Joseph** will be at Fisherman's Wharf from 12:45 PM to 2:00 PM. Need 75 minutes.\n5. **Anthony** will be at Golden Gate Park from 1:00 PM to 8:30 PM. Need 75 minutes.\n6. **Barbara** will be at Embarcadero from 7:15 PM to 8:30 PM. Need 75 minutes.\n7. **Carol** will be at Financial District from 11:45 AM to 4:15 PM. Need 60 minutes.\n8. **Sandra** will be at North Beach from 10:00 AM to 12:30 PM. Need 15 minutes.\n9. **Kenneth** will be at Presidio from 9:15 PM to 10:15 PM. Need 45 minutes.\n\nConsidering these constraints, I need to ensure that I have enough time to meet each person without rushing or cutting short any meeting.\n\nStarting at Marina District at 9:00 AM, my first move should be to Presidio to meet Kenneth. Presidio is 10 minutes away. From Presidio, I can then head to North Beach to meet Sandra, which is 17 minutes from Presidio.\n\nAfter meeting Sandra, I can go to Golden Gate Park to meet Anthony, which is 18 minutes from North Beach.\n\nFrom Golden Gate Park, I'll travel to Fisherman's Wharf to meet Joseph, a 25-minute trip.\n\nFrom Fisherman's Wharf, I'll head to Embarcadero to meet Barbara, 8 minutes away.\n\nFrom Embarcadero, I'll travel to Union Square to meet William, 10 minutes from Embarcadero.\n\nFrom Union Square, I'll go to Nob Hill to meet Elizabeth, 9 minutes from Union Square.\n\nFrom Nob Hill, I'll travel to Richmond District to meet Stephanie, 14 minutes from Nob Hill.\n\nFinally, I'll head to Financial District to meet Carol, 20 minutes from Richmond District.\n\nI need to ensure that each meeting starts and ends within the required times. For example, meeting Kenneth at Presidio from 9:15 AM to 9:45 AM gives me enough time to proceed to North Beach for Sandra.\n\nI also need to check if any adjustments are needed if a meeting is running too long, but this initial plan seems feasible.\n\nFinal itinerary:\n\n1. **Presidio** to meet Kenneth from 9:15 AM to 9:45 AM.\n2. **North Beach** to meet Sandra from 9:45 AM to 10:00 AM.\n3. **Golden Gate Park** to meet Anthony from 10:15 AM to 10:45 AM.\n4. **Fisherman's Wharf** to meet Joseph from 10:45 AM to 11:15 AM.\n5. **Embarcadero** to meet Barbara from 11:15 AM to 11:45 AM.\n6. **Union Square** to meet William from 11:45 AM to 12:15 PM.\n7. **Nob Hill** to meet Elizabeth from 12:45 PM to 1:30 PM.\n8. **Richmond District** to meet Stephanie from 1:30 PM to 2:15 PM.\n9. **Financial District** to meet Carol from 2:45 PM to 3:15 PM.\n\nThis schedule allows me to meet each friend within the required time frames, considering travel distances and the constraints provided. I should double-check each travel time to ensure I have enough time between meetings and that I don't exceed any meeting durations.\n\nOverall, this plan seems efficient and allows me to meet all the friends I want to see within the day.\n```json"
        }
    ]
}