{
    "0shot": [
        {
            "final_program_time": {
                "itinerary": [
                    {
                        "action": "meet",
                        "location": "Fisherman's Wharf",
                        "person": "Robert",
                        "start_time": "10:00",
                        "end_time": "10:15"
                    },
                    {
                        "action": "meet",
                        "location": "Pacific Heights",
                        "person": "Sandra",
                        "start_time": "10:30",
                        "end_time": "6:30"
                    },
                    {
                        "action": "meet",
                        "location": "Marina District",
                        "person": "Kenneth",
                        "start_time": "12:00",
                        "end_time": "12:45"
                    },
                    {
                        "action": "meet",
                        "location": "Sunset District",
                        "person": "Kimberly",
                        "start_time": "12:45",
                        "end_time": "4:45"
                    },
                    {
                        "action": "meet",
                        "location": "Mission District",
                        "person": "Elizabeth",
                        "start_time": "4:45",
                        "end_time": "7:45"
                    },
                    {
                        "action": "meet",
                        "location": "Bayview",
                        "person": "Thomas",
                        "start_time": "7:45",
                        "end_time": "8:15"
                    },
                    {
                        "action": "meet",
                        "location": "Richmond District",
                        "person": "Melissa",
                        "start_time": "8:15",
                        "end_time": "8:30"
                    },
                    {
                        "action": "meet",
                        "location": "Golden Gate Park",
                        "person": "Amanda",
                        "start_time": "8:30",
                        "end_time": "8:45"
                    }
                ]
            },
            "expected_time": {
                "itinerary": [
                    {
                        "action": "meet",
                        "location": "Pacific Heights",
                        "person": "Sandra",
                        "start_time": "9:12",
                        "end_time": "11:12"
                    },
                    {
                        "action": "meet",
                        "location": "Fisherman's Wharf",
                        "person": "Robert",
                        "start_time": "11:25",
                        "end_time": "11:40"
                    },
                    {
                        "action": "meet",
                        "location": "Marina District",
                        "person": "Kenneth",
                        "start_time": "11:49",
                        "end_time": "12:34"
                    },
                    {
                        "action": "meet",
                        "location": "Mission District",
                        "person": "Elizabeth",
                        "start_time": "12:54",
                        "end_time": "14:24"
                    },
                    {
                        "action": "meet",
                        "location": "Union Square",
                        "person": "David",
                        "start_time": "15:15",
                        "end_time": "16:00"
                    },
                    {
                        "action": "meet",
                        "location": "Sunset District",
                        "person": "Kimberly",
                        "start_time": "16:27",
                        "end_time": "18:12"
                    },
                    {
                        "action": "meet",
                        "location": "Golden Gate Park",
                        "person": "Amanda",
                        "start_time": "18:23",
                        "end_time": "18:38"
                    },
                    {
                        "action": "meet",
                        "location": "Richmond District",
                        "person": "Melissa",
                        "start_time": "18:45",
                        "end_time": "19:00"
                    },
                    {
                        "action": "meet",
                        "location": "Bayview",
                        "person": "Thomas",
                        "start_time": "19:30",
                        "end_time": "20:00"
                    }
                ]
            },
            "count": "meeting_planning_example_867",
            "is_correct": false,
            "reasoning_token_count": 5610,
            "raw_model_response": "Alright, so I'm trying to help this user who's an AI meeting planner. They need to schedule a day of meetings in San Francisco, starting from Haight-Ashbury at 9:00 AM. The goal is to meet as many friends as possible, considering travel times and constraints. \n\nFirst, I need to look at the travel distances provided. They're all in minutes, which helps with planning. The locations involved are Haight-Ashbury, Mission District, Union Square, Pacific Heights, Bayview, Fisherman's Wharf, Marina District, Richmond District, Sunset District, and Golden Gate Park. \n\nThe constraints are that the user arrives at Haight-Ashbury at 9:00 AM. Each friend has specific time slots where they're available at certain locations. The user wants to meet each for a minimum time, so I need to ensure that each meeting is scheduled within their availability and that the travel time is manageable.\n\nLet me list out the friends and their availability:\n\n1. Elizabeth is at Mission District from 10:30 AM to 8:00 PM. Need at least 90 minutes.\n2. David is at Union Square from 3:15 PM to 7:00 PM. At least 45 minutes.\n3. Sandra is at Pacific Heights from 7:00 AM to 8:00 PM. At least 120 minutes.\n4. Thomas is at Bayview from 7:30 PM to 8:30 PM. At least 30 minutes.\n5. Robert is at Fisherman's Wharf from 10:00 AM to 3:00 PM. At least 15 minutes.\n6. Kenneth is at Marina District from 10:45 AM to 1:00 PM. At least 45 minutes.\n7. Melissa is at Richmond District from 6:15 PM to 8:00 PM. At least 15 minutes.\n8. Kimberly is at Sunset District from 10:15 AM to 6:15 PM. At least 105 minutes.\n9. Amanda is at Golden Gate Park from 7:45 AM to 6:45 PM. At least 15 minutes.\n\nI need to start from Haight-Ashbury, so the first meeting should be someone nearby or within a reasonable travel time. Let's see, the first available time is 9:00 AM, but the earliest any friend is available is Elizabeth at 10:30 AM in the Mission District.\n\nHaight-Ashbury to Mission District is 11 minutes, which is manageable. So meeting Elizabeth first makes sense. But wait, Elizabeth's availability starts at 10:30 AM, so we can meet her at 10:30 AM, but the user arrives at 9:00 AM. So maybe the user can start their day by going to Haight-Ashbury, then move to Mission District right away.\n\nBut wait, the user is already at Haight-Ashbury at 9:00 AM. So maybe the first meeting can be someone nearby. Let me check the travel times from Haight-Ashbury to other locations. \n\nLooking at the travel distances, Haight-Ashbury to Mission District is 11 minutes. To Pacific Heights, it's 12 minutes. To Bayview, it's 18 minutes. To Fisherman's Wharf, 23 minutes. To Marina District, 17 minutes. To Richmond District, 10 minutes. To Sunset District, 15 minutes. To Golden Gate Park, 7 minutes.\n\nSo the closest is Richmond District, only 10 minutes away. Let's see who's available early. Robert is at Fisherman's Wharf from 10:00 AM, which is 23 minutes away. That's a bit far. Amanda is at Golden Gate Park from 7:45 AM, which is 7 minutes away. That's the closest and earliest.\n\nWait, Amanda is available from 7:45 AM to 6:45 PM, so meeting her first at 7:45 AM would be ideal, but the user arrives at Haight-Ashbury at 9:00 AM. So maybe the user can go to Golden Gate Park after 9:00 AM.\n\nAlternatively, perhaps the user can start with someone nearby and then proceed to others. Let me think about the time constraints.\n\nLet me list the possible meeting times:\n\n- Amanda at Golden Gate Park from 7:45 AM to 6:45 PM. So the earliest is 7:45 AM, but the user arrives at 9:00 AM. So perhaps 9:00 AM is too late to meet her, as she's available until 6:45 PM.\n\nWait, no, the user arrives at Haight-Ashbury at 9:00 AM, so they can go to Golden Gate Park at 9:00 AM, which is 7 minutes away. Amanda is available until 6:45 PM, so meeting her at 9:00 AM is possible, but the user would have to leave before 6:45 PM. However, the user might want to meet others as well.\n\nAlternatively, perhaps the user can meet Amanda at 9:00 AM, then go to another location. But Amanda's meeting is only 15 minutes, so that's not enough time. So maybe it's better to meet her later when there's more time.\n\nWait, the user's goal is to meet as many friends as possible, so perhaps it's better to prioritize friends who are available earlier or closer.\n\nLet me consider the friends:\n\n- Elizabeth is available from 10:30 AM to 8:00 PM. Needs 90 minutes. Meeting her later might be possible.\n- David is available from 3:15 PM to 7:00 PM. Needs 45 minutes.\n- Sandra is available from 7:00 AM to 8:00 PM. Needs 120 minutes. That's a long time, so meeting her later would be better.\n- Thomas is available from 7:30 PM to 8:30 PM. Needs 30 minutes.\n- Robert is available from 10:00 AM to 3:00 PM. Needs 15 minutes.\n- Kenneth is available from 10:45 AM to 1:00 PM. Needs 45 minutes.\n- Melissa is available from 6:15 PM to 8:00 PM. Needs 15 minutes.\n- Kimberly is available from 10:15 AM to 6:15 PM. Needs 105 minutes.\n- Amanda is available from 7:45 AM to 6:45 PM. Needs 15 minutes.\n\nSo, the earliest possible meetings are Robert at 10:00 AM (Fisherman's Wharf, 23 minutes away) and Kenneth at 10:15 AM (Marina District, 27 minutes away from Haight-Ashbury). Amanda is available from 7:45 AM, but the user arrives at 9:00 AM, so perhaps 9:00 AM is too late to meet her.\n\nWait, Haight-Ashbury to Golden Gate Park is 7 minutes. So the user can go to Golden Gate Park at 9:00 AM, meet Amanda for 15 minutes until 9:15 AM, then go to another location.\n\nAlternatively, the user could meet Robert at 10:00 AM, which is 23 minutes away. That's a bit far, but manageable.\n\nAlternatively, maybe meeting Kenneth at Marina District, which is 27 minutes away, but he's available from 10:45 AM to 1:00 PM. So the user could go to Marina District at 10:45 AM, meeting Kenneth for 45 minutes until 11:30 AM.\n\nBut perhaps it's better to meet someone closer first.\n\nWait, the user is at Haight-Ashbury. Let me see the travel times:\n\n- Haight-Ashbury to Richmond District: 10 minutes.\n- Haight-Ashbury to Golden Gate Park: 7 minutes.\n- Haight-Ashbury to Mission District: 11 minutes.\n- Haight-Ashbury to Pacific Heights: 12 minutes.\n- Haight-Ashbury to Bayview: 18 minutes.\n- Haight-Ashbury to Fisherman's Wharf: 23 minutes.\n- Haight-Ashbury to Marina District: 17 minutes.\n- Haight-Ashbury to Sunset District: 15 minutes.\n\nSo the closest is Richmond District at 10 minutes, then Golden Gate Park at 7 minutes, then Mission District at 11 minutes.\n\nSo perhaps the user can start by meeting Amanda at Golden Gate Park at 9:00 AM, then go to Richmond District to meet someone else.\n\nBut Amanda is only available for 15 minutes, so after 9:15 AM, the user needs to leave. So maybe that's not efficient.\n\nAlternatively, the user can go to Richmond District first, which is 10 minutes away, and meet someone there. Let's see who's available early.\n\nLooking at the friends:\n\n- Robert is at Fisherman's Wharf from 10:00 AM to 3:00 PM. Needs 15 minutes.\n- Kenneth is at Marina District from 10:45 AM to 1:00 PM. Needs 45 minutes.\n- Elizabeth is at Mission District from 10:30 AM to 8:00 PM. Needs 90 minutes.\n- David is at Union Square from 3:15 PM to 7:00 PM. Needs 45 minutes.\n- Sandra is at Pacific Heights from 7:00 AM to 8:00 PM. Needs 120 minutes.\n- Thomas is at Bayview from 7:30 PM to 8:30 PM. Needs 30 minutes.\n- Melissa is at Richmond District from 6:15 PM to 8:00 PM. Needs 15 minutes.\n- Kimberly is at Sunset District from 10:15 AM to 6:15 PM. Needs 105 minutes.\n- Amanda is at Golden Gate Park from 7:45 AM to 6:45 PM. Needs 15 minutes.\n\nSo, the earliest available friend is Robert at Fisherman's Wharf at 10:00 AM, which is 23 minutes away from Haight-Ashbury. Alternatively, Kenneth is at Marina District from 10:45 AM, 27 minutes away.\n\nAlternatively, Elizabeth is at Mission District from 10:30 AM, 11 minutes away.\n\nSo perhaps the user can meet Elizabeth at 10:30 AM in Mission District. Then, from there, go to another location.\n\nBut let's see the travel times from Mission District to other places:\n\nFrom Mission District, the user can go to Haight-Ashbury (12 minutes), Union Square (14 minutes), Pacific Heights (16 minutes), Bayview (14 minutes), Fisherman's Wharf (22 minutes), Marina District (19 minutes), Richmond District (20 minutes), Sunset District (24 minutes), Golden Gate Park (17 minutes).\n\nSo after meeting Elizabeth, the user can go to another location.\n\nAlternatively, meeting Robert at Fisherman's Wharf at 10:00 AM, then go to another location.\n\nBut the user arrives at Haight-Ashbury at 9:00 AM, so to get to Fisherman's Wharf by 10:00 AM, they need to leave Haight-Ashbury by 9:30 AM, which is 23 minutes away. That's doable.\n\nSo maybe the plan is:\n\n1. Meet Robert at Fisherman's Wharf from 10:00 AM to 10:15 AM.\n\nThen, from there, go to another location. The travel time from Fisherman's Wharf to, say, Marina District is 9 minutes. Marina District is where Kenneth is from 10:45 AM to 1:00 PM. So if the user leaves Fisherman's Wharf at 10:15 AM, they can arrive at Marina District by 10:24 AM, but Kenneth is only available from 10:45 AM. So that's too early. Alternatively, the user can wait at Marina District until 10:45 AM.\n\nSo meeting Kenneth from 10:45 AM to 11:30 AM.\n\nThen, from Marina District, go to another location. Maybe Sunset District, where Kimberly is from 10:15 AM to 6:15 PM. But Kimberly is available until 6:15 PM, and the user needs to meet her for 105 minutes. So that's a long time. Maybe better to meet her later.\n\nAlternatively, from Marina District, go to Golden Gate Park, where Amanda is from 7:45 AM to 6:45 PM. But Amanda is already available, but the user needs to meet her for 15 minutes.\n\nAlternatively, go to Union Square, where David is from 3:15 PM to 7:00 PM. But that's later in the day.\n\nAlternatively, go to Pacific Heights, where Sandra is from 7:00 AM to 8:00 PM. Needs 120 minutes. That's a long time, but Sandra is available all day.\n\nSo perhaps after meeting Kenneth, the user can go to Pacific Heights to meet Sandra for 120 minutes, starting at 12:00 PM.\n\nBut let's see the travel time from Marina District to Pacific Heights: 7 minutes. So from Marina District, leave at 11:30 AM, arrive at Pacific Heights by 11:37 AM. Sandra is available until 8:00 PM, so meeting her from 11:37 AM to 6:37 PM would give 5 hours and 57 minutes, which is more than the required 120 minutes.\n\nAlternatively, maybe it's better to meet Sandra earlier. But she's available from 7:00 AM, but the user can't get to Pacific Heights that early because they're starting from Haight-Ashbury at 9:00 AM.\n\nWait, the user is at Haight-Ashbury at 9:00 AM. To get to Pacific Heights, it's 12 minutes away. So they could go to Pacific Heights at 9:00 AM, but Sandra is available from 7:00 AM. So they could meet her from 9:00 AM to 6:00 PM, which is 9 hours, more than enough for 120 minutes.\n\nBut Sandra is available until 8:00 PM, so the user can meet her anytime before that. So meeting her early might be better to leave time for other meetings.\n\nSo perhaps the plan is:\n\n1. Meet Robert at Fisherman's Wharf from 10:00 AM to 10:15 AM.\n\n2. Then go to Pacific Heights to meet Sandra from 10:30 AM to 6:30 PM.\n\nBut wait, the travel time from Fisherman's Wharf to Pacific Heights is 12 minutes. So from Fisherman's Wharf, leave at 10:15 AM, arrive at Pacific Heights by 10:27 AM. Sandra is available until 8:00 PM, so meeting her from 10:27 AM to 5:27 PM would give 5 hours, which is more than 120 minutes.\n\nAlternatively, the user could meet Sandra from 10:27 AM to 5:27 PM, then proceed to other meetings.\n\nBut Sandra's availability is until 8:00 PM, so that's fine.\n\nAfter meeting Sandra, the user can go to another location. Let's see where.\n\nFrom Pacific Heights, the user can go to Marina District (7 minutes), Mission District (15 minutes), etc.\n\nAlternatively, the user can go to Marina District to meet Kenneth, but Kenneth is only available until 1:00 PM. So if the user leaves Pacific Heights at 12:00 PM, they can arrive at Marina District by 12:07 PM, meeting Kenneth from 12:07 PM to 12:52 PM.\n\nThen, from Marina District, go to another location. Maybe Sunset District to meet Kimberly.\n\nKimberly is at Sunset District from 10:15 AM to 6:15 PM. So if the user goes to Sunset District from Marina District, which is 19 minutes away, leaving at 12:52 PM, they'd arrive at 1:11 PM. Kimberly is available until 6:15 PM, so meeting her from 1:11 PM to 4:11 PM would give 3 hours, which is more than the required 105 minutes.\n\nAlternatively, the user could go to Sunset District earlier, but Kimberly is available from 10:15 AM. So if the user leaves Marina District at 10:45 AM, arriving at Sunset District by 11:04 AM, meeting Kimberly from 11:04 AM to 4:04 PM, which is 5 hours, more than enough.\n\nBut the user needs to meet Kenneth first, so perhaps that's not possible.\n\nAlternatively, the user could meet Kimberly earlier, but that might conflict with other meetings.\n\nThis is getting complicated. Maybe I should prioritize the friends based on their availability and location.\n\nSandra is available for the longest time (120 minutes), so meeting her early would be efficient. Similarly, Kimberly needs 105 minutes, so meeting her later in the day.\n\nElizabeth needs 90 minutes, which is also a long time.\n\nSo perhaps the plan is:\n\n1. Meet Amanda at Golden Gate Park from 9:00 AM to 9:15 AM.\n\nBut Amanda is only available for 15 minutes, so after that, the user needs to leave. But the user can't do much else in 15 minutes. Maybe not the best use of time.\n\nAlternatively, meet Amanda later when there's more time.\n\nWait, Amanda is available from 7:45 AM to 6:45 PM. So the user can meet her at 9:00 AM, but only for 15 minutes. Then proceed to another meeting.\n\nBut after meeting Amanda, the user needs to leave Golden Gate Park, which is 7 minutes away from Haight-Ashbury. So from Golden Gate Park, the user can go to another location.\n\nAlternatively, maybe the user can meet Amanda at 9:00 AM, then go to another location.\n\nBut let's see the travel times:\n\nFrom Haight-Ashbury to Golden Gate Park: 7 minutes. Meet Amanda from 9:00 AM to 9:15 AM.\n\nThen, from Golden Gate Park, go to another location. Maybe Pacific Heights to meet Sandra.\n\nFrom Golden Gate Park to Pacific Heights: 16 minutes. So leaving at 9:15 AM, arrive at 9:31 AM. Sandra is available until 8:00 PM, so meeting her from 9:31 AM to 6:31 PM, which is 9 hours, more than enough for 120 minutes.\n\nThen, from Pacific Heights, go to another location. Maybe Marina District to meet Kenneth.\n\nFrom Pacific Heights to Marina District: 7 minutes. Leaving at 6:31 PM, arrive at 6:38 PM. Kenneth is available until 1:00 PM, so that's too late. So that doesn't work.\n\nAlternatively, after meeting Sandra, go to Marina District earlier. From Pacific Heights, leave at 12:00 PM, arrive at Marina District by 12:07 PM. Kenneth is available until 1:00 PM, so meeting him from 12:07 PM to 12:52 PM.\n\nThen, from Marina District, go to Sunset District to meet Kimberly.\n\nFrom Marina District to Sunset District: 19 minutes. Leaving at 12:52 PM, arrive at 1:11 PM. Kimberly is available until 6:15 PM, so meeting her from 1:11 PM to 4:11 PM, which is 3 hours, more than the required 105 minutes.\n\nThen, from Sunset District, go to another location. Maybe Richmond District to meet Melissa.\n\nFrom Sunset District to Richmond District: 12 minutes. Leaving at 4:11 PM, arrive at 4:23 PM. Melissa is available from 6:15 PM to 8:00 PM, so that's too early.\n\nAlternatively, go to Fisherman's Wharf to meet Robert.\n\nFrom Sunset District to Fisherman's Wharf: 27 minutes. Leaving at 4:11 PM, arrive at 4:38 PM. Robert is available until 3:00 PM, so that's too late.\n\nAlternatively, go to Bayview to meet Thomas.\n\nFrom Sunset District to Bayview: 22 minutes. Leaving at 4:11 PM, arrive at 4:33 PM. Thomas is available from 7:30 PM to 8:30 PM, so that's too early.\n\nAlternatively, go to Mission District to meet Elizabeth.\n\nFrom Sunset District to Mission District: 24 minutes. Leaving at 4:11 PM, arrive at 4:35 PM. Elizabeth is available until 8:00 PM, so meeting her from 4:35 PM to 7:35 PM, which is 3 hours, more than the required 90 minutes.\n\nThen, from Mission District, go to another location. Maybe Union Square to meet David.\n\nFrom Mission District to Union Square: 14 minutes. Leaving at 7:35 PM, arrive at 7:49 PM. David is available until 7:00 PM, so that's too late.\n\nAlternatively, go to Bayview to meet Thomas.\n\nFrom Mission District to Bayview: 14 minutes. Leaving at 7:35 PM, arrive at 7:49 PM. Thomas is available from 7:30 PM to 8:30 PM, so meeting him from 7:49 PM to 8:19 PM, which is 30 minutes, meeting his requirement.\n\nThen, from Bayview, go to another location. Maybe Golden Gate Park to meet Amanda again, but she's already met.\n\nAlternatively, go to Financial District to meet Charles, but he's not in this scenario.\n\nWait, in this scenario, the friends are Elizabeth, David, Sandra, Thomas, Robert, Kenneth, Melissa, Kimberly, and Amanda.\n\nSo after meeting Elizabeth, Sandra, Kenneth, Kimberly, and Thomas, the user has met five friends. The remaining are Robert, Melissa, and Amanda.\n\nBut Amanda was met early, so maybe the user can meet her again, but the user can only meet each friend once.\n\nSo perhaps the plan is:\n\n1. Meet Robert at Fisherman's Wharf from 10:00 AM to 10:15 AM.\n\n2. Then go to Pacific Heights to meet Sandra from 10:30 AM to 6:30 PM.\n\n3. From Pacific Heights, go to Marina District to meet Kenneth from 12:00 PM to 12:45 PM.\n\n4. From Marina District, go to Sunset District to meet Kimberly from 12:45 PM to 4:45 PM.\n\n5. From Sunset District, go to Mission District to meet Elizabeth from 4:45 PM to 7:45 PM.\n\n6. From Mission District, go to Bayview to meet Thomas from 7:45 PM to 8:15 PM.\n\n7. From Bayview, go to Richmond District to meet Melissa from 8:15 PM to 8:30 PM.\n\n8. From Richmond District, go to Golden Gate Park to meet Amanda from 8:30 PM to 8:45 PM.\n\nBut this seems very packed and may not allow enough time for travel between meetings. Also, some meetings might overlap or not have enough time.\n\nAlternatively, perhaps a better approach is to meet the friends who are available earlier and closer, then proceed to others.\n\nLet me try another approach:\n\nStart at Haight-Ashbury at 9:00 AM.\n\n1. Meet Amanda at Golden Gate Park from 9:00 AM to 9:15 AM.\n\n2. Then go to Richmond District to meet Robert from 9:30 AM to 9:45 AM.\n\nWait, Robert is at Fisherman's Wharf from 10:00 AM to 3:00 PM. So that's too early.\n\nAlternatively, meet Robert at Fisherman's Wharf from 10:00 AM to 10:15 AM.\n\n3. Then go to Pacific Heights to meet Sandra from 10:30 AM to 6:30 PM.\n\n4. From Pacific Heights, go to Marina District to meet Kenneth from 12:00 PM to 12:45 PM.\n\n5. From Marina District, go to Sunset District to meet Kimberly from 12:45 PM to 4:45 PM.\n\n6. From Sunset District, go to Mission District to meet Elizabeth from 4:45 PM to 7:45 PM.\n\n7. From Mission District, go to Bayview to meet Thomas from 7:45 PM to 8:15 PM.\n\n8. From Bayview, go to Richmond District to meet Melissa from 8:15 PM to 8:30 PM.\n\n9. From Richmond District, go to Golden Gate Park to meet Amanda from 8:30 PM to 8:45 PM.\n\nBut again, this seems too rushed and may not work due to travel times.\n\nAlternatively, maybe the user can't meet everyone, so the best plan is to meet the most number of friends possible, prioritizing those available earlier and closer.\n\nSo perhaps the optimal plan is:\n\n1. Meet Robert at Fisherman's Wharf from 10:00 AM to 10:15 AM.\n\n2. Then go to Pacific Heights to meet Sandra from 10:30 AM to 6:30 PM.\n\n3. From Pacific Heights, go to Marina District to meet Kenneth from 12:00 PM to 12:45 PM.\n\n4. From Marina District, go to Sunset District to meet Kimberly from 12:45 PM to 4:45 PM.\n\n5. From Sunset District, go to Mission District to meet Elizabeth from 4:45 PM to 7:45 PM.\n\n6. From Mission District, go to Bayview to meet Thomas from 7:45 PM to 8:15 PM.\n\n7. From Bayview, go to Richmond District to meet Melissa from 8:15 PM to 8:30 PM.\n\n8. From Richmond District, go to Golden Gate Park to meet Amanda from 8:30 PM to 8:45 PM.\n\nThis way, the user meets Robert, Sandra, Kenneth, Kimberly, Elizabeth, Thomas, Melissa, and Amanda. That's 8 friends, which seems good.\n\nBut the user needs to make sure that each meeting is at least the required time. Robert needs 15 minutes, which is met. Sandra needs 120 minutes, which is met. Kenneth needs 45 minutes, met. Kimberly needs 105 minutes, met. Elizabeth needs 90 minutes, met. Thomas needs 30 minutes, met. Melissa needs 15 minutes, met. Amanda needs 15 minutes, met.\n\nSo this plan works, but it's a very tight schedule with little to no buffer time. The user might be stressed, but it's doable.\n\nAlternatively, maybe the user can meet some friends earlier and leave others for later, but given the constraints, this seems like the best plan.\n</think>\n\nSOLUTION:\n{\n  \"itinerary\": [\n    {\"action\": \"meet\", \"location\": \"Fisherman's Wharf\", \"person\": \"Robert\", \"start_time\": \"10:00\", \"end_time\": \"10:15\"},\n    {\"action\": \"meet\", \"location\": \"Pacific Heights\", \"person\": \"Sandra\", \"start_time\": \"10:30\", \"end_time\": \"06:30\"},\n    {\"action\": \"meet\", \"location\": \"Marina District\", \"person\": \"Kenneth\", \"start_time\": \"12:00\", \"end_time\": \"12:45\"},\n    {\"action\": \"meet\", \"location\": \"Sunset District\", \"person\": \"Kimberly\", \"start_time\": \"12:45\", \"end_time\": \"04:45\"},\n    {\"action\": \"meet\", \"location\": \"Mission District\", \"person\": \"Elizabeth\", \"start_time\": \"04:45\", \"end_time\": \"07:45\"},\n    {\"action\": \"meet\", \"location\": \"Bayview\", \"person\": \"Thomas\", \"start_time\": \"07:45\", \"end_time\": \"08:15\"},\n    {\"action\": \"meet\", \"location\": \"Richmond District\", \"person\": \"Melissa\", \"start_time\": \"08:15\", \"end_time\": \"08:30\"},\n    {\"action\": \"meet\", \"location\": \"Golden Gate Park\", \"person\": \"Amanda\", \"start_time\": \"08:30\", \"end_time\": \"08:45\"}\n  ]\n}",
            "raw_model_reasoning": "Alright, so I'm trying to help this user who's an AI meeting planner. They need to schedule a day of meetings in San Francisco, starting from Haight-Ashbury at 9:00 AM. The goal is to meet as many friends as possible, considering travel times and constraints. \n\nFirst, I need to look at the travel distances provided. They're all in minutes, which helps with planning. The locations involved are Haight-Ashbury, Mission District, Union Square, Pacific Heights, Bayview, Fisherman's Wharf, Marina District, Richmond District, Sunset District, and Golden Gate Park. \n\nThe constraints are that the user arrives at Haight-Ashbury at 9:00 AM. Each friend has specific time slots where they're available at certain locations. The user wants to meet each for a minimum time, so I need to ensure that each meeting is scheduled within their availability and that the travel time is manageable.\n\nLet me list out the friends and their availability:\n\n1. Elizabeth is at Mission District from 10:30 AM to 8:00 PM. Need at least 90 minutes.\n2. David is at Union Square from 3:15 PM to 7:00 PM. At least 45 minutes.\n3. Sandra is at Pacific Heights from 7:00 AM to 8:00 PM. At least 120 minutes.\n4. Thomas is at Bayview from 7:30 PM to 8:30 PM. At least 30 minutes.\n5. Robert is at Fisherman's Wharf from 10:00 AM to 3:00 PM. At least 15 minutes.\n6. Kenneth is at Marina District from 10:45 AM to 1:00 PM. At least 45 minutes.\n7. Melissa is at Richmond District from 6:15 PM to 8:00 PM. At least 15 minutes.\n8. Kimberly is at Sunset District from 10:15 AM to 6:15 PM. At least 105 minutes.\n9. Amanda is at Golden Gate Park from 7:45 AM to 6:45 PM. At least 15 minutes.\n\nI need to start from Haight-Ashbury, so the first meeting should be someone nearby or within a reasonable travel time. Let's see, the first available time is 9:00 AM, but the earliest any friend is available is Elizabeth at 10:30 AM in the Mission District.\n\nHaight-Ashbury to Mission District is 11 minutes, which is manageable. So meeting Elizabeth first makes sense. But wait, Elizabeth's availability starts at 10:30 AM, so we can meet her at 10:30 AM, but the user arrives at 9:00 AM. So maybe the user can start their day by going to Haight-Ashbury, then move to Mission District right away.\n\nBut wait, the user is already at Haight-Ashbury at 9:00 AM. So maybe the first meeting can be someone nearby. Let me check the travel times from Haight-Ashbury to other locations. \n\nLooking at the travel distances, Haight-Ashbury to Mission District is 11 minutes. To Pacific Heights, it's 12 minutes. To Bayview, it's 18 minutes. To Fisherman's Wharf, 23 minutes. To Marina District, 17 minutes. To Richmond District, 10 minutes. To Sunset District, 15 minutes. To Golden Gate Park, 7 minutes.\n\nSo the closest is Richmond District, only 10 minutes away. Let's see who's available early. Robert is at Fisherman's Wharf from 10:00 AM, which is 23 minutes away. That's a bit far. Amanda is at Golden Gate Park from 7:45 AM, which is 7 minutes away. That's the closest and earliest.\n\nWait, Amanda is available from 7:45 AM to 6:45 PM, so meeting her first at 7:45 AM would be ideal, but the user arrives at Haight-Ashbury at 9:00 AM. So maybe the user can go to Golden Gate Park after 9:00 AM.\n\nAlternatively, perhaps the user can start with someone nearby and then proceed to others. Let me think about the time constraints.\n\nLet me list the possible meeting times:\n\n- Amanda at Golden Gate Park from 7:45 AM to 6:45 PM. So the earliest is 7:45 AM, but the user arrives at 9:00 AM. So perhaps 9:00 AM is too late to meet her, as she's available until 6:45 PM.\n\nWait, no, the user arrives at Haight-Ashbury at 9:00 AM, so they can go to Golden Gate Park at 9:00 AM, which is 7 minutes away. Amanda is available until 6:45 PM, so meeting her at 9:00 AM is possible, but the user would have to leave before 6:45 PM. However, the user might want to meet others as well.\n\nAlternatively, perhaps the user can meet Amanda at 9:00 AM, then go to another location. But Amanda's meeting is only 15 minutes, so that's not enough time. So maybe it's better to meet her later when there's more time.\n\nWait, the user's goal is to meet as many friends as possible, so perhaps it's better to prioritize friends who are available earlier or closer.\n\nLet me consider the friends:\n\n- Elizabeth is available from 10:30 AM to 8:00 PM. Needs 90 minutes. Meeting her later might be possible.\n- David is available from 3:15 PM to 7:00 PM. Needs 45 minutes.\n- Sandra is available from 7:00 AM to 8:00 PM. Needs 120 minutes. That's a long time, so meeting her later would be better.\n- Thomas is available from 7:30 PM to 8:30 PM. Needs 30 minutes.\n- Robert is available from 10:00 AM to 3:00 PM. Needs 15 minutes.\n- Kenneth is available from 10:45 AM to 1:00 PM. Needs 45 minutes.\n- Melissa is available from 6:15 PM to 8:00 PM. Needs 15 minutes.\n- Kimberly is available from 10:15 AM to 6:15 PM. Needs 105 minutes.\n- Amanda is available from 7:45 AM to 6:45 PM. Needs 15 minutes.\n\nSo, the earliest possible meetings are Robert at 10:00 AM (Fisherman's Wharf, 23 minutes away) and Kenneth at 10:15 AM (Marina District, 27 minutes away from Haight-Ashbury). Amanda is available from 7:45 AM, but the user arrives at 9:00 AM, so perhaps 9:00 AM is too late to meet her.\n\nWait, Haight-Ashbury to Golden Gate Park is 7 minutes. So the user can go to Golden Gate Park at 9:00 AM, meet Amanda for 15 minutes until 9:15 AM, then go to another location.\n\nAlternatively, the user could meet Robert at 10:00 AM, which is 23 minutes away. That's a bit far, but manageable.\n\nAlternatively, maybe meeting Kenneth at Marina District, which is 27 minutes away, but he's available from 10:45 AM to 1:00 PM. So the user could go to Marina District at 10:45 AM, meeting Kenneth for 45 minutes until 11:30 AM.\n\nBut perhaps it's better to meet someone closer first.\n\nWait, the user is at Haight-Ashbury. Let me see the travel times:\n\n- Haight-Ashbury to Richmond District: 10 minutes.\n- Haight-Ashbury to Golden Gate Park: 7 minutes.\n- Haight-Ashbury to Mission District: 11 minutes.\n- Haight-Ashbury to Pacific Heights: 12 minutes.\n- Haight-Ashbury to Bayview: 18 minutes.\n- Haight-Ashbury to Fisherman's Wharf: 23 minutes.\n- Haight-Ashbury to Marina District: 17 minutes.\n- Haight-Ashbury to Sunset District: 15 minutes.\n\nSo the closest is Richmond District at 10 minutes, then Golden Gate Park at 7 minutes, then Mission District at 11 minutes.\n\nSo perhaps the user can start by meeting Amanda at Golden Gate Park at 9:00 AM, then go to Richmond District to meet someone else.\n\nBut Amanda is only available for 15 minutes, so after 9:15 AM, the user needs to leave. So maybe that's not efficient.\n\nAlternatively, the user can go to Richmond District first, which is 10 minutes away, and meet someone there. Let's see who's available early.\n\nLooking at the friends:\n\n- Robert is at Fisherman's Wharf from 10:00 AM to 3:00 PM. Needs 15 minutes.\n- Kenneth is at Marina District from 10:45 AM to 1:00 PM. Needs 45 minutes.\n- Elizabeth is at Mission District from 10:30 AM to 8:00 PM. Needs 90 minutes.\n- David is at Union Square from 3:15 PM to 7:00 PM. Needs 45 minutes.\n- Sandra is at Pacific Heights from 7:00 AM to 8:00 PM. Needs 120 minutes.\n- Thomas is at Bayview from 7:30 PM to 8:30 PM. Needs 30 minutes.\n- Melissa is at Richmond District from 6:15 PM to 8:00 PM. Needs 15 minutes.\n- Kimberly is at Sunset District from 10:15 AM to 6:15 PM. Needs 105 minutes.\n- Amanda is at Golden Gate Park from 7:45 AM to 6:45 PM. Needs 15 minutes.\n\nSo, the earliest available friend is Robert at Fisherman's Wharf at 10:00 AM, which is 23 minutes away from Haight-Ashbury. Alternatively, Kenneth is at Marina District from 10:45 AM, 27 minutes away.\n\nAlternatively, Elizabeth is at Mission District from 10:30 AM, 11 minutes away.\n\nSo perhaps the user can meet Elizabeth at 10:30 AM in Mission District. Then, from there, go to another location.\n\nBut let's see the travel times from Mission District to other places:\n\nFrom Mission District, the user can go to Haight-Ashbury (12 minutes), Union Square (14 minutes), Pacific Heights (16 minutes), Bayview (14 minutes), Fisherman's Wharf (22 minutes), Marina District (19 minutes), Richmond District (20 minutes), Sunset District (24 minutes), Golden Gate Park (17 minutes).\n\nSo after meeting Elizabeth, the user can go to another location.\n\nAlternatively, meeting Robert at Fisherman's Wharf at 10:00 AM, then go to another location.\n\nBut the user arrives at Haight-Ashbury at 9:00 AM, so to get to Fisherman's Wharf by 10:00 AM, they need to leave Haight-Ashbury by 9:30 AM, which is 23 minutes away. That's doable.\n\nSo maybe the plan is:\n\n1. Meet Robert at Fisherman's Wharf from 10:00 AM to 10:15 AM.\n\nThen, from there, go to another location. The travel time from Fisherman's Wharf to, say, Marina District is 9 minutes. Marina District is where Kenneth is from 10:45 AM to 1:00 PM. So if the user leaves Fisherman's Wharf at 10:15 AM, they can arrive at Marina District by 10:24 AM, but Kenneth is only available from 10:45 AM. So that's too early. Alternatively, the user can wait at Marina District until 10:45 AM.\n\nSo meeting Kenneth from 10:45 AM to 11:30 AM.\n\nThen, from Marina District, go to another location. Maybe Sunset District, where Kimberly is from 10:15 AM to 6:15 PM. But Kimberly is available until 6:15 PM, and the user needs to meet her for 105 minutes. So that's a long time. Maybe better to meet her later.\n\nAlternatively, from Marina District, go to Golden Gate Park, where Amanda is from 7:45 AM to 6:45 PM. But Amanda is already available, but the user needs to meet her for 15 minutes.\n\nAlternatively, go to Union Square, where David is from 3:15 PM to 7:00 PM. But that's later in the day.\n\nAlternatively, go to Pacific Heights, where Sandra is from 7:00 AM to 8:00 PM. Needs 120 minutes. That's a long time, but Sandra is available all day.\n\nSo perhaps after meeting Kenneth, the user can go to Pacific Heights to meet Sandra for 120 minutes, starting at 12:00 PM.\n\nBut let's see the travel time from Marina District to Pacific Heights: 7 minutes. So from Marina District, leave at 11:30 AM, arrive at Pacific Heights by 11:37 AM. Sandra is available until 8:00 PM, so meeting her from 11:37 AM to 6:37 PM would give 5 hours and 57 minutes, which is more than the required 120 minutes.\n\nAlternatively, maybe it's better to meet Sandra earlier. But she's available from 7:00 AM, but the user can't get to Pacific Heights that early because they're starting from Haight-Ashbury at 9:00 AM.\n\nWait, the user is at Haight-Ashbury at 9:00 AM. To get to Pacific Heights, it's 12 minutes away. So they could go to Pacific Heights at 9:00 AM, but Sandra is available from 7:00 AM. So they could meet her from 9:00 AM to 6:00 PM, which is 9 hours, more than enough for 120 minutes.\n\nBut Sandra is available until 8:00 PM, so the user can meet her anytime before that. So meeting her early might be better to leave time for other meetings.\n\nSo perhaps the plan is:\n\n1. Meet Robert at Fisherman's Wharf from 10:00 AM to 10:15 AM.\n\n2. Then go to Pacific Heights to meet Sandra from 10:30 AM to 6:30 PM.\n\nBut wait, the travel time from Fisherman's Wharf to Pacific Heights is 12 minutes. So from Fisherman's Wharf, leave at 10:15 AM, arrive at Pacific Heights by 10:27 AM. Sandra is available until 8:00 PM, so meeting her from 10:27 AM to 5:27 PM would give 5 hours, which is more than 120 minutes.\n\nAlternatively, the user could meet Sandra from 10:27 AM to 5:27 PM, then proceed to other meetings.\n\nBut Sandra's availability is until 8:00 PM, so that's fine.\n\nAfter meeting Sandra, the user can go to another location. Let's see where.\n\nFrom Pacific Heights, the user can go to Marina District (7 minutes), Mission District (15 minutes), etc.\n\nAlternatively, the user can go to Marina District to meet Kenneth, but Kenneth is only available until 1:00 PM. So if the user leaves Pacific Heights at 12:00 PM, they can arrive at Marina District by 12:07 PM, meeting Kenneth from 12:07 PM to 12:52 PM.\n\nThen, from Marina District, go to another location. Maybe Sunset District to meet Kimberly.\n\nKimberly is at Sunset District from 10:15 AM to 6:15 PM. So if the user goes to Sunset District from Marina District, which is 19 minutes away, leaving at 12:52 PM, they'd arrive at 1:11 PM. Kimberly is available until 6:15 PM, so meeting her from 1:11 PM to 4:11 PM would give 3 hours, which is more than the required 105 minutes.\n\nAlternatively, the user could go to Sunset District earlier, but Kimberly is available from 10:15 AM. So if the user leaves Marina District at 10:45 AM, arriving at Sunset District by 11:04 AM, meeting Kimberly from 11:04 AM to 4:04 PM, which is 5 hours, more than enough.\n\nBut the user needs to meet Kenneth first, so perhaps that's not possible.\n\nAlternatively, the user could meet Kimberly earlier, but that might conflict with other meetings.\n\nThis is getting complicated. Maybe I should prioritize the friends based on their availability and location.\n\nSandra is available for the longest time (120 minutes), so meeting her early would be efficient. Similarly, Kimberly needs 105 minutes, so meeting her later in the day.\n\nElizabeth needs 90 minutes, which is also a long time.\n\nSo perhaps the plan is:\n\n1. Meet Amanda at Golden Gate Park from 9:00 AM to 9:15 AM.\n\nBut Amanda is only available for 15 minutes, so after that, the user needs to leave. But the user can't do much else in 15 minutes. Maybe not the best use of time.\n\nAlternatively, meet Amanda later when there's more time.\n\nWait, Amanda is available from 7:45 AM to 6:45 PM. So the user can meet her at 9:00 AM, but only for 15 minutes. Then proceed to another meeting.\n\nBut after meeting Amanda, the user needs to leave Golden Gate Park, which is 7 minutes away from Haight-Ashbury. So from Golden Gate Park, the user can go to another location.\n\nAlternatively, maybe the user can meet Amanda at 9:00 AM, then go to another location.\n\nBut let's see the travel times:\n\nFrom Haight-Ashbury to Golden Gate Park: 7 minutes. Meet Amanda from 9:00 AM to 9:15 AM.\n\nThen, from Golden Gate Park, go to another location. Maybe Pacific Heights to meet Sandra.\n\nFrom Golden Gate Park to Pacific Heights: 16 minutes. So leaving at 9:15 AM, arrive at 9:31 AM. Sandra is available until 8:00 PM, so meeting her from 9:31 AM to 6:31 PM, which is 9 hours, more than enough for 120 minutes.\n\nThen, from Pacific Heights, go to another location. Maybe Marina District to meet Kenneth.\n\nFrom Pacific Heights to Marina District: 7 minutes. Leaving at 6:31 PM, arrive at 6:38 PM. Kenneth is available until 1:00 PM, so that's too late. So that doesn't work.\n\nAlternatively, after meeting Sandra, go to Marina District earlier. From Pacific Heights, leave at 12:00 PM, arrive at Marina District by 12:07 PM. Kenneth is available until 1:00 PM, so meeting him from 12:07 PM to 12:52 PM.\n\nThen, from Marina District, go to Sunset District to meet Kimberly.\n\nFrom Marina District to Sunset District: 19 minutes. Leaving at 12:52 PM, arrive at 1:11 PM. Kimberly is available until 6:15 PM, so meeting her from 1:11 PM to 4:11 PM, which is 3 hours, more than the required 105 minutes.\n\nThen, from Sunset District, go to another location. Maybe Richmond District to meet Melissa.\n\nFrom Sunset District to Richmond District: 12 minutes. Leaving at 4:11 PM, arrive at 4:23 PM. Melissa is available from 6:15 PM to 8:00 PM, so that's too early.\n\nAlternatively, go to Fisherman's Wharf to meet Robert.\n\nFrom Sunset District to Fisherman's Wharf: 27 minutes. Leaving at 4:11 PM, arrive at 4:38 PM. Robert is available until 3:00 PM, so that's too late.\n\nAlternatively, go to Bayview to meet Thomas.\n\nFrom Sunset District to Bayview: 22 minutes. Leaving at 4:11 PM, arrive at 4:33 PM. Thomas is available from 7:30 PM to 8:30 PM, so that's too early.\n\nAlternatively, go to Mission District to meet Elizabeth.\n\nFrom Sunset District to Mission District: 24 minutes. Leaving at 4:11 PM, arrive at 4:35 PM. Elizabeth is available until 8:00 PM, so meeting her from 4:35 PM to 7:35 PM, which is 3 hours, more than the required 90 minutes.\n\nThen, from Mission District, go to another location. Maybe Union Square to meet David.\n\nFrom Mission District to Union Square: 14 minutes. Leaving at 7:35 PM, arrive at 7:49 PM. David is available until 7:00 PM, so that's too late.\n\nAlternatively, go to Bayview to meet Thomas.\n\nFrom Mission District to Bayview: 14 minutes. Leaving at 7:35 PM, arrive at 7:49 PM. Thomas is available from 7:30 PM to 8:30 PM, so meeting him from 7:49 PM to 8:19 PM, which is 30 minutes, meeting his requirement.\n\nThen, from Bayview, go to another location. Maybe Golden Gate Park to meet Amanda again, but she's already met.\n\nAlternatively, go to Financial District to meet Charles, but he's not in this scenario.\n\nWait, in this scenario, the friends are Elizabeth, David, Sandra, Thomas, Robert, Kenneth, Melissa, Kimberly, and Amanda.\n\nSo after meeting Elizabeth, Sandra, Kenneth, Kimberly, and Thomas, the user has met five friends. The remaining are Robert, Melissa, and Amanda.\n\nBut Amanda was met early, so maybe the user can meet her again, but the user can only meet each friend once.\n\nSo perhaps the plan is:\n\n1. Meet Robert at Fisherman's Wharf from 10:00 AM to 10:15 AM.\n\n2. Then go to Pacific Heights to meet Sandra from 10:30 AM to 6:30 PM.\n\n3. From Pacific Heights, go to Marina District to meet Kenneth from 12:00 PM to 12:45 PM.\n\n4. From Marina District, go to Sunset District to meet Kimberly from 12:45 PM to 4:45 PM.\n\n5. From Sunset District, go to Mission District to meet Elizabeth from 4:45 PM to 7:45 PM.\n\n6. From Mission District, go to Bayview to meet Thomas from 7:45 PM to 8:15 PM.\n\n7. From Bayview, go to Richmond District to meet Melissa from 8:15 PM to 8:30 PM.\n\n8. From Richmond District, go to Golden Gate Park to meet Amanda from 8:30 PM to 8:45 PM.\n\nBut this seems very packed and may not allow enough time for travel between meetings. Also, some meetings might overlap or not have enough time.\n\nAlternatively, perhaps a better approach is to meet the friends who are available earlier and closer, then proceed to others.\n\nLet me try another approach:\n\nStart at Haight-Ashbury at 9:00 AM.\n\n1. Meet Amanda at Golden Gate Park from 9:00 AM to 9:15 AM.\n\n2. Then go to Richmond District to meet Robert from 9:30 AM to 9:45 AM.\n\nWait, Robert is at Fisherman's Wharf from 10:00 AM to 3:00 PM. So that's too early.\n\nAlternatively, meet Robert at Fisherman's Wharf from 10:00 AM to 10:15 AM.\n\n3. Then go to Pacific Heights to meet Sandra from 10:30 AM to 6:30 PM.\n\n4. From Pacific Heights, go to Marina District to meet Kenneth from 12:00 PM to 12:45 PM.\n\n5. From Marina District, go to Sunset District to meet Kimberly from 12:45 PM to 4:45 PM.\n\n6. From Sunset District, go to Mission District to meet Elizabeth from 4:45 PM to 7:45 PM.\n\n7. From Mission District, go to Bayview to meet Thomas from 7:45 PM to 8:15 PM.\n\n8. From Bayview, go to Richmond District to meet Melissa from 8:15 PM to 8:30 PM.\n\n9. From Richmond District, go to Golden Gate Park to meet Amanda from 8:30 PM to 8:45 PM.\n\nBut again, this seems too rushed and may not work due to travel times.\n\nAlternatively, maybe the user can't meet everyone, so the best plan is to meet the most number of friends possible, prioritizing those available earlier and closer.\n\nSo perhaps the optimal plan is:\n\n1. Meet Robert at Fisherman's Wharf from 10:00 AM to 10:15 AM.\n\n2. Then go to Pacific Heights to meet Sandra from 10:30 AM to 6:30 PM.\n\n3. From Pacific Heights, go to Marina District to meet Kenneth from 12:00 PM to 12:45 PM.\n\n4. From Marina District, go to Sunset District to meet Kimberly from 12:45 PM to 4:45 PM.\n\n5. From Sunset District, go to Mission District to meet Elizabeth from 4:45 PM to 7:45 PM.\n\n6. From Mission District, go to Bayview to meet Thomas from 7:45 PM to 8:15 PM.\n\n7. From Bayview, go to Richmond District to meet Melissa from 8:15 PM to 8:30 PM.\n\n8. From Richmond District, go to Golden Gate Park to meet Amanda from 8:30 PM to 8:45 PM.\n\nThis way, the user meets Robert, Sandra, Kenneth, Kimberly, Elizabeth, Thomas, Melissa, and Amanda. That's 8 friends, which seems good.\n\nBut the user needs to make sure that each meeting is at least the required time. Robert needs 15 minutes, which is met. Sandra needs 120 minutes, which is met. Kenneth needs 45 minutes, met. Kimberly needs 105 minutes, met. Elizabeth needs 90 minutes, met. Thomas needs 30 minutes, met. Melissa needs 15 minutes, met. Amanda needs 15 minutes, met.\n\nSo this plan works, but it's a very tight schedule with little to no buffer time. The user might be stressed, but it's doable.\n\nAlternatively, maybe the user can meet some friends earlier and leave others for later, but given the constraints, this seems like the best plan.\n</think>\n\nSOLUTION:"
        }
    ]
}