{
    "0shot": [
        {
            "final_program_time": {
                "itinerary": [
                    {
                        "action": "meet",
                        "location": "Richmond District",
                        "person": "Daniel",
                        "start_time": "19:00",
                        "end_time": "19:14"
                    }
                ]
            },
            "expected_time": {
                "itinerary": [
                    {
                        "action": "meet",
                        "location": "Richmond District",
                        "person": "Daniel",
                        "start_time": "19:00",
                        "end_time": "20:15"
                    }
                ]
            },
            "count": "meeting_planning_example_91",
            "is_correct": false,
            "reasoning_token_count": 446,
            "raw_model_response": "Okay, so I'm trying to figure out how to help this AI meeting planner. They've been given a bunch of travel distances and constraints, and they need to schedule a day of meetings in San Francisco. The goal is to meet as many friends as possible, so the planner needs to consider all possible locations and constraints to maximize the number of meetings.\n\nFirst, I need to understand the constraints. The user arrives at Russian Hill at 9:00 AM. The only person they need to meet is Daniel, who will be at Richmond District from 7:00 PM to 8:15 PM. So, the main task is to figure out the best time to meet Daniel without conflicting with other meetings.\n\nLooking at the travel distances, Russian Hill to Richmond District is 14 minutes, and Richmond District to Russian Hill is 13 minutes. That means it's a quick trip between these two locations. Daniel is available from 7:00 PM to 8:15 PM, so the meeting needs to fit within that window.\n\nBut since the user is starting their day at Russian Hill at 9:00 AM, they might have other meetings throughout the day. However, the only constraint is meeting Daniel during his availability. So, the planner needs to ensure that the meeting with Daniel doesn't interfere with other scheduled meetings.\n\nI think the best approach is to schedule the meeting with Daniel as early as possible during his available time to leave room for other meetings later in the day. So, the earliest possible meeting time would be at 7:00 PM.\n\nNow, considering the travel time from Russian Hill to Richmond District is 14 minutes, the meeting can start at 7:00 PM and end at 7:14 PM. This way, the user can attend other meetings before and after this time without issues.\n\nI should also check if there are any other constraints or people to meet, but based on the information given, the only person to meet is Daniel. Therefore, scheduling the meeting with Daniel at 7:00 PM seems optimal.\n\nSo, the itinerary would include just this one meeting with Daniel at Richmond District at 7:00 PM to 7:14 PM.\n</think>\n\n```json\n{\n  \"itinerary\": [\n    {\n      \"action\": \"meet\",\n      \"location\": \"Richmond District\",\n      \"person\": \"Daniel\",\n      \"start_time\": \"19:00\",\n      \"end_time\": \"19:14\"\n    }\n  ]\n}\n```",
            "raw_model_reasoning": "Okay, so I'm trying to figure out how to help this AI meeting planner. They've been given a bunch of travel distances and constraints, and they need to schedule a day of meetings in San Francisco. The goal is to meet as many friends as possible, so the planner needs to consider all possible locations and constraints to maximize the number of meetings.\n\nFirst, I need to understand the constraints. The user arrives at Russian Hill at 9:00 AM. The only person they need to meet is Daniel, who will be at Richmond District from 7:00 PM to 8:15 PM. So, the main task is to figure out the best time to meet Daniel without conflicting with other meetings.\n\nLooking at the travel distances, Russian Hill to Richmond District is 14 minutes, and Richmond District to Russian Hill is 13 minutes. That means it's a quick trip between these two locations. Daniel is available from 7:00 PM to 8:15 PM, so the meeting needs to fit within that window.\n\nBut since the user is starting their day at Russian Hill at 9:00 AM, they might have other meetings throughout the day. However, the only constraint is meeting Daniel during his availability. So, the planner needs to ensure that the meeting with Daniel doesn't interfere with other scheduled meetings.\n\nI think the best approach is to schedule the meeting with Daniel as early as possible during his available time to leave room for other meetings later in the day. So, the earliest possible meeting time would be at 7:00 PM.\n\nNow, considering the travel time from Russian Hill to Richmond District is 14 minutes, the meeting can start at 7:00 PM and end at 7:14 PM. This way, the user can attend other meetings before and after this time without issues.\n\nI should also check if there are any other constraints or people to meet, but based on the information given, the only person to meet is Daniel. Therefore, scheduling the meeting with Daniel at 7:00 PM seems optimal.\n\nSo, the itinerary would include just this one meeting with Daniel at Richmond District at 7:00 PM to 7:14 PM.\n</think>\n\n```json"
        }
    ]
}