{
    "0shot": [
        {
            "final_program_time": {
                "itinerary": [
                    {
                        "action": "meet",
                        "location": "Golden Gate Park",
                        "person": "Mary",
                        "start_time": "9:00",
                        "end_time": "9:45"
                    },
                    {
                        "action": "meet",
                        "location": "Haight-Ashbury",
                        "person": "Kevin",
                        "start_time": "10:15",
                        "end_time": "12:15"
                    },
                    {
                        "action": "meet",
                        "location": "Bayview",
                        "person": "Deborah",
                        "start_time": "15:00",
                        "end_time": "16:30"
                    },
                    {
                        "action": "meet",
                        "location": "Presidio",
                        "person": "Stephanie",
                        "start_time": "16:30",
                        "end_time": "17:30"
                    },
                    {
                        "action": "meet",
                        "location": "Financial District",
                        "person": "Emily",
                        "start_time": "18:00",
                        "end_time": "19:45"
                    }
                ]
            },
            "expected_time": {
                "itinerary": [
                    {
                        "action": "meet",
                        "location": "Golden Gate Park",
                        "person": "Mary",
                        "start_time": "9:25",
                        "end_time": "10:10"
                    },
                    {
                        "action": "meet",
                        "location": "Haight-Ashbury",
                        "person": "Kevin",
                        "start_time": "10:17",
                        "end_time": "11:47"
                    },
                    {
                        "action": "meet",
                        "location": "Presidio",
                        "person": "Stephanie",
                        "start_time": "12:02",
                        "end_time": "14:02"
                    },
                    {
                        "action": "meet",
                        "location": "Bayview",
                        "person": "Deborah",
                        "start_time": "15:00",
                        "end_time": "17:00"
                    },
                    {
                        "action": "meet",
                        "location": "Financial District",
                        "person": "Emily",
                        "start_time": "17:19",
                        "end_time": "19:04"
                    }
                ]
            },
            "count": "meeting_planning_example_479",
            "is_correct": false,
            "reasoning_token_count": 599,
            "raw_model_response": "Alright, let's tackle this problem step by step. I'm an AI meeting planner, and my goal is to schedule meetings efficiently for a day in San Francisco. The user wants to meet as many friends as possible, so I need to consider various constraints and travel times to optimize the schedule.\n\nFirst, I'll review the travel distances provided. They cover locations like Embarcadero, Golden Gate Park, Haight-Ashbury, Bayview, Presidio, and Financial District. The distances vary, which means some locations are closer together than others. I need to plan the meetings in a way that minimizes travel time and allows for enough time to meet each person for the required durations.\n\nNext, I'll look at the constraints. The user arrives at Embarcadero at 9:00AM. There are several people to meet, each with specific time windows:\n\n1. **Mary** will be at Golden Gate Park from 8:45AM to 11:45AM. I need to meet her for at least 45 minutes.\n2. **Kevin** will be at Haight-Ashbury from 10:15AM to 4:15PM. Meeting him for 90 minutes.\n3. **Deborah** will be at Bayview from 3:00PM to 7:15PM. Need to meet her for 120 minutes.\n4. **Stephanie** will be at Presidio from 10:00AM to 5:15PM. Meeting her for 120 minutes.\n5. **Emily** will be at Financial District from 11:30AM to 9:45PM. Need to meet her for 105 minutes.\n\nGiven these constraints, I need to plan the meetings in a logical order, considering the travel times between locations. Starting with Embarcadero, I can move to Golden Gate Park first to meet Mary. From there, Haight-Ashbury is a short trip, so Kevin can be met next. After that, moving to Bayview to meet Deborah, and then to Presidio for Stephanie, and finally to Financial District for Emily.\n\nI'll also need to ensure that the meeting times don't overlap and that the user has enough time to travel between meetings. Since Deborah's meeting is in the afternoon, that gives time to move from Haight-Ashbury to Bayview. Similarly, Stephanie's meeting is in the late morning to early afternoon, and Emily's is in the late afternoon, allowing for a flexible schedule.\n\nI'll structure the itinerary starting with Mary at Golden Gate Park, then Kevin at Haight-Ashbury, Deborah at Bayview, Stephanie at Presidio, and Emily at Financial District. This sequence minimizes travel time and ensures each meeting is within the required time frames.\n\nFinally, I'll format the response in the specified JSON format, ensuring the times are in 24-hour format without leading zeros.\n</think>\n\n```json\n{\n  \"itinerary\": [\n    {\n      \"action\": \"meet\",\n      \"location\": \"Golden Gate Park\",\n      \"person\": \"Mary\",\n      \"start_time\": \"09:00\",\n      \"end_time\": \"09:45\"\n    },\n    {\n      \"action\": \"meet\",\n      \"location\": \"Haight-Ashbury\",\n      \"person\": \"Kevin\",\n      \"start_time\": \"10:15\",\n      \"end_time\": \"12:15\"\n    },\n    {\n      \"action\": \"meet\",\n      \"location\": \"Bayview\",\n      \"person\": \"Deborah\",\n      \"start_time\": \"15:00\",\n      \"end_time\": \"16:30\"\n    },\n    {\n      \"action\": \"meet\",\n      \"location\": \"Presidio\",\n      \"person\": \"Stephanie\",\n      \"start_time\": \"16:30\",\n      \"end_time\": \"17:30\"\n    },\n    {\n      \"action\": \"meet\",\n      \"location\": \"Financial District\",\n      \"person\": \"Emily\",\n      \"start_time\": \"18:00\",\n      \"end_time\": \"19:45\"\n    }\n  ]\n}\n```",
            "raw_model_reasoning": "Alright, let's tackle this problem step by step. I'm an AI meeting planner, and my goal is to schedule meetings efficiently for a day in San Francisco. The user wants to meet as many friends as possible, so I need to consider various constraints and travel times to optimize the schedule.\n\nFirst, I'll review the travel distances provided. They cover locations like Embarcadero, Golden Gate Park, Haight-Ashbury, Bayview, Presidio, and Financial District. The distances vary, which means some locations are closer together than others. I need to plan the meetings in a way that minimizes travel time and allows for enough time to meet each person for the required durations.\n\nNext, I'll look at the constraints. The user arrives at Embarcadero at 9:00AM. There are several people to meet, each with specific time windows:\n\n1. **Mary** will be at Golden Gate Park from 8:45AM to 11:45AM. I need to meet her for at least 45 minutes.\n2. **Kevin** will be at Haight-Ashbury from 10:15AM to 4:15PM. Meeting him for 90 minutes.\n3. **Deborah** will be at Bayview from 3:00PM to 7:15PM. Need to meet her for 120 minutes.\n4. **Stephanie** will be at Presidio from 10:00AM to 5:15PM. Meeting her for 120 minutes.\n5. **Emily** will be at Financial District from 11:30AM to 9:45PM. Need to meet her for 105 minutes.\n\nGiven these constraints, I need to plan the meetings in a logical order, considering the travel times between locations. Starting with Embarcadero, I can move to Golden Gate Park first to meet Mary. From there, Haight-Ashbury is a short trip, so Kevin can be met next. After that, moving to Bayview to meet Deborah, and then to Presidio for Stephanie, and finally to Financial District for Emily.\n\nI'll also need to ensure that the meeting times don't overlap and that the user has enough time to travel between meetings. Since Deborah's meeting is in the afternoon, that gives time to move from Haight-Ashbury to Bayview. Similarly, Stephanie's meeting is in the late morning to early afternoon, and Emily's is in the late afternoon, allowing for a flexible schedule.\n\nI'll structure the itinerary starting with Mary at Golden Gate Park, then Kevin at Haight-Ashbury, Deborah at Bayview, Stephanie at Presidio, and Emily at Financial District. This sequence minimizes travel time and ensures each meeting is within the required time frames.\n\nFinally, I'll format the response in the specified JSON format, ensuring the times are in 24-hour format without leading zeros.\n</think>\n\n```json"
        }
    ]
}