{
    "trip_planning_example_1173": {
        "input_query": [
            "You plan to visit 8 European cities for 17 days in total. You only take direct flights to commute between cities. You plan to stay in Lyon for 2 days. You have to attend a workshop in Lyon between day 8 and day 9. You plan to stay in Amsterdam for 5 days. During day 9 and day 13, you have to attend a conference in Amsterdam. You want to spend 2 days in Barcelona. You plan to stay in Manchester for 3 days. You plan to stay in Vilnius for 2 days. You plan to visit relatives in Vilnius between day 2 and day 3. You plan to stay in Santorini for 5 days. You plan to stay in Paris for 3 days. You want to spend 2 days in Riga.\n\nHere are the cities that have direct flights:\nParis and Lyon, Paris and Manchester, Vilnius and Amsterdam, Riga and Manchester, Amsterdam and Santorini, Riga and Amsterdam, Paris and Amsterdam, Manchester and Santorini, Manchester and Amsterdam, Barcelona and Santorini, Lyon and Amsterdam, Riga and Paris, Riga and Barcelona, Paris and Barcelona, Vilnius and Paris, Barcelona and Lyon, Manchester and Barcelona, Barcelona and Amsterdam, from Riga to Vilnius.\n\nFind a trip plan of visiting the cities for 17 days by taking direct flights to commute between them."
        ],
        "trip_length": 17,
        "city_length": [
            {
                "city": "Vilnius",
                "days": 2
            },
            {
                "city": "Riga",
                "days": 2
            },
            {
                "city": "Manchester",
                "days": 3
            },
            {
                "city": "Santorini",
                "days": 5
            },
            {
                "city": "Barcelona",
                "days": 2
            },
            {
                "city": "Lyon",
                "days": 2
            },
            {
                "city": "Paris",
                "days": 3
            },
            {
                "city": "Amsterdam",
                "days": 5
            }
        ],
        "city_day_ranges": [
            {
                "city": "Vilnius",
                "start": 1,
                "end": 2
            },
            {
                "city": "Riga",
                "start": 3,
                "end": 4
            },
            {
                "city": "Manchester",
                "start": 5,
                "end": 7
            },
            {
                "city": "Lyon",
                "start": 8,
                "end": 9
            },
            {
                "city": "Santorini",
                "start": 10,
                "end": 14
            },
            {
                "city": "Barcelona",
                "start": 15,
                "end": 16
            },
            {
                "city": "Paris",
                "start": 17,
                "end": 19
            },
            {
                "city": "Amsterdam",
                "start": 20,
                "end": 24
            }
        ],
        "special_events": [
            {
                "event": "Visit relatives",
                "city": "Vilnius",
                "day_range": [
                    2,
                    3
                ]
            },
            {
                "event": "Workshop",
                "city": "Lyon",
                "day_range": [
                    8,
                    9
                ]
            },
            {
                "event": "Conference",
                "city": "Amsterdam",
                "day_range": [
                    9,
                    13
                ]
            }
        ],
        "direct_flights": [
            {
                "from": "Paris",
                "to": "Lyon"
            },
            {
                "from": "Paris",
                "to": "Manchester"
            },
            {
                "from": "Vilnius",
                "to": "Amsterdam"
            },
            {
                "from": "Riga",
                "to": "Manchester"
            },
            {
                "from": "Amsterdam",
                "to": "Santorini"
            },
            {
                "from": "Riga",
                "to": "Amsterdam"
            },
            {
                "from": "Paris",
                "to": "Amsterdam"
            },
            {
                "from": "Manchester",
                "to": "Santorini"
            },
            {
                "from": "Manchester",
                "to": "Amsterdam"
            },
            {
                "from": "Barcelona",
                "to": "Santorini"
            },
            {
                "from": "Lyon",
                "to": "Amsterdam"
            },
            {
                "from": "Riga",
                "to": "Paris"
            },
            {
                "from": "Riga",
                "to": "Barcelona"
            },
            {
                "from": "Paris",
                "to": "Barcelona"
            },
            {
                "from": "Vilnius",
                "to": "Paris"
            },
            {
                "from": "Barcelona",
                "to": "Lyon"
            },
            {
                "from": "Manchester",
                "to": "Barcelona"
            },
            {
                "from": "Barcelona",
                "to": "Amsterdam"
            },
            {
                "from": "Riga",
                "to": "Vilnius"
            }
        ],
        "city_visit_sequence": [
            "Vilnius",
            "Riga",
            "Manchester",
            "Lyon",
            "Santorini",
            "Barcelona",
            "Paris",
            "Amsterdam"
        ]
    }
}