{
    "trip_planning_example_1312": {
        "input_query": [
            "You plan to visit 9 European cities for 25 days in total. You only take direct flights to commute between cities. You would like to visit Seville for 5 days. You would like to meet your friends at Seville between day 2 and day 6 to tour together. You want to spend 2 days in Amsterdam. You want to spend 3 days in Edinburgh. You want to spend 5 days in Copenhagen. You plan to visit relatives in Copenhagen between day 17 and day 21. You would like to visit Krakow for 4 days. You want to spend 2 days in Porto. You are going to attend a wedding in Porto between day 1 and day 2. You would like to visit Tallinn for 5 days. During day 21 and day 25, you have to attend a conference in Tallinn. You would like to visit Santorini for 3 days. You would like to visit Split for 4 days.\n\nHere are the cities that have direct flights:\nAmsterdam and Tallinn, Edinburgh and Krakow, Santorini and Copenhagen, Split and Amsterdam, Seville and Amsterdam, Porto and Edinburgh, Split and Copenhagen, Copenhagen and Tallinn, Krakow and Split, Edinburgh and Copenhagen, Porto and Amsterdam, Seville and Edinburgh, Krakow and Amsterdam, Amsterdam and Santorini, Porto and Copenhagen.\n\nFind a trip plan of visiting the cities for 25 days by taking direct flights to commute between them."
        ],
        "trip_length": 25,
        "city_length": [
            {
                "city": "Porto",
                "days": 2
            },
            {
                "city": "Seville",
                "days": 5
            },
            {
                "city": "Edinburgh",
                "days": 3
            },
            {
                "city": "Krakow",
                "days": 4
            },
            {
                "city": "Split",
                "days": 4
            },
            {
                "city": "Amsterdam",
                "days": 2
            },
            {
                "city": "Santorini",
                "days": 3
            },
            {
                "city": "Copenhagen",
                "days": 5
            },
            {
                "city": "Tallinn",
                "days": 5
            }
        ],
        "city_day_ranges": [
            {
                "city": "Porto",
                "start": 1,
                "end": 2
            },
            {
                "city": "Seville",
                "start": 3,
                "end": 7
            },
            {
                "city": "Edinburgh",
                "start": 8,
                "end": 10
            },
            {
                "city": "Krakow",
                "start": 11,
                "end": 14
            },
            {
                "city": "Split",
                "start": 15,
                "end": 18
            },
            {
                "city": "Amsterdam",
                "start": 19,
                "end": 20
            },
            {
                "city": "Santorini",
                "start": 21,
                "end": 23
            },
            {
                "city": "Copenhagen",
                "start": 24,
                "end": 25
            }
        ],
        "special_events": [
            {
                "event": "Attend wedding",
                "city": "Porto",
                "start": 1,
                "end": 2
            },
            {
                "event": "Meet friends",
                "city": "Seville",
                "start": 3,
                "end": 7
            },
            {
                "event": "Visit relatives",
                "city": "Copenhagen",
                "start": 24,
                "end": 25
            },
            {
                "event": "Attend conference",
                "city": "Tallinn",
                "start": 21,
                "end": 25
            }
        ],
        "direct_flights": [
            {
                "from": "Amsterdam",
                "to": "Tallinn"
            },
            {
                "from": "Edinburgh",
                "to": "Krakow"
            },
            {
                "from": "Santorini",
                "to": "Copenhagen"
            },
            {
                "from": "Split",
                "to": "Amsterdam"
            },
            {
                "from": "Seville",
                "to": "Amsterdam"
            },
            {
                "from": "Porto",
                "to": "Edinburgh"
            },
            {
                "from": "Split",
                "to": "Copenhagen"
            },
            {
                "from": "Copenhagen",
                "to": "Tallinn"
            },
            {
                "from": "Krakow",
                "to": "Split"
            },
            {
                "from": "Edinburgh",
                "to": "Copenhagen"
            },
            {
                "from": "Porto",
                "to": "Amsterdam"
            },
            {
                "from": "Seville",
                "to": "Edinburgh"
            },
            {
                "from": "Krakow",
                "to": "Amsterdam"
            },
            {
                "from": "Amsterdam",
                "to": "Santorini"
            },
            {
                "from": "Porto",
                "to": "Copenhagen"
            }
        ],
        "final_trip_order": [
            "Porto",
            "Seville",
            "Edinburgh",
            "Krakow",
            "Split",
            "Amsterdam",
            "Santorini",
            "Copenhagen",
            "Tallinn"
        ],
        "final_trip_days": [
            {
                "city": "Porto",
                "start": 1,
                "end": 2
            },
            {
                "city": "Seville",
                "start": 3,
                "end": 7
            },
            {
                "city": "Edinburgh",
                "start": 8,
                "end": 10
            },
            {
                "city": "Krakow",
                "start": 11,
                "end": 14
            },
            {
                "city": "Split",
                "start": 15,
                "end": 18
            },
            {
                "city": "Amsterdam",
                "start": 19,
                "end": 20
            },
            {
                "city": "Santorini",
                "start": 21,
                "end": 23
            },
            {
                "city": "Copenhagen",
                "start": 24,
                "end": 25
            },
            {
                "city": "Tallinn",
                "start": 21,
                "end": 25
            }
        ]
    }
}