{
    "trip_planning_example_995": {
        "input_query": [
            "You plan to visit 7 European cities for 16 days in total. You only take direct flights to commute between cities. You would like to visit Oslo for 2 days. You would like to meet your friends at Oslo between day 3 and day 4 to tour together. You want to spend 3 days in Stuttgart. You would like to visit Venice for 4 days. You plan to stay in Split for 4 days. You plan to stay in Barcelona for 3 days. From day 1 to day 3, there is a annual show you want to attend in Barcelona. You would like to visit Brussels for 3 days. You want to meet a friend in Brussels between day 9 and day 11. You would like to visit Copenhagen for 3 days.\n\nHere are the cities that have direct flights:\nVenice and Stuttgart, Oslo and Brussels, Split and Copenhagen, Barcelona and Copenhagen, Barcelona and Venice, Brussels and Venice, Barcelona and Stuttgart, Copenhagen and Brussels, Oslo and Split, Oslo and Venice, Barcelona and Split, Oslo and Copenhagen, Barcelona and Oslo, Copenhagen and Stuttgart, Split and Stuttgart, Copenhagen and Venice, Barcelona and Brussels.\n\nFind a trip plan of visiting the cities for 16 days by taking direct flights to commute between them."
        ],
        "trip_length": 16,
        "city_length": [
            {
                "city": "Barcelona",
                "days": 3
            },
            {
                "city": "Oslo",
                "days": 2
            },
            {
                "city": "Split",
                "days": 4
            },
            {
                "city": "Copenhagen",
                "days": 3
            },
            {
                "city": "Stuttgart",
                "days": 3
            },
            {
                "city": "Venice",
                "days": 4
            },
            {
                "city": "Brussels",
                "days": 3
            }
        ],
        "city_day_ranges": [
            {
                "city": "Barcelona",
                "start": 1,
                "end": 3
            },
            {
                "city": "Oslo",
                "start": 4,
                "end": 5
            },
            {
                "city": "Split",
                "start": 6,
                "end": 9
            },
            {
                "city": "Copenhagen",
                "start": 10,
                "end": 12
            },
            {
                "city": "Stuttgart",
                "start": 13,
                "end": 15
            },
            {
                "city": "Venice",
                "start": 8,
                "end": 11
            },
            {
                "city": "Brussels",
                "start": 9,
                "end": 11
            }
        ],
        "special_meetings": [
            {
                "city": "Oslo",
                "meeting_type": "meet friends for touring",
                "start": 3,
                "end": 4
            },
            {
                "city": "Brussels",
                "meeting_type": "meet a friend",
                "start": 9,
                "end": 11
            }
        ],
        "events": [
            {
                "city": "Barcelona",
                "event": "annual show",
                "start": 1,
                "end": 3
            }
        ],
        "direct_flights": [
            {
                "from": "Venice",
                "to": "Stuttgart"
            },
            {
                "from": "Oslo",
                "to": "Brussels"
            },
            {
                "from": "Split",
                "to": "Copenhagen"
            },
            {
                "from": "Barcelona",
                "to": "Copenhagen"
            },
            {
                "from": "Barcelona",
                "to": "Venice"
            },
            {
                "from": "Brussels",
                "to": "Venice"
            },
            {
                "from": "Barcelona",
                "to": "Stuttgart"
            },
            {
                "from": "Copenhagen",
                "to": "Brussels"
            },
            {
                "from": "Oslo",
                "to": "Split"
            },
            {
                "from": "Oslo",
                "to": "Venice"
            },
            {
                "from": "Barcelona",
                "to": "Split"
            },
            {
                "from": "Oslo",
                "to": "Copenhagen"
            },
            {
                "from": "Barcelona",
                "to": "Oslo"
            },
            {
                "from": "Copenhagen",
                "to": "Stuttgart"
            },
            {
                "from": "Split",
                "to": "Stuttgart"
            },
            {
                "from": "Copenhagen",
                "to": "Venice"
            },
            {
                "from": "Barcelona",
                "to": "Brussels"
            }
        ],
        "planned_route": [
            {
                "city": "Barcelona",
                "start": 1,
                "end": 3,
                "flight_to": "Oslo"
            },
            {
                "city": "Oslo",
                "start": 4,
                "end": 5,
                "flight_to": "Split"
            },
            {
                "city": "Split",
                "start": 6,
                "end": 9,
                "flight_to": "Copenhagen"
            },
            {
                "city": "Copenhagen",
                "start": 10,
                "end": 12,
                "flight_to": "Stuttgart"
            },
            {
                "city": "Stuttgart",
                "start": 13,
                "end": 15,
                "flight_to": "Venice"
            },
            {
                "city": "Venice",
                "start": 16,
                "end": 16,
                "flight_to": null
            }
        ]
    }
}