{
    "0shot": [
        {
            "final_program_time": {
                "itinerary": [
                    {
                        "action": "meet",
                        "location": "The Castro",
                        "person": "Melissa",
                        "start_time": "20:15",
                        "end_time": "20:45"
                    },
                    {
                        "action": "meet",
                        "location": "North Beach",
                        "person": "Kimberly",
                        "start_time": "8:20",
                        "end_time": "10:30"
                    },
                    {
                        "action": "meet",
                        "location": "Embarcadero",
                        "person": "Joseph",
                        "start_time": "15:30",
                        "end_time": "16:45"
                    },
                    {
                        "action": "meet",
                        "location": "Alamo Square",
                        "person": "Barbara",
                        "start_time": "21:44",
                        "end_time": "21:45"
                    },
                    {
                        "action": "meet",
                        "location": "Nob Hill",
                        "person": "Kenneth",
                        "start_time": "22:15",
                        "end_time": "17:15"
                    },
                    {
                        "action": "meet",
                        "location": "Presidio",
                        "person": "Joshua",
                        "start_time": "17:43",
                        "end_time": "18:15"
                    },
                    {
                        "action": "meet",
                        "location": "Fisherman's Wharf",
                        "person": "Brian",
                        "start_time": "18:51",
                        "end_time": "15:30"
                    },
                    {
                        "action": "meet",
                        "location": "Mission District",
                        "person": "Steven",
                        "start_time": "19:30",
                        "end_time": "21:00"
                    },
                    {
                        "action": "meet",
                        "location": "Haight-Ashbury",
                        "person": "Betty",
                        "start_time": "0:53",
                        "end_time": "20:30"
                    }
                ]
            },
            "expected_time": {
                "itinerary": [
                    {
                        "action": "meet",
                        "location": "North Beach",
                        "person": "Kimberly",
                        "start_time": "9:10",
                        "end_time": "9:25"
                    },
                    {
                        "action": "meet",
                        "location": "Nob Hill",
                        "person": "Kenneth",
                        "start_time": "12:15",
                        "end_time": "14:00"
                    },
                    {
                        "action": "meet",
                        "location": "Fisherman's Wharf",
                        "person": "Brian",
                        "start_time": "14:10",
                        "end_time": "14:55"
                    },
                    {
                        "action": "meet",
                        "location": "Embarcadero",
                        "person": "Joseph",
                        "start_time": "15:30",
                        "end_time": "16:45"
                    },
                    {
                        "action": "meet",
                        "location": "Haight-Ashbury",
                        "person": "Betty",
                        "start_time": "19:00",
                        "end_time": "20:30"
                    },
                    {
                        "action": "meet",
                        "location": "The Castro",
                        "person": "Melissa",
                        "start_time": "20:36",
                        "end_time": "21:06"
                    },
                    {
                        "action": "meet",
                        "location": "Alamo Square",
                        "person": "Barbara",
                        "start_time": "21:14",
                        "end_time": "21:29"
                    }
                ]
            },
            "has_error": false,
            "raw_model_response": "```python\nimport json\nfrom datetime import datetime, timedelta\n\n# Travel distances (in minutes)\ntravel_distances = {\n    \"Union Square\": {\n        \"The Castro\": 17,\n        \"North Beach\": 10,\n        \"Embarcadero\": 11,\n        \"Alamo Square\": 15,\n        \"Nob Hill\": 9,\n        \"Presidio\": 24,\n        \"Fisherman's Wharf\": 15,\n        \"Mission District\": 14,\n        \"Haight-Ashbury\": 18\n    },\n    \"The Castro\": {\n        \"Union Square\": 19,\n        \"North Beach\": 20,\n        \"Embarcadero\": 22,\n        \"Alamo Square\": 8,\n        \"Nob Hill\": 16,\n        \"Presidio\": 20,\n        \"Fisherman's Wharf\": 24,\n        \"Mission District\": 7,\n        \"Haight-Ashbury\": 6\n    },\n    \"North Beach\": {\n        \"Union Square\": 7,\n        \"The Castro\": 23,\n        \"Embarcadero\": 6,\n        \"Alamo Square\": 16,\n        \"Nob Hill\": 7,\n        \"Presidio\": 17,\n        \"Fisherman's Wharf\": 5,\n        \"Mission District\": 18,\n        \"Haight-Ashbury\": 18\n    },\n    \"Embarcadero\": {\n        \"Union Square\": 10,\n        \"The Castro\": 25,\n        \"North Beach\": 5,\n        \"Alamo Square\": 19,\n        \"Nob Hill\": 10,\n        \"Presidio\": 20,\n        \"Fisherman's Wharf\": 6,\n        \"Mission District\": 20,\n        \"Haight-Ashbury\": 21\n    },\n    \"Alamo Square\": {\n        \"Union Square\": 14,\n        \"The Castro\": 8,\n        \"North Beach\": 15,\n        \"Embarcadero\": 16,\n        \"Nob Hill\": 11,\n        \"Presidio\": 17,\n        \"Fisherman's Wharf\": 19,\n        \"Mission District\": 10,\n        \"Haight-Ashbury\": 5\n    },\n    \"Nob Hill\": {\n        \"Union Square\": 7,\n        \"The Castro\": 17,\n        \"North Beach\": 8,\n        \"Embarcadero\": 9,\n        \"Alamo Square\": 11,\n        \"Presidio\": 17,\n        \"Fisherman's Wharf\": 10,\n        \"Mission District\": 13,\n        \"Haight-Ashbury\": 13\n    },\n    \"Presidio\": {\n        \"Union Square\": 22,\n        \"The Castro\": 21,\n        \"North Beach\": 18,\n        \"Embarcadero\": 20,\n        \"Alamo Square\": 19,\n        \"Nob Hill\": 18,\n        \"Fisherman's Wharf\": 19,\n        \"Mission District\": 26,\n        \"Haight-Ashbury\": 15\n    },\n    \"Fisherman's Wharf\": {\n        \"Union Square\": 13,\n        \"The Castro\": 27,\n        \"North Beach\": 6,\n        \"Embarcadero\": 8,\n        \"Alamo Square\": 21,\n        \"Nob Hill\": 11,\n        \"Presidio\": 17,\n        \"Mission District\": 22,\n        \"Haight-Ashbury\": 22\n    },\n    \"Mission District\": {\n        \"Union Square\": 15,\n        \"The Castro\": 7,\n        \"North Beach\": 17,\n        \"Embarcadero\": 19,\n        \"Alamo Square\": 11,\n        \"Nob Hill\": 12,\n        \"Presidio\": 25,\n        \"Fisherman's Wharf\": 22,\n        \"Haight-Ashbury\": 12\n    },\n    \"Haight-Ashbury\": {\n        \"Union Square\": 19,\n        \"The Castro\": 6,\n        \"North Beach\": 19,\n        \"Embarcadero\": 20,\n        \"Alamo Square\": 5,\n        \"Nob Hill\": 15,\n        \"Presidio\": 15,\n        \"Fisherman's Wharf\": 23,\n        \"Mission District\": 11\n    }\n}\n\n# Meeting constraints\nmeetings = [\n    {\"name\": \"Melissa\", \"location\": \"The Castro\", \"start_time\": \"20:15\", \"end_time\": \"21:15\", \"duration\": 30},\n    {\"name\": \"Kimberly\", \"location\": \"North Beach\", \"start_time\": \"07:00\", \"end_time\": \"10:30\", \"duration\": 15},\n    {\"name\": \"Joseph\", \"location\": \"Embarcadero\", \"start_time\": \"15:30\", \"end_time\": \"19:30\", \"duration\": 75},\n    {\"name\": \"Barbara\", \"location\": \"Alamo Square\", \"start_time\": \"20:45\", \"end_time\": \"21:45\", \"duration\": 15},\n    {\"name\": \"Kenneth\", \"location\": \"Nob Hill\", \"start_time\": \"12:15\", \"end_time\": \"17:15\", \"duration\": 105},\n    {\"name\": \"Joshua\", \"location\": \"Presidio\", \"start_time\": \"16:30\", \"end_time\": \"18:15\", \"duration\": 105},\n    {\"name\": \"Brian\", \"location\": \"Fisherman's Wharf\", \"start_time\": \"09:30\", \"end_time\": \"15:30\", \"duration\": 45},\n    {\"name\": \"Steven\", \"location\": \"Mission District\", \"start_time\": \"19:30\", \"end_time\": \"21:00\", \"duration\": 90},\n    {\"name\": \"Betty\", \"location\": \"Haight-Ashbury\", \"start_time\": \"19:00\", \"end_time\": \"20:30\", \"duration\": 90}\n]\n\ndef calculate_itinerary(meetings, travel_distances):\n    itinerary = []\n    current_location = \"Union Square\"\n    current_time = datetime.strptime(\"09:00\", \"%H:%M\")\n\n    for meeting in meetings:\n        travel_time = travel_distances[current_location][meeting[\"location\"]]\n        arrival_time = current_time + timedelta(minutes=travel_time)\n        start_time = datetime.strptime(meeting[\"start_time\"], \"%H:%M\")\n        end_time = datetime.strptime(meeting[\"end_time\"], \"%H:%M\")\n\n        if arrival_time < start_time:\n            wait_time = start_time - arrival_time\n            current_time = start_time\n        else:\n            wait_time = timedelta(0)\n\n        meeting_start_time = max(arrival_time, start_time)\n        meeting_end_time = min(meeting_start_time + timedelta(minutes=meeting[\"duration\"]), end_time)\n\n        itinerary.append({\n            \"action\": \"meet\",\n            \"location\": meeting[\"location\"],\n            \"person\": meeting[\"name\"],\n            \"start_time\": meeting_start_time.strftime(\"%H:%M\"),\n            \"end_time\": meeting_end_time.strftime(\"%H:%M\")\n        })\n\n        current_time = meeting_end_time + wait_time + timedelta(minutes=travel_time)\n        current_location = meeting[\"location\"]\n\n    return itinerary\n\nitinerary = calculate_itinerary(meetings, travel_distances)\nprint(json.dumps({\"itinerary\": itinerary}, indent=4))\n```",
            "count": "meeting_planning_example_800"
        }
    ]
}