{
    "0shot": [
        {
            "final_program_time": {
                "itinerary": [
                    {
                        "action": "meet",
                        "location": "Bayview",
                        "person": "Matthew",
                        "start_time": "19:15",
                        "end_time": "21:15"
                    },
                    {
                        "action": "meet",
                        "location": "Chinatown",
                        "person": "Karen",
                        "start_time": "7:49",
                        "end_time": "21:15"
                    },
                    {
                        "action": "meet",
                        "location": "Alamo Square",
                        "person": "Sarah",
                        "start_time": "21:51",
                        "end_time": "21:45"
                    },
                    {
                        "action": "meet",
                        "location": "Nob Hill",
                        "person": "Jessica",
                        "start_time": "22:13",
                        "end_time": "18:45"
                    },
                    {
                        "action": "meet",
                        "location": "Presidio",
                        "person": "Stephanie",
                        "start_time": "19:13",
                        "end_time": "10:15"
                    },
                    {
                        "action": "meet",
                        "location": "Union Square",
                        "person": "Mary",
                        "start_time": "16:45",
                        "end_time": "17:45"
                    },
                    {
                        "action": "meet",
                        "location": "The Castro",
                        "person": "Charles",
                        "start_time": "0:15",
                        "end_time": "22:00"
                    },
                    {
                        "action": "meet",
                        "location": "North Beach",
                        "person": "Nancy",
                        "start_time": "22:37",
                        "end_time": "20:00"
                    },
                    {
                        "action": "meet",
                        "location": "Fisherman's Wharf",
                        "person": "Thomas",
                        "start_time": "20:25",
                        "end_time": "19:00"
                    },
                    {
                        "action": "meet",
                        "location": "Marina District",
                        "person": "Brian",
                        "start_time": "19:15",
                        "end_time": "18:00"
                    }
                ]
            },
            "expected_time": {
                "itinerary": [
                    {
                        "action": "meet",
                        "location": "Fisherman's Wharf",
                        "person": "Thomas",
                        "start_time": "13:30",
                        "end_time": "14:00"
                    },
                    {
                        "action": "meet",
                        "location": "North Beach",
                        "person": "Nancy",
                        "start_time": "14:45",
                        "end_time": "15:00"
                    },
                    {
                        "action": "meet",
                        "location": "Marina District",
                        "person": "Brian",
                        "start_time": "15:09",
                        "end_time": "16:09"
                    },
                    {
                        "action": "meet",
                        "location": "Nob Hill",
                        "person": "Jessica",
                        "start_time": "16:30",
                        "end_time": "18:30"
                    },
                    {
                        "action": "meet",
                        "location": "Union Square",
                        "person": "Mary",
                        "start_time": "18:37",
                        "end_time": "19:37"
                    },
                    {
                        "action": "meet",
                        "location": "Bayview",
                        "person": "Matthew",
                        "start_time": "19:52",
                        "end_time": "21:52"
                    }
                ]
            },
            "has_error": false,
            "raw_model_response": "```python\nimport json\nfrom datetime import datetime, timedelta\n\n# Travel distances (in minutes)\ntravel_distances = {\n    \"Embarcadero\": {\n        \"Bayview\": 21,\n        \"Chinatown\": 7,\n        \"Alamo Square\": 19,\n        \"Nob Hill\": 10,\n        \"Presidio\": 20,\n        \"Union Square\": 10,\n        \"The Castro\": 25,\n        \"North Beach\": 5,\n        \"Fisherman's Wharf\": 6,\n        \"Marina District\": 12\n    },\n    \"Bayview\": {\n        \"Embarcadero\": 19,\n        \"Chinatown\": 19,\n        \"Alamo Square\": 16,\n        \"Nob Hill\": 20,\n        \"Presidio\": 32,\n        \"Union Square\": 18,\n        \"The Castro\": 19,\n        \"North Beach\": 22,\n        \"Fisherman's Wharf\": 25,\n        \"Marina District\": 27\n    },\n    \"Chinatown\": {\n        \"Embarcadero\": 5,\n        \"Bayview\": 20,\n        \"Alamo Square\": 17,\n        \"Nob Hill\": 9,\n        \"Presidio\": 19,\n        \"Union Square\": 7,\n        \"The Castro\": 22,\n        \"North Beach\": 3,\n        \"Fisherman's Wharf\": 8,\n        \"Marina District\": 12\n    },\n    \"Alamo Square\": {\n        \"Embarcadero\": 16,\n        \"Bayview\": 16,\n        \"Chinatown\": 15,\n        \"Nob Hill\": 11,\n        \"Presidio\": 17,\n        \"Union Square\": 14,\n        \"The Castro\": 8,\n        \"North Beach\": 15,\n        \"Fisherman's Wharf\": 19,\n        \"Marina District\": 15\n    },\n    \"Nob Hill\": {\n        \"Embarcadero\": 9,\n        \"Bayview\": 19,\n        \"Chinatown\": 6,\n        \"Alamo Square\": 11,\n        \"Presidio\": 17,\n        \"Union Square\": 7,\n        \"The Castro\": 17,\n        \"North Beach\": 8,\n        \"Fisherman's Wharf\": 10,\n        \"Marina District\": 11\n    },\n    \"Presidio\": {\n        \"Embarcadero\": 20,\n        \"Bayview\": 31,\n        \"Chinatown\": 21,\n        \"Alamo Square\": 19,\n        \"Nob Hill\": 18,\n        \"Union Square\": 22,\n        \"The Castro\": 21,\n        \"North Beach\": 18,\n        \"Fisherman's Wharf\": 19,\n        \"Marina District\": 11\n    },\n    \"Union Square\": {\n        \"Embarcadero\": 11,\n        \"Bayview\": 15,\n        \"Chinatown\": 7,\n        \"Alamo Square\": 15,\n        \"Nob Hill\": 9,\n        \"Presidio\": 24,\n        \"The Castro\": 17,\n        \"North Beach\": 10,\n        \"Fisherman's Wharf\": 15,\n        \"Marina District\": 18\n    },\n    \"The Castro\": {\n        \"Embarcadero\": 22,\n        \"Bayview\": 19,\n        \"Chinatown\": 22,\n        \"Alamo Square\": 8,\n        \"Nob Hill\": 16,\n        \"Presidio\": 20,\n        \"Union Square\": 19,\n        \"North Beach\": 20,\n        \"Fisherman's Wharf\": 24,\n        \"Marina District\": 21\n    },\n    \"North Beach\": {\n        \"Embarcadero\": 6,\n        \"Bayview\": 25,\n        \"Chinatown\": 6,\n        \"Alamo Square\": 16,\n        \"Nob Hill\": 7,\n        \"Presidio\": 17,\n        \"Union Square\": 7,\n        \"The Castro\": 23,\n        \"Fisherman's Wharf\": 5,\n        \"Marina District\": 9\n    },\n    \"Fisherman's Wharf\": {\n        \"Embarcadero\": 8,\n        \"Bayview\": 26,\n        \"Chinatown\": 12,\n        \"Alamo Square\": 21,\n        \"Nob Hill\": 11,\n        \"Presidio\": 17,\n        \"Union Square\": 13,\n        \"The Castro\": 27,\n        \"North Beach\": 6,\n        \"Marina District\": 10\n    },\n    \"Marina District\": {\n        \"Embarcadero\": 14,\n        \"Bayview\": 27,\n        \"Chinatown\": 15,\n        \"Alamo Square\": 15,\n        \"Nob Hill\": 12,\n        \"Presidio\": 10,\n        \"Union Square\": 16,\n        \"The Castro\": 22,\n        \"North Beach\": 11,\n        \"Fisherman's Wharf\": 10\n    }\n}\n\n# Meeting constraints\nmeetings = [\n    {\"name\": \"Matthew\", \"location\": \"Bayview\", \"start_time\": \"19:15\", \"end_time\": \"22:00\", \"duration\": 120},\n    {\"name\": \"Karen\", \"location\": \"Chinatown\", \"start_time\": \"19:15\", \"end_time\": \"21:15\", \"duration\": 90},\n    {\"name\": \"Sarah\", \"location\": \"Alamo Square\", \"start_time\": \"20:00\", \"end_time\": \"21:45\", \"duration\": 105},\n    {\"name\": \"Jessica\", \"location\": \"Nob Hill\", \"start_time\": \"16:30\", \"end_time\": \"18:45\", \"duration\": 120},\n    {\"name\": \"Stephanie\", \"location\": \"Presidio\", \"start_time\": \"07:30\", \"end_time\": \"10:15\", \"duration\": 60},\n    {\"name\": \"Mary\", \"location\": \"Union Square\", \"start_time\": \"16:45\", \"end_time\": \"21:30\", \"duration\": 60},\n    {\"name\": \"Charles\", \"location\": \"The Castro\", \"start_time\": \"16:30\", \"end_time\": \"22:00\", \"duration\": 105},\n    {\"name\": \"Nancy\", \"location\": \"North Beach\", \"start_time\": \"14:45\", \"end_time\": \"20:00\", \"duration\": 15},\n    {\"name\": \"Thomas\", \"location\": \"Fisherman's Wharf\", \"start_time\": \"13:30\", \"end_time\": \"19:00\", \"duration\": 30},\n    {\"name\": \"Brian\", \"location\": \"Marina District\", \"start_time\": \"12:15\", \"end_time\": \"18:00\", \"duration\": 60}\n]\n\ndef calculate_itinerary(meetings, travel_distances):\n    itinerary = []\n    current_location = \"Embarcadero\"\n    current_time = datetime.strptime(\"09:00\", \"%H:%M\")\n\n    for meeting in meetings:\n        travel_time = travel_distances[current_location][meeting[\"location\"]]\n        arrival_time = current_time + timedelta(minutes=travel_time)\n        start_time = datetime.strptime(meeting[\"start_time\"], \"%H:%M\")\n        end_time = datetime.strptime(meeting[\"end_time\"], \"%H:%M\")\n\n        if arrival_time < start_time:\n            wait_time = start_time - arrival_time\n            current_time = start_time\n        else:\n            wait_time = timedelta(0)\n\n        meeting_start_time = max(arrival_time, start_time)\n        meeting_end_time = min(meeting_start_time + timedelta(minutes=meeting[\"duration\"]), end_time)\n\n        itinerary.append({\n            \"action\": \"meet\",\n            \"location\": meeting[\"location\"],\n            \"person\": meeting[\"name\"],\n            \"start_time\": meeting_start_time.strftime(\"%H:%M\"),\n            \"end_time\": meeting_end_time.strftime(\"%H:%M\")\n        })\n\n        current_time = meeting_end_time + wait_time + timedelta(minutes=travel_time)\n        current_location = meeting[\"location\"]\n\n    return itinerary\n\nitinerary = calculate_itinerary(meetings, travel_distances)\nprint(json.dumps({\"itinerary\": itinerary}, indent=4))\n```",
            "count": "meeting_planning_example_976"
        }
    ]
}