{
    "0shot": [
        {
            "final_program_time": {
                "itinerary": [
                    {
                        "action": "meet",
                        "location": "Marina District",
                        "person": "Joshua",
                        "start_time": "9:18",
                        "end_time": "10:03"
                    },
                    {
                        "action": "meet",
                        "location": "Nob Hill",
                        "person": "Kenneth",
                        "start_time": "12:45",
                        "end_time": "13:15"
                    },
                    {
                        "action": "meet",
                        "location": "Sunset District",
                        "person": "Betty",
                        "start_time": "14:00",
                        "end_time": "15:00"
                    },
                    {
                        "action": "meet",
                        "location": "Presidio",
                        "person": "Kimberly",
                        "start_time": "15:30",
                        "end_time": "15:45"
                    },
                    {
                        "action": "meet",
                        "location": "Chinatown",
                        "person": "Deborah",
                        "start_time": "17:15",
                        "end_time": "17:30"
                    },
                    {
                        "action": "meet",
                        "location": "Russian Hill",
                        "person": "Barbara",
                        "start_time": "17:37",
                        "end_time": "19:37"
                    },
                    {
                        "action": "meet",
                        "location": "North Beach",
                        "person": "Steven",
                        "start_time": "19:42",
                        "end_time": "20:45"
                    },
                    {
                        "action": "meet",
                        "location": "Haight-Ashbury",
                        "person": "Daniel",
                        "start_time": "21:03",
                        "end_time": "18:45"
                    },
                    {
                        "action": "meet",
                        "location": "Alamo Square",
                        "person": "Elizabeth",
                        "start_time": "19:15",
                        "end_time": "19:30"
                    },
                    {
                        "action": "meet",
                        "location": "Financial District",
                        "person": "Sandra",
                        "start_time": "19:47",
                        "end_time": "20:15"
                    }
                ]
            },
            "expected_time": {
                "itinerary": [
                    {
                        "action": "meet",
                        "location": "Marina District",
                        "person": "Joshua",
                        "start_time": "10:30",
                        "end_time": "11:15"
                    },
                    {
                        "action": "meet",
                        "location": "Presidio",
                        "person": "Kimberly",
                        "start_time": "15:30",
                        "end_time": "15:45"
                    },
                    {
                        "action": "meet",
                        "location": "Nob Hill",
                        "person": "Kenneth",
                        "start_time": "16:03",
                        "end_time": "16:33"
                    },
                    {
                        "action": "meet",
                        "location": "Sunset District",
                        "person": "Betty",
                        "start_time": "16:57",
                        "end_time": "17:57"
                    },
                    {
                        "action": "meet",
                        "location": "Haight-Ashbury",
                        "person": "Daniel",
                        "start_time": "18:30",
                        "end_time": "18:45"
                    },
                    {
                        "action": "meet",
                        "location": "Alamo Square",
                        "person": "Elizabeth",
                        "start_time": "19:15",
                        "end_time": "19:30"
                    },
                    {
                        "action": "meet",
                        "location": "Chinatown",
                        "person": "Deborah",
                        "start_time": "19:45",
                        "end_time": "20:00"
                    }
                ]
            },
            "has_error": false,
            "raw_model_response": "```python\nimport json\n\n# Travel distances (in minutes)\ntravel_distances = {\n    'Union Square': {'Presidio': 24, 'Alamo Square': 15, 'Marina District': 18, 'Financial District': 9, 'Nob Hill': 9, 'Sunset District': 27, 'Chinatown': 7, 'Russian Hill': 13, 'North Beach': 10, 'Haight-Ashbury': 18},\n    'Presidio': {'Union Square': 22, 'Alamo Square': 19, 'Marina District': 11, 'Financial District': 23, 'Nob Hill': 18, 'Sunset District': 15, 'Chinatown': 21, 'Russian Hill': 14, 'North Beach': 18, 'Haight-Ashbury': 15},\n    'Alamo Square': {'Union Square': 14, 'Presidio': 17, 'Marina District': 15, 'Financial District': 17, 'Nob Hill': 11, 'Sunset District': 16, 'Chinatown': 15, 'Russian Hill': 13, 'North Beach': 15, 'Haight-Ashbury': 5},\n    'Marina District': {'Union Square': 16, 'Presidio': 10, 'Alamo Square': 15, 'Financial District': 17, 'Nob Hill': 12, 'Sunset District': 19, 'Chinatown': 15, 'Russian Hill': 8, 'North Beach': 11, 'Haight-Ashbury': 16},\n    'Financial District': {'Union Square': 9, 'Presidio': 22, 'Alamo Square': 17, 'Marina District': 15, 'Nob Hill': 8, 'Sunset District': 30, 'Chinatown': 5, 'Russian Hill': 11, 'North Beach': 7, 'Haight-Ashbury': 19},\n    'Nob Hill': {'Union Square': 7, 'Presidio': 17, 'Alamo Square': 11, 'Marina District': 11, 'Financial District': 9, 'Sunset District': 24, 'Chinatown': 6, 'Russian Hill': 5, 'North Beach': 8, 'Haight-Ashbury': 13},\n    'Sunset District': {'Union Square': 30, 'Presidio': 16, 'Alamo Square': 17, 'Marina District': 21, 'Financial District': 30, 'Nob Hill': 27, 'Chinatown': 30, 'Russian Hill': 24, 'North Beach': 28, 'Haight-Ashbury': 15},\n    'Chinatown': {'Union Square': 7, 'Presidio': 19, 'Alamo Square': 17, 'Marina District': 12, 'Financial District': 5, 'Nob Hill': 9, 'Sunset District': 29, 'Russian Hill': 7, 'North Beach': 3, 'Haight-Ashbury': 19},\n    'Russian Hill': {'Union Square': 10, 'Presidio': 14, 'Alamo Square': 15, 'Marina District': 7, 'Financial District': 11, 'Nob Hill': 5, 'Sunset District': 23, 'Chinatown': 9, 'North Beach': 5, 'Haight-Ashbury': 17},\n    'North Beach': {'Union Square': 7, 'Presidio': 17, 'Alamo Square': 16, 'Marina District': 9, 'Financial District': 8, 'Nob Hill': 7, 'Sunset District': 27, 'Chinatown': 6, 'Russian Hill': 4, 'Haight-Ashbury': 18},\n    'Haight-Ashbury': {'Union Square': 19, 'Presidio': 15, 'Alamo Square': 5, 'Marina District': 17, 'Financial District': 21, 'Nob Hill': 15, 'Sunset District': 15, 'Chinatown': 19, 'Russian Hill': 17, 'North Beach': 19}\n}\n\n# Meeting constraints\nmeeting_constraints = {\n    'Kimberly': {'location': 'Presidio','start_time': '15:30', 'end_time': '16:00','min_duration': 15},\n    'Elizabeth': {'location': 'Alamo Square','start_time': '19:15', 'end_time': '20:15','min_duration': 15},\n    'Joshua': {'location': 'Marina District','start_time': '10:30', 'end_time': '14:15','min_duration': 45},\n    'Sandra': {'location': 'Financial District','start_time': '19:30', 'end_time': '20:15','min_duration': 45},\n    'Kenneth': {'location': 'Nob Hill','start_time': '12:45', 'end_time': '21:45','min_duration': 30},\n    'Betty': {'location': 'Sunset District','start_time': '14:00', 'end_time': '19:00','min_duration': 60},\n    'Deborah': {'location': 'Chinatown','start_time': '17:15', 'end_time': '20:30','min_duration': 15},\n    'Barbara': {'location': 'Russian Hill','start_time': '17:30', 'end_time': '21:15','min_duration': 120},\n    'Steven': {'location': 'North Beach','start_time': '17:45', 'end_time': '20:45','min_duration': 90},\n    'Daniel': {'location': 'Haight-Ashbury','start_time': '18:30', 'end_time': '18:45','min_duration': 15}\n}\n\ndef calculate_meeting_schedule(travel_distances, meeting_constraints):\n    itinerary = []\n    current_time = '09:00'\n    current_location = 'Union Square'\n\n    # Sort meeting constraints by start time\n    sorted_meetings = sorted(meeting_constraints.items(), key=lambda x: x[1]['start_time'])\n\n    for person, meeting in sorted_meetings:\n        travel_time = travel_distances[current_location][meeting['location']]\n        arrival_time = add_time(current_time, travel_time)\n\n        if arrival_time > meeting['start_time']:\n            start_time = arrival_time\n        else:\n            start_time = meeting['start_time']\n\n        end_time = add_time(start_time, meeting['min_duration'])\n\n        if end_time > meeting['end_time']:\n            end_time = meeting['end_time']\n\n        itinerary.append({\n            'action':'meet',\n            'location': meeting['location'],\n            'person': person,\n           'start_time': start_time,\n            'end_time': end_time\n        })\n\n        current_time = end_time\n        current_location = meeting['location']\n\n    return itinerary\n\ndef add_time(time, minutes):\n    hours, mins = map(int, time.split(':'))\n    mins += minutes\n    hours += mins // 60\n    mins %= 60\n    return f'{hours}:{mins:02d}'\n\ndef main():\n    meeting_schedule = calculate_meeting_schedule(travel_distances, meeting_constraints)\n    print(json.dumps({'itinerary': meeting_schedule}, indent=4))\n\nif __name__ == '__main__':\n    main()\n```",
            "count": "meeting_planning_example_912"
        }
    ]
}