{
    "0shot": [
        {
            "final_program_time": {
                "itinerary": []
            },
            "expected_time": {
                "itinerary": [
                    {
                        "action": "meet",
                        "location": "Nob Hill",
                        "person": "Paul",
                        "start_time": "16:15",
                        "end_time": "17:15"
                    },
                    {
                        "action": "meet",
                        "location": "The Castro",
                        "person": "Karen",
                        "start_time": "17:32",
                        "end_time": "18:17"
                    },
                    {
                        "action": "meet",
                        "location": "Russian Hill",
                        "person": "Matthew",
                        "start_time": "18:35",
                        "end_time": "19:50"
                    },
                    {
                        "action": "meet",
                        "location": "Pacific Heights",
                        "person": "Jeffrey",
                        "start_time": "20:00",
                        "end_time": "20:45"
                    },
                    {
                        "action": "meet",
                        "location": "Presidio",
                        "person": "Nancy",
                        "start_time": "20:56",
                        "end_time": "21:26"
                    }
                ]
            },
            "has_error": true,
            "raw_model_response": "```python\nimport json\nfrom datetime import datetime, timedelta\n\nclass SchedulePlanner:\n    def __init__(self):\n        self.travel_times = {\n            ('Bayview', 'Nob Hill'): 20,\n            ('Bayview', 'Union Square'): 17,\n            ('Bayview', 'Chinatown'): 18,\n            ('Bayview', 'The Castro'): 20,\n            ('Bayview', 'Presidio'): 31,\n            ('Bayview', 'Pacific Heights'): 23,\n            ('Bayview', 'Russian Hill'): 23,\n            ('Nob Hill', 'Union Square'): 7,\n            ('Nob Hill', 'Chinatown'): 6,\n            ('Nob Hill', 'The Castro'): 17,\n            ('Nob Hill', 'Presidio'): 17,\n            ('Nob Hill', 'Pacific Heights'): 8,\n            ('Nob Hill', 'Russian Hill'): 5,\n            ('Union Square', 'Chinatown'): 7,\n            ('Union Square', 'The Castro'): 19,\n            ('Union Square', 'Presidio'): 24,\n            ('Union Square', 'Pacific Heights'): 15,\n            ('Union Square', 'Russian Hill'): 13,\n            ('Chinatown', 'The Castro'): 20,\n            ('Chinatown', 'Presidio'): 19,\n            ('Chinatown', 'Pacific Heights'): 10,\n            ('Chinatown', 'Russian Hill'): 7,\n            ('The Castro', 'Presidio'): 20,\n            ('The Castro', 'Pacific Heights'): 16,\n            ('The Castro', 'Russian Hill'): 18,\n            ('Presidio', 'Pacific Heights'): 11,\n            ('Presidio', 'Russian Hill'): 14,\n            ('Pacific Heights', 'Russian Hill'): 7,\n        }\n\n        # Meeting constraints (start_time, end_time, minimum_meeting_time)\n        self.meetings = {\n            'Paul': ('16:15', '21:15', 60),\n            'Carol': ('18:00', '20:15', 120),\n            'Patricia': ('20:00', '21:30', 75),\n            'Karen': ('17:00', '19:00', 45),\n            'Nancy': ('11:45', '22:00', 30),\n            'Jeffrey': ('20:00', '20:45', 45),\n            'Matthew': ('15:45', '21:45', 75),\n        }\n\n        self.start_location = 'Bayview'\n        self.start_time = datetime.strptime('09:00', '%H:%M')\n\n        self.schedule = []\n\n    def convert_to_minutes(self, time_str):\n        time_obj = datetime.strptime(time_str, '%H:%M')\n        return time_obj.hour * 60 + time_obj.minute\n\n    def convert_to_time_str(self, total_minutes):\n        hours = total_minutes // 60\n        minutes = total_minutes % 60\n        return f\"{hours}:{minutes:02d}\"\n\n    def plan_schedule(self):\n        available_meetings = {\n            person: (self.convert_to_minutes(start), \n                      self.convert_to_minutes(end), \n                      min_time)\n            for person, (start, end, min_time) in self.meetings.items()\n        }\n\n        current_time = self.start_time\n        current_location = self.start_location\n\n        # Visit Nancy first since it has the longest availability\n        nancy_start, nancy_end, nancy_minutes = available_meetings['Nancy']\n        travel_time_to_nancy = self.travel_times[(current_location, 'Presidio')]\n        nancy_meeting_time = max(current_time + timedelta(minutes=travel_time_to_nancy), \n                                  datetime.strptime('11:45', '%H:%M'))\n\n        # If we arrive after Nancy's meeting, skip to next\n        if nancy_meeting_time < datetime.strptime('11:45', '%H:%M'):\n            nancy_meeting_time = datetime.strptime('11:45', '%H:%M')\n\n        self.schedule.append({\n            'action': 'meet',\n            'location': 'Presidio',\n            'person': 'Nancy',\n            'start_time': nancy_meeting_time.strftime('%H:%M'),\n            'end_time': (nancy_meeting_time + timedelta(minutes=nancy_minutes)).strftime('%H:%M')\n        })\n\n        # Update current time and location\n        current_time = nancy_meeting_time + timedelta(minutes=nancy_minutes)\n        current_location = 'Presidio'\n\n        # Meeting sequence based on available time\n        for person in ['Matthew', 'Paul', 'Karen', 'Carol', 'Jeffrey', 'Patricia']:\n            start, end, min_time = available_meetings[person]\n            end_time = datetime.strptime(end, '%H:%M')\n\n            while current_time.hour * 60 + current_time.minute < end:\n                travel_time = self.travel_times.get((current_location, 'Nob Hill' if person == 'Paul' else \n                                                     'Union Square' if person == 'Carol' else \n                                                     'Chinatown' if person == 'Patricia' else\n                                                     'The Castro' if person == 'Karen' else \n                                                     'Pacific Heights' if person == 'Jeffrey' else \n                                                     'Russian Hill' if person == 'Matthew' else 'Bayview'), float('inf'))\n\n                meeting_start = current_time + timedelta(minutes=travel_time)\n                if meeting_start.hour * 60 + meeting_start.minute <= end and (meeting_start + timedelta(minutes=min_time)).hour * 60 + (meeting_start + timedelta(minutes=min_time)).minute <= end:\n                    self.schedule.append({\n                        'action': 'meet',\n                        'location': ('Nob Hill' if person == 'Paul' else\n                                     'Union Square' if person == 'Carol' else \n                                     'Chinatown' if person == 'Patricia' else \n                                     'The Castro' if person == 'Karen' else \n                                     'Pacific Heights' if person == 'Jeffrey' else \n                                     'Russian Hill' if person == 'Matthew' else 'Bayview'),\n                        'person': person,\n                        'start_time': meeting_start.strftime('%H:%M'),\n                        'end_time': (meeting_start + timedelta(minutes=min_time)).strftime('%H:%M')\n                    })\n\n                    # Update current time and location\n                    current_time = meeting_start + timedelta(minutes=min_time)\n                    current_location = ('Nob Hill' if person == 'Paul' else\n                                        'Union Square' if person == 'Carol' else\n                                        'Chinatown' if person == 'Patricia' else\n                                        'The Castro' if person == 'Karen' else\n                                        'Pacific Heights' if person == 'Jeffrey' else\n                                        'Russian Hill' if person == 'Matthew' else 'Bayview')\n                    if current_time.hour * 60 + current_time.minute >= 21 * 60:  # 21:00\n                        break\n                else:\n                    break\n\n        return self.schedule\n\nif __name__ == \"__main__\":\n    planner = SchedulePlanner()\n    optimal_schedule = planner.plan_schedule()\n\n    result = {\n        \"itinerary\": optimal_schedule\n    }\n\n    print(json.dumps(result, indent=2))\n```",
            "count": "meeting_planning_example_695"
        }
    ]
}