{
    "0shot": [
        {
            "final_program_time": {
                "itinerary": []
            },
            "expected_time": {
                "itinerary": [
                    {
                        "action": "meet",
                        "location": "Richmond District",
                        "person": "Jeffrey",
                        "start_time": "12:00",
                        "end_time": "12:45"
                    },
                    {
                        "action": "meet",
                        "location": "Presidio",
                        "person": "Charles",
                        "start_time": "13:15",
                        "end_time": "15:00"
                    },
                    {
                        "action": "meet",
                        "location": "Nob Hill",
                        "person": "Robert",
                        "start_time": "15:18",
                        "end_time": "16:48"
                    },
                    {
                        "action": "meet",
                        "location": "Marina District",
                        "person": "Kimberly",
                        "start_time": "17:00",
                        "end_time": "18:15"
                    },
                    {
                        "action": "meet",
                        "location": "Embarcadero",
                        "person": "Karen",
                        "start_time": "18:29",
                        "end_time": "19:29"
                    },
                    {
                        "action": "meet",
                        "location": "Mission District",
                        "person": "Brian",
                        "start_time": "19:49",
                        "end_time": "20:49"
                    },
                    {
                        "action": "meet",
                        "location": "Alamo Square",
                        "person": "Joshua",
                        "start_time": "21:00",
                        "end_time": "22:00"
                    }
                ]
            },
            "has_error": true,
            "raw_model_response": "```python\nimport json\nfrom datetime import datetime, timedelta\n\n# Define travel times between locations\ntravel_times = {\n    (\"Sunset District\", \"Presidio\"): 16,\n    (\"Presidio\", \"Nob Hill\"): 18,\n    (\"Nob Hill\", \"Pacific Heights\"): 8,\n    (\"Pacific Heights\", \"Mission District\"): 15,\n    (\"Mission District\", \"Marina District\"): 20,\n    (\"Marina District\", \"North Beach\"): 11,\n    (\"North Beach\", \"Russian Hill\"): 5,\n    (\"Russian Hill\", \"Richmond District\"): 14,\n    (\"Richmond District\", \"Embarcadero\"): 19,\n    (\"Embarcadero\", \"Alamo Square\"): 19,\n    # Additional necessary routes\n    (\"Sunset District\", \"Nob Hill\"): 27,\n    (\"Sunset District\", \"Pacific Heights\"): 21,\n    (\"Sunset District\", \"Mission District\"): 25,\n    (\"Sunset District\", \"Marina District\"): 21,\n    (\"Sunset District\", \"North Beach\"): 28,\n    (\"Sunset District\", \"Russian Hill\"): 24,\n    (\"Sunset District\", \"Richmond District\"): 12,\n    (\"Sunset District\", \"Embarcadero\"): 30,\n    (\"Sunset District\", \"Alamo Square\"): 17,\n    # and so on for combinations...\n}\n\n# Participant constraints\nparticipants = {\n    \"Charles\": {\"location\": \"Presidio\", \"start\": \"13:15\", \"end\": \"15:00\", \"min_time\": 105},\n    \"Robert\": {\"location\": \"Nob Hill\", \"start\": \"13:15\", \"end\": \"17:30\", \"min_time\": 90},\n    \"Nancy\": {\"location\": \"Pacific Heights\", \"start\": \"14:45\", \"end\": \"22:00\", \"min_time\": 105},\n    \"Brian\": {\"location\": \"Mission District\", \"start\": \"15:30\", \"end\": \"22:00\", \"min_time\": 60},\n    \"Kimberly\": {\"location\": \"Marina District\", \"start\": \"17:00\", \"end\": \"19:45\", \"min_time\": 75},\n    \"David\": {\"location\": \"North Beach\", \"start\": \"14:45\", \"end\": \"16:30\", \"min_time\": 75},\n    \"William\": {\"location\": \"Russian Hill\", \"start\": \"12:30\", \"end\": \"19:15\", \"min_time\": 120},\n    \"Jeffrey\": {\"location\": \"Richmond District\", \"start\": \"12:00\", \"end\": \"19:15\", \"min_time\": 45},\n    \"Karen\": {\"location\": \"Embarcadero\", \"start\": \"14:15\", \"end\": \"20:45\", \"min_time\": 60},\n    \"Joshua\": {\"location\": \"Alamo Square\", \"start\": \"18:45\", \"end\": \"22:00\", \"min_time\": 60},\n}\n\n# Meeting scheduling logic\nstart_meeting_time = datetime.strptime(\"09:00\", \"%H:%M\")\nitinerary = []\n\ndef add_meeting(person, start, duration):\n    end_time = start + timedelta(minutes=duration)\n    itinerary.append({\"action\": \"meet\", \"location\": participants[person][\"location\"],\n                      \"person\": person, \"start_time\": start.strftime(\"%H:%M\"),\n                      \"end_time\": end_time.strftime(\"%H:%M\")})\n    return end_time\n\n# Function to find the next meeting slot\ndef find_meeting_schedule(current_time):\n    for person, details in participants.items():\n        available_start = datetime.strptime(details[\"start\"], \"%H:%M\")\n        available_end = datetime.strptime(details[\"end\"], \"%H:%M\")\n        duration = details[\"min_time\"]\n        travel_time = travel_times.get((current_location, details[\"location\"]), float('inf'))\n\n        if current_time + timedelta(minutes=travel_time) <= available_start:\n            # Travel in the morning before meeting\n            arrival_time = available_start\n        else:\n            arrival_time = current_time + timedelta(minutes=travel_time)\n\n        if arrival_time + timedelta(minutes=duration) <= available_end:\n            # We can schedule a meeting\n            current_time = add_meeting(person, arrival_time, duration)\n            current_location = details[\"location\"]\n\n# Start scheduling\ncurrent_location = \"Sunset District\"\ncurrent_time = start_meeting_time\n\n# Execute scheduling\nfind_meeting_schedule(current_time)\n\n# Output the itinerary in JSON format\nresult = {\"itinerary\": itinerary}\nprint(json.dumps(result, indent=2))\n```",
            "count": "meeting_planning_example_974"
        }
    ]
}