{
    "0shot": [
        {
            "final_program_time": {
                "itinerary": []
            },
            "expected_time": {
                "itinerary": [
                    {
                        "action": "meet",
                        "location": "Richmond District",
                        "person": "Sandra",
                        "start_time": "9:20",
                        "end_time": "9:50"
                    },
                    {
                        "action": "meet",
                        "location": "Presidio",
                        "person": "Brian",
                        "start_time": "10:15",
                        "end_time": "10:45"
                    },
                    {
                        "action": "meet",
                        "location": "North Beach",
                        "person": "Stephanie",
                        "start_time": "11:03",
                        "end_time": "12:18"
                    },
                    {
                        "action": "meet",
                        "location": "Golden Gate Park",
                        "person": "Helen",
                        "start_time": "12:40",
                        "end_time": "14:40"
                    },
                    {
                        "action": "meet",
                        "location": "Alamo Square",
                        "person": "Laura",
                        "start_time": "14:49",
                        "end_time": "16:04"
                    },
                    {
                        "action": "meet",
                        "location": "Embarcadero",
                        "person": "Mary",
                        "start_time": "16:45",
                        "end_time": "18:45"
                    },
                    {
                        "action": "meet",
                        "location": "Financial District",
                        "person": "Deborah",
                        "start_time": "19:00",
                        "end_time": "20:45"
                    }
                ]
            },
            "has_error": false,
            "raw_model_response": "```python\nimport json\nfrom datetime import datetime, timedelta\nimport itertools\n\n# Setup travel times\ntravel_times = {\n    ('Mission District', 'Alamo Square'): 11,\n    ('Mission District', 'Presidio'): 25,\n    ('Mission District', 'Russian Hill'): 15,\n    ('Mission District', 'North Beach'): 17,\n    ('Mission District', 'Golden Gate Park'): 17,\n    ('Mission District', 'Richmond District'): 20,\n    ('Mission District', 'Embarcadero'): 19,\n    ('Mission District', 'Financial District'): 15,\n    ('Mission District', 'Marina District'): 19,\n    ('Alamo Square', 'Presidio'): 17,\n    ('Alamo Square', 'Russian Hill'): 13,\n    ('Alamo Square', 'North Beach'): 15,\n    ('Alamo Square', 'Golden Gate Park'): 9,\n    ('Alamo Square', 'Richmond District'): 11,\n    ('Alamo Square', 'Embarcadero'): 16,\n    ('Alamo Square', 'Financial District'): 17,\n    ('Alamo Square', 'Marina District'): 15,\n    ('Presidio', 'Russian Hill'): 14,\n    ('Presidio', 'North Beach'): 18,\n    ('Presidio', 'Golden Gate Park'): 12,\n    ('Presidio', 'Richmond District'): 7,\n    ('Presidio', 'Embarcadero'): 20,\n    ('Presidio', 'Financial District'): 23,\n    ('Presidio', 'Marina District'): 11,\n    ('Russian Hill', 'North Beach'): 5,\n    ('Russian Hill', 'Golden Gate Park'): 21,\n    ('Russian Hill', 'Richmond District'): 14,\n    ('Russian Hill', 'Embarcadero'): 8,\n    ('Russian Hill', 'Financial District'): 11,\n    ('Russian Hill', 'Marina District'): 7,\n    ('North Beach', 'Golden Gate Park'): 22,\n    ('North Beach', 'Richmond District'): 18,\n    ('North Beach', 'Embarcadero'): 6,\n    ('North Beach', 'Financial District'): 8,\n    ('North Beach', 'Marina District'): 9,\n    ('Golden Gate Park', 'Richmond District'): 9,\n    ('Golden Gate Park', 'Embarcadero'): 25,\n    ('Golden Gate Park', 'Financial District'): 26,\n    ('Golden Gate Park', 'Marina District'): 16,\n    ('Richmond District', 'Embarcadero'): 19,\n    ('Richmond District', 'Financial District'): 22,\n    ('Richmond District', 'Marina District'): 9,\n    ('Embarcadero', 'Financial District'): 4,\n    ('Embarcadero', 'Marina District'): 12,\n    ('Marina District', 'Presidio'): 10,\n    ('Marina District', 'Russian Hill'): 8,\n}\n\n# Setup constraints\nconstraints = {\n    'Laura': ('Alamo Square', '14:30', '16:15', 75),\n    'Brian': ('Presidio', '10:15', '17:00', 30),\n    'Karen': ('Russian Hill', '18:00', '20:15', 90),\n    'Stephanie': ('North Beach', '10:15', '16:00', 75),\n    'Helen': ('Golden Gate Park', '11:30', '21:45', 120),\n    'Sandra': ('Richmond District', '08:00', '15:15', 30),\n    'Mary': ('Embarcadero', '16:45', '18:45', 120),\n    'Deborah': ('Financial District', '19:00', '20:45', 105),\n    'Elizabeth': ('Marina District', '08:30', '13:15', 105),\n}\n\n# Convert times to datetime\ndef get_time_in_minutes(time_str):\n    # Convert \"HH:MM\" string to total minutes\n    hour, minute = map(int, time_str.split(':'))\n    return hour * 60 + minute\n\n# Get the travel time between two locations\ndef travel_time(from_location, to_location):\n    return travel_times.get((from_location, to_location), 0)\n\n# Check if a meeting can be scheduled\ndef can_schedule_meeting(start_time, duration, available_start, available_end):\n    return start_time >= available_start and (start_time + duration) <= available_end\n\ndef schedule_meetings():\n    # Starting point at Mission District\n    starting_time = get_time_in_minutes(\"9:00\")\n    current_time = starting_time\n    itinerary = []\n\n    # Meeting order based on constraints, planning for maximum meet-ups\n    meeting_order = ['Elizabeth', 'Sandra', 'Brian', 'Stephanie', 'Laura', 'Helen', 'Mary', 'Deborah', 'Karen']\n\n    for person in meeting_order:\n        location, start, end, duration = constraints[person]\n        available_start = get_time_in_minutes(start)\n        available_end = get_time_in_minutes(end)\n        \n        travel_to_location = travel_time(\"Mission District\", location)\n        meeting_start_time = current_time + travel_to_location\n        \n        if can_schedule_meeting(meeting_start_time, duration, available_start, available_end):\n            meeting_end_time = meeting_start_time + duration\n            itinerary.append({\n                \"action\": \"meet\",\n                \"location\": location,\n                \"person\": person,\n                \"start_time\": f\"{meeting_start_time // 60}:{meeting_start_time % 60:02d}\",\n                \"end_time\": f\"{meeting_end_time // 60}:{meeting_end_time % 60:02d}\"\n            })\n            current_time = meeting_end_time + travel_time(location, \"Mission District\")  # Travel back to Mission District\n        else:\n            print(f\"Cannot schedule meeting with {person}.\")\n    \n    return itinerary\n\ndef main():\n    itinerary = schedule_meetings()\n    output = {\"itinerary\": itinerary}\n    print(json.dumps(output, indent=2))\n\nif __name__ == \"__main__\":\n    main()\n```",
            "count": "meeting_planning_example_862"
        }
    ]
}