{
    "0shot": [
        {
            "final_program_time": {
                "itinerary": []
            },
            "expected_time": {
                "itinerary": [
                    {
                        "action": "meet",
                        "location": "Nob Hill",
                        "person": "Daniel",
                        "start_time": "9:12",
                        "end_time": "9:27"
                    },
                    {
                        "action": "meet",
                        "location": "Pacific Heights",
                        "person": "Timothy",
                        "start_time": "12:00",
                        "end_time": "13:30"
                    },
                    {
                        "action": "meet",
                        "location": "Chinatown",
                        "person": "Kevin",
                        "start_time": "13:41",
                        "end_time": "14:11"
                    },
                    {
                        "action": "meet",
                        "location": "Richmond District",
                        "person": "Betty",
                        "start_time": "14:31",
                        "end_time": "15:01"
                    },
                    {
                        "action": "meet",
                        "location": "Marina District",
                        "person": "Steven",
                        "start_time": "16:30",
                        "end_time": "18:00"
                    },
                    {
                        "action": "meet",
                        "location": "The Castro",
                        "person": "Lisa",
                        "start_time": "19:15",
                        "end_time": "21:15"
                    }
                ]
            },
            "has_error": false,
            "raw_model_response": "```python\nimport json\nfrom datetime import datetime, timedelta\n\n# Travel distances (in minutes)\ntravel_times = {\n    ('Mission District', 'The Castro'): 7,\n    ('Mission District', 'Nob Hill'): 12,\n    ('Mission District', 'Presidio'): 25,\n    ('Mission District', 'Marina District'): 19,\n    ('Mission District', 'Pacific Heights'): 16,\n    ('Mission District', 'Golden Gate Park'): 17,\n    ('Mission District', 'Chinatown'): 16,\n    ('Mission District', 'Richmond District'): 20,\n    ('The Castro', 'Nob Hill'): 16,\n    ('The Castro', 'Presidio'): 20,\n    ('The Castro', 'Marina District'): 21,\n    ('The Castro', 'Pacific Heights'): 16,\n    ('The Castro', 'Golden Gate Park'): 11,\n    ('The Castro', 'Chinatown'): 22,\n    ('The Castro', 'Richmond District'): 16,\n    ('Nob Hill', 'Presidio'): 17,\n    ('Nob Hill', 'Marina District'): 11,\n    ('Nob Hill', 'Pacific Heights'): 8,\n    ('Nob Hill', 'Golden Gate Park'): 17,\n    ('Nob Hill', 'Chinatown'): 6,\n    ('Nob Hill', 'Richmond District'): 14,\n    ('Presidio', 'Marina District'): 11,\n    ('Presidio', 'Pacific Heights'): 11,\n    ('Presidio', 'Golden Gate Park'): 12,\n    ('Presidio', 'Chinatown'): 21,\n    ('Presidio', 'Richmond District'): 7,\n    ('Marina District', 'Pacific Heights'): 6,\n    ('Marina District', 'Golden Gate Park'): 18,\n    ('Marina District', 'Chinatown'): 15,\n    ('Marina District', 'Richmond District'): 11,\n    ('Pacific Heights', 'Golden Gate Park'): 15,\n    ('Pacific Heights', 'Chinatown'): 11,\n    ('Golden Gate Park', 'Chinatown'): 23,\n}\n\n# Meeting constraints\nmeetings = {\n    'Lisa': {'location': 'The Castro', 'start': '19:15', 'end': '21:15', 'duration': 120},\n    'Daniel': {'location': 'Nob Hill', 'start': '08:15', 'end': '11:00', 'duration': 15},\n    'Elizabeth': {'location': 'Presidio', 'start': '21:15', 'end': '22:15', 'duration': 45},\n    'Steven': {'location': 'Marina District', 'start': '16:30', 'end': '20:45', 'duration': 90},\n    'Timothy': {'location': 'Pacific Heights', 'start': '12:00', 'end': '18:00', 'duration': 90},\n    'Ashley': {'location': 'Golden Gate Park', 'start': '20:45', 'end': '21:45', 'duration': 60},\n    'Kevin': {'location': 'Chinatown', 'start': '12:00', 'end': '19:00', 'duration': 30},\n    'Betty': {'location': 'Richmond District', 'start': '13:15', 'end': '15:45', 'duration': 30},\n}\n\n# Initial time in Mission District\nstart_time = datetime.strptime(\"09:00\", \"%H:%M\")\nitinerary = []\n\n# Function to add meeting to itinerary\ndef add_meeting(person, location, start, duration):\n    end = start + timedelta(minutes=duration)\n    itinerary.append({\n        \"action\": \"meet\",\n        \"location\": location,\n        \"person\": person,\n        \"start_time\": start.strftime(\"%H:%M\"),\n        \"end_time\": end.strftime(\"%H:%M\"),\n    })\n    return end\n\ncurrent_time = start_time\n\n# Function to compute schedule considering all constraints\nfor person, details in meetings.items():\n    location = details['location']\n    duration = details['duration']\n    start_window = datetime.strptime(details['start'], \"%H:%M\")\n    end_window = datetime.strptime(details['end'], \"%H:%M\")\n\n    travel_back = travel_times.get(('Mission District', location), 0)\n    travel_to = travel_times.get((location, 'Mission District'), 0)\n\n    # Check meeting time in the window\n    if current_time < start_window:\n        current_time = start_window\n\n    if current_time + timedelta(minutes=duration + travel_back) > end_window:\n        continue  # Not enough time for this meeting\n\n    # Move to the location for the meeting\n    current_time += timedelta(minutes=travel_back)\n\n    # Schedule the meeting\n    current_time = add_meeting(person, location, current_time, duration)\n\n    # Travel back to Mission District\n    current_time += timedelta(minutes=travel_to)\n\n# Output the resulting itinerary in JSON format\nresult = {\n    \"itinerary\": itinerary\n}\n\nprint(json.dumps(result, indent=2))\n```",
            "count": "meeting_planning_example_701"
        }
    ]
}