{
    "0shot": [
        {
            "final_program_time": {
                "itinerary": [
                    {
                        "action": "meet",
                        "location": "Chinatown",
                        "person": "Deborah",
                        "start_time": "9:00",
                        "end_time": "9:45"
                    },
                    {
                        "action": "meet",
                        "location": "The Castro",
                        "person": "George",
                        "start_time": "10:01",
                        "end_time": "11:01"
                    }
                ]
            },
            "expected_time": {
                "itinerary": [
                    {
                        "action": "meet",
                        "location": "Chinatown",
                        "person": "Deborah",
                        "start_time": "9:16",
                        "end_time": "10:01"
                    },
                    {
                        "action": "meet",
                        "location": "The Castro",
                        "person": "George",
                        "start_time": "10:23",
                        "end_time": "11:23"
                    },
                    {
                        "action": "meet",
                        "location": "Russian Hill",
                        "person": "Emily",
                        "start_time": "12:15",
                        "end_time": "14:00"
                    },
                    {
                        "action": "meet",
                        "location": "Presidio",
                        "person": "Mark",
                        "start_time": "14:45",
                        "end_time": "15:45"
                    },
                    {
                        "action": "meet",
                        "location": "Golden Gate Park",
                        "person": "Steven",
                        "start_time": "15:57",
                        "end_time": "17:42"
                    },
                    {
                        "action": "meet",
                        "location": "Sunset District",
                        "person": "Margaret",
                        "start_time": "21:30",
                        "end_time": "22:30"
                    }
                ]
            },
            "has_error": false,
            "raw_model_response": "```python\nimport json\nfrom datetime import datetime, timedelta\nfrom itertools import permutations\n\n# Input parameters\nlocations = {\n    \"Alamo Square\": {\"name\": \"Alamo Square\"},\n    \"Russian Hill\": {\"name\": \"Russian Hill\"},\n    \"Presidio\": {\"name\": \"Presidio\"},\n    \"Chinatown\": {\"name\": \"Chinatown\"},\n    \"Sunset District\": {\"name\": \"Sunset District\"},\n    \"The Castro\": {\"name\": \"The Castro\"},\n    \"Embarcadero\": {\"name\": \"Embarcadero\"},\n    \"Golden Gate Park\": {\"name\": \"Golden Gate Park\"}\n}\n\ntravel_times = {\n    (\"Alamo Square\", \"Russian Hill\"): 13,\n    (\"Alamo Square\", \"Presidio\"): 18,\n    (\"Alamo Square\", \"Chinatown\"): 16,\n    (\"Alamo Square\", \"Sunset District\"): 16,\n    (\"Alamo Square\", \"The Castro\"): 8,\n    (\"Alamo Square\", \"Embarcadero\"): 17,\n    (\"Alamo Square\", \"Golden Gate Park\"): 9,\n    (\"Russian Hill\", \"Alamo Square\"): 15,\n    (\"Russian Hill\", \"Presidio\"): 14,\n    (\"Russian Hill\", \"Chinatown\"): 9,\n    (\"Russian Hill\", \"Sunset District\"): 23,\n    (\"Russian Hill\", \"The Castro\"): 21,\n    (\"Russian Hill\", \"Embarcadero\"): 8,\n    (\"Russian Hill\", \"Golden Gate Park\"): 21,\n    (\"Presidio\", \"Alamo Square\"): 18,\n    (\"Presidio\", \"Russian Hill\"): 14,\n    (\"Presidio\", \"Chinatown\"): 21,\n    (\"Presidio\", \"Sunset District\"): 15,\n    (\"Presidio\", \"The Castro\"): 21,\n    (\"Presidio\", \"Embarcadero\"): 20,\n    (\"Presidio\", \"Golden Gate Park\"): 12,\n    (\"Chinatown\", \"Alamo Square\"): 17,\n    (\"Chinatown\", \"Russian Hill\"): 7,\n    (\"Chinatown\", \"Presidio\"): 19,\n    (\"Chinatown\", \"Sunset District\"): 29,\n    (\"Chinatown\", \"The Castro\"): 22,\n    (\"Chinatown\", \"Embarcadero\"): 5,\n    (\"Chinatown\", \"Golden Gate Park\"): 23,\n    (\"Sunset District\", \"Alamo Square\"): 17,\n    (\"Sunset District\", \"Russian Hill\"): 24,\n    (\"Sunset District\", \"Presidio\"): 16,\n    (\"Sunset District\", \"Chinatown\"): 30,\n    (\"Sunset District\", \"The Castro\"): 17,\n    (\"Sunset District\", \"Embarcadero\"): 31,\n    (\"Sunset District\", \"Golden Gate Park\"): 11,\n    (\"The Castro\", \"Alamo Square\"): 8,\n    (\"The Castro\", \"Russian Hill\"): 18,\n    (\"The Castro\", \"Presidio\"): 20,\n    (\"The Castro\", \"Chinatown\"): 20,\n    (\"The Castro\", \"Sunset District\"): 17,\n    (\"The Castro\", \"Embarcadero\"): 22,\n    (\"The Castro\", \"Golden Gate Park\"): 11,\n    (\"Embarcadero\", \"Alamo Square\"): 19,\n    (\"Embarcadero\", \"Russian Hill\"): 8,\n    (\"Embarcadero\", \"Presidio\"): 20,\n    (\"Embarcadero\", \"Chinatown\"): 7,\n    (\"Embarcadero\", \"Sunset District\"): 30,\n    (\"Embarcadero\", \"The Castro\"): 25,\n    (\"Embarcadero\", \"Golden Gate Park\"): 25,\n    (\"Golden Gate Park\", \"Alamo Square\"): 10,\n    (\"Golden Gate Park\", \"Russian Hill\"): 19,\n    (\"Golden Gate Park\", \"Presidio\"): 11,\n    (\"Golden Gate Park\", \"Chinatown\"): 23,\n    (\"Golden Gate Park\", \"Sunset District\"): 10,\n    (\"Golden Gate Park\", \"The Castro\"): 13,\n}\n\nconstraints = {\n    \"Emily\": {\"location\": \"Russian Hill\", \"start\": \"12:15\", \"end\": \"14:15\", \"duration\": 105},\n    \"Mark\": {\"location\": \"Presidio\", \"start\": \"14:45\", \"end\": \"19:30\", \"duration\": 60},\n    \"Deborah\": {\"location\": \"Chinatown\", \"start\": \"7:30\", \"end\": \"15:30\", \"duration\": 45},\n    \"Margaret\": {\"location\": \"Sunset District\", \"start\": \"21:30\", \"end\": \"22:30\", \"duration\": 60},\n    \"George\": {\"location\": \"The Castro\", \"start\": \"7:30\", \"end\": \"14:15\", \"duration\": 60},\n    \"Andrew\": {\"location\": \"Embarcadero\", \"start\": \"20:15\", \"end\": \"22:00\", \"duration\": 75},\n    \"Steven\": {\"location\": \"Golden Gate Park\", \"start\": \"11:15\", \"end\": \"21:15\", \"duration\": 105},\n}\n\narrival_time = datetime.strptime(\"09:00\", \"%H:%M\")\nitinerary = []\n\n# Helper function to check if time overlaps\ndef overlaps(start1, end1, start2, end2):\n    return not (end1 <= start2 or end2 <= start1)\n\n# Helper function to try scheduling meetings\ndef schedule_meeting(person, start_time):\n    location = constraints[person]['location']\n    meet_duration = constraints[person]['duration']\n    \n    start_time_dt = datetime.combine(start_time.date(), start_time.time())\n    end_time_dt = start_time_dt + timedelta(minutes=meet_duration)\n\n    if start_time_dt.time() >= datetime.strptime(constraints[person]['start'], \"%H:%M\").time() and \\\n       end_time_dt.time() <= datetime.strptime(constraints[person]['end'], \"%H:%M\").time():\n        return start_time_dt, end_time_dt, location\n    return None\n\n# Main scheduling routine\ndef schedule_visits(current_time, visited):\n    for person in constraints.keys():\n        if person not in visited:\n            meeting = schedule_meeting(person, current_time)\n            if meeting:\n                start_time, end_time, location = meeting \n                travel_time = travel_times.get((locations[location][\"name\"], locations[\"Alamo Square\"][\"name\"]), 0)\n                travel_back_time = travel_times.get((locations[\"Alamo Square\"][\"name\"], locations[location][\"name\"]), 0)\n                \n                # Adding to itinerary\n                itinerary.append({\n                    \"action\": \"meet\",\n                    \"location\": location,\n                    \"person\": person,\n                    \"start_time\": start_time.strftime(\"%H:%M\"),\n                    \"end_time\": end_time.strftime(\"%H:%M\")\n                })\n                \n                # Move current time to after meeting plus return to previous location\n                current_time = end_time + timedelta(minutes=travel_back_time)\n                visited.add(person)\n\n                # Schedule next visits\n                schedule_visits(current_time, visited)\n\n# Start scheduling from Alamo Square\nschedule_visits(arrival_time, set())\n\n# Preparing output\nresult = {\n    \"itinerary\": itinerary,\n}\n\n# Print the result as JSON\nprint(json.dumps(result, indent=2))\n```",
            "count": "meeting_planning_example_612"
        }
    ]
}