{
    "0shot": [
        {
            "final_program_time": {
                "itinerary": []
            },
            "expected_time": {
                "itinerary": [
                    {
                        "action": "meet",
                        "location": "The Castro",
                        "person": "Melissa",
                        "start_time": "9:30",
                        "end_time": "10:00"
                    },
                    {
                        "action": "meet",
                        "location": "Bayview",
                        "person": "Matthew",
                        "start_time": "10:19",
                        "end_time": "10:49"
                    },
                    {
                        "action": "meet",
                        "location": "Alamo Square",
                        "person": "Robert",
                        "start_time": "11:15",
                        "end_time": "13:15"
                    },
                    {
                        "action": "meet",
                        "location": "Golden Gate Park",
                        "person": "Joseph",
                        "start_time": "13:24",
                        "end_time": "15:09"
                    },
                    {
                        "action": "meet",
                        "location": "Marina District",
                        "person": "Amanda",
                        "start_time": "15:25",
                        "end_time": "17:10"
                    },
                    {
                        "action": "meet",
                        "location": "Mission District",
                        "person": "Karen",
                        "start_time": "17:30",
                        "end_time": "19:15"
                    },
                    {
                        "action": "meet",
                        "location": "Pacific Heights",
                        "person": "Nancy",
                        "start_time": "19:31",
                        "end_time": "21:16"
                    }
                ]
            },
            "has_error": false,
            "raw_model_response": "```python\nimport json\nfrom datetime import datetime, timedelta\n\n# Travel distances in minutes\ntravel_times = {\n    ('Presidio', 'Marina District'): 11,\n    ('Presidio', 'The Castro'): 21,\n    ('Presidio', 'Fisherman\\'s Wharf'): 19,\n    ('Presidio', 'Bayview'): 31,\n    ('Presidio', 'Pacific Heights'): 11,\n    ('Presidio', 'Mission District'): 26,\n    ('Presidio', 'Alamo Square'): 19,\n    ('Presidio', 'Golden Gate Park'): 12,\n    ('Marina District', 'Presidio'): 10,\n    ('Marina District', 'The Castro'): 22,\n    ('Marina District', 'Fisherman\\'s Wharf'): 10,\n    ('Marina District', 'Bayview'): 27,\n    ('Marina District', 'Pacific Heights'): 7,\n    ('Marina District', 'Mission District'): 20,\n    ('Marina District', 'Alamo Square'): 15,\n    ('Marina District', 'Golden Gate Park'): 18,\n    ('The Castro', 'Presidio'): 20,\n    ('The Castro', 'Marina District'): 21,\n    ('The Castro', 'Fisherman\\'s Wharf'): 24,\n    ('The Castro', 'Bayview'): 19,\n    ('The Castro', 'Pacific Heights'): 16,\n    ('The Castro', 'Mission District'): 7,\n    ('The Castro', 'Alamo Square'): 8,\n    ('The Castro', 'Golden Gate Park'): 11,\n    ('Fisherman\\'s Wharf', 'Presidio'): 17,\n    ('Fisherman\\'s Wharf', 'Marina District'): 9,\n    ('Fisherman\\'s Wharf', 'The Castro'): 27,\n    ('Fisherman\\'s Wharf', 'Bayview'): 26,\n    ('Fisherman\\'s Wharf', 'Pacific Heights'): 12,\n    ('Fisherman\\'s Wharf', 'Mission District'): 22,\n    ('Fisherman\\'s Wharf', 'Alamo Square'): 21,\n    ('Fisherman\\'s Wharf', 'Golden Gate Park'): 25,\n    ('Bayview', 'Presidio'): 32,\n    ('Bayview', 'Marina District'): 27,\n    ('Bayview', 'The Castro'): 19,\n    ('Bayview', 'Fisherman\\'s Wharf'): 25,\n    ('Bayview', 'Pacific Heights'): 23,\n    ('Bayview', 'Mission District'): 13,\n    ('Bayview', 'Alamo Square'): 16,\n    ('Bayview', 'Golden Gate Park'): 22,\n    ('Pacific Heights', 'Presidio'): 11,\n    ('Pacific Heights', 'Marina District'): 6,\n    ('Pacific Heights', 'The Castro'): 16,\n    ('Pacific Heights', 'Fisherman\\'s Wharf'): 13,\n    ('Pacific Heights', 'Bayview'): 22,\n    ('Pacific Heights', 'Mission District'): 15,\n    ('Pacific Heights', 'Alamo Square'): 10,\n    ('Pacific Heights', 'Golden Gate Park'): 15,\n    ('Mission District', 'Presidio'): 25,\n    ('Mission District', 'Marina District'): 19,\n    ('Mission District', 'The Castro'): 7,\n    ('Mission District', 'Fisherman\\'s Wharf'): 22,\n    ('Mission District', 'Bayview'): 14,\n    ('Mission District', 'Pacific Heights'): 16,\n    ('Mission District', 'Alamo Square'): 11,\n    ('Mission District', 'Golden Gate Park'): 17,\n    ('Alamo Square', 'Presidio'): 17,\n    ('Alamo Square', 'Marina District'): 15,\n    ('Alamo Square', 'The Castro'): 8,\n    ('Alamo Square', 'Fisherman\\'s Wharf'): 19,\n    ('Alamo Square', 'Bayview'): 16,\n    ('Alamo Square', 'Pacific Heights'): 10,\n    ('Alamo Square', 'Mission District'): 10,\n    ('Alamo Square', 'Golden Gate Park'): 9,\n    ('Golden Gate Park', 'Presidio'): 11,\n    ('Golden Gate Park', 'Marina District'): 16,\n    ('Golden Gate Park', 'The Castro'): 13,\n    ('Golden Gate Park', 'Fisherman\\'s Wharf'): 24,\n    ('Golden Gate Park', 'Bayview'): 23,\n    ('Golden Gate Park', 'Pacific Heights'): 16,\n    ('Golden Gate Park', 'Mission District'): 17,\n    ('Golden Gate Park', 'Alamo Square'): 9,\n}\n\n# Meeting constraints\nmeetings = {\n    'Amanda': {'location': 'Marina District', 'start': '14:45', 'end': '19:30', 'duration': 105},\n    'Melissa': {'location': 'The Castro', 'start': '09:30', 'end': '17:00', 'duration': 30},\n    'Jeffrey': {'location': 'Fisherman\\'s Wharf', 'start': '12:45', 'end': '18:45', 'duration': 120},\n    'Matthew': {'location': 'Bayview', 'start': '10:15', 'end': '13:15', 'duration': 30},\n    'Nancy': {'location': 'Pacific Heights', 'start': '17:00', 'end': '21:30', 'duration': 105},\n    'Karen': {'location': 'Mission District', 'start': '17:30', 'end': '20:30', 'duration': 105},\n    'Robert': {'location': 'Alamo Square', 'start': '11:15', 'end': '17:30', 'duration': 120},\n    'Joseph': {'location': 'Golden Gate Park', 'start': '08:30', 'end': '21:15', 'duration': 105},\n}\n\n# Convert string time to datetime object\ndef str_to_time(time_str):\n    return datetime.strptime(time_str, '%H:%M')\n\n# Check if a meeting can occur between two time periods and includes travel time\ndef can_meet(start_a, end_a, start_b, end_b, travel_time):\n    return not (end_a + timedelta(minutes=travel_time) > start_b or end_b < start_a)\n\n# Planning the itinerary\nitinerary = []\ncurrent_time = str_to_time('09:00')  # starting at Presidio\ncurrent_location = 'Presidio'\n\nwhile True:\n    if current_location == 'Marina District':\n        person = 'Amanda'\n    elif current_location == 'The Castro':\n        person = 'Melissa'\n    elif current_location == 'Fisherman\\'s Wharf':\n        person = 'Jeffrey'\n    elif current_location == 'Bayview':\n        person = 'Matthew'\n    elif current_location == 'Pacific Heights':\n        person = 'Nancy'\n    elif current_location == 'Mission District':\n        person = 'Karen'\n    elif current_location == 'Alamo Square':\n        person = 'Robert'\n    elif current_location == 'Golden Gate Park':\n        person = 'Joseph'\n    else:\n        break\n    \n    meeting_info = meetings[person]\n    meeting_start = str_to_time(meeting_info['start'])\n    meeting_end = str_to_time(meeting_info['end'])\n\n    if current_time < meeting_start:\n        current_time = meeting_start\n\n    # If we can meet\n    if can_meet(current_time, meeting_end, meeting_start, meeting_end, travel_times[(current_location, meeting_info['location'])]):\n        duration = meeting_info['duration']\n        end_meeting_time = current_time + timedelta(minutes=duration)\n\n        # Schedule the meeting\n        itinerary.append({\n            \"action\": \"meet\",\n            \"location\": meeting_info['location'],\n            \"person\": person,\n            \"start_time\": current_time.strftime('%H:%M'),\n            \"end_time\": end_meeting_time.strftime('%H:%M')\n        })\n\n        current_time = end_meeting_time + timedelta(minutes=travel_times[(current_location, meeting_info['location'])])\n        current_location = meeting_info['location']\n        \n        # Remove the meeting from the list (to not meet twice)\n        del meetings[person]\n    else:\n        # Move to the next meeting in a location where currently not scheduled\n        if not meetings:\n            break\n        \n        # Sort and choose the closest location we can still meet\n        next_location = min(meetings.items(), key=lambda x: travel_times[(current_location, x[1]['location'])])[1]\n        travel_time = travel_times[(current_location, next_location['location'])]\n        current_time += timedelta(minutes=travel_time)\n        current_location = next_location['location']\n        \n# Output JSON\noutput = json.dumps({\"itinerary\": itinerary}, indent=2)\nprint(output)\n```",
            "count": "meeting_planning_example_715"
        }
    ]
}