{
    "0shot": [
        {
            "final_program_time": {
                "itinerary": [
                    {
                        "action": "meet",
                        "location": "Mission District",
                        "person": "Elizabeth",
                        "start_time": "9:00",
                        "end_time": "12:00"
                    },
                    {
                        "action": "meet",
                        "location": "Union Square",
                        "person": "David",
                        "start_time": "12:00",
                        "end_time": "21:30"
                    }
                ]
            },
            "expected_time": {
                "itinerary": [
                    {
                        "action": "meet",
                        "location": "Pacific Heights",
                        "person": "Sandra",
                        "start_time": "9:12",
                        "end_time": "11:12"
                    },
                    {
                        "action": "meet",
                        "location": "Fisherman's Wharf",
                        "person": "Robert",
                        "start_time": "11:25",
                        "end_time": "11:40"
                    },
                    {
                        "action": "meet",
                        "location": "Marina District",
                        "person": "Kenneth",
                        "start_time": "11:49",
                        "end_time": "12:34"
                    },
                    {
                        "action": "meet",
                        "location": "Mission District",
                        "person": "Elizabeth",
                        "start_time": "12:54",
                        "end_time": "14:24"
                    },
                    {
                        "action": "meet",
                        "location": "Union Square",
                        "person": "David",
                        "start_time": "15:15",
                        "end_time": "16:00"
                    },
                    {
                        "action": "meet",
                        "location": "Sunset District",
                        "person": "Kimberly",
                        "start_time": "16:27",
                        "end_time": "18:12"
                    },
                    {
                        "action": "meet",
                        "location": "Golden Gate Park",
                        "person": "Amanda",
                        "start_time": "18:23",
                        "end_time": "18:38"
                    },
                    {
                        "action": "meet",
                        "location": "Richmond District",
                        "person": "Melissa",
                        "start_time": "18:45",
                        "end_time": "19:00"
                    },
                    {
                        "action": "meet",
                        "location": "Bayview",
                        "person": "Thomas",
                        "start_time": "19:30",
                        "end_time": "20:00"
                    }
                ]
            },
            "has_error": false,
            "raw_model_response": "```python\nimport json\nfrom datetime import datetime, timedelta\n\n# Travel distances (in minutes)\ntravel_distances = {\n    'Haight-Ashbury': {'Mission District': 11, 'Union Square': 19, 'Pacific Heights': 12, 'Bayview': 18, 'Fisherman\\'s Wharf': 23, 'Marina District': 17, 'Richmond District': 10, 'Sunset District': 15, 'Golden Gate Park': 7},\n    'Mission District': {'Haight-Ashbury': 12, 'Union Square': 15, 'Pacific Heights': 16, 'Bayview': 14, 'Fisherman\\'s Wharf': 22, 'Marina District': 19, 'Richmond District': 20, 'Sunset District': 24, 'Golden Gate Park': 17},\n    'Union Square': {'Haight-Ashbury': 18, 'Mission District': 14, 'Pacific Heights': 12, 'Bayview': 15, 'Fisherman\\'s Wharf': 15, 'Marina District': 18, 'Richmond District': 20, 'Sunset District': 27, 'Golden Gate Park': 22},\n    'Pacific Heights': {'Haight-Ashbury': 11, 'Mission District': 15, 'Union Square': 12, 'Bayview': 22, 'Fisherman\\'s Wharf': 13, 'Marina District': 6, 'Richmond District': 12, 'Sunset District': 21, 'Golden Gate Park': 15},\n    'Bayview': {'Haight-Ashbury': 19, 'Mission District': 13, 'Union Square': 18, 'Pacific Heights': 23, 'Fisherman\\'s Wharf': 25, 'Marina District': 27, 'Richmond District': 25, 'Sunset District': 23, 'Golden Gate Park': 22},\n    'Fisherman\\'s Wharf': {'Haight-Ashbury': 22, 'Mission District': 22, 'Union Square': 13, 'Pacific Heights': 12, 'Bayview': 26, 'Marina District': 9, 'Richmond District': 18, 'Sunset District': 27, 'Golden Gate Park': 25},\n    'Marina District': {'Haight-Ashbury': 16, 'Mission District': 20, 'Union Square': 16, 'Pacific Heights': 7, 'Bayview': 27, 'Fisherman\\'s Wharf': 10, 'Richmond District': 11, 'Sunset District': 19, 'Golden Gate Park': 18},\n    'Richmond District': {'Haight-Ashbury': 10, 'Mission District': 20, 'Union Square': 21, 'Pacific Heights': 10, 'Bayview': 27, 'Fisherman\\'s Wharf': 18, 'Marina District': 9, 'Sunset District': 11, 'Golden Gate Park': 9},\n    'Sunset District': {'Haight-Ashbury': 15, 'Mission District': 25, 'Union Square': 30, 'Pacific Heights': 21, 'Bayview': 22, 'Fisherman\\'s Wharf': 29, 'Marina District': 21, 'Richmond District': 12, 'Golden Gate Park': 11},\n    'Golden Gate Park': {'Haight-Ashbury': 7, 'Mission District': 17, 'Union Square': 22, 'Pacific Heights': 16, 'Bayview': 23, 'Fisherman\\'s Wharf': 24, 'Marina District': 16, 'Richmond District': 7, 'Sunset District': 10}\n}\n\n# Constraints\nconstraints = {\n    'Elizabeth': {'location': 'Mission District','start_time': '10:30', 'end_time': '20:00','required_time': 90},\n    'David': {'location': 'Union Square','start_time': '15:15', 'end_time': '19:00','required_time': 45},\n    'Sandra': {'location': 'Pacific Heights','start_time': '07:00', 'end_time': '20:00','required_time': 120},\n    'Thomas': {'location': 'Bayview','start_time': '19:30', 'end_time': '20:30','required_time': 30},\n    'Robert': {'location': 'Fisherman\\'s Wharf','start_time': '10:00', 'end_time': '15:00','required_time': 15},\n    'Kenneth': {'location': 'Marina District','start_time': '10:45', 'end_time': '13:00','required_time': 45},\n    'Melissa': {'location': 'Richmond District','start_time': '18:15', 'end_time': '20:00','required_time': 15},\n    'Kimberly': {'location': 'Sunset District','start_time': '10:15', 'end_time': '18:15','required_time': 105},\n    'Amanda': {'location': 'Golden Gate Park','start_time': '07:45', 'end_time': '18:45','required_time': 15}\n}\n\ndef calculate_travel_time(start_location, end_location):\n    return travel_distances[start_location][end_location]\n\ndef is_valid_meeting(person, start_time, end_time, required_time):\n    return (datetime.strptime(start_time, '%H:%M') + timedelta(minutes=required_time)).time() <= datetime.strptime(end_time, '%H:%M').time()\n\ndef schedule_meeting(person, start_time, end_time, required_time, location):\n    travel_time = calculate_travel_time('Haight-Ashbury', location)\n    start_time = (datetime.strptime(start_time, '%H:%M') + timedelta(minutes=travel_time)).strftime('%H:%M')\n    end_time = (datetime.strptime(end_time, '%H:%M') + timedelta(minutes=travel_time)).strftime('%H:%M')\n    return is_valid_meeting(person, start_time, end_time, required_time)\n\ndef generate_itinerary():\n    itinerary = []\n    start_time = '09:00'\n    end_time = '12:00'\n    \n    for person in constraints:\n        location = constraints[person]['location']\n        start_person_time = constraints[person]['start_time']\n        end_person_time = constraints[person]['end_time']\n        required_time = constraints[person]['required_time']\n        \n        if schedule_meeting(person, start_time, end_time, required_time, location):\n            itinerary.append({\n                'action':'meet',\n                'location': location,\n                'person': person,\n           'start_time': start_time,\n                'end_time': end_time\n            })\n            start_time = end_time\n            end_time = (datetime.strptime(end_person_time, '%H:%M') + timedelta(minutes=required_time)).strftime('%H:%M')\n    \n    return itinerary\n\ndef main():\n    itinerary = generate_itinerary()\n    print(json.dumps({'itinerary': itinerary}, indent=4))\n\nif __name__ == '__main__':\n    main()\n```",
            "count": "meeting_planning_example_867"
        }
    ]
}