{
    "0shot": [
        {
            "final_program_time": {
                "itinerary": []
            },
            "expected_time": {
                "itinerary": [
                    {
                        "action": "meet",
                        "location": "Presidio",
                        "person": "Joshua",
                        "start_time": "9:20",
                        "end_time": "11:05"
                    },
                    {
                        "action": "meet",
                        "location": "Embarcadero",
                        "person": "David",
                        "start_time": "11:25",
                        "end_time": "11:55"
                    },
                    {
                        "action": "meet",
                        "location": "Alamo Square",
                        "person": "Stephanie",
                        "start_time": "15:30",
                        "end_time": "16:00"
                    },
                    {
                        "action": "meet",
                        "location": "Haight-Ashbury",
                        "person": "Kimberly",
                        "start_time": "16:45",
                        "end_time": "18:00"
                    },
                    {
                        "action": "meet",
                        "location": "Golden Gate Park",
                        "person": "Lisa",
                        "start_time": "18:07",
                        "end_time": "18:52"
                    },
                    {
                        "action": "meet",
                        "location": "North Beach",
                        "person": "Timothy",
                        "start_time": "19:45",
                        "end_time": "21:15"
                    }
                ]
            },
            "has_error": false,
            "raw_model_response": "Alright, let's tackle this problem step by step. The user wants a Python program that calculates the optimal meeting schedule based on given constraints. The program must compute the schedule dynamically, not just print a pre-determined one.\n\nFirst, I'll need to understand the input parameters. There are travel times between various locations in San Francisco and constraints on when and where friends are available. The goal is to meet as many friends as possible, considering both travel times and the duration each meeting requires.\n\nI'll start by setting up the travel times in a dictionary. Each location will have another dictionary mapping to the travel times to other locations. This allows quick lookup when calculating the time it takes to move between locations.\n\nNext, I'll define the friends' constraints. Each friend has a name, location, start and end times, and a minimum meeting duration. These will be stored in a list of dictionaries for easy iteration.\n\nThe core of the solution involves generating all possible permutations of the friends to determine the optimal schedule. For each permutation, I'll simulate the day starting from the initial location (The Castro) and calculate the arrival times at each friend's location. If the arrival time plus the required meeting duration exceeds the friend's available end time, that permutation is invalid.\n\nI'll use the `itertools.permutations` function to generate all possible orders of meeting friends. For each permutation, I'll track the current location and time, starting from The Castro at 9:00 AM. For each friend in the permutation, I'll calculate the travel time to their location, determine the earliest possible start time for the meeting, and check if it fits within their available window. If it does, I'll add the meeting to the itinerary and update the current location and time.\n\nAfter evaluating all permutations, I'll select the one with the most meetings that fit within the constraints. This ensures the optimal schedule is chosen.\n\nFinally, I'll format the best itinerary into the required JSON structure and print it as the solution.\n\nThroughout this process, I'll ensure that the code is self-contained, runs independently, and produces valid JSON output. The solution must handle all edge cases, such as invalid permutations where meetings can't be scheduled without exceeding the available time windows.\n</think>\n\n```python\nimport itertools\n\ndef time_to_minutes(t):\n    h, m = map(int, t.split(':'))\n    return h * 60 + m\n\ndef minutes_to_time(m):\n    h = m // 60\n    m = m % 60\n    return f\"{h}:{m:02d}\"\n\ntravel_times = {\n    'The Castro': {\n        'Marina District': 21,\n        'Presidio': 20,\n        'North Beach': 20,\n        'Embarcadero': 22,\n        'Haight-Ashbury': 6,\n        'Golden Gate Park': 11,\n        'Richmond District': 16,\n        'Alamo Square': 8,\n        'Financial District': 21,\n        'Sunset District': 17,\n    },\n    'Marina District': {\n        'The Castro': 22,\n        'Presidio': 10,\n        'North Beach': 11,\n        'Embarcadero': 14,\n        'Haight-Ashbury': 16,\n        'Golden Gate Park': 18,\n        'Richmond District': 11,\n        'Alamo Square': 15,\n        'Financial District': 17,\n        'Sunset District': 19,\n    },\n    'Presidio': {\n        'The Castro': 21,\n        'Marina District': 11,\n        'North Beach': 18,\n        'Embarcadero': 20,\n        'Haight-Ashbury': 15,\n        'Golden Gate Park': 12,\n        'Richmond District': 7,\n        'Alamo Square': 19,\n        'Financial District': 23,\n        'Sunset District': 15,\n    },\n    'North Beach': {\n        'The Castro': 23,\n        'Marina District': 9,\n        'Presidio': 17,\n        'Embarcadero': 6,\n        'Haight-Ashbury': 18,\n        'Golden Gate Park': 22,\n        'Richmond District': 18,\n        'Alamo Square': 16,\n        'Financial District': 8,\n        'Sunset District': 27,\n    },\n    'Embarcadero': {\n        'The Castro': 25,\n        'Marina District': 12,\n        'Presidio': 20,\n        'North Beach': 5,\n        'Haight-Ashbury': 21,\n        'Golden Gate Park': 25,\n        'Richmond District': 21,\n        'Alamo Square': 19,\n        'Financial District': 5,\n        'Sunset District': 30,\n    },\n    'Haight-Ashbury': {\n        'The Castro': 6,\n        'Marina District': 17,\n        'Presidio': 15,\n        'North Beach': 19,\n        'Embarcadero': 20,\n        'Golden Gate Park': 7,\n        'Richmond District': 10,\n        'Alamo Square': 5,\n        'Financial District': 21,\n        'Sunset District': 15,\n    },\n    'Golden Gate Park': {\n        'The Castro': 13,\n        'Marina District': 16,\n        'Presidio': 11,\n        'North Beach': 23,\n        'Embarcadero': 25,\n        'Haight-Ashbury': 7,\n        'Richmond District': 7,\n        'Alamo Square': 9,\n        'Financial District': 26,\n        'Sunset District': 10,\n    },\n    'Richmond District': {\n        'The Castro': 16,\n        'Marina District': 9,\n        'Presidio': 7,\n        'North Beach': 17,\n        'Embarcadero': 19,\n        'Haight-Ashbury': 10,\n        'Golden Gate Park': 9,\n        'Alamo Square': 13,\n        'Financial District': 22,\n        'Sunset District': 11,\n    },\n    'Alamo Square': {\n        'The Castro': 8,\n        'Marina District': 15,\n        'Presidio': 17,\n        'North Beach': 15,\n        'Embarcadero': 16,\n        'Haight-Ashbury': 5,\n        'Golden Gate Park': 9,\n        'Richmond District': 11,\n        'Financial District': 17,\n        'Sunset District': 16,\n    },\n    'Financial District': {\n        'The Castro': 20,\n        'Marina District': 15,\n        'Presidio': 22,\n        'North Beach': 7,\n        'Embarcadero': 4,\n        'Haight-Ashbury': 19,\n        'Golden Gate Park': 23,\n        'Richmond District': 21,\n        'Alamo Square': 17,\n        'Sunset District': 30,\n    },\n    'Sunset District': {\n        'The Castro': 17,\n        'Marina District': 21,\n        'Presidio': 16,\n        'North Beach': 28,\n        'Embarcadero': 30,\n        'Haight-Ashbury': 15,\n        'Golden Gate Park': 11,\n        'Richmond District': 12,\n        'Alamo Square': 17,\n        'Financial District': 30,\n    },\n}\n\nfriends = [\n    {'name': 'Elizabeth', 'location': 'Marina District', 'start': '19:00', 'end': '20:45', 'duration': 105},\n    {'name': 'Joshua', 'location': 'Presidio', 'start': '8:30', 'end': '13:15', 'duration': 105},\n    {'name': 'Timothy', 'location': 'North Beach', 'start': '19:45', 'end': '22:00', 'duration': 90},\n    {'name': 'David', 'location': 'Embarcadero', 'start': '10:45', 'end': '12:30', 'duration': 30},\n    {'name': 'Kimberly', 'location': 'Haight-Ashbury', 'start': '16:45', 'end': '21:30', 'duration': 75},\n    {'name': 'Lisa', 'location': 'Golden Gate Park', 'start': '17:30', 'end': '21:45', 'duration': 45},\n    {'name': 'Ronald', 'location': 'Richmond District', 'start': '8:00', 'end': '9:30', 'duration': 90},\n    {'name': 'Stephanie', 'location': 'Alamo Square', 'start': '15:30', 'end': '16:30', 'duration': 30},\n    {'name': 'Helen', 'location': 'Financial District', 'start': '17:30', 'end': '18:30', 'duration': 45},\n    {'name': 'Laura', 'location': 'Sunset District', 'start': '17:45', 'end': '21:15', 'duration': 90},\n]\n\nbest_itinerary = []\n\nfor perm in itertools.permutations(friends):\n    current_location = 'The Castro'\n    current_time = 540  # 9:00 AM\n    itinerary = []\n    valid = True\n    for friend in perm:\n        travel = travel_times[current_location][friend['location']]\n        arrival = current_time + travel\n        start = time_to_minutes(friend['start'])\n        end = time_to_minutes(friend['end'])\n        meet_start = max(arrival, start)\n        meet_end = meet_start + friend['duration']\n        if meet_end > end:\n            valid = False\n            break\n        itinerary.append({\n            'action': 'meet',\n            'location': friend['location'],\n            'person': friend['name'],\n            'start_time': minutes_to_time(meet_start),\n            'end_time': minutes_to_time(meet_end)\n        })\n        current_location = friend['location']\n        current_time = meet_end\n    if valid:\n        if len(itinerary) > len(best_itinerary):\n            best_itinerary = itinerary.copy()\n\nprint('SOLUTION:')\nprint('{ \"itinerary\": [')\nfor i, meeting in enumerate(best_itinerary):\n    print(f'    {{\"action\": \"meet\", \"location\": \"{meeting[\"location\"]}\", \"person\": \"{meeting[\"person\"]}\", \"start_time\": \"{meeting[\"start_time\"]}\", \"end_time\": \"{meeting[\"end_time\"]}\"}}' + ('' if i == len(best_itinerary)-1 else ','))\nprint(']}')\n```",
            "count": "meeting_planning_example_962"
        }
    ]
}