{
    "0shot": [
        {
            "final_program_time": {
                "itinerary": [
                    {
                        "action": "meet",
                        "location": "Mission District",
                        "person": "Daniel",
                        "start_time": "9:26",
                        "end_time": "11:11"
                    },
                    {
                        "action": "meet",
                        "location": "Chinatown",
                        "person": "Ronald",
                        "start_time": "11:27",
                        "end_time": "12:57"
                    },
                    {
                        "action": "meet",
                        "location": "Golden Gate Park",
                        "person": "Jessica",
                        "start_time": "13:45",
                        "end_time": "14:15"
                    },
                    {
                        "action": "meet",
                        "location": "North Beach",
                        "person": "William",
                        "start_time": "14:39",
                        "end_time": "14:54"
                    },
                    {
                        "action": "meet",
                        "location": "Bayview",
                        "person": "Ashley",
                        "start_time": "17:15",
                        "end_time": "19:00"
                    }
                ]
            },
            "expected_time": {
                "itinerary": [
                    {
                        "action": "meet",
                        "location": "Mission District",
                        "person": "Daniel",
                        "start_time": "9:26",
                        "end_time": "11:11"
                    },
                    {
                        "action": "meet",
                        "location": "Chinatown",
                        "person": "Ronald",
                        "start_time": "11:27",
                        "end_time": "12:57"
                    },
                    {
                        "action": "meet",
                        "location": "Golden Gate Park",
                        "person": "Jessica",
                        "start_time": "13:45",
                        "end_time": "14:15"
                    },
                    {
                        "action": "meet",
                        "location": "Bayview",
                        "person": "Ashley",
                        "start_time": "17:15",
                        "end_time": "19:00"
                    },
                    {
                        "action": "meet",
                        "location": "North Beach",
                        "person": "William",
                        "start_time": "19:21",
                        "end_time": "19:36"
                    }
                ]
            },
            "has_error": false,
            "raw_model_response": "Okay, I need to solve this problem where I have to plan an optimal meeting schedule for a day in San Francisco. The goal is to meet as many friends as possible, considering their availability and the travel times between locations. \n\nFirst, I'll start by understanding the problem thoroughly. The user arrives at Presidio at 9:00 AM. There are five friends, each located in different areas, with specific time windows and meeting durations. The task is to create a schedule that allows meeting each friend for the required minimum time, considering travel times between locations.\n\nI think the approach should involve modeling this as a scheduling problem where each meeting is an activity that has a start and end time, and each transition between meetings requires travel time. The challenge is to fit as many meetings as possible without overlapping and respecting each person's availability.\n\nLet me list out the friends and their constraints:\n\n1. Jessica at Golden Gate Park from 13:45 to 15:00 (1:45 PM to 3:00 PM). Need to meet for at least 30 minutes.\n2. Ashley at Bayview from 17:15 to 20:00 (5:15 PM to 8:00 PM). Need 105 minutes.\n3. Ronald at Chinatown from 7:15 AM to 14:45 (2:45 PM). Need 90 minutes.\n4. William at North Beach from 13:15 to 20:15 (1:15 PM to 8:15 PM). Need 15 minutes.\n5. Daniel at Mission District from 7:00 AM to 11:15 AM. Need 105 minutes.\n\nThe user starts at Presidio at 9:00 AM. So, the first possible meeting is with Daniel in Mission District, but the travel time from Presidio to Mission District is 26 minutes. So arriving at Mission District at 9:26 AM. Daniel is available until 11:15 AM. The required meeting time is 105 minutes, which is 1 hour and 45 minutes. So, if we start at 9:26, the meeting would end at 11:11 AM, which fits within Daniel's availability.\n\nAfter meeting Daniel, the next possible meetings could be Ronald in Chinatown. Travel time from Mission District to Chinatown is 16 minutes (since Mission District to Chinatown is 16 minutes). So arriving at 11:27 AM. Ronald is available until 14:45. We need 90 minutes, so the meeting could end at 12:57 PM.\n\nThen, perhaps William in North Beach. Travel from Chinatown to North Beach is 6 minutes. So arrive at 12:63, which is 13:03 (1:03 PM). William is available from 13:15, so maybe start at 13:15. But we only need 15 minutes, so the meeting could end at 13:30.\n\nWait, but the travel time from Chinatown to North Beach is 6 minutes. So if the meeting with Ronald ends at 12:57, adding 6 minutes gets us to 13:03. But William is available from 13:15, so we have to wait until then. So the meeting starts at 13:15 and ends at 13:30.\n\nAfter that, maybe Jessica in Golden Gate Park. Travel from North Beach to Golden Gate Park is 22 minutes. So arrive at 13:52. Jessica is available from 13:45 to 15:00. We need 30 minutes, so the meeting could be from 13:52 to 14:22.\n\nFinally, Ashley in Bayview. Travel from Golden Gate Park to Bayview is 23 minutes. So arrive at 14:45. Ashley is available from 17:15, so we have to wait until then. But that's a long wait. Alternatively, maybe we can rearrange the order.\n\nWait, perhaps after meeting William, we could go to Golden Gate Park to meet Jessica, and then proceed to Bayview for Ashley. Let me check the timings.\n\nWait, let me outline the possible order:\n\n1. Daniel in Mission District: 9:26 AM to 11:11 AM (105 mins)\n2. Ronald in Chinatown: 11:27 AM to 12:57 PM (90 mins)\n3. William in North Beach: 13:03 PM (arrive) but he's available from 13:15, so meet from 13:15 to 13:30 (15 mins)\n4. Jessica in Golden Gate Park: arrive at 13:52, meet until 14:22 (30 mins)\n5. Then to Bayview for Ashley: arrive at 14:22 + 23 mins = 14:45. But Ashley is available from 17:15. So we have to wait until 17:15. Then meet for 105 mins, ending at 18:00. That's possible.\n\nBut wait, the travel time from Golden Gate Park to Bayview is 23 minutes. So from 14:22, adding 23 minutes gets us to 14:45. But Ashley isn't available until 17:15. So the meeting with Ashley would start at 17:15 and end at 18:00, which is within her availability.\n\nSo that's one possible schedule. Let's see if all the times fit without overlapping.\n\nAnother consideration: Are there other orders that allow more meetings or perhaps fit better? For example, after meeting Daniel, maybe go to William first, but that might not be optimal because William is available later, but perhaps starting earlier allows more meetings.\n\nAlternatively, maybe after Daniel, go to North Beach to meet William earlier, but William is available from 13:15, so arriving at 11:27 (after Daniel) is too early. So that might not help.\n\nWait, perhaps the order I have is the most efficient. Let me check the timings again.\n\nStart at Presidio at 9:00 AM.\n\n1. Travel to Mission District: 26 mins. Arrive at 9:26. Meet Daniel until 11:11.\n2. Travel to Chinatown: 16 mins. Arrive 11:27. Meet Ronald until 12:57.\n3. Travel to North Beach: 6 mins. Arrive 13:03. But William is available from 13:15. So wait until 13:15, meet until 13:30.\n4. Travel to Golden Gate Park: 22 mins. Arrive 13:52. Meet Jessica until 14:22.\n5. Travel to Bayview: 23 mins. Arrive 14:45. Wait until 17:15. Meet Ashley until 18:00.\n\nYes, that seems to fit. Now, let's check if all the meeting durations are met.\n\nDaniel: 105 mins (9:26-11:11) \u2705\nRonald: 90 mins (11:27-12:57) \u2705\nWilliam: 15 mins (13:15-13:30) \u2705\nJessica: 30 mins (13:52-14:22) \u2705\nAshley: 105 mins (17:15-18:00) \u2705\n\nAll constraints are satisfied.\n\nNow, I need to represent this in a JSON structure as per the problem statement. The itinerary should be an array of actions, each with action, location, person, start_time, end_time.\n\nSo the JSON would look like:\n\n{\n  \"itinerary\": [\n    {\"action\": \"meet\", \"location\": \"Mission District\", \"person\": \"Daniel\", \"start_time\": \"9:26\", \"end_time\": \"11:11\"},\n    {\"action\": \"meet\", \"location\": \"Chinatown\", \"person\": \"Ronald\", \"start_time\": \"11:27\", \"end_time\": \"12:57\"},\n    {\"action\": \"meet\", \"location\": \"North Beach\", \"person\": \"William\", \"start_time\": \"13:15\", \"end_time\": \"13:30\"},\n    {\"action\": \"meet\", \"location\": \"Golden Gate Park\", \"person\": \"Jessica\", \"start_time\": \"13:52\", \"end_time\": \"14:22\"},\n    {\"action\": \"meet\", \"location\": \"Bayview\", \"person\": \"Ashley\", \"start_time\": \"17:15\", \"end_time\": \"18:00\"}\n  ]\n}\n\nNow, I need to write a Python program that calculates this schedule. The program should take the constraints as input variables, compute the optimal schedule, and output the JSON.\n\nThe steps the program needs to perform:\n\n1. Define the travel times between all locations. This can be represented as a dictionary of dictionaries, where travel_times[location1][location2] gives the time in minutes.\n\n2. Define the friends' availability and required meeting durations. Each friend has a location, start time, end time, and required duration.\n\n3. Starting from Presidio at 9:00 AM, determine the optimal order to meet as many friends as possible, considering their availability and travel times.\n\nThis seems like a scheduling problem where we need to find the best order to visit each friend without overlapping and maximizing the number of meetings.\n\nBut since the number of friends is small (five), perhaps a brute-force approach with permutations could work, but that might be computationally intensive. However, for five friends, it's 5! = 120 permutations, which is manageable.\n\nAlternatively, since the problem requires any optimal schedule (not necessarily all possible), perhaps a greedy approach could work, selecting the next best meeting based on certain criteria, like earliest possible start time or highest priority.\n\nBut given the time constraints, perhaps a permutation approach is feasible. For each permutation of friends, check if it's possible to meet them all in that order without violating their availability and travel times. If yes, compute the schedule and see if it's the earliest possible or covers all friends.\n\nWait, but the problem says \"optimize your goals\" to meet as many friends as possible. So the goal is to maximize the number of friends met, and if possible, meet all five. So the solution I have above meets all five.\n\nBut perhaps there are other permutations that also meet all five. So the program needs to find any valid permutation that meets all five, or as many as possible.\n\nBut how to model this in code? Let me outline the steps:\n\n- For each permutation of friends:\n   - Starting at Presidio at 9:00 AM.\n   - For each friend in the permutation order:\n      - Calculate the earliest arrival time at the friend's location.\n      - Check if there's enough time to meet for the required duration within the friend's availability.\n      - If yes, add this meeting to the itinerary and update the current time and location.\n      - If any friend cannot be met, break and try the next permutation.\n   - If all friends are met in this permutation, return the itinerary.\n\nBut this approach might not be efficient, but for five friends, it's manageable.\n\nHowever, the problem is that the number of permutations is 120, and each permutation requires checking each friend in order, which is manageable.\n\nBut perhaps a better approach is to model this as a graph problem, where each node represents a state (current location, current time), and edges represent moving to a friend's location, meeting them if possible. The goal is to find the longest possible path that visits as many friends as possible.\n\nBut that might be more complex. For the sake of time, perhaps a permutation-based approach is acceptable.\n\nAlternatively, perhaps we can prioritize friends based on the earliest end time of their availability. For example, Daniel is only available until 11:15 AM, so he should be met early. Similarly, Ronald is available until 14:45, so he should be met after Daniel.\n\nBut I'm not sure if that's the best approach. Let me think about the constraints:\n\n- Daniel must be met by 11:15 AM, and requires 105 minutes. So the latest he can be started is 11:15 - 1:45 = 9:30 AM. But since we start at 9:00 AM, it's best to meet him first.\n\nSo Daniel is the first meeting.\n\nAfter Daniel, the next could be Ronald, as he's available until 14:45. Meeting him next allows us to use the morning slot.\n\nThen, William is available from 13:15, so after Ronald, we can go to William.\n\nJessica is available from 13:45, so after William, we can go to her.\n\nFinally, Ashley is available from 17:15, so after Jessica, we can go to Ashley.\n\nThis order makes sense and fits all the constraints as we saw earlier.\n\nSo the program can model this order as the optimal one.\n\nNow, the program needs to:\n\n1. Read the travel times and store them in a data structure.\n\n2. For each friend, store their location, available start and end times, and required duration.\n\n3. Starting from Presidio at 9:00, iterate through the friends in the optimal order, calculating arrival times and meeting times.\n\n4. For each friend, calculate the earliest possible arrival time based on travel from the previous location.\n\n5. Check if the meeting can fit within the friend's availability.\n\n6. If yes, add the meeting to the itinerary and update the current time and location.\n\n7. If any friend cannot be met, perhaps try a different order, but in this case, the order seems to work.\n\nNow, let's model this in code.\n\nFirst, the travel times. I'll create a dictionary where each key is a location, and the value is another dictionary with the travel times to other locations.\n\nFor example:\n\ntravel_times = {\n    'Presidio': {\n        'Golden Gate Park': 12,\n        'Bayview': 31,\n        'Chinatown': 21,\n        'North Beach': 18,\n        'Mission District': 26,\n    },\n    'Golden Gate Park': {\n        'Presidio': 11,\n        'Bayview': 23,\n        'Chinatown': 23,\n        'North Beach': 24,\n        'Mission District': 17,\n    },\n    # and so on for all locations\n}\n\nBut I need to input all the travel times given in the problem. That's a bit tedious but necessary.\n\nNext, the friends' data. Each friend has a location, start time, end time, and required duration. I'll represent this as a list of dictionaries.\n\nfriends = [\n    {\n        'name': 'Daniel',\n        'location': 'Mission District',\n        'start': '7:00',\n        'end': '11:15',\n        'duration': 105,\n    },\n    {\n        'name': 'Ronald',\n        'location': 'Chinatown',\n        'start': '7:15',\n        'end': '14:45',\n        'duration': 90,\n    },\n    {\n        'name': 'Jessica',\n        'location': 'Golden Gate Park',\n        'start': '13:45',\n        'end': '15:00',\n        'duration': 30,\n    },\n    {\n        'name': 'William',\n        'location': 'North Beach',\n        'start': '13:15',\n        'end': '20:15',\n        'duration': 15,\n    },\n    {\n        'name': 'Ashley',\n        'location': 'Bayview',\n        'start': '17:15',\n        'end': '20:00',\n        'duration': 105,\n    },\n]\n\nWait, but in the problem statement, the friends' availability is given as:\n\n- Jessica: 1:45PM to 3:00PM \u2192 13:45 to 15:00\n- Ashley: 5:15PM to 8:00PM \u2192 17:15 to 20:00\n- Ronald: 7:15AM to 2:45PM \u2192 7:15 to 14:45\n- William: 1:15PM to 8:15PM \u2192 13:15 to 20:15\n- Daniel: 7:00AM to 11:15AM \u2192 7:00 to 11:15\n\nYes, that's correct.\n\nNow, the program needs to process these friends in the order that allows meeting all of them. As discussed, the optimal order is Daniel \u2192 Ronald \u2192 William \u2192 Jessica \u2192 Ashley.\n\nSo the program can process them in this specific order.\n\nNow, the steps for each friend:\n\n1. Start at Presidio at 9:00 AM.\n\n2. For Daniel in Mission District:\n\n   - Travel time from Presidio to Mission District is 26 minutes. So arrival at 9:26.\n   - Check if arrival time is within Daniel's availability (7:00-11:15). Yes.\n   - The meeting needs to be at least 105 minutes. So the earliest end time is 9:26 + 1:45 = 11:11.\n   - 11:11 is before Daniel's end time of 11:15. So the meeting is from 9:26 to 11:11.\n\n3. Next, Ronald in Chinatown:\n\n   - Travel time from Mission District to Chinatown is 16 minutes. So arrival at 11:27.\n   - Ronald is available until 14:45. So the meeting can start at 11:27.\n   - Meeting duration 90 minutes \u2192 ends at 12:57.\n\n4. Next, William in North Beach:\n\n   - Travel time from Chinatown to North Beach is 6 minutes. Arrival at 12:57 + 6 = 13:03.\n   - William is available from 13:15. So the meeting starts at 13:15.\n   - Duration 15 mins \u2192 ends at 13:30.\n\n5. Next, Jessica in Golden Gate Park:\n\n   - Travel time from North Beach to Golden Gate Park is 22 minutes. Arrival at 13:30 + 22 = 13:52.\n   - Jessica is available from 13:45. So meeting starts at 13:52.\n   - Duration 30 mins \u2192 ends at 14:22.\n\n6. Finally, Ashley in Bayview:\n\n   - Travel time from Golden Gate Park to Bayview is 23 minutes. Arrival at 14:22 + 23 = 14:45.\n   - Ashley is available from 17:15. So we wait until 17:15.\n   - Meeting duration 105 mins \u2192 ends at 18:00.\n\nSo the program needs to model this sequence.\n\nNow, to implement this in code:\n\n- Convert all times to minutes since midnight for easier calculations.\n\n- For each friend in order, calculate arrival time.\n\n- Check if arrival time is within the friend's available window.\n\n- If yes, calculate the meeting end time as arrival_time + duration. Ensure it doesn't exceed the friend's end time.\n\n- Update current time and location.\n\nNow, the code structure:\n\n1. Define the travel times.\n\n2. Define the friends in the desired order.\n\n3. Initialize current_time as 9:00 AM (540 minutes) and current_location as 'Presidio'.\n\n4. For each friend in the order:\n\n   a. Get the travel time from current_location to friend's location.\n\n   b. Calculate arrival_time = current_time + travel_time.\n\n   c. Convert friend's start and end times to minutes.\n\n   d. If arrival_time < friend's start_time_in_mins: wait until friend's start_time.\n\n   e. If arrival_time + duration > friend's end_time_in_mins: cannot meet this friend. But in our case, all can be met.\n\n   f. Set meeting_start = max(arrival_time, friend's start_time).\n\n   g. meeting_end = meeting_start + duration.\n\n   h. Add to itinerary.\n\n   i. Update current_time to meeting_end.\n\n   j. Update current_location to friend's location.\n\nBut wait, in the case of Ashley, arrival is at 14:45, but she's available from 17:15. So the meeting starts at 17:15, which is after the arrival time.\n\nSo the code needs to handle cases where arrival_time is before the friend's start time.\n\nNow, the code:\n\nFirst, define the travel_times:\n\ntravel_times = {\n    'Presidio': {\n        'Golden Gate Park': 12,\n        'Bayview': 31,\n        'Chinatown': 21,\n        'North Beach': 18,\n        'Mission District': 26,\n    },\n    'Golden Gate Park': {\n        'Presidio': 11,\n        'Bayview': 23,\n        'Chinatown': 23,\n        'North Beach': 24,\n        'Mission District': 17,\n    },\n    'Bayview': {\n        'Presidio': 31,\n        'Golden Gate Park': 22,\n        'Chinatown': 18,\n        'North Beach': 21,\n        'Mission District': 13,\n    },\n    'Chinatown': {\n        'Presidio': 19,\n        'Golden Gate Park': 23,\n        'Bayview': 22,\n        'North Beach': 3,\n        'Mission District': 18,\n    },\n    'North Beach': {\n        'Presidio': 17,\n        'Golden Gate Park': 22,\n        'Bayview': 22,\n        'Chinatown': 6,\n        'Mission District': 17,\n    },\n    'Mission District': {\n        'Presidio': 25,\n        'Golden Gate Park': 17,\n        'Bayview': 15,\n        'Chinatown': 16,\n        'North Beach': 17,\n    }\n}\n\nWait, let me double-check the travel times from the problem statement.\n\nFor example, Presidio to Mission District is 26, which is correct.\n\nGolden Gate Park to Mission District is 17, as per the problem.\n\nChinatown to North Beach is 3, etc.\n\nYes, the travel_times are correctly represented.\n\nNext, define the friends in the order we want to meet them.\n\nfriends = [\n    {'name': 'Daniel', 'location': 'Mission District', 'start': '7:00', 'end': '11:15', 'duration': 105},\n    {'name': 'Ronald', 'location': 'Chinatown', 'start': '7:15', 'end': '14:45', 'duration': 90},\n    {'name': 'William', 'location': 'North Beach', 'start': '13:15', 'end': '20:15', 'duration': 15},\n    {'name': 'Jessica', 'location': 'Golden Gate Park', 'start': '13:45', 'end': '15:00', 'duration': 30},\n    {'name': 'Ashley', 'location': 'Bayview', 'start': '17:15', 'end': '20:00', 'duration': 105},\n]\n\nNow, the code:\n\ncurrent_time = 540  # 9:00 AM in minutes\ncurrent_location = 'Presidio'\nitinerary = []\n\nfor friend in friends:\n    # Get travel time\n    travel = travel_times[current_location][friend['location']]\n    arrival = current_time + travel\n\n    # Convert friend's times to minutes\n    start_h, start_m = map(int, friend['start'].split(':'))\n    start = start_h * 60 + start_m\n    end_h, end_m = map(int, friend['end'].split(':'))\n    end = end_h * 60 + end_m\n\n    # Calculate meeting start time\n    meeting_start = max(arrival, start)\n    meeting_end = meeting_start + friend['duration']\n\n    # Check if meeting_end exceeds friend's end time\n    if meeting_end > end:\n        # Cannot meet this friend\n        continue\n\n    # Add to itinerary\n    itinerary.append({\n        'action': 'meet',\n        'location': friend['location'],\n        'person': friend['name'],\n        'start_time': f\"{meeting_start // 60}:{meeting_start % 60:02d}\",\n        'end_time': f\"{meeting_end // 60}:{meeting_end % 60:02d}\"\n    })\n\n    # Update current time and location\n    current_time = meeting_end\n    current_location = friend['location']\n\nWait, but in the case of Ashley, arrival is at 14:45 (885 minutes), which is before her start time of 17:15 (1050). So meeting_start is 1050, and meeting_end is 1050 + 105 = 1155 (19:15). But her end time is 20:00 (1200). So 1155 is within 1200. So it works.\n\nBut in the code above, the 'end' for Ashley is 20:00, which is 1200. So meeting_end is 1155, which is okay.\n\nWait, but in the problem statement, Ashley's end time is 8:00 PM, which is 20:00, so 20:00 is 1200 minutes. So the code correctly handles it.\n\nBut wait, in the code, the 'end' variable is set to the friend's end time in minutes. So for Ashley, end is 1200. meeting_end is 1155, which is less than 1200. So it's acceptable.\n\nYes.\n\nNow, the code will generate the itinerary correctly.\n\nBut wait, the code appends all friends in the order, but in reality, the order is fixed as per the friends list. So the code will process them in that order.\n\nBut the problem is that the code assumes that the order is correct, but in reality, the program should compute the optimal order. However, for the sake of time and given that the solution is known, perhaps the code can process the friends in this specific order.\n\nBut to make the program more general, perhaps it's better to try all permutations and find the one that allows meeting the maximum number of friends.\n\nBut given time constraints, perhaps the code can proceed with this fixed order, as it's known to work.\n\nAlternatively, the code can be written to try different orders, but that would complicate the code.\n\nGiven that, I'll proceed with the code as written, processing the friends in the given order.\n\nBut wait, in the code, the friends are processed in the order Daniel, Ronald, William, Jessica, Ashley. So the code will correctly generate the itinerary as per the solution.\n\nNow, the code will output the itinerary in JSON format.\n\nBut the code as written appends all friends, regardless of whether they can be met. But in the case where a friend cannot be met (e.g., if the meeting_end exceeds their end time), the code skips that friend.\n\nBut in our case, all friends can be met, so the code will include all.\n\nFinally, the code will output the JSON with the itinerary.\n\nNow, the code needs to handle the time formatting correctly. For example, 9:26 AM is 9:26, not 09:26. So in the code, the f-strings should format without leading zeros for hours, but with leading zeros for minutes.\n\nWait, in the code, the start_time and end_time are formatted as f\"{meeting_start // 60}:{meeting_start % 60:02d}\". So for 9:26, it's 9:26. For 13:03, it's 13:3 \u2192 wait, no, because {meeting_start % 60:02d} adds leading zero. So 13:03 becomes '13:03', which is correct.\n\nYes.\n\nSo the code should correctly format the times.\n\nNow, putting it all together, the code will:\n\n- Read the travel times and friends data.\n\n- Iterate through the friends in the given order.\n\n- For each, calculate arrival time.\n\n- Check if the meeting can be scheduled within their availability.\n\n- If yes, add to itinerary.\n\n- Update current time and location.\n\n- Finally, print the JSON.\n\nBut wait, the friends list in the code is in the order that works, but the code doesn't try other orders. So if the order is not correct, the code might not find a solution. But in this case, the order is correct.\n\nBut to make the code more robust, perhaps it's better to try all possible permutations of friends and select the one that allows the maximum number of meetings.\n\nBut given the time, perhaps it's better to proceed with the known order.\n\nAlternatively, perhaps the code can process the friends in the order of their end times, prioritizing those who are available earlier.\n\nBut for the sake of this problem, I'll proceed with the code as written.\n\nNow, the code:\n\nBut wait, the code as written has a friends list in a specific order, but perhaps the order is not the only possible. However, the problem requires that the code computes the optimal schedule, not just follows a pre-determined order.\n\nSo perhaps the code should try all possible permutations and find the one that allows meeting the maximum number of friends.\n\nBut implementing that would complicate the code, but it's necessary to make the solution general.\n\nSo, to make the code compute the optimal schedule, it needs to consider all possible orders.\n\nSo the plan is:\n\n1. Generate all possible permutations of the friends.\n\n2. For each permutation, simulate the schedule:\n\n   a. Start at Presidio at 9:00.\n\n   b. For each friend in the permutation order:\n\n      i. Calculate arrival time.\n\n      ii. Check if the meeting can be scheduled within the friend's availability.\n\n      iii. If yes, add to itinerary and update current time and location.\n\n      iv. If no, break and try next permutation.\n\n3. Keep track of the permutation that results in the maximum number of meetings.\n\n4. Among those with the maximum, choose the one that meets the friends earliest or in the most optimal time.\n\nBut for the sake of time, perhaps the code can process all permutations and select the one that meets all five friends, as in our case.\n\nSo, in code, we can use itertools.permutations to generate all possible orders.\n\nBut with five friends, it's 120 permutations, which is manageable.\n\nSo, the code can be modified as follows:\n\n- Import itertools.\n\n- For each permutation in itertools.permutations(friends):\n\n   - Reset current_time and current_location.\n\n   - Create a temporary itinerary.\n\n   - For each friend in the permutation:\n\n      - Calculate arrival time.\n\n      - Check if meeting is possible.\n\n      - If yes, add to temp_itinerary.\n\n      - Else, break.\n\n   - If the length of temp_itinerary is greater than the current best, update best_itinerary.\n\n- After all permutations, output the best_itinerary.\n\nBut this approach is computationally feasible for five friends.\n\nHowever, the code will need to handle the friends as objects that can be permuted. So perhaps the friends list should contain objects or dictionaries that can be processed in any order.\n\nBut in the code, each friend is a dictionary with 'name', 'location', etc.\n\nSo, the code can proceed as follows:\n\nimport itertools\n\ntravel_times = { ... }  # as before\n\nfriends = [ ... ]  # as before, but without the specific order\n\nbest_itinerary = []\n\nfor perm in itertools.permutations(friends):\n    current_time = 540  # 9:00 AM\n    current_location = 'Presidio'\n    temp_itinerary = []\n    for friend in perm:\n        # Get travel time from current_location to friend's location\n        if current_location not in travel_times or friend['location'] not in travel_times[current_location]:\n            # No path, skip\n            break\n        travel = travel_times[current_location][friend['location']]\n        arrival = current_time + travel\n\n        # Convert friend's times to minutes\n        start_h, start_m = map(int, friend['start'].split(':'))\n        start = start_h * 60 + start_m\n        end_h, end_m = map(int, friend['end'].split(':'))\n        end = end_h * 60 + end_m\n\n        meeting_start = max(arrival, start)\n        meeting_end = meeting_start + friend['duration']\n\n        if meeting_end > end:\n            # Cannot meet this friend\n            break\n\n        # Add to temp itinerary\n        temp_itinerary.append({\n            'action': 'meet',\n            'location': friend['location'],\n            'person': friend['name'],\n            'start_time': f\"{meeting_start // 60}:{meeting_start % 60:02d}\",\n            'end_time': f\"{meeting_end // 60}:{meeting_end % 60:02d}\"\n        })\n\n        current_time = meeting_end\n        current_location = friend['location']\n\n    # Update best_itinerary if this permutation is better\n    if len(temp_itinerary) > len(best_itinerary):\n        best_itinerary = temp_itinerary\n\n# After all permutations, output the best_itinerary\n\nBut wait, in the code above, the friends are processed in the order of the permutation. However, in the code, the friends list is a list of dictionaries, and each permutation is a tuple of these dictionaries. So the code should work.\n\nBut in the problem statement, the friends have specific constraints, and the order that allows meeting all five is only one (or a few). So the code will find that permutation.\n\nBut the code as written will process all permutations and find the one with the maximum number of meetings.\n\nIn our case, the optimal permutation is the one that meets all five friends, which is the one we manually determined.\n\nBut the code will find that permutation and set it as the best_itinerary.\n\nHowever, there might be multiple permutations that allow meeting all five friends, but the code will pick the one that meets the most friends.\n\nOnce the best_itinerary is determined, the code can output it.\n\nBut in the code above, the best_itinerary is just the list of meetings. But the problem requires the JSON to have the \"itinerary\" key.\n\nSo, after determining best_itinerary, the code can create the JSON as:\n\nresult = {\n    \"itinerary\": best_itinerary\n}\n\nBut wait, in the code above, the temp_itinerary is built correctly, but the best_itinerary is just the list, not wrapped in \"itinerary\".\n\nSo, the code should collect the best_itinerary and then structure it correctly.\n\nWait, no. The code as written appends each meeting to temp_itinerary as a dictionary with 'action', 'location', 'person', 'start_time', 'end_time'. So best_itinerary is a list of such dictionaries.\n\nThus, the final result is:\n\nresult = {\n    \"itinerary\": best_itinerary\n}\n\nWhich is correct.\n\nBut in the code above, the initial best_itinerary is an empty list. So, after processing all permutations, if any permutation results in a longer itinerary, it's updated.\n\nBut in the problem, the optimal solution meets all five friends, so the best_itinerary will have five entries.\n\nNow, the code will correctly generate the JSON.\n\nBut wait, in the code, the friends are processed in the order of the permutation. So for each permutation, the code tries to meet the friends in that order, and if all can be met, the temp_itinerary will have five entries.\n\nThus, the code will find the correct permutation and output the correct itinerary.\n\nBut the problem is that the code will take longer to run because it's processing all 120 permutations. However, for the sake of correctness, it's necessary.\n\nBut given that, I'll proceed to write the code accordingly.\n\nBut in the problem statement, the code must actually compute the schedule, not just print a pre-determined answer. So the code must not hard-code the order but instead compute it.\n\nTherefore, the code should implement the permutation approach.\n\nSo, putting it all together, the code is as follows.\n</think>\n\n```python\nimport itertools\n\n# Travel times in minutes between locations\ntravel_times = {\n    'Presidio': {\n        'Golden Gate Park': 12,\n        'Bayview': 31,\n        'Chinatown': 21,\n        'North Beach': 18,\n        'Mission District': 26,\n    },\n    'Golden Gate Park': {\n        'Presidio': 11,\n        'Bayview': 23,\n        'Chinatown': 23,\n        'North Beach': 24,\n        'Mission District': 17,\n    },\n    'Bayview': {\n        'Presidio': 31,\n        'Golden Gate Park': 22,\n        'Chinatown': 18,\n        'North Beach': 21,\n        'Mission District': 13,\n    },\n    'Chinatown': {\n        'Presidio': 19,\n        'Golden Gate Park': 23,\n        'Bayview': 22,\n        'North Beach': 3,\n        'Mission District': 18,\n    },\n    'North Beach': {\n        'Presidio': 17,\n        'Golden Gate Park': 22,\n        'Bayview': 22,\n        'Chinatown': 6,\n        'Mission District': 17,\n    },\n    'Mission District': {\n        'Presidio': 25,\n        'Golden Gate Park': 17,\n        'Bayview': 15,\n        'Chinatown': 16,\n        'North Beach': 17,\n    }\n}\n\n# Friends' data\nfriends = [\n    {\n        'name': 'Daniel',\n        'location': 'Mission District',\n        'start': '7:00',\n        'end': '11:15',\n        'duration': 105,\n    },\n    {\n        'name': 'Ronald',\n        'location': 'Chinatown',\n        'start': '7:15',\n        'end': '14:45',\n        'duration': 90,\n    },\n    {\n        'name': 'Jessica',\n        'location': 'Golden Gate Park',\n        'start': '13:45',\n        'end': '15:00',\n        'duration': 30,\n    },\n    {\n        'name': 'William',\n        'location': 'North Beach',\n        'start': '13:15',\n        'end': '20:15',\n        'duration': 15,\n    },\n    {\n        'name': 'Ashley',\n        'location': 'Bayview',\n        'start': '17:15',\n        'end': '20:00',\n        'duration': 105,\n    },\n]\n\nbest_itinerary = []\n\n# Try all possible permutations of friends\nfor perm in itertools.permutations(friends):\n    current_time = 540  # 9:00 AM in minutes\n    current_location = 'Presidio'\n    temp_itinerary = []\n    \n    for friend in perm:\n        # Get travel time from current_location to friend's location\n        if current_location not in travel_times or friend['location'] not in travel_times[current_location]:\n            break  # No path available\n        \n        travel = travel_times[current_location][friend['location']]\n        arrival = current_time + travel\n        \n        # Convert friend's time window to minutes\n        start_h, start_m = map(int, friend['start'].split(':'))\n        start = start_h * 60 + start_m\n        end_h, end_m = map(int, friend['end'].split(':'))\n        end = end_h * 60 + end_m\n        \n        # Determine meeting start time\n        meeting_start = max(arrival, start)\n        meeting_end = meeting_start + friend['duration']\n        \n        if meeting_end > end:\n            break  # Cannot meet this friend\n        \n        # Add to temporary itinerary\n        temp_itinerary.append({\n            'action': 'meet',\n            'location': friend['location'],\n            'person': friend['name'],\n            'start_time': f\"{meeting_start // 60}:{meeting_start % 60:02d}\",\n            'end_time': f\"{meeting_end // 60}:{meeting_end % 60:02d}\"\n        })\n        \n        # Update current time and location\n        current_time = meeting_end\n        current_location = friend['location']\n    \n    # Update best itinerary if this permutation is better\n    if len(temp_itinerary) > len(best_itinerary):\n        best_itinerary = temp_itinerary\n\n# Prepare the result\nresult = {\n    \"itinerary\": best_itinerary\n}\n\n# Print the result as JSON\nimport json\nprint(json.dumps(result))\n```",
            "count": "meeting_planning_example_454"
        }
    ]
}