{
    "0shot": [
        {
            "final_program_time": {
                "itinerary": []
            },
            "expected_time": {
                "itinerary": [
                    {
                        "action": "meet",
                        "location": "Pacific Heights",
                        "person": "Emily",
                        "start_time": "11:15",
                        "end_time": "11:30"
                    },
                    {
                        "action": "meet",
                        "location": "Haight-Ashbury",
                        "person": "Karen",
                        "start_time": "11:45",
                        "end_time": "12:15"
                    },
                    {
                        "action": "meet",
                        "location": "Mission District",
                        "person": "Stephanie",
                        "start_time": "13:00",
                        "end_time": "14:15"
                    },
                    {
                        "action": "meet",
                        "location": "Chinatown",
                        "person": "James",
                        "start_time": "14:31",
                        "end_time": "16:31"
                    },
                    {
                        "action": "meet",
                        "location": "Russian Hill",
                        "person": "Steven",
                        "start_time": "16:38",
                        "end_time": "17:08"
                    },
                    {
                        "action": "meet",
                        "location": "The Castro",
                        "person": "Matthew",
                        "start_time": "17:29",
                        "end_time": "18:14"
                    },
                    {
                        "action": "meet",
                        "location": "Bayview",
                        "person": "William",
                        "start_time": "18:33",
                        "end_time": "20:03"
                    },
                    {
                        "action": "meet",
                        "location": "Marina District",
                        "person": "Brian",
                        "start_time": "20:30",
                        "end_time": "21:00"
                    }
                ]
            },
            "has_error": true,
            "raw_model_response": "```python\nimport json\nfrom datetime import datetime, timedelta\n\n# Define travel distances in a dictionary\ntravel_times = {\n    \"Richmond District\": {\n        \"The Castro\": 16,\n        \"Nob Hill\": 17,\n        \"Marina District\": 9,\n        \"Pacific Heights\": 10,\n        \"Haight-Ashbury\": 10,\n        \"Mission District\": 20,\n        \"Chinatown\": 20,\n        \"Russian Hill\": 13,\n        \"Alamo Square\": 13,\n        \"Bayview\": 27\n    },\n    \"The Castro\": {\n        \"Richmond District\": 16,\n        \"Nob Hill\": 16,\n        \"Marina District\": 21,\n        \"Pacific Heights\": 16,\n        \"Haight-Ashbury\": 6,\n        \"Mission District\": 7,\n        \"Chinatown\": 22,\n        \"Russian Hill\": 18,\n        \"Alamo Square\": 8,\n        \"Bayview\": 19\n    },\n    \"Nob Hill\": {\n        \"Richmond District\": 14,\n        \"The Castro\": 17,\n        \"Marina District\": 11,\n        \"Pacific Heights\": 8,\n        \"Haight-Ashbury\": 13,\n        \"Mission District\": 13,\n        \"Chinatown\": 6,\n        \"Russian Hill\": 5,\n        \"Alamo Square\": 11,\n        \"Bayview\": 19\n    },\n    # ... continue defining other locations similarly,\n    # This full structure should include all locations and their travel times.\n}\n\n# Define meeting constraints\nconstraints = {\n    \"Matthew\": {\"location\": \"The Castro\", \"start\": \"16:30\", \"end\": \"20:00\", \"duration\": 45},\n    \"Rebecca\": {\"location\": \"Nob Hill\", \"start\": \"15:15\", \"end\": \"19:15\", \"duration\": 105},\n    \"Brian\": {\"location\": \"Marina District\", \"start\": \"14:15\", \"end\": \"22:00\", \"duration\": 30},\n    \"Emily\": {\"location\": \"Pacific Heights\", \"start\": \"11:15\", \"end\": \"19:45\", \"duration\": 15},\n    \"Karen\": {\"location\": \"Haight-Ashbury\", \"start\": \"11:45\", \"end\": \"17:30\", \"duration\": 30},\n    \"Stephanie\": {\"location\": \"Mission District\", \"start\": \"13:00\", \"end\": \"15:45\", \"duration\": 75},\n    \"James\": {\"location\": \"Chinatown\", \"start\": \"14:30\", \"end\": \"19:00\", \"duration\": 120},\n    \"Steven\": {\"location\": \"Russian Hill\", \"start\": \"14:00\", \"end\": \"20:00\", \"duration\": 30},\n    \"Elizabeth\": {\"location\": \"Alamo Square\", \"start\": \"13:00\", \"end\": \"17:15\", \"duration\": 120},\n    \"William\": {\"location\": \"Bayview\", \"start\": \"18:15\", \"end\": \"20:15\", \"duration\": 90},\n}\n\n# Function to calculate the meeting schedule\ndef calculate_schedule(travel_times, constraints):\n    start_time = datetime.strptime(\"09:00\", \"%H:%M\")\n    schedule = []\n    current_time = start_time\n    current_location = \"Richmond District\"\n    \n    for person, info in constraints.items():\n        location = info[\"location\"]\n        person's_start_time = datetime.strptime(info[\"start\"], \"%H:%M\")\n        person's_end_time = datetime.strptime(info[\"end\"], \"%H:%M\")\n\n        # Calculate travel time to the person's location\n        travel_time = travel_times[current_location][location]\n        arrival_time = current_time + timedelta(minutes=travel_time)\n\n        # Check if we can meet the person\n        if arrival_time >= person's_start_time and arrival_time + timedelta(minutes=info[\"duration\"]) <= person\u2019s_end_time:\n            meet_start_time = arrival_time\n            meet_end_time = meet_start_time + timedelta(minutes=info[\"duration\"])\n            \n            # Append the meeting to the schedule\n            schedule.append({\n                \"action\": \"meet\",\n                \"location\": location,\n                \"person\": person,\n                \"start_time\": meet_start_time.strftime(\"%H:%M\"),\n                \"end_time\": meet_end_time.strftime(\"%H:%M\")\n            })\n            \n            # Update current time and location\n            current_time = meet_end_time\n            current_location = location\n\n            # Include travel time to next constraint in the loop\n            next_person_location = next(iter(constraints.values()))['location']\n            travel_time_to_next = travel_times[current_location][next_person_location]\n            current_time += timedelta(minutes=travel_time_to_next)\n\n    return {\"itinerary\": schedule}\n\n# Get the meeting schedule\nitinerary = calculate_schedule(travel_times, constraints)\n\n# Output the result as JSON\nprint(json.dumps(itinerary, indent=2))\n```",
            "count": "meeting_planning_example_900"
        }
    ]
}