{
    "0shot": [
        {
            "final_program_time": {
                "itinerary": [
                    {
                        "action": "meet",
                        "location": "Golden Gate Park",
                        "person": "Helen",
                        "start_time": "9:30",
                        "end_time": "10:15"
                    },
                    {
                        "action": "meet",
                        "location": "The Castro",
                        "person": "Steven",
                        "start_time": "20:15",
                        "end_time": "22:00"
                    }
                ]
            },
            "expected_time": {
                "itinerary": [
                    {
                        "action": "meet",
                        "location": "Golden Gate Park",
                        "person": "Helen",
                        "start_time": "9:30",
                        "end_time": "10:15"
                    },
                    {
                        "action": "meet",
                        "location": "Bayview",
                        "person": "Deborah",
                        "start_time": "10:38",
                        "end_time": "11:08"
                    },
                    {
                        "action": "meet",
                        "location": "Marina District",
                        "person": "Matthew",
                        "start_time": "11:35",
                        "end_time": "12:20"
                    },
                    {
                        "action": "meet",
                        "location": "Financial District",
                        "person": "Rebecca",
                        "start_time": "14:45",
                        "end_time": "15:15"
                    },
                    {
                        "action": "meet",
                        "location": "Union Square",
                        "person": "Joseph",
                        "start_time": "15:24",
                        "end_time": "17:24"
                    },
                    {
                        "action": "meet",
                        "location": "Sunset District",
                        "person": "Ronald",
                        "start_time": "17:51",
                        "end_time": "18:51"
                    },
                    {
                        "action": "meet",
                        "location": "The Castro",
                        "person": "Steven",
                        "start_time": "20:15",
                        "end_time": "22:00"
                    }
                ]
            },
            "has_error": false,
            "raw_model_response": "```python\nimport json\nfrom datetime import datetime, timedelta\n\n# Define the travel distances between locations (in minutes)\ntravel_times = {\n    (\"Pacific Heights\", \"Golden Gate Park\"): 15,\n    (\"Pacific Heights\", \"The Castro\"): 16,\n    (\"Pacific Heights\", \"Bayview\"): 22,\n    (\"Pacific Heights\", \"Marina District\"): 6,\n    (\"Pacific Heights\", \"Union Square\"): 12,\n    (\"Pacific Heights\", \"Sunset District\"): 21,\n    (\"Pacific Heights\", \"Alamo Square\"): 10,\n    (\"Pacific Heights\", \"Financial District\"): 13,\n    (\"Pacific Heights\", \"Mission District\"): 15,\n    (\"Golden Gate Park\", \"The Castro\"): 13,\n    (\"Golden Gate Park\", \"Bayview\"): 23,\n    (\"Golden Gate Park\", \"Marina District\"): 16,\n    (\"Golden Gate Park\", \"Union Square\"): 22,\n    (\"Golden Gate Park\", \"Sunset District\"): 10,\n    (\"Golden Gate Park\", \"Alamo Square\"): 9,\n    (\"Golden Gate Park\", \"Financial District\"): 26,\n    (\"Golden Gate Park\", \"Mission District\"): 17,\n    (\"The Castro\", \"Bayview\"): 19,\n    (\"The Castro\", \"Marina District\"): 21,\n    (\"The Castro\", \"Union Square\"): 19,\n    (\"The Castro\", \"Sunset District\"): 17,\n    (\"The Castro\", \"Alamo Square\"): 8,\n    (\"The Castro\", \"Financial District\"): 21,\n    (\"The Castro\", \"Mission District\"): 7,\n    (\"Bayview\", \"Marina District\"): 27,\n    (\"Bayview\", \"Union Square\"): 18,\n    (\"Bayview\", \"Sunset District\"): 23,\n    (\"Bayview\", \"Alamo Square\"): 16,\n    (\"Bayview\", \"Financial District\"): 19,\n    (\"Bayview\", \"Mission District\"): 13,\n    (\"Marina District\", \"Union Square\"): 16,\n    (\"Marina District\", \"Sunset District\"): 19,\n    (\"Marina District\", \"Alamo Square\"): 15,\n    (\"Marina District\", \"Financial District\"): 17,\n    (\"Marina District\", \"Mission District\"): 20,\n    (\"Union Square\", \"Sunset District\"): 27,\n    (\"Union Square\", \"Alamo Square\"): 15,\n    (\"Union Square\", \"Financial District\"): 9,\n    (\"Union Square\", \"Mission District\"): 14,\n    (\"Sunset District\", \"Alamo Square\"): 17,\n    (\"Sunset District\", \"Financial District\"): 30,\n    (\"Sunset District\", \"Mission District\"): 25,\n    (\"Alamo Square\", \"Financial District\"): 17,\n}\n\n# Define meeting constraints\nmeetings = {\n    \"Helen\": {\"location\": \"Golden Gate Park\", \"start\": \"09:30\", \"end\": \"12:15\", \"duration\": 45},\n    \"Steven\": {\"location\": \"The Castro\", \"start\": \"20:15\", \"end\": \"22:00\", \"duration\": 105},\n    \"Deborah\": {\"location\": \"Bayview\", \"start\": \"08:30\", \"end\": \"12:00\", \"duration\": 30},\n    \"Matthew\": {\"location\": \"Marina District\", \"start\": \"09:15\", \"end\": \"14:15\", \"duration\": 45},\n    \"Joseph\": {\"location\": \"Union Square\", \"start\": \"14:15\", \"end\": \"18:45\", \"duration\": 120},\n    \"Ronald\": {\"location\": \"Sunset District\", \"start\": \"16:00\", \"end\": \"20:45\", \"duration\": 60},\n    \"Robert\": {\"location\": \"Alamo Square\", \"start\": \"18:30\", \"end\": \"21:15\", \"duration\": 120},\n    \"Rebecca\": {\"location\": \"Financial District\", \"start\": \"14:45\", \"end\": \"16:15\", \"duration\": 30},\n    \"Elizabeth\": {\"location\": \"Mission District\", \"start\": \"18:30\", \"end\": \"21:00\", \"duration\": 120},\n}\n\n# Start planning from Pacific Heights at 9:00AM\nstart_time = datetime.strptime(\"09:00\", \"%H:%M\")\n\n# Create a list to hold the meeting schedule\nitinerary = []\n\n# Function to check if meeting is possible\ndef can_meet(start, end, duration):\n    available_time = end - start\n    return available_time >= timedelta(minutes=duration)\n\n# Function to schedule meetings\ndef schedule_meetings(initial_time):\n    current_time = initial_time\n    for friend, details in meetings.items():\n        location = details[\"location\"]\n        meeting_start = datetime.strptime(details[\"start\"], \"%H:%M\")\n        meeting_end = datetime.strptime(details[\"end\"], \"%H:%M\")\n        duration = details[\"duration\"]\n        \n        # Adjusted meeting start time considering travel time and previous meetings\n        travel_time = travel_times.get((\"Pacific Heights\", location), float('inf'))\n        adjusted_start_time = current_time + timedelta(minutes=travel_time)\n\n        # Check if we can start meeting\n        if adjusted_start_time < meeting_start:\n            adjusted_start_time = meeting_start\n        \n        adjusted_end_time = adjusted_start_time + timedelta(minutes=duration)\n\n        if adjusted_end_time <= meeting_end:\n            itinerary.append({\n                \"action\": \"meet\",\n                \"location\": location,\n                \"person\": friend,\n                \"start_time\": adjusted_start_time.strftime(\"%H:%M\"),\n                \"end_time\": adjusted_end_time.strftime(\"%H:%M\")\n            })\n            # Update the current time to reflect travel time to the next location\n            current_time = adjusted_end_time\n            # Traveling time to set next location to Pacific Heights after meeting\n            current_time += timedelta(minutes=travel_times.get((location, \"Pacific Heights\"), 0))\n\n# Schedule the meetings\nschedule_meetings(start_time)\n\n# Output JSON result\nresult = {\"itinerary\": itinerary}\nprint(json.dumps(result, indent=2))\n```",
            "count": "meeting_planning_example_835"
        }
    ]
}