{
    "0shot": [
        {
            "final_program_time": {
                "itinerary": [
                    {
                        "action": "meet",
                        "location": "Embarcadero",
                        "person": "James",
                        "start_time": "11:00",
                        "end_time": "11:30"
                    }
                ]
            },
            "expected_time": {
                "itinerary": [
                    {
                        "action": "meet",
                        "location": "Pacific Heights",
                        "person": "Emily",
                        "start_time": "9:15",
                        "end_time": "11:15"
                    },
                    {
                        "action": "meet",
                        "location": "Haight-Ashbury",
                        "person": "Linda",
                        "start_time": "11:26",
                        "end_time": "11:41"
                    },
                    {
                        "action": "meet",
                        "location": "Mission District",
                        "person": "Anthony",
                        "start_time": "11:52",
                        "end_time": "13:37"
                    },
                    {
                        "action": "meet",
                        "location": "North Beach",
                        "person": "Helen",
                        "start_time": "13:54",
                        "end_time": "14:24"
                    },
                    {
                        "action": "meet",
                        "location": "Fisherman's Wharf",
                        "person": "Paul",
                        "start_time": "14:45",
                        "end_time": "16:15"
                    },
                    {
                        "action": "meet",
                        "location": "Bayview",
                        "person": "William",
                        "start_time": "17:30",
                        "end_time": "19:30"
                    },
                    {
                        "action": "meet",
                        "location": "Golden Gate Park",
                        "person": "Kimberly",
                        "start_time": "19:52",
                        "end_time": "21:07"
                    }
                ]
            },
            "has_error": false,
            "raw_model_response": "```python\nimport json\nfrom datetime import datetime, timedelta\n\n# Define travel times (in minutes) between locations\ntravel_times = {\n    (\"Russian Hill\", \"Pacific Heights\"): 7,\n    (\"Russian Hill\", \"North Beach\"): 5,\n    (\"Russian Hill\", \"Golden Gate Park\"): 21,\n    (\"Russian Hill\", \"Embarcadero\"): 8,\n    (\"Russian Hill\", \"Haight-Ashbury\"): 17,\n    (\"Russian Hill\", \"Fisherman's Wharf\"): 7,\n    (\"Russian Hill\", \"Mission District\"): 16,\n    (\"Russian Hill\", \"Alamo Square\"): 15,\n    (\"Russian Hill\", \"Bayview\"): 23,\n    (\"Russian Hill\", \"Richmond District\"): 14,\n    (\"Pacific Heights\", \"North Beach\"): 9,\n    (\"Pacific Heights\", \"Golden Gate Park\"): 15,\n    (\"Pacific Heights\", \"Embarcadero\"): 10,\n    (\"Pacific Heights\", \"Haight-Ashbury\"): 11,\n    (\"Pacific Heights\", \"Fisherman's Wharf\"): 13,\n    (\"Pacific Heights\", \"Mission District\"): 15,\n    (\"Pacific Heights\", \"Alamo Square\"): 10,\n    (\"Pacific Heights\", \"Bayview\"): 22,\n    (\"Pacific Heights\", \"Richmond District\"): 12,\n    (\"North Beach\", \"Golden Gate Park\"): 22,\n    (\"North Beach\", \"Embarcadero\"): 6,\n    (\"North Beach\", \"Haight-Ashbury\"): 18,\n    (\"North Beach\", \"Fisherman's Wharf\"): 5,\n    (\"North Beach\", \"Mission District\"): 18,\n    (\"North Beach\", \"Alamo Square\"): 16,\n    (\"North Beach\", \"Bayview\"): 25,\n    (\"North Beach\", \"Richmond District\"): 18,\n    (\"Golden Gate Park\", \"Embarcadero\"): 25,\n    (\"Golden Gate Park\", \"Haight-Ashbury\"): 7,\n    (\"Golden Gate Park\", \"Fisherman's Wharf\"): 24,\n    (\"Golden Gate Park\", \"Mission District\"): 17,\n    (\"Golden Gate Park\", \"Alamo Square\"): 9,\n    (\"Golden Gate Park\", \"Bayview\"): 23,\n    (\"Golden Gate Park\", \"Richmond District\"): 7,\n    (\"Embarcadero\", \"Haight-Ashbury\"): 20,\n    (\"Embarcadero\", \"Fisherman's Wharf\"): 6,\n    (\"Embarcadero\", \"Mission District\"): 20,\n    (\"Embarcadero\", \"Alamo Square\"): 19,\n    (\"Embarcadero\", \"Bayview\"): 21,\n    (\"Embarcadero\", \"Richmond District\"): 21,\n    (\"Haight-Ashbury\", \"Golden Gate Park\"): 7,\n    (\"Haight-Ashbury\", \"Fisherman's Wharf\"): 23,\n    (\"Haight-Ashbury\", \"Mission District\"): 11,\n    (\"Haight-Ashbury\", \"Alamo Square\"): 5,\n    (\"Haight-Ashbury\", \"Bayview\"): 18,\n    (\"Haight-Ashbury\", \"Richmond District\"): 10,\n    (\"Fisherman's Wharf\", \"Golden Gate Park\"): 25,\n    (\"Fisherman's Wharf\", \"Mission District\"): 22,\n    (\"Fisherman's Wharf\", \"Alamo Square\"): 21,\n    (\"Fisherman's Wharf\", \"Bayview\"): 26,\n    (\"Fisherman's Wharf\", \"Richmond District\"): 18,\n    (\"Mission District\", \"Golden Gate Park\"): 17,\n    (\"Mission District\", \"Haight-Ashbury\"): 12,\n    (\"Mission District\", \"Alamo Square\"): 10,\n    (\"Mission District\", \"Bayview\"): 14,\n    (\"Mission District\", \"Richmond District\"): 20,\n    (\"Alamo Square\", \"Golden Gate Park\"): 9,\n    (\"Alamo Square\", \"Bayview\"): 16,\n    (\"Alamo Square\", \"Richmond District\"): 11,\n    (\"Bayview\", \"Richmond District\"): 25,\n}\n\n# Define meeting constraints\nmeetings = [\n    {\"name\": \"Emily\", \"location\": \"Pacific Heights\", \"start\": \"9:15\", \"end\": \"13:45\", \"min_time\": 120},\n    {\"name\": \"Helen\", \"location\": \"North Beach\", \"start\": \"13:45\", \"end\": \"18:45\", \"min_time\": 30},\n    {\"name\": \"Kimberly\", \"location\": \"Golden Gate Park\", \"start\": \"18:45\", \"end\": \"21:15\", \"min_time\": 75},\n    {\"name\": \"James\", \"location\": \"Embarcadero\", \"start\": \"10:30\", \"end\": \"11:30\", \"min_time\": 30},\n    {\"name\": \"Linda\", \"location\": \"Haight-Ashbury\", \"start\": \"7:30\", \"end\": \"19:15\", \"min_time\": 15},\n    {\"name\": \"Paul\", \"location\": \"Fisherman's Wharf\", \"start\": \"14:45\", \"end\": \"18:45\", \"min_time\": 90},\n    {\"name\": \"Anthony\", \"location\": \"Mission District\", \"start\": \"8:00\", \"end\": \"14:45\", \"min_time\": 105},\n    {\"name\": \"Nancy\", \"location\": \"Alamo Square\", \"start\": \"8:30\", \"end\": \"13:45\", \"min_time\": 120},\n    {\"name\": \"William\", \"location\": \"Bayview\", \"start\": \"17:30\", \"end\": \"20:30\", \"min_time\": 120},\n    {\"name\": \"Margaret\", \"location\": \"Richmond District\", \"start\": \"15:15\", \"end\": \"18:15\", \"min_time\": 45},\n]\n\nstart_time = datetime.strptime(\"9:00\", \"%H:%M\")\nitinerary = []\n\n# Helper function to compute available meeting slots\ndef find_meeting(start, end, location, duration):\n    duration = timedelta(minutes=duration)\n    available_slots = []\n    \n    for meeting in meetings:\n        if meeting[\"location\"] == location:\n            meeting_start = datetime.strptime(meeting[\"start\"], \"%H:%M\")\n            meeting_end = datetime.strptime(meeting[\"end\"], \"%H:%M\")\n            meeting_start = meeting_start.replace(year=start.year, month=start.month, day=start.day)\n            meeting_end = meeting_end.replace(year=start.year, month=start.month, day=start.day)\n            \n            if meeting_start >= start and meeting_end <= end:\n                available_slots.append((meeting_start, meeting_end, meeting[\"name\"], meeting[\"min_time\"]))\n    \n    return available_slots\n\n# Initial schedule calculation\ndef schedule_meetings():\n    current_time = start_time\n    # Check for each person based on availability\n    for meeting in meetings:\n        location = meeting[\"location\"]\n        available_times = find_meeting(current_time, current_time + timedelta(hours=3), location, meeting[\"min_time\"])\n        \n        for start, end, person_name, min_time in available_times:\n            if (end - start) >= timedelta(minutes=min_time):\n                end_time = start + timedelta(minutes=min_time)\n                travel_time = travel_times.get((current_time.strftime(\"%H:%M\"), location), 0)\n                current_time += timedelta(minutes=travel_time)\n                itinerary.append({\n                    \"action\": \"meet\",\n                    \"location\": location,\n                    \"person\": person_name,\n                    \"start_time\": end_time.strftime(\"%H:%M\"),\n                    \"end_time\": (end_time + timedelta(minutes=min_time)).strftime(\"%H:%M\")\n                })\n                current_time = end_time + timedelta(minutes=travel_time)\n\nschedule_meetings()\n\n# Generate final itinerary\nresult = {\n    \"itinerary\": itinerary\n}\n\n# Output result in JSON format\nprint(json.dumps(result, indent=2))\n```",
            "count": "meeting_planning_example_901"
        }
    ]
}