{
    "0shot": [
        {
            "final_program_time": {
                "itinerary": []
            },
            "expected_time": {
                "itinerary": [
                    {
                        "action": "meet",
                        "location": "Financial District",
                        "person": "Carol",
                        "start_time": "10:15",
                        "end_time": "11:15"
                    },
                    {
                        "action": "meet",
                        "location": "Richmond District",
                        "person": "Kimberly",
                        "start_time": "14:15",
                        "end_time": "14:45"
                    },
                    {
                        "action": "meet",
                        "location": "The Castro",
                        "person": "Kenneth",
                        "start_time": "15:01",
                        "end_time": "15:31"
                    },
                    {
                        "action": "meet",
                        "location": "Presidio",
                        "person": "Brian",
                        "start_time": "15:51",
                        "end_time": "17:06"
                    },
                    {
                        "action": "meet",
                        "location": "Nob Hill",
                        "person": "Sandra",
                        "start_time": "17:24",
                        "end_time": "18:24"
                    },
                    {
                        "action": "meet",
                        "location": "Mission District",
                        "person": "Laura",
                        "start_time": "18:37",
                        "end_time": "19:07"
                    },
                    {
                        "action": "meet",
                        "location": "Russian Hill",
                        "person": "Karen",
                        "start_time": "19:22",
                        "end_time": "20:37"
                    },
                    {
                        "action": "meet",
                        "location": "Alamo Square",
                        "person": "Paul",
                        "start_time": "21:00",
                        "end_time": "21:15"
                    },
                    {
                        "action": "meet",
                        "location": "Marina District",
                        "person": "Linda",
                        "start_time": "21:30",
                        "end_time": "22:00"
                    }
                ]
            },
            "has_error": true,
            "raw_model_response": "```python\nimport json\nfrom datetime import datetime, timedelta\nimport itertools\n\n# Define the travel distances in minutes\ntravel_times = {\n    (\"Pacific Heights\", \"Marina District\"): 6,\n    (\"Pacific Heights\", \"The Castro\"): 16,\n    (\"Pacific Heights\", \"Richmond District\"): 12,\n    (\"Pacific Heights\", \"Alamo Square\"): 10,\n    (\"Pacific Heights\", \"Financial District\"): 13,\n    (\"Pacific Heights\", \"Presidio\"): 11,\n    (\"Pacific Heights\", \"Mission District\"): 15,\n    (\"Pacific Heights\", \"Nob Hill\"): 8,\n    (\"Pacific Heights\", \"Russian Hill\"): 7,\n    (\"Marina District\", \"Pacific Heights\"): 7,\n    (\"Marina District\", \"The Castro\"): 22,\n    (\"Marina District\", \"Richmond District\"): 11,\n    (\"Marina District\", \"Alamo Square\"): 15,\n    (\"Marina District\", \"Financial District\"): 17,\n    (\"Marina District\", \"Presidio\"): 10,\n    (\"Marina District\", \"Mission District\"): 20,\n    (\"Marina District\", \"Nob Hill\"): 12,\n    (\"Marina District\", \"Russian Hill\"): 8,\n    (\"The Castro\", \"Pacific Heights\"): 16,\n    (\"The Castro\", \"Marina District\"): 21,\n    (\"The Castro\", \"Richmond District\"): 16,\n    (\"The Castro\", \"Alamo Square\"): 8,\n    (\"The Castro\", \"Financial District\"): 21,\n    (\"The Castro\", \"Presidio\"): 20,\n    (\"The Castro\", \"Mission District\"): 7,\n    (\"The Castro\", \"Nob Hill\"): 16,\n    (\"The Castro\", \"Russian Hill\"): 18,\n    (\"Richmond District\", \"Pacific Heights\"): 10,\n    (\"Richmond District\", \"Marina District\"): 9,\n    (\"Richmond District\", \"The Castro\"): 16,\n    (\"Richmond District\", \"Alamo Square\"): 13,\n    (\"Richmond District\", \"Financial District\"): 22,\n    (\"Richmond District\", \"Presidio\"): 7,\n    (\"Richmond District\", \"Mission District\"): 20,\n    (\"Richmond District\", \"Nob Hill\"): 17,\n    (\"Richmond District\", \"Russian Hill\"): 13,\n    (\"Alamo Square\", \"Pacific Heights\"): 10,\n    (\"Alamo Square\", \"Marina District\"): 15,\n    (\"Alamo Square\", \"The Castro\"): 8,\n    (\"Alamo Square\", \"Richmond District\"): 11,\n    (\"Alamo Square\", \"Financial District\"): 17,\n    (\"Alamo Square\", \"Presidio\"): 17,\n    (\"Alamo Square\", \"Mission District\"): 10,\n    (\"Alamo Square\", \"Nob Hill\"): 11,\n    (\"Alamo Square\", \"Russian Hill\"): 13,\n    (\"Financial District\", \"Pacific Heights\"): 13,\n    (\"Financial District\", \"Marina District\"): 15,\n    (\"Financial District\", \"The Castro\"): 20,\n    (\"Financial District\", \"Richmond District\"): 21,\n    (\"Financial District\", \"Alamo Square\"): 17,\n    (\"Financial District\", \"Presidio\"): 22,\n    (\"Financial District\", \"Mission District\"): 17,\n    (\"Financial District\", \"Nob Hill\"): 8,\n    (\"Financial District\", \"Russian Hill\"): 11,\n    (\"Presidio\", \"Pacific Heights\"): 11,\n    (\"Presidio\", \"Marina District\"): 11,\n    (\"Presidio\", \"The Castro\"): 21,\n    (\"Presidio\", \"Richmond District\"): 7,\n    (\"Presidio\", \"Alamo Square\"): 19,\n    (\"Presidio\", \"Financial District\"): 23,\n    (\"Presidio\", \"Mission District\"): 26,\n    (\"Presidio\", \"Nob Hill\"): 18,\n    (\"Presidio\", \"Russian Hill\"): 14,\n    (\"Mission District\", \"Pacific Heights\"): 16,\n    (\"Mission District\", \"Marina District\"): 19,\n    (\"Mission District\", \"The Castro\"): 7,\n    (\"Mission District\", \"Richmond District\"): 20,\n    (\"Mission District\", \"Alamo Square\"): 11,\n    (\"Mission District\", \"Financial District\"): 15,\n    (\"Mission District\", \"Presidio\"): 25,\n    (\"Mission District\", \"Nob Hill\"): 12,\n    (\"Mission District\", \"Russian Hill\"): 15,\n    (\"Nob Hill\", \"Pacific Heights\"): 8,\n    (\"Nob Hill\", \"Marina District\"): 11,\n    (\"Nob Hill\", \"The Castro\"): 17,\n    (\"Nob Hill\", \"Richmond District\"): 14,\n    (\"Nob Hill\", \"Alamo Square\"): 11,\n    (\"Nob Hill\", \"Financial District\"): 9,\n    (\"Nob Hill\", \"Presidio\"): 17,\n    (\"Nob Hill\", \"Mission District\"): 13,\n    (\"Nob Hill\", \"Russian Hill\"): 5,\n    (\"Russian Hill\", \"Pacific Heights\"): 7,\n    (\"Russian Hill\", \"Marina District\"): 7,\n    (\"Russian Hill\", \"The Castro\"): 21,\n    (\"Russian Hill\", \"Richmond District\"): 14,\n    (\"Russian Hill\", \"Alamo Square\"): 15,\n    (\"Russian Hill\", \"Financial District\"): 11,\n    (\"Russian Hill\", \"Presidio\"): 14,\n    (\"Russian Hill\", \"Mission District\"): 16,\n    (\"Russian Hill\", \"Nob Hill\"): 5,\n}\n\n# Define the friends' constraints\nfriends = [\n    {\"name\": \"Linda\", \"location\": \"Marina District\", \"start\": \"18:00\", \"end\": \"22:00\", \"duration\": 30},\n    {\"name\": \"Kenneth\", \"location\": \"The Castro\", \"start\": \"14:45\", \"end\": \"16:15\", \"duration\": 30},\n    {\"name\": \"Kimberly\", \"location\": \"Richmond District\", \"start\": \"14:15\", \"end\": \"22:00\", \"duration\": 30},\n    {\"name\": \"Paul\", \"location\": \"Alamo Square\", \"start\": \"21:00\", \"end\": \"21:30\", \"duration\": 15},\n    {\"name\": \"Carol\", \"location\": \"Financial District\", \"start\": \"10:15\", \"end\": \"12:00\", \"duration\": 60},\n    {\"name\": \"Brian\", \"location\": \"Presidio\", \"start\": \"10:00\", \"end\": \"21:30\", \"duration\": 75},\n    {\"name\": \"Laura\", \"location\": \"Mission District\", \"start\": \"16:15\", \"end\": \"20:30\", \"duration\": 30},\n    {\"name\": \"Sandra\", \"location\": \"Nob Hill\", \"start\": \"09:15\", \"end\": \"18:30\", \"duration\": 60},\n    {\"name\": \"Karen\", \"location\": \"Russian Hill\", \"start\": \"18:30\", \"end\": \"22:00\", \"duration\": 75},\n]\n\n# Convert time strings to datetime objects\nfor friend in friends:\n    friend[\"start\"] = datetime.strptime(friend[\"start\"], \"%H:%M\")\n    friend[\"end\"] = datetime.strptime(friend[\"end\"], \"%H:%M\")\n    friend[\"duration\"] = timedelta(minutes=friend[\"duration\"])\n\n# Determine best meeting schedule\ndef find_schedule(friends):\n    itinerary = []\n    current_time = datetime.strptime(\"09:00\", \"%H:%M\")\n    current_location = \"Pacific Heights\"\n\n    # List of possible locations\n    locations = [friend[\"location\"] for friend in friends]\n\n    while friends:\n        for friend in friends:\n            travel_time = travel_times.get((current_location, friend[\"location\"]), float('inf'))\n            meet_start_time = current_time + timedelta(minutes=travel_time)\n\n            if meet_start_time < friend[\"start\"]:\n                current_time = friend[\"start\"] - timedelta(minutes=travel_time)\n                meet_start_time = current_time + timedelta(minutes=travel_time)\n                \n            meet_end_time = meet_start_time + friend[\"duration\"]\n\n            # Check if time is within friend's availability\n            if friend[\"start\"] <= meet_start_time < friend[\"end\"] and meet_end_time <= friend[\"end\"]:\n                itinerary.append({\n                    \"action\": \"meet\",\n                    \"location\": friend[\"location\"],\n                    \"person\": friend[\"name\"],\n                    \"start_time\": meet_start_time.strftime(\"%H:%M\"),\n                    \"end_time\": meet_end_time.strftime(\"%H:%M\")\n                })\n                current_time = meet_end_time + timedelta(minutes=travel_time)  # Move time forward after meeting\n                current_location = friend[\"location\"]  # Update current location\n                friends.remove(friend)  # Remove from the list after meeting\n\n            # Continue until no more friends left to meet or cannot meet in available time.\n            if not friends:\n                break\n\n    return itinerary\n\n# Find the optimal meeting schedule\nitinerary = find_schedule(friends)\n\n# Output as JSON\nresult = {\"itinerary\": itinerary}\nprint(json.dumps(result, indent=2))\n```",
            "count": "meeting_planning_example_870"
        }
    ]
}