{
    "0shot": [
        {
            "final_program_time": {
                "itinerary": [
                    {
                        "action": "meet",
                        "location": "Chinatown",
                        "person": "Deborah",
                        "start_time": "9:16",
                        "end_time": "10:01"
                    },
                    {
                        "action": "meet",
                        "location": "The Castro",
                        "person": "George",
                        "start_time": "10:23",
                        "end_time": "11:23"
                    },
                    {
                        "action": "meet",
                        "location": "Golden Gate Park",
                        "person": "Steven",
                        "start_time": "11:34",
                        "end_time": "13:19"
                    },
                    {
                        "action": "meet",
                        "location": "Presidio",
                        "person": "Mark",
                        "start_time": "14:45",
                        "end_time": "15:45"
                    },
                    {
                        "action": "meet",
                        "location": "Embarcadero",
                        "person": "Andrew",
                        "start_time": "20:15",
                        "end_time": "21:30"
                    }
                ]
            },
            "expected_time": {
                "itinerary": [
                    {
                        "action": "meet",
                        "location": "Chinatown",
                        "person": "Deborah",
                        "start_time": "9:16",
                        "end_time": "10:01"
                    },
                    {
                        "action": "meet",
                        "location": "The Castro",
                        "person": "George",
                        "start_time": "10:23",
                        "end_time": "11:23"
                    },
                    {
                        "action": "meet",
                        "location": "Russian Hill",
                        "person": "Emily",
                        "start_time": "12:15",
                        "end_time": "14:00"
                    },
                    {
                        "action": "meet",
                        "location": "Presidio",
                        "person": "Mark",
                        "start_time": "14:45",
                        "end_time": "15:45"
                    },
                    {
                        "action": "meet",
                        "location": "Golden Gate Park",
                        "person": "Steven",
                        "start_time": "15:57",
                        "end_time": "17:42"
                    },
                    {
                        "action": "meet",
                        "location": "Sunset District",
                        "person": "Margaret",
                        "start_time": "21:30",
                        "end_time": "22:30"
                    }
                ]
            },
            "has_error": false,
            "raw_model_response": "```python\nimport json\nfrom datetime import datetime, timedelta\n\n# Define travel distances in minutes\ntravel_distances = {\n    'Alamo Square': {'Russian Hill': 13, 'Presidio': 18, 'Chinatown': 16, 'Sunset District': 16, 'The Castro': 8, 'Embarcadero': 17, 'Golden Gate Park': 9},\n    'Russian Hill': {'Alamo Square': 15, 'Presidio': 14, 'Chinatown': 9, 'Sunset District': 23, 'The Castro': 21, 'Embarcadero': 8, 'Golden Gate Park': 21},\n    'Presidio': {'Alamo Square': 18, 'Russian Hill': 14, 'Chinatown': 21, 'Sunset District': 15, 'The Castro': 21, 'Embarcadero': 20, 'Golden Gate Park': 12},\n    'Chinatown': {'Alamo Square': 17, 'Russian Hill': 7, 'Presidio': 19, 'Sunset District': 29, 'The Castro': 22, 'Embarcadero': 5, 'Golden Gate Park': 23},\n    'Sunset District': {'Alamo Square': 17, 'Russian Hill': 24, 'Presidio': 16, 'Chinatown': 30, 'The Castro': 17, 'Embarcadero': 31, 'Golden Gate Park': 11},\n    'The Castro': {'Alamo Square': 8, 'Russian Hill': 18, 'Presidio': 20, 'Chinatown': 20, 'Sunset District': 17, 'Embarcadero': 22, 'Golden Gate Park': 11},\n    'Embarcadero': {'Alamo Square': 19, 'Russian Hill': 8, 'Presidio': 20, 'Chinatown': 7, 'Sunset District': 30, 'The Castro': 25, 'Golden Gate Park': 25},\n    'Golden Gate Park': {'Alamo Square': 10, 'Russian Hill': 19, 'Presidio': 11, 'Chinatown': 23, 'Sunset District': 10, 'The Castro': 13, 'Embarcadero': 25}\n}\n\n# Define meeting constraints\nmeeting_constraints = {\n    'Emily': {'location': 'Russian Hill','start_time': '12:15', 'end_time': '14:15', 'duration': 105},\n    'Mark': {'location': 'Presidio','start_time': '14:45', 'end_time': '19:30', 'duration': 60},\n    'Deborah': {'location': 'Chinatown','start_time': '07:30', 'end_time': '15:30', 'duration': 45},\n    'Margaret': {'location': 'Sunset District','start_time': '21:30', 'end_time': '22:30', 'duration': 60},\n    'George': {'location': 'The Castro','start_time': '07:30', 'end_time': '14:15', 'duration': 60},\n    'Andrew': {'location': 'Embarcadero','start_time': '20:15', 'end_time': '22:00', 'duration': 75},\n    'Steven': {'location': 'Golden Gate Park','start_time': '11:15', 'end_time': '21:15', 'duration': 105}\n}\n\ndef calculate_meeting_schedule():\n    # Initialize the schedule\n    schedule = []\n    current_location = 'Alamo Square'\n    current_time = '9:00'\n\n    # Sort the meeting constraints by start time\n    sorted_constraints = sorted(meeting_constraints.items(), key=lambda x: x[1]['start_time'])\n\n    # Calculate the schedule for each person\n    for person, constraint in sorted_constraints:\n        # Calculate the travel time to the person's location\n        travel_time = travel_distances[current_location][constraint['location']]\n        arrival_time = add_time(current_time, travel_time)\n\n        # Check if we can meet the person within their available time\n        if arrival_time < constraint['start_time']:\n            # Wait until the person is available\n            start_time = constraint['start_time']\n        else:\n            start_time = arrival_time\n\n        # Calculate the end time of the meeting\n        end_time = add_time(start_time, constraint['duration'])\n\n        # Check if the meeting ends within the person's available time\n        if end_time > constraint['end_time']:\n            # We cannot meet the person within their available time\n            continue\n\n        # Add the meeting to the schedule\n        schedule.append({\n            'action':'meet',\n            'location': constraint['location'],\n            'person': person,\n          'start_time': start_time,\n            'end_time': end_time\n        })\n\n        # Update the current location and time\n        current_location = constraint['location']\n        current_time = end_time\n\n    return schedule\n\ndef add_time(time, minutes):\n    dt = datetime.strptime(time, '%H:%M')\n    dt += timedelta(minutes=minutes)\n    return dt.strftime('%H:%M')\n\ndef main():\n    schedule = calculate_meeting_schedule()\n    print(json.dumps({'itinerary': schedule}, indent=4))\n\nif __name__ == '__main__':\n    main()\n```",
            "count": "meeting_planning_example_612"
        }
    ]
}