{
    "0shot": [
        {
            "final_program_time": {
                "itinerary": [
                    {
                        "action": "meet",
                        "location": "Nob Hill",
                        "person": "Daniel",
                        "start_time": "9:12",
                        "end_time": "9:27"
                    },
                    {
                        "action": "meet",
                        "location": "Pacific Heights",
                        "person": "Timothy",
                        "start_time": "12:00",
                        "end_time": "13:30"
                    },
                    {
                        "action": "meet",
                        "location": "Chinatown",
                        "person": "Kevin",
                        "start_time": "13:41",
                        "end_time": "14:11"
                    },
                    {
                        "action": "meet",
                        "location": "Richmond District",
                        "person": "Betty",
                        "start_time": "14:31",
                        "end_time": "15:01"
                    },
                    {
                        "action": "meet",
                        "location": "Marina District",
                        "person": "Steven",
                        "start_time": "16:30",
                        "end_time": "18:00"
                    },
                    {
                        "action": "meet",
                        "location": "The Castro",
                        "person": "Lisa",
                        "start_time": "19:15",
                        "end_time": "21:15"
                    }
                ]
            },
            "expected_time": {
                "itinerary": [
                    {
                        "action": "meet",
                        "location": "Nob Hill",
                        "person": "Daniel",
                        "start_time": "9:12",
                        "end_time": "9:27"
                    },
                    {
                        "action": "meet",
                        "location": "Pacific Heights",
                        "person": "Timothy",
                        "start_time": "12:00",
                        "end_time": "13:30"
                    },
                    {
                        "action": "meet",
                        "location": "Chinatown",
                        "person": "Kevin",
                        "start_time": "13:41",
                        "end_time": "14:11"
                    },
                    {
                        "action": "meet",
                        "location": "Richmond District",
                        "person": "Betty",
                        "start_time": "14:31",
                        "end_time": "15:01"
                    },
                    {
                        "action": "meet",
                        "location": "Marina District",
                        "person": "Steven",
                        "start_time": "16:30",
                        "end_time": "18:00"
                    },
                    {
                        "action": "meet",
                        "location": "The Castro",
                        "person": "Lisa",
                        "start_time": "19:15",
                        "end_time": "21:15"
                    }
                ]
            },
            "has_error": false,
            "raw_model_response": "```python\nimport json\nfrom datetime import datetime, timedelta\n\n# Define travel distances in minutes\ntravel_distances = {\n    'Mission District': {'The Castro': 7, 'Nob Hill': 12, 'Presidio': 25, 'Marina District': 19, 'Pacific Heights': 16, 'Golden Gate Park': 17, 'Chinatown': 16, 'Richmond District': 20},\n    'The Castro': {'Mission District': 7, 'Nob Hill': 16, 'Presidio': 20, 'Marina District': 21, 'Pacific Heights': 16, 'Golden Gate Park': 11, 'Chinatown': 22, 'Richmond District': 16},\n    'Nob Hill': {'Mission District': 13, 'The Castro': 17, 'Presidio': 17, 'Marina District': 11, 'Pacific Heights': 8, 'Golden Gate Park': 17, 'Chinatown': 6, 'Richmond District': 14},\n    'Presidio': {'Mission District': 26, 'The Castro': 21, 'Nob Hill': 18, 'Marina District': 11, 'Pacific Heights': 11, 'Golden Gate Park': 12, 'Chinatown': 21, 'Richmond District': 7},\n    'Marina District': {'Mission District': 20, 'The Castro': 22, 'Nob Hill': 12, 'Presidio': 10, 'Pacific Heights': 7, 'Golden Gate Park': 18, 'Chinatown': 15, 'Richmond District': 11},\n    'Pacific Heights': {'Mission District': 15, 'The Castro': 16, 'Nob Hill': 8, 'Presidio': 11, 'Marina District': 6, 'Golden Gate Park': 15, 'Chinatown': 11, 'Richmond District': 12},\n    'Golden Gate Park': {'Mission District': 17, 'The Castro': 13, 'Nob Hill': 20, 'Presidio': 11, 'Marina District': 16, 'Pacific Heights': 16, 'Chinatown': 23, 'Richmond District': 7},\n    'Chinatown': {'Mission District': 17, 'The Castro': 22, 'Nob Hill': 9, 'Presidio': 19, 'Marina District': 12, 'Pacific Heights': 10, 'Golden Gate Park': 23, 'Richmond District': 20},\n    'Richmond District': {'Mission District': 20, 'The Castro': 16, 'Nob Hill': 17, 'Presidio': 7, 'Marina District': 9, 'Pacific Heights': 10, 'Golden Gate Park': 9, 'Chinatown': 20}\n}\n\n# Define meeting constraints\nmeeting_constraints = {\n    'Lisa': {'location': 'The Castro','start_time': '19:15', 'end_time': '21:15', 'duration': 120},\n    'Daniel': {'location': 'Nob Hill','start_time': '08:15', 'end_time': '11:00', 'duration': 15},\n    'Elizabeth': {'location': 'Presidio','start_time': '21:15', 'end_time': '22:15', 'duration': 45},\n    'Steven': {'location': 'Marina District','start_time': '16:30', 'end_time': '20:45', 'duration': 90},\n    'Timothy': {'location': 'Pacific Heights','start_time': '12:00', 'end_time': '18:00', 'duration': 90},\n    'Ashley': {'location': 'Golden Gate Park','start_time': '20:45', 'end_time': '21:45', 'duration': 60},\n    'Kevin': {'location': 'Chinatown','start_time': '12:00', 'end_time': '19:00', 'duration': 30},\n    'Betty': {'location': 'Richmond District','start_time': '13:15', 'end_time': '15:45', 'duration': 30}\n}\n\ndef calculate_meeting_schedule():\n    # Initialize the schedule\n    schedule = []\n    current_location = 'Mission District'\n    current_time = '9:00'\n\n    # Sort the meeting constraints by start time\n    sorted_constraints = sorted(meeting_constraints.items(), key=lambda x: x[1]['start_time'])\n\n    # Calculate the schedule for each person\n    for person, constraint in sorted_constraints:\n        # Calculate the travel time to the person's location\n        travel_time = travel_distances[current_location][constraint['location']]\n        arrival_time = add_time(current_time, travel_time)\n\n        # Check if we can meet the person within their available time\n        if arrival_time < constraint['start_time']:\n            # Wait until the person is available\n            start_time = constraint['start_time']\n        else:\n            start_time = arrival_time\n\n        # Calculate the end time of the meeting\n        end_time = add_time(start_time, constraint['duration'])\n\n        # Check if the meeting ends within the person's available time\n        if end_time > constraint['end_time']:\n            # We cannot meet the person within their available time\n            continue\n\n        # Add the meeting to the schedule\n        schedule.append({\n            'action':'meet',\n            'location': constraint['location'],\n            'person': person,\n        'start_time': start_time,\n            'end_time': end_time\n        })\n\n        # Update the current location and time\n        current_location = constraint['location']\n        current_time = end_time\n\n    return schedule\n\ndef add_time(time, minutes):\n    dt = datetime.strptime(time, '%H:%M')\n    dt += timedelta(minutes=minutes)\n    return dt.strftime('%H:%M')\n\ndef main():\n    schedule = calculate_meeting_schedule()\n    print(json.dumps({'itinerary': schedule}, indent=4))\n\nif __name__ == '__main__':\n    main()\n```",
            "count": "meeting_planning_example_701"
        }
    ]
}